0000000059.png,-KUtWDJ4GEk,58,7130,偷一部車也重視警鍥而不捨破解體工
0000000007.png,pDMEgvyjo0c,6,7153,6月1日起新北敬老卡也能扣點免費搭捷
0000000020.png,pDMEgvyjo0c,19,7176,敬老卡點數北市可搭捷運新北只能坐公
0000000040.png,pDMEgvyjo0c,39,7199,侯友宜承諾敬老卡六月起可扣點搭捷
0000000065.png,pDMEgvyjo0c,64,7222,侯友宜承諾敬老卡六月起可扣點搭捷
0000000001.png,1qsXaOsM4yY,1,7245,郭董雙手佛珠醒目盧嘉辰每串都是結
0000000033.png,1qsXaOsM4yY,32,7268,篤信關聖帝君慮設廠龍華也是神意
0000000001.png,HUukgDv2niU,1,7291,6.1地震一級開設蘇接急赴災變中心坐
0000000041.png,HUukgDv2niU,40,7314,府院熱線總統速致電蘇接要求掌握狀:
0000000065.png,HUukgDv2niU,64,7337,天花板塌鐵櫃倒破洞公部門傳零星災
0000000001.png,xyJn3ZygYXA,1,7360,“為人民這是股票?”劉家昌挺韓批郭董授
0000000057.png,xyJn3ZygYXA,56,7383,劉家昌質疑毫無貢獻郭董曾捐款韩
0000000078.png,xyJn3ZygYXA,77,7406,金主拚大位藍營人士知恩圖報挺郭台
0000000101.png,xyJn3ZygYXA,100,7429,金主拚大位藍營人士知恩圖報挺郭台
0000000001.png,8jbQW8yfrEs,1,7452,暗諷賴清德:蔡英文當總統不該當
0000000031.png,8jbQW8yfrEs,30,7475,「為2020拉抬聲量總統空戰組織戰齊
0000000073.png,8jbQW8yfrEs,72,7498,初選攻防蔡賴不約而同打組織單
0000000001.png,7jz8nMXxQaI,1,7521,逃逸勞工遇警落跑警衝水溝逮人
0000000012.png,7jz8nMXxQaI,11,7544,一個都不許跑警變泥巴人逮女勞。
0000000001.png,qWndOAce8lU,1,7567,「你不借我錢我就去搶男子鐵棍搶超
0000000069.png,qWndOAce8lU,68,7590,搶劫找藉口嫌犯先偷車行搶後變裝回
0000000001.png,ng4M2isbbE4,1,7613,音樂水舞+無人機秀花火節新招吸客
0000000033.png,ng4M2isbbE4,32,7636,音樂水幕+無人機秀花火節”新招吸客
0000000061.png,ng4M2isbbE4,60,7659,音樂水幕+無人機秀花火節新招吸客
0000000001.png,L2CHDn8kXAU,1,7682,媽媽市長最會省中市6月份短債減27億
0000000042.png,L2CHDn8kXAU,41,7705,媽媽市長最會省中市3月份短債減27億
0000000059.png,L2CHDn8kXAU,58,7728,媽媽市長最會省中市3月份短債減27億
0000000018.png,Rc7QwNnGF70,17,7751,馬國明不生氣保護黃心穎:她年輕知錯
0000000038.png,Rc7QwNnGF70,37,7774,馬國明不生氣保護心穎:她年輕知錯
0000000046.png,Rc7QwNnGF70,45,7797,"片段再流出,許志安、黃心穎直奔香目"
0000000062.png,Rc7QwNnGF70,61,7820,曾合作港馬國明戲裡也遭許志安導
0000000094.png,Rc7QwNnGF70,93,7843,被撤主題曲!黃心穎馬國明養不起;
0000000001.png,mlSQnLriF6U,1,7866,影城正片開演近3分鐘未來廣告變12分生
0000000015.png,mlSQnLriF6U,14,7889,影正片開演延3分鐘未來廣告變12分
0000000060.png,mlSQnLriF6U,59,7912,影城正片開演延3分鐘未來廣告變12分
0000000007.png,TqSGAMrm1J4,6,7935,6月1日起新北敬老卡也能扣點免費搭捷
0000000021.png,TqSGAMrm1J4,20,7958,敬老卡點數北市可搭捷運新北只能坐公
0000000040.png,TqSGAMrm1J4,39,7981,侯友宜承諾敬老卡六月起可扣點搭捷;
0000000066.png,TqSGAMrm1J4,65,8004,侯友宜承諾敬老卡六月起可扣點搭捷
0000000001.png,3VMkdhjC9kE,1,8027,女移工疑遭性侵鄉代遭指控發誓自
0000000019.png,3VMkdhjC9kE,18,8050,女移工疑遭性侵鄉代遭指控發誓食
0000000036.png,3VMkdhjC9kE,35,8073,女移工疑遭性侵鄉代遭指控發誓食
0000000088.png,3VMkdhjC9kE,87,8096,女移工疑遭性侵鄉代遭指控發誓食
0000000005.png,XZkwPjbWUtg,4,8119,服刑206天!千位支持者迎接傅崐其深擁妻
0000000017.png,XZkwPjbWUtg,16,8142,傅崐其出獄讀郭台銘能保台和平促經
0000000100.png,XZkwPjbWUtg,99,8165,群眾鼓課選立委傳尾草先回家洗衣拖
0000000007.png,EiUA_0APeDs,6,8188,"男性理想情人,萌魚活後Nono身材傲,"
0000000017.png,EiUA_0APeDs,16,8211,「國光擔任助理受理目魚主持外景節
0000000042.png,EiUA_0APeDs,41,8234,「國光擔任助理受贿魚主持外景節
0000000055.png,EiUA_0APeDs,54,8257,人氣寫真女神莞允IG擁60萬人追
0000000075.png,EiUA_0APeDs,74,8280,人氣寫真女神辜莞允G擁60萬人追
0000000020.png,iGzjxpdvAnc,19,8303,用人哲學自成一套韓市政”大咖雲集
0000000063.png,iGzjxpdvAnc,62,8326,鋪路逐大位?韓國瑜團隊”點兵借
0000000123.png,iGzjxpdvAnc,122,8349,治水路平用人唯才逐大位仍缺智
0000000177.png,iGzjxpdvAnc,176,8372,"藍綠闊冒大不同”因才適任""累積經"
0000000240.png,iGzjxpdvAnc,239,8395,韓國瑜施政借將國政市政大不
0000000006.png,e3ONtfcluak,5,8418,TRAW.態芮升2/頭宫3星主廚:壓力
0000000067.png,e3ONtfcluak,66,8441,想吃!米其林24家摘星頭宫”蟬連3星稱
0000000101.png,e3ONtfcluak,100,8464,想吃!米其林24家摘星頭宫蟬連3星稱
0000000001.png,eWUDBHJFJEE,1,8487,遊覽車業進入枯水期全台缺3000名司
0000000022.png,eWUDBHJFJEE,21,8510,遊覽車業爆車潮千鋪車間置找駕駛
0000000054.png,eWUDBHJFJEE,53,8533,遊覽車業枯水期業緩老的退休新人不
0000000134.png,eWUDBHJFJEE,133,8556,團旅旺季找临遊覽駕駛日薪1萬無人
0000000212.png,eWUDBHJFJEE,211,8579,遊覽車業枯水期業緩老的退休新人不
0000000001.png,nqB6mZDlCRI,1,8602,無菌安全手術室感染控制嚴格規
0000000012.png,nqB6mZDlCRI,11,8625,缺一不可進出管控人員清潔有SC
0000000041.png,nqB6mZDlCRI,40,8648,手術風險?醫材業代傳”跟刀變動
0000000180.png,nqB6mZDlCRI,179,8671,坊間傳業代指導變動刀最高罰1500
0000000229.png,nqB6mZDlCRI,228,8694,圖内部管理業代進手術室缺規
0000000001.png,kQHtMhE-77k,1,8717,上市櫃公司遭控110萬包案竟收99萬回
0000000030.png,kQHtMhE-77k,29,8740,上市櫃公司遭控110萬包案竟收99萬回
0000000073.png,kQHtMhE-77k,72,8763,上市櫃公司遭控110萬包案竟收99萬回
0000000101.png,kQHtMhE-77k,100,8786,政府補助計畫收回扣議經濟部深入調
