0000000001.png,pqQcB_qN5Yo,1,0,長炭牙膏嗎?英國研究:反更容易蛀牙
0000000047.png,pqQcB_qN5Yo,46,23,長炭牙膏嗎?英國研究:反更容易蛀牙
0000000078.png,pqQcB_qN5Yo,77,46,膜添歲助知音師電吸附清麟效果
0000000014.png,moVJEoPccrg,13,69,在這!陸巡把富張開直播曝藏身處遭逮
0000000030.png,moVJEoPccrg,29,92,法吸金約4500萬台幣嫌躲緬甸直播叫
0000000050.png,moVJEoPccrg,49,115,在這陸逃犯還張開直播曝藏身處這還
0000000001.png,cac2dyYLaSQ,1,138,力賽翻車意外賽車滚上坡”摔成廢
0000000038.png,cac2dyYLaSQ,37,161,力賽翻車意外賽車滚上坡”摔成廢
0000000063.png,cac2dyYLaSQ,62,184,涯最大車禍冠軍手幸運生還僅輕傷
0000000008.png,FajrPVZJuIs,7,207,糖哥哥改焦糖走跳遭控黃國昌助瞻:愚蠢
0000000019.png,FajrPVZJuIs,18,230,東家控違商標權”陳嘉行怒嗆被恐嚇
0000000084.png,FajrPVZJuIs,83,253,控”焦糖也達商標權律師:仍有混淆之
0000000109.png,FajrPVZJuIs,108,276,控焦糖也違商標權律師:仍有混淆之嫌
0000000001.png,OeTJA5OK_nU,1,299,收差錯時間遭拒北市議員批“一市多制
0000000021.png,OeTJA5OK_nU,20,322,收差錯時間遭拒北市議員批一市多制
0000000051.png,OeTJA5OK_nU,50,345,市資收分日分類得自辩種類民怨難記
0000000074.png,OeTJA5OK_nU,73,368,市資收分日分類得自辩種類民怨難
0000000004.png,iZK7MXl_t8w,3,391,"親節老公小孩陪逛,買花市場湧人潮,"
0000000042.png,iZK7MXl_t8w,41,414,親節老公小孩进買花市場湧人潮
0000000054.png,iZK7MXl_t8w,53,437,"市場,巴士遊樂園搭母節祭折扣搶媽敗"
0000000001.png,ACuxN6hB2Rk,1,460,保存期限前壞掉”好市多下架義美鮮奶
0000000001.png,7tyhnB2TUyY,1,483,文哲逛一中夜市人潮擠爆!疑志工爆粗口
0000000041.png,7tyhnB2TUyY,40,506,義勇軍管理困難柯文哲:只能道德勸說
0000000062.png,7tyhnB2TUyY,61,529,義勇軍”管理困難柯文哲:只能道德勸說
0000000001.png,_j95RPQ58hU,1,552,租漲?生意差正興街咖啡館月底停業
0000000043.png,_j95RPQ58hU,42,575,台南版忠孝東路店租直漲人潮變少
0000000093.png,_j95RPQ58hU,92,598,南版忠孝東路店租直漲人潮變少
0000000002.png,O4KxUdYfpaQ,1,621,畏韓粉灌爆留言高閔琳堅持不關驗
0000000046.png,O4KxUdYfpaQ,45,644,一再留恐嚇性言論網掀抓假韓粉風潮
0000000028.png,u-dTHSvI3nM,27,667,長應會提醒郭九二共識非兩個中國
0000000038.png,u-dTHSvI3nM,37,690,吴應會提醒郭九二共識非兩個中國
0000000077.png,u-dTHSvI3nM,76,713,否蹲幫綁鞋帶?朱有自動綁鞋帶設
0000000016.png,ig4tHR9CG2o,15,736,醉還騎車男狂吹氣30幾次酒測值0.5
0000000039.png,ig4tHR9CG2o,38,759,酒駕男偵訊室吐滿地警花2小時清理
0000000058.png,ig4tHR9CG2o,57,782,醉還騎車男狂吹氣30幾次酒測值0.
0000000001.png,OMBQkIqrpHg,1,805,是酒駕高速闖紅燈衝撞騎士慘拋飛
0000000040.png,OMBQkIqrpHg,39,828,一字路口遭撞!騎士髖骨碎裂送醫救治
0000000001.png,JhZdR2Ox79Q,1,851,後一言不合爆衝突警方18人快打壓制
0000000053.png,JhZdR2Ox79Q,52,874,後一言不合爆衝突警方18人快打壓制
0000000001.png,PKjd0bNv_A4,1,897,家族聚餐照驚見服務生竟比不雅手勢
0000000022.png,PKjd0bNv_A4,21,920,家族聚餐照驚見服務生竟比不雅手勢
0000000042.png,PKjd0bNv_A4,41,943,故意服務生跟同事嬉鬧餐廳已致歉
0000000069.png,PKjd0bNv_A4,68,966,三故意服務生跟同事嬉鬧餐廳:已致歉
0000000001.png,xewzV-FtWMQ,1,989,幫我住装學稱籌學費假賣愛心毛中
0000000027.png,xewzV-FtWMQ,26,1012,肯定外國客推銷集團流童西門町車站
0000000051.png,xewzV-FtWMQ,50,1035,爱心真推銷兜售廉價毛印暴利逾10倍
0000000001.png,IxPdZ8PVwGI,1,1058,二務段控合歡山了3千擴寬彎路未報備
0000000054.png,IxPdZ8PVwGI,53,1081,高山生態難復原居民強調有交通需求
0000000004.png,Jo2A59Qj85I,3,1104,反毒談判雙撞人輾壓涉案主嫌落網
0000000027.png,Jo2A59Qj85I,26,1127,反毒談判變撞人輾壓涉案主嫌落網
0000000054.png,Jo2A59Qj85I,53,1150,反毒談判變撞人輾壓涉案主嫌落網
0000000001.png,P2qelvZHcKg,1,1173,可到眼惹禍!醉男返家不滿鄰居竟揍人
0000000028.png,P2qelvZHcKg,27,1196,可看一眼醉男不滿揮拳鄰居慘遭毆
0000000066.png,P2qelvZHcKg,65,1219,警到場醉男情緒激動遭噴辣椒水制
0000000001.png,njEH71mQPHk,1,1242,車禍停國道遭釀追撞夾擊2死4傷
0000000001.png,4dPPkaY4cp8,1,1265,"錢代繳帳單,訂單最睹設積分躲響"
0000000002.png,ky0Qor7eaVI,1,1288,"舞跳進總統府,總統秀DAB手勢搶票"
0000000035.png,ky0Qor7eaVI,34,1311,日親節彩蛋!總統LINE影片蔡想想入鏡
0000000054.png,ky0Qor7eaVI,53,1334,东台妹發言炒熱選總統支持度上升
0000000064.png,ky0Qor7eaVI,63,1357,可稱總統親美抗中不對總統過度簡化
0000000001.png,W6V7GMinwXk,1,1380,例商旅賣床單給徵信社法院判違個資法
0000000001.png,Hx1FfAnzFXg,1,1403,款奥客網購18件衣服拍美照後全退貨
0000000025.png,Hx1FfAnzFXg,24,1426,款奧客!網購18件衣服拍美照後全退貨
0000000050.png,Hx1FfAnzFXg,49,1449,款奧客網購18件衣服拍美照後全退貨
0000000067.png,Hx1FfAnzFXg,66,1472,款奧客網購18件衣服拍美照後全退貨
0000000001.png,H5XaEuRzAuY,1,1495,電動車喇叭壞狂車主擔心吃慶記
0000000053.png,H5XaEuRzAuY,52,1518,電動車喇叭壞狂車主擔心吃慶記
0000000021.png,CsfPm4mJDRY,20,1541,TIApp推陪媽咪工作千人搶購600元時報
0000000054.png,CsfPm4mJDRY,53,1564,成學生難陪媽咪調節學生暖心稱:處處有
0000000001.png,_KT598XaTLM,1,1587,兩年摘星三代傳承金蓬萊實至名歸
0000000018.png,_KT598XaTLM,17,1610,兩年摘星三代傳承金蓬萊實至名歸
0000000029.png,_KT598XaTLM,28,1633,金蓬萊三代經典菜出自孝子的傳承
0000000077.png,_KT598XaTLM,76,1656,兩年摘星三代傳承金蓬萊實至名歸
0000000001.png,V0emhJ70aJI,1,1679,護車左轉上演蟹行”擦撞直行車輛
0000000001.png,5QPlkUNj4Bc,1,1702,輔會車緩慢男駕駛猛按喇叭遭司機據
0000000008.png,ObUjWF_91tw,7,1725,阿拉丁鮮話色彩歌舞秀頗有寶萊塢味
0000000035.png,ObUjWF_91tw,34,1748,"阿拉丁""鮮語色彩歌舞秀頗有寶萊塢味"
0000000056.png,ObUjWF_91tw,55,1771,音速小子電影版變長腿粉絲:童年崩壞
0000000083.png,ObUjWF_91tw,82,1794,由士尼接力拍真人版獅子王暑假上映
0000000001.png,0it80yWF7sc,1,1817,5月天邀梁家輝合唱頑固”影帝自爆沙吃
0000000051.png,0it80yWF7sc,50,1840,項固再聚首梁家輝連2年助陣五月天
0000000096.png,0it80yWF7sc,95,1863,帝力挺五月县梁家輝空運港點拍片
0000000004.png,c24p14rTD_0,3,1886,要對韓國瑜硬派?康裕成:我沒這麼LOW
0000000029.png,c24p14rTD_0,28,1909,上服宇宙康裕成想送韓國瑜薩諾斯手智
0000000047.png,c24p14rTD_0,46,1932,马晰道歉留一時不糊塗綠議員納感
0000000081.png,c24p14rTD_0,80,1955,煥宗關閉粉專黃文益再攻擊不原
0000000001.png,ufqShmwrebM,1,1978,录變換車道失控國道4車追撞2死4傷
0000000030.png,ufqShmwrebM,29,2001,录變換車道失钾國道4車追撞2死4傷
0000000046.png,ufqShmwrebM,45,2024,是變換車道失控國道追撞2死4傷
0000000084.png,ufqShmwrebM,83,2047,产變換車道失控國道4車追撞2死4傷
0000000001.png,4DYEoeG6Css,1,2070,"新北蝴蝶地景公園花海,光雕閃耀浪漫"
0000000019.png,4DYEoeG6Css,18,2093,"北蝴蝶地景公園花海,光雕閃耀浪漫"
0000000052.png,4DYEoeG6Css,51,2116,新北蝴蝶地景公園花海光雕閃耀浪漫
0000000011.png,gxjfsbFJl7U,10,2139,昌興哲首攻蛋落淚!化身舞王女友現身支持
0000000043.png,gxjfsbFJl7U,42,2162,昌興哲首攻蛋落淚!化身舞王女友現身支持
0000000058.png,gxjfsbFJl7U,57,2185,周興哲太興奮!歌迷心跳破160昏倒送醫
0000000077.png,gxjfsbFJl7U,76,2208,要典情歌首首!周興哲攻蛋眾星到場支持
0000000089.png,gxjfsbFJl7U,88,2231,要典情歌首首!周興哲攻蛋眾星到場支持
0000000029.png,1rFf1nbgljQ,28,2254,團隊成形Powe组前小編助郭董打選戰
0000000047.png,1rFf1nbgljQ,46,2277,郭董講話太長了!小編提勇氣插話喊卡
0000000082.png,1rFf1nbgljQ,81,2300,董講話太長了!小編提勇氣插話喊卡
0000000007.png,B4LWYNMAMFQ,6,2323,反核食將有因果謝長廷:馬承諾解夢
0000000087.png,B4LWYNMAMFQ,86,2346,白總統不開心?謝長廷不評論賴清德訪日
0000000009.png,dGgF2voBfHw,8,2369,"鳥海誰接班?郭證實盧松青,戴正吳业局"
0000000033.png,dGgF2voBfHw,32,2392,万人出局鴻海新董座將從三挑一
0000000075.png,dGgF2voBfHw,74,2415,及東會逼近鴻海新董座將脫穎而曾
0000000032.png,39zTvw9Hgik,31,2438,「群育」講到盖有由善终目答话斜化基
0000000001.png,VvoARFIfawc,1,2461,基隆嶼放流8萬尾魚首淨灘清出2噸垃圾
0000000040.png,VvoARFIfawc,39,2484,基隆嶼放流8萬尾魚苗淨灘清出2噸垃圾
0000000001.png,-5PgmAzf2ls,1,2507,或受客家文化2015聖仙師文化祭開跑
0000000018.png,-5PgmAzf2ls,17,2530,或受客家文化2015聖仙師文化祭開跑
0000000029.png,-5PgmAzf2ls,28,2553,或受客家文化2019巧聖仙師文化祭開跑
0000000001.png,YXz72ooUKYU,1,2576,過去5年碰4回勇士再勝火箭挺進西冠
0000000011.png,YXz72ooUKYU,10,2599,上半場得分掛蛋柯瑞下半場爆氣拿33分
0000000035.png,YXz72ooUKYU,34,2622,上半場得分掛蛋柯瑞下半場爆氣拿33分
0000000054.png,YXz72ooUKYU,53,2645,"火箭雙槍哈波,保羅合拿62分無助贏球"
0000000009.png,TyS0IaPMFqI,8,2668,嘻哈新人高爾宣頭擠下林宥嘉奪冠
0000000036.png,TyS0IaPMFqI,35,2691,高爾宣出道半年!演唱會門票秒殺點閱百萬
0000000059.png,TyS0IaPMFqI,58,2714,貴人相助高爾宣碩董啟發謝和弦親帶跑校園
0000000080.png,TyS0IaPMFqI,79,2737,貴人相助高爾宣頑童啟發謝和弦親帶跑校園
0000000094.png,TyS0IaPMFqI,93,2760,高爾宣出道半年演唱會門票秒殺點閱百萬
0000000016.png,SPN6Wg4-mr8,15,2783,日財務副大臣當導遊帶賴清德进橫濱
0000000043.png,SPN6Wg4-mr8,42,2806,亡已矣來者可追賴盼多溝通核食
0000000072.png,SPN6Wg4-mr8,71,2829,領清德訪日低調變風光謝長廷二度同台
0000000009.png,cHcgkWq3KJI,8,2852,恐怖情人前科多指吸毒向七旬母討錢
0000000036.png,cHcgkWq3KJI,35,2875,不要打女生國中見義勇為反遭砍
0000000050.png,cHcgkWq3KJI,49,2898,少年阻衝突遭砍分局長慰問提醒:先報警
0000000084.png,cHcgkWq3KJI,83,2921,憂遭報復兩性專家報警提告是必要的
0000000008.png,lklKvBQl2CU,7,2944,雷高空彈跳一吐怨氣隔空邀綠營議員同樂
0000000025.png,lklKvBQl2CU,24,2967,王浩宇高雄開襪子店潘佔好處又批韓流
0000000050.png,lklKvBQl2CU,49,2990,番喧”用除臭襪除嘴冥王浩宇:局長先
0000000090.png,lklKvBQl2CU,89,3013,番喧”用除臭襪除嘴冥王浩宇:局長先試試
0000000005.png,8wHxv39z3iY,4,3036,"立低售價,新設計PP材質耐刮,感應解鎖"
0000000016.png,8wHxv39z3iY,15,3059,"立低售價,新斯PP材質耐刮,感應解鎖"
0000000039.png,8wHxv39z3iY,38,3082,等價土補助搶市Gogoro.光陽.中華3萬起
0000000069.png,8wHxv39z3iY,68,3105,本土品牌靠降價取跨陸電動機車龍頭攻台
0000000089.png,8wHxv39z3iY,88,3128,本土品牌第降價取勝陸電動機車龍頭攻台
0000000001.png,BZAJoyR9moM,1,3151,喝他的湯逆子痛殴85歲父”助骨斷2根
0000000029.png,BZAJoyR9moM,28,3174,喝他端的湯逆子痛殴85歲父肋骨斷2根
0000000048.png,BZAJoyR9moM,47,3197,染毒癮父母沒給錢男持水果刀刺燒房子
0000000086.png,BZAJoyR9moM,85,3220,染毒癮父母沒給錢男持水果刀刺燒房子
0000000001.png,8gbcobnK0Jc,1,3243,南進審計新村柯文哲拿冰淇淋拍網紅照
0000000034.png,8gbcobnK0Jc,33,3266,"柯文哲假日南下中彰演講,參訪全都來"
0000000059.png,8gbcobnK0Jc,58,3289,"柯文哲假日南下中彰演講,參訪全都來"
0000000009.png,xKdqIwgPBsE,8,3312,母親節限定!送電視十微波爐PK快閃299方案
0000000070.png,xKdqIwgPBsE,69,3335,電信再掀低價戰吃到飽月租下殺2字頭
0000000014.png,EjfEEA9KrdM,13,3358,"染色難分!店家添色素無果粒,化工味重"
0000000047.png,EjfEEA9KrdM,46,3381,"染色難分店家添色素無果粒,化工味重"
0000000001.png,btiiAAAGEQA,1,3404,請注意這支門號餐飲店籲別收單
0000000037.png,btiiAAAGEQA,36,3427,吃喝送到卻遭拒門號苦主嘆可能被整
0000000056.png,btiiAAAGEQA,55,3450,改來電顯示?請店家給證據來報案
0000000008.png,G6O_w_g5K4w,7,3473,租金貴?4年1家業者遷離美食華爾街
0000000030.png,G6O_w_g5K4w,29,3496,老店搬離月租120萬閒置兩年租不出去
0000000048.png,G6O_w_g5K4w,47,3519,藝人餐廳搬家租金翻倍火鍋店僅租4個月
0000000077.png,G6O_w_g5K4w,76,3542,租金貴?4年11家業者遷離美食華爾街
0000000108.png,G6O_w_g5K4w,107,3565,預金派人事成本外送宅經濟餐廳難經營
0000000001.png,EMGKliIC5X8,1,3588,買到假貨”男不滿怒端老闆搶手錶遭逮
0000000021.png,EMGKliIC5X8,20,3611,買到假貨男不滿怒骚老闆搶手錶遭逮
0000000039.png,EMGKliIC5X8,38,3634,買到假貨”男不滿怒老闆搶手錶速
0000000053.png,EMGKliIC5X8,52,3657,氣炸”男市場買戒指檢驗驚覺假貨暴走
0000000002.png,LXAHNSfv4CU,1,3680,出地下道橫越慢道切西瓜撞傷騎士
0000000039.png,LXAHNSfv4CU,38,3703,出地下道橫越慢道切西瓜撞傷騎士
0000000056.png,LXAHNSfv4CU,55,3726,右轉請走慢道軍高頻傳連2告示提醒」
0000000008.png,nACbLI0Mmpg,7,3749,前後任市長都提自經區綠質疑韓抄襲報
0000000030.png,nACbLI0Mmpg,29,3772,陳菊多次提自經區高雄條件最適合
0000000040.png,nACbLI0Mmpg,39,3795,韓提醫療觀光菊未開放陸人士工作
0000000090.png,nACbLI0Mmpg,89,3818,前後任市長都是自經區綠質疑韓抄襲報
0000000018.png,nuNJ8EbMGAE,17,3841,自有設備又故障微風南山半年內3度跳電
0000000052.png,nuNJ8EbMGAE,51,3864,停電時間最長一次顧客摸黑逛街逾1小時
0000000073.png,nuNJ8EbMGAE,72,3887,停電時間最長一次顧客摸黑逛街逾1小時
0000000001.png,VhM4_Zvrhfg,1,3910,自經區說帖抄襲陳菊?韓國瑜:不可能
0000000044.png,VhM4_Zvrhfg,43,3933,要讓我出模韓國瑜喻先查說帖”定義
0000000015.png,F5S6ztYsqdA,14,3956,跟我回家攻拒絕遭打傷控男恐嚇殺人
0000000044.png,F5S6ztYsqdA,43,3979,跟我回家攻拒絕遭打傷控男恐嚇殺人
0000000077.png,F5S6ztYsqdA,76,4002,落網稱金錢糾紛女控說謊聲請家暴令
0000000001.png,D-MlCYn0k5Q,1,4025,警轉車疑圓紅燈連撞2車駕駛險噴飛
0000000027.png,D-MlCYn0k5Q,26,4048,驚!轎車疑闖紅燈連撞2車駕駛險噴飛
0000000047.png,D-MlCYn0k5Q,46,4071,接撞駕駛卡車內警破壞車體急救援
0000000078.png,D-MlCYn0k5Q,77,4094,驚!轎車疑間紅燈連撞2車駕駛險噴飛
0000000014.png,9ZDkwbD0ZJ0,13,4117,下次叫市長陳其邁:是叫韓市長來啦
0000000036.png,9ZDkwbD0ZJ0,35,4140,頭回高雄就走陳其邁:常常回家很正常
0000000101.png,9ZDkwbD0ZJ0,100,4163,陳其邁談產業園區建議韓國瑜多走多看
0000000009.png,-HnPTr3i8_g,8,4186,“自經區為大陸開放?馬英九轟綠:沒常識
0000000056.png,-HnPTr3i8_g,55,4209,糾正郭一中各表?馬朱一中是中華民國
0000000090.png,-HnPTr3i8_g,89,4232,糾正郭一中各表?馬朱一中是中華民國
0000000010.png,9luvcCUNLXA,9,4255,疑遭打水貨疫苗港體檢中心遭陸客擠
0000000030.png,9luvcCUNLXA,29,4278,陸客討說法港體檢中心只退款不說來源
0000000066.png,9luvcCUNLXA,65,4301,陸客頻上門質問診所人員暴走開喧對圖
0000000078.png,9luvcCUNLXA,77,4324,陸客頻上門質問診所人員暴走開嗆對屬
0000000007.png,UMKSchWCIGY,6,4347,陳妍希穿旗袍開唱重現鄧麗君溫柔氣質
0000000021.png,UMKSchWCIGY,20,4370,還原70年代場景陸資劇打造繁體字道具
0000000049.png,UMKSchWCIGY,48,4393,何潤東飾陳妍希男友虛擬角色添感情戲
0000000065.png,UMKSchWCIGY,64,4416,穿古装要刀劍馮小剛監製何潤東新劇
0000000086.png,UMKSchWCIGY,85,4439,穿古装要刀劍馮小剛監製何潤東新劇
0000000001.png,cqxp1GxaQdY,1,4462,駁“網紅總統蔡英文:我工作是當總統
0000000054.png,cqxp1GxaQdY,53,4485,搶青年族群總統任內兩度破框”改革
0000000085.png,cqxp1GxaQdY,84,4508,板中男裙日惹議總統挺黨元老也穿
0000000111.png,cqxp1GxaQdY,110,4531,堅持改革引批評總統好處要待往後看
0000000006.png,DOaJR2R1-_k,5,4554,"普欽打冰球顯身手,個人得8分賽後跌大路"
0000000016.png,DOaJR2R1-_k,15,4577,最強總統展雄風!普欽打冰球不輸職業好
0000000041.png,DOaJR2R1-_k,40,4600,個人連進8球普欽擔任中鋒成最強射
0000000075.png,DOaJR2R1-_k,74,4623,個人連進8球普欽擔任中鋒成最強射手
0000000085.png,DOaJR2R1-_k,84,4646,"普欽打冰球顯身手,個人得8分賽後大該"
0000000001.png,pqQcB_qN5Yo,1,4669,備長炭牙膏致?英國研究:反更容易蛀牙
0000000047.png,pqQcB_qN5Yo,46,4692,備長炭牙膏效?英國研究:反更容易蛀牙
0000000078.png,pqQcB_qN5Yo,77,4715,面膜添歲助站?醫師:僅吸附”清麟”效果
0000000014.png,moVJEoPccrg,13,4738,「我在這陸逃犯還張開直播曝藏身處這還
0000000030.png,moVJEoPccrg,29,4761,非法吸金約4500萬台幣嫌躲緬甸直播叫器
0000000050.png,moVJEoPccrg,49,4784,“我在這陸逃犯富張開直播曝藏身處遭逮
0000000001.png,cac2dyYLaSQ,1,4807,拉力賽翻車意外賽車滾上坡摔成廢鐵
0000000038.png,cac2dyYLaSQ,37,4830,拉力賽翻車意外賽車滨上坡”摔成廢鐵
0000000063.png,cac2dyYLaSQ,62,4853,生涯最大車禍冠軍軍幸運生還僅輕
0000000008.png,FajrPVZJuIs,7,4876,焦糖哥哥改焦糖走跳道控黃國昌助喻愚
0000000019.png,FajrPVZJuIs,18,4899,老東家控違商標權、陳嘉行怒嗆被恐
0000000084.png,FajrPVZJuIs,83,4922,遭控焦糖也這商標權律師:仍有混淆之嫌
0000000109.png,FajrPVZJuIs,108,4945,遭控焦糖也建商標權律師:仍有混淆之辑
0000000001.png,OeTJA5OK_nU,1,4968,資收丟錯時間遭拒北市議員批“一市多制
0000000021.png,OeTJA5OK_nU,20,4991,資收丟錯時間遭拒饰議員批一市多制
0000000051.png,OeTJA5OK_nU,50,5014,北市資收分百分類得自辨種類民怨難記
0000000074.png,OeTJA5OK_nU,73,5037,北市資收分日分類得自辦種類民怨難記
0000000004.png,iZK7MXl_t8w,3,5060,母親節老公意!小孩陪買花市場湧人潮
0000000042.png,iZK7MXl_t8w,41,5083,母親節老公意!小孩陪買花市場湧人潮
0000000054.png,iZK7MXl_t8w,53,5106,"“市場,巴士遊樂園搭母節祭折扣搶媽財"
0000000001.png,ACuxN6hB2Rk,1,5129,疑保存期限前壞掉”好市多下架義美鮮奶
0000000001.png,7tyhnB2TUyY,1,5152,柯文哲逛一中夜市人潮擠爆!疑志工爆粗口
0000000041.png,7tyhnB2TUyY,40,5175,「義勇軍管理困難柯文哲:只能道德勸說
0000000062.png,7tyhnB2TUyY,61,5198,“義勇軍”管理困難柯文哲:只能道德勸說
0000000001.png,_j95RPQ58hU,1,5221,店租漲?生意差正興街咖啡館月底停業
0000000043.png,_j95RPQ58hU,42,5244,台南版忠孝東路店租直漲人潮變少
0000000093.png,_j95RPQ58hU,92,5267,台南版忠孝東路店租直漲人潮變少
0000000002.png,O4KxUdYfpaQ,1,5290,不畏韓粉灌爆電高閔琳堅持不關除責
0000000046.png,O4KxUdYfpaQ,45,5313,一再留恐嚇性言論網掀抓假韓粉風潮
0000000028.png,u-dTHSvI3nM,27,5336,「吳應會提醒郭朱九二共識非兩個中國
0000000038.png,u-dTHSvI3nM,37,5359,「吳應會提醒郭”朱九二共識非兩個中國
0000000077.png,u-dTHSvI3nM,76,5382,會否蹲幫綁鞋帶?朱:有自動綁鞋帶器
0000000016.png,ig4tHR9CG2o,15,5405,爛醉還騎車男狂吹氣30幾次酒測值0.3
0000000039.png,ig4tHR9CG2o,38,5428,酒駕男偵訊室吐滿地警花2小時清理
0000000058.png,ig4tHR9CG2o,57,5451,爛醉還騎車男狂吹氣30幾次酒測值0.5
0000000001.png,OMBQkIqrpHg,1,5474,又是酒駕高速闖紅燈衝撞騎士慘地飛
0000000040.png,OMBQkIqrpHg,39,5497,十字路口遭撞!騎士領骨碎裂送醫救治
0000000001.png,JhZdR2Ox79Q,1,5520,酒後一言不合爆衝突警方18人快打壓制
0000000053.png,JhZdR2Ox79Q,52,5543,酒後一言不合爆衝突警方18人快打壓制
0000000001.png,PKjd0bNv_A4,1,5566,独家族聚餐照驚見服務生竟比不雅手勢
0000000022.png,PKjd0bNv_A4,21,5589,独家族聚餐照驚見服務生竟比不雅手勢
0000000042.png,PKjd0bNv_A4,41,5612,非故意服務生跟同事嬉鬧餐廳:已致歉
0000000069.png,PKjd0bNv_A4,68,5635,非故意服務生跟同事嬉鬧餐廳:已致歉
0000000001.png,xewzV-FtWMQ,1,5658,我住裝學生稱籌學費假賣爱心毛巾
0000000027.png,xewzV-FtWMQ,26,5681,"鎖定外國客推銷集團流童西門町,車站"
0000000051.png,xewzV-FtWMQ,50,5704,假愛心真推銷兜售廉價毛巾暴利逾10倍
0000000001.png,IxPdZ8PVwGI,1,5727,工務段挖合歡山罰3千擴寬彎路未報備
0000000054.png,IxPdZ8PVwGI,53,5750,高山生態難復原居民強調有交通需求
0000000004.png,Jo2A59Qj85I,3,5773,販毒談判雙撞人無涉案主嫌落網
0000000027.png,Jo2A59Qj85I,26,5796,販毒談判雙撞人無壓涉案主嫌落網
0000000054.png,Jo2A59Qj85I,53,5819,販毒談判雙撞人無涉案主嫌落網
0000000001.png,P2qelvZHcKg,1,5842,對到眼惹禍!醉男返家不滿鄰居竟揍人
0000000028.png,P2qelvZHcKg,27,5865,對看一眼醉男不滿揮拳鄰居慘遭國
0000000066.png,P2qelvZHcKg,65,5888,警到場醉男情緒激動遭噴辣椒水制
0000000001.png,njEH71mQPHk,1,5911,遇車禍停國道遭車追撞擊2死4傷
0000000001.png,4dPPkaY4cp8,1,5934,"贏錢代繳帳單,訂單聚賭設積分”躲警"
0000000002.png,ky0Qor7eaVI,1,5957,街舞跳進總統府副總統秀DAB手勢搶票
0000000035.png,ky0Qor7eaVI,34,5980,母親節彩蛋:總統LINE影片蔡想想入鏡
0000000054.png,ky0Qor7eaVI,53,6003,辣台妹發言炒熱選情總統支持度上升
0000000064.png,ky0Qor7eaVI,63,6026,柯稱總統親美抗中不對總統過度簡化
0000000001.png,W6V7GMinwXk,1,6049,首例商旅賣床單給徵信法院判違個資法
0000000001.png,Hx1FfAnzFXg,1,6072,這款奧客!網購18件衣服拍美照後全退貨
0000000025.png,Hx1FfAnzFXg,24,6095,這款奥網購18件衣服拍美照後全退貨
0000000050.png,Hx1FfAnzFXg,49,6118,這款奧客!網購18件衣服拍美照後全退貨
0000000067.png,Hx1FfAnzFXg,66,6141,這款奧客網購18件衣服拍美照後全退貨
0000000001.png,H5XaEuRzAuY,1,6164,電動車喇叭壞狂!車主擔心吃慶記
0000000053.png,H5XaEuRzAuY,52,6187,電動車喇叭壞狂車主擔心吃慶記
0000000021.png,CsfPm4mJDRY,20,6210,打工App推陪媽咪工作千人搶賺600元時報
0000000054.png,CsfPm4mJDRY,53,6233,"6成學生難陪媽咪過節!學生暖心稱,處處有如"
0000000001.png,_KT598XaTLM,1,6256,連兩年摘星三代傳承金蓬萊實至名歸
0000000018.png,_KT598XaTLM,17,6279,連兩年摘星三代傳承金蓬萊實至名留
0000000029.png,_KT598XaTLM,28,6302,「金蓬萊三代經典菜出自孝子的傳库
0000000077.png,_KT598XaTLM,76,6325,連兩年摘星三代傳承金蓬萊實至名歸
0000000001.png,V0emhJ70aJI,1,6348,「機車左轉上演蟹行擦撞直行車輛
0000000001.png,5QPlkUNj4Bc,1,6371,嫌會車緩慢男駕駛猛按喇叭遭司機摸
0000000008.png,ObUjWF_91tw,7,6394,“阿拉丁鮮話色彩歌舞秀頗有寶萊塢明
0000000035.png,ObUjWF_91tw,34,6417,"阿拉丁""鮮豔色彩歌舞秀頗有寶萊塢"
0000000056.png,ObUjWF_91tw,55,6440,「音速小子電影版變長腿粉絲:童年崩壞
0000000083.png,ObUjWF_91tw,82,6463,迪士尼接力拍真人版獅子王暑假上
0000000001.png,0it80yWF7sc,1,6486,"五月天邀梁家輝合唱頑固,影帝自爆沙"
0000000051.png,0it80yWF7sc,50,6509,「頑固再聚首?梁家輝連2年助陣五月天
0000000096.png,0it80yWF7sc,95,6532,影帝力挺五月天!梁家輝空運港點拍户
0000000004.png,c24p14rTD_0,3,6555,要對韓國瑜砸派?康裕成:我沒這麼LOV
0000000029.png,c24p14rTD_0,28,6578,征服宇宙康裕成想送韓國瑜薩諾斯手套
0000000047.png,c24p14rTD_0,46,6601,恐嚇道歉留一時不糊塗”綠議員納思
0000000081.png,c24p14rTD_0,80,6624,簡煥宗關閉粉專黃文益再攻擊不原
0000000001.png,ufqShmwrebM,1,6647,疑變換車道失國道4車追撞2死4傷
0000000030.png,ufqShmwrebM,29,6670,疑變換車道失控國道4車追撞2死4傷
0000000046.png,ufqShmwrebM,45,6693,疑變換車道失控國道4車追撞2死4傷
0000000084.png,ufqShmwrebM,83,6716,疑變換車道失控國道4車追撞2死4傷
0000000001.png,4DYEoeG6Css,1,6739,新北蝴蝶地景公園花海光雕閃耀浪漫
0000000019.png,4DYEoeG6Css,18,6762,新北蝴蝶地景公園花海光雕閃耀浪漫
0000000052.png,4DYEoeG6Css,51,6785,"新北蝴蝶地景公園花海,光雕閃耀浪漫"
0000000011.png,gxjfsbFJl7U,10,6808,周興哲首攻蛋落源化身舞王女友現身支援
0000000043.png,gxjfsbFJl7U,42,6831,周興哲首攻蛋落淚化身舞王女友現身支援
0000000058.png,gxjfsbFJl7U,57,6854,看周興哲太興奮!歌迷心跳破160昏倒送
0000000077.png,gxjfsbFJl7U,76,6877,經典情歌首首!周興哲攻蛋眾星到場支援
0000000089.png,gxjfsbFJl7U,88,6900,經典情歌首首周興哲攻蛋眾星到場支援
0000000029.png,1rFf1nbgljQ,28,6923,團隊成形Power錕前小編助郭董打選單
0000000047.png,1rFf1nbgljQ,46,6946,郭董講話太長了!小編提勇氣插話喊卡
0000000082.png,1rFf1nbgljQ,81,6969,郎董講話太長了!小編提勇氣插話喊卡
0000000007.png,B4LWYNMAMFQ,6,6992,藍反核食將有因果謝長廷:馬承諾解套
0000000087.png,B4LWYNMAMFQ,86,7015,怕總統不開心?長廷不評論賴清德訪日
0000000009.png,dGgF2voBfHw,8,7038,"鴻海誰接班?郭證實盧松青,戴正吳出目"
0000000033.png,dGgF2voBfHw,32,7061,兩人出局鴻海新董座將從三挑一
0000000075.png,dGgF2voBfHw,74,7084,股東會逼近鴻海新董座將脫穎而出
