0000000107.png,qLw6EcLZFH8,106,7130,許志安淪全民公敵粉絲罵:太讓人失
0000000007.png,k4NJHOWV9MU,6,7153,許志安黃心穎深合唱台上台下都牽手
0000000024.png,k4NJHOWV9MU,23,7176,「發電機黃心穎出道7年情史比事業精
0000000038.png,k4NJHOWV9MU,37,7199,團與人夫曖昧?黃心穎害吳啟華家庭革
0000000057.png,k4NJHOWV9MU,56,7222,黃心穎男友埋首工作发人曾勸馬國明分
0000000092.png,k4NJHOWV9MU,91,7245,傳遭TVB封殺黃心穎新劇恐延播或換角
0000000001.png,DAlufVnRtFI,1,7268,是否選總統?郭台銘夢到媽祖一定要我出
0000000034.png,DAlufVnRtFI,33,7291,是否選總統?郭台銘夢到媽祖一定要我出:
0000000099.png,DAlufVnRtFI,98,7314,趕場拜關公!郭董跪著參拜盼尋求參選意
0000000001.png,8042BaEdmfs,1,7337,"反駁”卡韓說”王金平:坚持參選不接受徵,"
0000000014.png,8042BaEdmfs,13,7360,「你不尊重我”王金平反而是你卡我不是
0000000027.png,8042BaEdmfs,26,7383,促”立提名機制”王才能合法合理當提名。
0000000044.png,8042BaEdmfs,43,7406,「選舉無效將宣判遭嗆:最好失業選總
0000000056.png,8042BaEdmfs,55,7429,「希望你們敗訴”議員初最好失業去選總
0000000001.png,IAaR48Zq3Mw,1,7452,郭董若參選連勝文:綠營會比韓選更頭
0000000024.png,IAaR48Zq3Mw,23,7475,郭平起平坐國際領袖連台灣唯一見川
0000000049.png,pF592EO5DE0,48,7498,"挺郭董參選?許勝雄宋表態,賴正錯挺乾"
0000000068.png,pF592EO5DE0,67,7521,「媽祖託夢激勵鴻海股價漲幅創13月新
0000000092.png,pF592EO5DE0,91,7544,"挑戰多!資產脱钩工程大誰接班,出國管"
0000000004.png,zoR8q-_kJ44,3,7567,龍魂不滅葉君璋張泰山黃興隆出任教
0000000038.png,zoR8q-_kJ44,37,7590,沒有味全龍張泰山喻中職像是少了翅朋
0000000052.png,zoR8q-_kJ44,51,7613,龍魂不滅葉君璋張泰山貴興隆出任教
0000000081.png,zoR8q-_kJ44,80,7636,龍魂不滅葉君璋張泰山黃興隆出任教;
0000000010.png,L2zIrjPsJZ0,9,7659,遭多店家控欠款多用誠實蜜蜂:已處理80
0000000034.png,L2zIrjPsJZ0,33,7682,遭多店家控欠款多前就實蜜蜂已處理81
0000000056.png,L2zIrjPsJZ0,55,7705,自稱亞洲最大平台honestbee抽成30
0000000035.png,MuGaZ3AaOVo,34,7728,郭台銘參選韓流最大公約數恐變
0000000066.png,MuGaZ3AaOVo,65,7751,郭台銘選總統?韓妙喻愛情片變武俠
0000000001.png,wTT0HAR1JZw,1,7774,迎大甲媽回鑾後北返男子國道上遭開
0000000045.png,wTT0HAR1JZw,44,7797,房仲男開老車遭槍擊車留8處彈:
0000000001.png,iD-LJuGFkkY,1,7820,宛如造勢!韓國瑜最終晚宴湧入3千僑
0000000028.png,iD-LJuGFkkY,27,7843,韓抛“做總統為國民僑胞躁狂喊選總統
0000000053.png,iD-LJuGFkkY,52,7866,基層狂拱選總統韓不急等郭台銘出
0000000094.png,iD-LJuGFkkY,93,7889,宛如造勢!韓國瑜最終晚宴湧入3千僑
0000000001.png,cVKkv_pezu4,1,7912,惡人先告狀逆向撞女大生男喻”都這樣嗎
0000000011.png,cVKkv_pezu4,10,7935,逆向撞倒女大生男怒喊我都這樣
0000000043.png,cVKkv_pezu4,42,7958,"址逆向害撞車男哈我幾十年都這樣,"
0000000055.png,cVKkv_pezu4,54,7981,越線逆向要返家撞女騎士男嗆聲提
0000000102.png,cVKkv_pezu4,101,8004,地方頭痛人物不開心就吼叫鄰少搭!
0000000001.png,R2W5HUMhR4A,1,8027,公股行庫董座大換血藍委質疑選舉考
0000000036.png,R2W5HUMhR4A,35,8050,公股行庫人事調動為選舉?蘇揆:用人為
0000000056.png,R2W5HUMhR4A,55,8073,公股行庫董座大換血疑新系全面掌
0000000003.png,UHWiAH95Oro,2,8096,蔡賴會後傳聞多蔡總統未提現任優
0000000039.png,UHWiAH95Oro,38,8119,"「忍耐諸多貼標籤,總統放話適可而"
0000000070.png,UHWiAH95Oro,69,8142,蔡賴會後傳聞多蔡總統未提現任優
0000000097.png,UHWiAH95Oro,96,8165,賴無正當性?總統道局定義過去執
0000000002.png,Y3w6IqrMaqg,1,8188,惡煞持棍猛K金中玉右手骨折全身擦挫
0000000037.png,Y3w6IqrMaqg,36,8211,金中玉遭痛毆骨折建商行免”議員害敗。
0000000055.png,Y3w6IqrMaqg,54,8234,新北議員金中王遇襲惡煞持球棒痛
0000000077.png,Y3w6IqrMaqg,76,8257,金中玉遭痛毆骨折建商行兇議員書敗言
0000000005.png,QY84z6lS6oo,4,8280,為選舉市政合作藍議員爆本土派尋柯協
0000000023.png,QY84z6lS6oo,22,8303,為選舉市政合作議員爆本土派尋柯協
0000000041.png,QY84z6lS6oo,40,8326,為選舉市政合作議員爆本土派尋柯協
0000000097.png,QY84z6lS6oo,96,8349,"樓面接輯,私下找何?藍議員駁斥否"
0000000014.png,RRhB49cpfRI,13,8372,睽違24天首露面白冰冰吐露面霜心
0000000028.png,RRhB49cpfRI,27,8395,睽違24天首露面白冰冰吐露面癱心
0000000050.png,RRhB49cpfRI,49,8418,睽違24天首露面吃冰冰吐露面癱心
0000000068.png,RRhB49cpfRI,67,8441,胡德夫與友餐敘突量倒一度無呼吸心
