0000000001.png,lUmh0raXeUk,1,0,星座信用卡結合AR搶攻年輕族群
0000000033.png,lUmh0raXeUk,32,23,星座信用卡結合AR搶攻年輕族群
0000000054.png,lUmh0raXeUk,53,46,星座信用卡結合AR搶攻年輕族群
0000000015.png,yk7m3SJ9IDI,14,69,AR點餐機器称重未來商務展造科技體驗
0000000048.png,yk7m3SJ9IDI,47,92,AR點餐機器秘書未來商務展造科技體驗
0000000075.png,yk7m3SJ9IDI,74,115,互動!VR旅遊實景KAR服務員幫點餐
0000000001.png,nMzngL81x5U,1,138,暴雨取消香港巡演紅髮艾德錄影致歉
0000000029.png,nMzngL81x5U,28,161,暴雨取消香港巡演紅髮艾德錄影致歉
0000000051.png,nMzngL81x5U,50,184,絲雨中等候3小時卻聽見廣播取消演出
0000000076.png,nMzngL81x5U,75,207,唱完第一場紅髮艾德香港演出喊自
0000000003.png,RuvotZKEIr0,2,230,15小時連震!花蓮上午餘震規模3.8
0000000029.png,RuvotZKEIr0,28,253,"柱裂,屋頂透光中途之家地震中受損"
0000000050.png,RuvotZKEIr0,49,276,15小時連震!花蓮上午餘震規模3.8
0000000004.png,sd1TZ47r3mQ,3,299,台味大腸包小腸、米血糕餅變零食
0000000035.png,sd1TZ47r3mQ,34,322,台味零食外國人也愛!超商業績增三成
0000000001.png,b6mOx22p8Ok,1,345,其實場A4和牛沒賣了!業者貨源不穩
0000000025.png,b6mOx22p8Ok,24,368,式賣場A4和牛沒賣了!業者:貨源不穩
0000000047.png,b6mOx22p8Ok,46,391,熱降和生質量進口商市場分配也有著
0000000072.png,b6mOx22p8Ok,71,414,"熱降和牛質量,進口商市場分配也有差"
0000000002.png,yj5Bc3bDtbg,1,437,"總統不需被託夢,總統:我邊境走很久"
0000000021.png,yj5Bc3bDtbg,20,460,非廟別苗頭?總統拜媽祖賴拜保生大帝
0000000071.png,yj5Bc3bDtbg,70,483,"話賴!總統:不管金孫,媳婦家和萬事興"
0000000099.png,yj5Bc3bDtbg,98,506,話賴!總統不管金孫媳婦家和萬事興
0000000001.png,GkMTa8H_Icw,1,529,酒駕廂型車逆向連環撞4人傷送醫
0000000029.png,GkMTa8H_Icw,28,552,型車逆向連環撞校車遭波及學生傷
0000000046.png,GkMTa8H_Icw,45,575,酒駕廂型車逆向連環撞4人傷送
0000000073.png,GkMTa8H_Icw,72,598,重型車逆向連環撞校車遭波及1學生傷
0000000088.png,GkMTa8H_Icw,87,621,「酒駕廂型車逆向連環撞4人傷送
0000000001.png,psWbcR43FHo,1,644,生男廁所遊戲室雙手拖拉童腰害嚇哭
0000000032.png,psWbcR43FHo,31,667,百生男闖診所遊戲室雙手拖拉童腰害嚇哭
0000000047.png,psWbcR43FHo,46,690,百生男圓診所遊戲室雙手拖拉童腰害嚇哭
0000000057.png,psWbcR43FHo,56,713,奔出遊戲室求助家長報警男騎腳踏車逃
0000000087.png,psWbcR43FHo,86,736,奔出遊戲室求助家長報警男騎腳踏車逃
0000000001.png,7MBevCMSCE8,1,759,文中路變安中河店家摸黑架水閘門
0000000046.png,7MBevCMSCE8,45,782,澳門大霧原機返航乘客不滿頻抱怨
0000000076.png,7MBevCMSCE8,75,805,門大霧原機返航長榮安排150客住宿
0000000001.png,kipTVueNOLE,1,828,5公分棟距1.2隔壁住戶憂越震越看
0000000021.png,kipTVueNOLE,20,851,5公分棟距剩7.2隔壁住戶憂越震越智
0000000046.png,kipTVueNOLE,45,874,三林遭震非危樓價未達1/200尚安全
0000000082.png,kipTVueNOLE,81,897,三樓房價恐受影響凝土壤液化加速沉陷
0000000022.png,9mFMGJmoC5k,21,920,員工認購愛心芭樂?台水稱:沒有強迫
0000000048.png,9mFMGJmoC5k,47,943,員工認購愛心芭樂?台水稱:沒有強迫
0000000072.png,9mFMGJmoC5k,71,966,員工認購愛心芭樂?台水稱沒有強迫
0000000001.png,4JrLL1-_ITQ,1,989,主震中以身護嬰護理員獲譽最美天使
0000000001.png,qYU4-u_ygv4,1,1012,一機車駕訓班有補路考通過率7成-8成
0000000045.png,qYU4-u_ygv4,44,1035,訓班人仍公總觀察半年是否改為強制
0000000067.png,qYU4-u_ygv4,66,1058,訓班人!公總觀察半年是否改為強制
0000000012.png,eaP4ebJhzZI,11,1081,当空窗失業的人笑可熙主演兼劇本創作
0000000038.png,eaP4ebJhzZI,37,1104,当空窗失業的人吳可熙主演兼劇本創伯
0000000053.png,eaP4ebJhzZI,52,1127,台片爭光趙德胤为人入圍坎城注目單元
0000000079.png,eaP4ebJhzZI,78,1150,黑又消瘦胡歌程输钱南方入圍坎城
0000000106.png,eaP4ebJhzZI,105,1173,一華語入圍主競賽桂綸鎂角逐坎城影后
0000000001.png,k5RuMfHCKxI,1,1196,三国韓流人氣比拼年輕高學歷挺郭居多
0000000053.png,k5RuMfHCKxI,52,1219,吉營手握兩大人氣王誰出征反成難題
0000000002.png,uHpHfjPJkrM,1,1242,砂屋整建可強制柯:別一堆議員來協調
0000000021.png,uHpHfjPJkrM,20,1265,公辦都更等中央柯嗆:別忙初選耽誤國家
0000000094.png,uHpHfjPJkrM,93,1288,"郭台銘奔松仁路斷炎柯酸,是要選里長嗎"
0000000001.png,lM4VJmTbpmo,1,1311,鐵窗工人趁隙偷竊百萬鑽戒賤價典當
0000000026.png,lM4VJmTbpmo,25,1334,鐵窗工人趁隙偷竊百萬鑽戒購價典當
0000000001.png,H_pJxYtckZU,1,1357,走火節登場!無人機+水幕秀吸客近3萬
0000000032.png,H_pJxYtckZU,31,1380,花火節登場!無人機+水幕秀吸客近3萬
0000000054.png,H_pJxYtckZU,53,1403,飞影视女王頭輪廓野柳夜訪新玩法
0000000048.png,K6TXicMnCTI,47,1426,奇車遇攔檢逃亡9年通緝犯被逮
0000000080.png,K6TXicMnCTI,79,1449,奇車遇攔檢逃亡9年通緝犯被逮
0000000001.png,CbhcceRWV54,1,1472,收布假訊息隔三年政院修刑法設罰則
0000000028.png,CbhcceRWV54,27,1495,"資電,網路散布不實訊息最重將判3年"
0000000077.png,CbhcceRWV54,76,1518,行政機關球員兼裁判:新法恐箱制言論
0000000001.png,kpFjRSuKgWE,1,1541,心律不整未注意泳客沖SPA昏倒獲救
0000000049.png,kpFjRSuKgWE,48,1564,"令熱,劇烈運動疼痛易誘發心律不整"
0000000011.png,zIZWhfG_gZs,10,1587,"琴葛雷吸鳳凰之力,潔西卡反派挑撥"
0000000029.png,zIZWhfG_gZs,28,1610,琴葛雷吸”凤凰之力潔西卡反派挑擦
0000000053.png,zIZWhfG_gZs,52,1633,昔日戰友大開殺戒萬磁王頭盔遭炸裂
0000000067.png,zIZWhfG_gZs,66,1656,系列最華麗陣容潔西卡首演X戰警
0000000001.png,w3F580JcbfQ,1,1679,司政鹏女友遭輾斃謝淑薇轟:抵制大都會
0000000037.png,w3F580JcbfQ,36,1702,否認卸責賠償金沒共識業者盡最大誠意
0000000073.png,w3F580JcbfQ,72,1725,否認卸責賠償金沒共識業者:盡最大誠意
0000000025.png,ve7td1lMxPI,24,1748,易太數度衝向記者意圖強搶攝影機
0000000046.png,ve7td1lMxPI,45,1771,辛男喧嘩超商女客只因看一眼遭追逐嗆聲
0000000069.png,ve7td1lMxPI,68,1794,多工思鄉心權喝酒澆愁醉後行為脫序
0000000001.png,EQquJyr-VM0,1,1817,走入時空隧道笔懷舊夯賣火鍋燒肉
0000000026.png,EQquJyr-VM0,25,1840,生入時空隧道轮懷舊夯賣火鍋燒肉
0000000049.png,EQquJyr-VM0,48,1863,走入時空隧道笔懷舊夯賣火鍋燒肉
0000000061.png,EQquJyr-VM0,60,1886,懷舊風勝工業式国保古厝賣美食
0000000031.png,ZOH7mFla3yE,30,1909,"馬國明不生氣,保護黃心穎她年輕知錯了"
0000000057.png,ZOH7mFla3yE,56,1932,或撤主題曲黃心穎馬國明養不起我
0000000084.png,ZOH7mFla3yE,83,1955,曾合作鄭秀文錢小豪來台:不要給她壓力
0000000104.png,ZOH7mFla3yE,103,1978,安心偷食事發第3天鄭秀文首發聲原
0000000015.png,0akKBPaGgww,14,2001,最正駁為信逼宮韓國瑜說三次:絕無此事
0000000102.png,0akKBPaGgww,101,2024,韓國瑜要吳徵召杜紫宸發聲明道歉
0000000001.png,QZMR1zRPXkI,1,2047,頂樓火海5人受困雲梯車搶救5傷送醫
0000000053.png,QZMR1zRPXkI,52,2070,白天地震晚上大火公寓祝融5人受傷
0000000067.png,QZMR1zRPXkI,66,2093,白天地震晚上失火5人受傷住戶驚嚇
0000000003.png,eO_xlzsm-bA,2,2116,震後大雨襲!今變天全台雷雨勿近山區
0000000039.png,eO_xlzsm-bA,38,2139,司五華南雨區東移各地有雨局部大雨
0000000053.png,eO_xlzsm-bA,52,2162,雲雨區內對流強注意雷電擊劇烈天氣
0000000065.png,eO_xlzsm-bA,64,2185,台南高雄澎湖嚴防短時致炎性強降雨
0000000075.png,eO_xlzsm-bA,74,2208,雲雨區內對流強注意雷電擊劇烈天
0000000083.png,eO_xlzsm-bA,82,2231,台南高雄澎湖嚴防短時致炎性強降
0000000097.png,eO_xlzsm-bA,96,2254,五華南雨區東移各地有雨局部大雨
0000000113.png,eO_xlzsm-bA,112,2277,雲雨區內對流強注意雷電擊劇烈天氣
0000000133.png,eO_xlzsm-bA,132,2300,司一雨勢稍緩午後至晚上山區
0000000152.png,eO_xlzsm-bA,151,2323,白天不下雨時感覺悶熱夜晚清晨舒適
0000000177.png,eO_xlzsm-bA,176,2346,带留鋒前暖濕空氣周六雨多局部
0000000197.png,eO_xlzsm-bA,196,2369,高二起偏西南暖濕環境午後局部雷雨
0000000209.png,eO_xlzsm-bA,208,2392,賽後大雨襲!今變天全台雷雨勿近山區
0000000001.png,r39dGcWs95Q,1,2415,921就震科北市2大樓傾斜百人急疏散
0000000012.png,r39dGcWs95Q,11,2438,921就震北市2大樓傾斜百人急疏散
0000000028.png,r39dGcWs95Q,27,2461,強震瞬間異常巨響大樓歪了百人驚味
0000000052.png,r39dGcWs95Q,51,2484,強震瞬間異常巨響大樓歪了百人驚嚇
0000000073.png,r39dGcWs95Q,72,2507,強震瞬間異常巨響大樓歪了百人驚嚇
0000000022.png,WYcnYLJCpoY,21,2530,地震瞬間中橫落石如雨駕駛狂閃尖叫
0000000040.png,WYcnYLJCpoY,39,2553,也震瞬間中橫落石如雨駕駛狂閃尖叫
0000000062.png,WYcnYLJCpoY,61,2576,地震瞬間中橫落石如雨駕駛狂閃尖叫
0000000033.png,nMm8fptQeDQ,32,2599,外商捐贈學校新產品畢業季狂搶人才
0000000050.png,nMm8fptQeDQ,49,2622,外商捐贈學校新產品畢業季狂搶人才
0000000090.png,nMm8fptQeDQ,89,2645,國際大廠擴大投資AI領域成重點
0000000130.png,nMm8fptQeDQ,129,2668,國際大廠擴大投資A領域成重點
0000000154.png,nMm8fptQeDQ,153,2691,國際大廠擴大投資A領域成重點
0000000185.png,nMm8fptQeDQ,184,2714,或立AI研發中心微軟目標助企業轉型
0000000208.png,nMm8fptQeDQ,207,2737,台灣服務業值得投資政策鬆綁是前提
0000000230.png,nMm8fptQeDQ,229,2760,台灣服務業值得投資政策鬆綁是前提
0000000024.png,Zn1JEd_oNXk,23,2783,大路口人車復雜裝智慧警示降低死角
0000000059.png,Zn1JEd_oNXk,58,2806,大路口人車複雜裝智慧警示降低死角
0000000094.png,Zn1JEd_oNXk,93,2829,智慧路口提前實現提前警示避免意外
0000000115.png,Zn1JEd_oNXk,114,2852,智慧路口提前實現提前警示避免意外
0000000134.png,Zn1JEd_oNXk,133,2875,智慧路口提前實現提前警示避免意外
0000000183.png,Zn1JEd_oNXk,182,2898,智慧路口提前實現提前警示避免意外
0000000206.png,Zn1JEd_oNXk,205,2921,智慧路口提前實現提前警示避免意外
0000000001.png,Ie3Xp9aS6hQ,1,2944,台積法說開場報平安地震不受影響
0000000022.png,Ie3Xp9aS6hQ,21,2967,全台大地震台積電產能不受影響
0000000030.png,Ie3Xp9aS6hQ,29,2990,台積電法說公布財報第一季EPS2.37元
0000000075.png,Ie3Xp9aS6hQ,74,3013,台積電估今年小幅成長可望發10元股利
0000000128.png,Ie3Xp9aS6hQ,127,3036,台積電魏哲家脫離谷底下半年強力反彈
0000000176.png,Ie3Xp9aS6hQ,175,3059,台積電魏哲家:脫離谷底下半年強力反彈
0000000205.png,Ie3Xp9aS6hQ,204,3082,"台積電魏哲家,脫離谷底下半年強力反彈"
0000000004.png,MV0VsgVhrE4,3,3105,英德內則消耗綠營傳民進黨撤退黨潮
0000000044.png,MV0VsgVhrE4,43,3128,英德對撞綠營破碎立委選將”找鳴人
0000000149.png,MV0VsgVhrE4,148,3151,英德對撞綠營破碎立委選將“找晦人
0000000206.png,MV0VsgVhrE4,205,3174,2020綠營選將拉警報民進黨全面「防台」
0000000003.png,kzQ-ynsoi2s,2,3197,郭台銘替韓國瑜解套港媒看好台風崛起
0000000045.png,kzQ-ynsoi2s,44,3220,郭台銘替韓國瑜解套?港媒看好台国崛起
0000000079.png,kzQ-ynsoi2s,78,3243,權力下放郭台銘從政鴻海集團短多長空
0000000113.png,kzQ-ynsoi2s,112,3266,股價未達200元郭董不退休小股東失望
0000000156.png,kzQ-ynsoi2s,155,3289,管理風格-人說了算日媒唱衰鴻海營運
0000000199.png,kzQ-ynsoi2s,198,3312,鴻海能完全切割利益衝突爭議郭董接招
0000000010.png,TYVEaUveA5o,9,3335,強勢韓流殺出新路郭台铭劍指2020
0000000036.png,TYVEaUveA5o,35,3358,強勢韓流殺出新路郭台銘劍指2020
0000000054.png,TYVEaUveA5o,53,3381,郭董參選真能為初選解套找台階
0000000127.png,TYVEaUveA5o,126,3404,郭董參選真能為初選解套找台階
0000000148.png,TYVEaUveA5o,147,3427,拱韓參選仍是大熱門風吹草動引話題
0000000214.png,TYVEaUveA5o,213,3450,從企業家變政治人郭董參選掀波瀾
0000000001.png,4LaAuAfLDr0,1,3473,郭董總統路”學者胡幼偉:有五關要過
0000000022.png,4LaAuAfLDr0,21,3496,「韓粉能否轉郭粉”胡幼偉:影響郭民調數字
0000000031.png,4LaAuAfLDr0,30,3519,斷開或集團接管台灣?學者:2種不同心態
0000000050.png,4LaAuAfLDr0,49,3542,"直通白宫,中南海郭與美陸關係分寸拿捏"
0000000063.png,4LaAuAfLDr0,62,3565,“爆料”郭有無材料在敵人手上要有準備
0000000077.png,4LaAuAfLDr0,76,3588,藍營選民能否支持郭學者:柯文哲是個關自
0000000004.png,xQgDEHC5m9k,3,3611,昔柯競選總幹事小野選後回鍋引發爭議
0000000018.png,xQgDEHC5m9k,17,3634,任職文化基金會議員批小野服務政治
0000000027.png,xQgDEHC5m9k,26,3657,回鍋任基金會董事長小野未拿半毛錢
0000000036.png,xQgDEHC5m9k,35,3680,昔幫打選戰今回銷小野柯P希望我回來
0000000001.png,MKd7ivtyUjs,1,3703,企業家選總統川普成郭台銘參考對象
0000000017.png,MKd7ivtyUjs,16,3726,川普強勢領導風格常公開嗆聲口水戰
0000000031.png,MKd7ivtyUjs,30,3749,“讓美國再次偉大”淺顯易懂川普Style
0000000049.png,MKd7ivtyUjs,48,3772,捍衛名聲主動出擊川普多次槓上媒體
0000000076.png,MKd7ivtyUjs,75,3795,"郭掌美陸關係能與華府,北京高層對話"
0000000088.png,MKd7ivtyUjs,87,3818,雄厚財力助選估郭個人財富70億美元
0000000099.png,MKd7ivtyUjs,98,3841,白手起家聲望夠郭台銘全球擁萬員工
0000000001.png,K-mYd07su1Q,1,3864,韓重申2020不在考量內藍委仍在選項內
0000000030.png,K-mYd07su1Q,29,3887,吳韓會未完待續韓:任何安排都不排序
0000000001.png,daquS1gQQCc,1,3910,儂特利尔3月份薪水!勞動局:75人沒領到
0000000029.png,daquS1gQQCc,28,3933,大飲停牌“儂特利發不出薪最高罰100萬
0000000053.png,daquS1gQQCc,52,3956,大飲停牌“懷特利發不出薪”最高罰100萬
0000000068.png,daquS1gQQCc,67,3979,儂特利尔3月份薪水!勞動局:75人沒領到
0000000023.png,hJuavFtKgOA,22,4002,-世新任理:台纪799kie韓國於298%國民當讲讲座
0000000070.png,hJuavFtKgOA,69,4025,=51.9%is57.19%4263sues8.6%。定個好選
0000000080.png,hJuavFtKgOA,79,4048,三部6029.img57198、4262wang8.6%。字鹏络建站
0000000001.png,w6vQbMMQErY,1,4071,便衣警攔運惹毛殯葬正妹警駁:合乎規定
0000000013.png,w6vQbMMQErY,12,4094,便衣警爛車惹毛殯葬正妹警駁:合乎規定
0000000034.png,w6vQbMMQErY,33,4117,“可以站好嗎警曝蒐證帶自清警口氣平和
0000000063.png,w6vQbMMQErY,62,4140,出沒犯案熱點有前科遭警跟隨攔查
0000000081.png,jDcXWImWevA,80,4163,郭台銘來了唐湘龍韓朱吳都解套
0000000004.png,fOmRztZArvY,3,4186,“震瘋校園師大男宿洗手台磁磚掉
0000000042.png,fOmRztZArvY,41,4209,“震瘋校園師大男宿洗手台磁磚掉
0000000058.png,fOmRztZArvY,57,4232,"北捷台鐵一度停駛,通勤族嚇壞幸無人傷"
0000000012.png,sJN23U20_00,11,4255,三善而言活到當日韓国经加强
0000000032.png,sJN23U20_00,31,4278,三敦盖面看佳音上街转国论的理論
0000000002.png,Ih36f1HgK3I,1,4301,大地震古董吊燈碎裂黃子佼:欲哭無淚
0000000019.png,Ih36f1HgK3I,18,4324,大地震古董吊燈碎裂黃子佼:欲哭無
0000000040.png,Ih36f1HgK3I,39,4347,蔡依林金曲獎座斷裂DJ吳建恆CD牆倒塌
0000000067.png,Ih36f1HgK3I,66,4370,來台遇地震錢小豪新鮮沒看過!兒子淡定
0000000090.png,Ih36f1HgK3I,89,4393,影廳放映機歪斜94人受影響全面退票
0000000106.png,Ih36f1HgK3I,105,4416,影廳放映機歪斜194人受影響全面退票
0000000032.png,i76dxuecsss,31,4439,"灣10名詐騙犯,日本被逮!打去大陸騙錢"
0000000060.png,i76dxuecsss,59,4462,"詐騙集團山梨,千葉設點仍有同夥在逃"
0000000085.png,i76dxuecsss,84,4485,內查獲詐騙教戰守則窗戶封死
0000000128.png,i76dxuecsss,127,4508,是的合會三国
0000000137.png,i76dxuecsss,136,4531,"人主腦,並陸高齡者手冊泡水淹證據"
0000000155.png,i76dxuecsss,154,4554,成中國社會問題2017年被害620億
0000000188.png,i76dxuecsss,187,4577,本年詐騙金額百億泰警查獲15人集團
0000000211.png,i76dxuecsss,210,4600,"達雅高級別墅五房兩廳,15名電話手"
0000000240.png,i76dxuecsss,239,4623,"話50部,電腦20台詐百名日本人2.2億"
0000000286.png,i76dxuecsss,285,4646,第三地打電話跨國詐騙犯罪激增
0000000014.png,_1k0PPAkU0k,13,4669,是由党委:不能看了郭台銘計控套韓國公民強納鼓)
0000000046.png,_1k0PPAkU0k,45,4692,三、由曾秀:不能有了郭台铭矿控室韓國裕全民調纳鼓》
0000000055.png,_1k0PPAkU0k,54,4715,部台銘言在好入國民黨初選綠徵召男缝》唱大国倫)
0000000021.png,Zkcv6f_ILTU,20,4738,郭台銘前進统后台遭川普嚴選總纯摆在布局2
0000000070.png,Zkcv6f_ILTU,69,4761,英儿歌台銘要如理石尚贸有算回份音選輯
0000000002.png,VytjvfjdtCE,1,4784,天搖地動燈具晃桌椅搖用餐客急逃生
0000000043.png,VytjvfjdtCE,42,4807,磁磚散落!金林大廈傾斜靠在隔壁棟上
0000000055.png,VytjvfjdtCE,54,4830,921就震至週大樓震到緊貼磁磚剝落
0000000082.png,VytjvfjdtCE,81,4853,921就傾斜北市老舊建物震後再受損
0000000095.png,VytjvfjdtCE,94,4876,地震威力大!信義區大樓傾斜32人急疏影
0000000001.png,Ky5aipfwylw,1,4899,韓流帶動商機?高雄伴手禮選拔哈韓風
0000000021.png,Ky5aipfwylw,20,4922,韓流帶動商機?高雄伴手禮選拔哈韓風
0000000050.png,Ky5aipfwylw,49,4945,十大伴手禮票選夯業者搶搭韓流美食風潮
0000000083.png,Ky5aipfwylw,82,4968,結合過去票選活動:6月推全市美食地圖
0000000001.png,QEEhH0cQCkg,1,4991,关搖地動民眾拔腿逃傅崐萁夫婦拜廟鎮定
0000000023.png,QEEhH0cQCkg,22,5014,"花蓮車站玻璃碎,水管破開放站票疏散旅客"
0000000049.png,QEEhH0cQCkg,48,5037,天搖地動民眾拔腿逃傅崐萁夫婦拜廟鎮定
0000000059.png,QEEhH0cQCkg,58,5060,"超賣場飲料掉,酒瓶碎水族箱水險溢出"
0000000087.png,QEEhH0cQCkg,86,5083,"超賣場飲料掉,酒瓶碎水族箱水險溢出"
0000000069.png,ODavw3aI5lM,68,5106,食拒捕舉槍自盡秘魯前總統享壽69歲
0000000081.png,ODavw3aI5lM,80,5129,總統加西亞口才佳獲封南美甘迺迪”
0000000096.png,ODavw3aI5lM,95,5152,「二度任秘魯元首涉貪加西亞拒捕自號
0000000120.png,ODavw3aI5lM,119,5175,聲大作!警方破門救人送醫仍回天乏術
0000000154.png,ODavw3aI5lM,153,5198,項重量級人物秘魯人看法:評價兩極
0000000175.png,ODavw3aI5lM,174,5221,5歲勝選秘魯總統推經濟改革失敗收場
0000000185.png,ODavw3aI5lM,184,5244,膨破200萬%武裝鎮因年輕執政背黑名
0000000199.png,ODavw3aI5lM,198,5267,寂後回歸政壇2006年再度登總統大位
0000000227.png,ODavw3aI5lM,226,5290,2任期捲跨國行賄案疑收巴西建商賄賂
0000000272.png,ODavw3aI5lM,271,5313,"|西亞否認涉資尋烏拉圭政治庇護,失敗"
0000000296.png,ODavw3aI5lM,295,5336,資疑雲前總統自秘魯全國哀悼3天
0000000007.png,ebtfXD7Ggzc,6,5359,"「搭肩,樓腰,拍臀工控診所醫涉性"
0000000043.png,ebtfXD7Ggzc,42,5382,驚恐女員工控醫教心電圖”碰敏感部位
0000000071.png,ebtfXD7Ggzc,70,5405,驚恐!女員工控醫教心電圖”碰敏感部位
0000000088.png,ebtfXD7Ggzc,87,5428,否認醫師性騷」診所簡訊回前員工報復
0000000001.png,Qjfmmi588pI,1,5451,驚魂40分鐘終脫困住戶誤報消防累壞
0000000016.png,Qjfmmi588pI,15,5474,困電梯別慌逃出恐堂樓消防備萬用鏡是
0000000040.png,Qjfmmi588pI,39,5497,地震搖搖雙北13起電梯受困救出44人
0000000058.png,Qjfmmi588pI,57,5520,困電梯別慌逃出恐墜樓消防備萬用鑰匙
0000000072.png,Qjfmmi588pI,71,5543,黑漆漆運動中心地震跳電全日停止營業
0000000091.png,Qjfmmi588pI,90,5566,黑漆漆運動中心地震跳電全日停止營業
0000000001.png,hKPTNP1AvDA,1,5589,松仁路地裂烏龍!鄰居郭台銘搶先來幫忙
0000000033.png,hKPTNP1AvDA,32,5612,松仁路地裂烏龍!鄰居郭台銘搶先來幫忙
0000000063.png,hKPTNP1AvDA,62,5635,松仁路地裂烏龍!鄰居郭台銘搶先來幫们
0000000081.png,hKPTNP1AvDA,80,5658,「地震路突起了!郭台銘霸氣叮寧市府應檢们
0000000106.png,hKPTNP1AvDA,105,5681,地震路突起了!郭台銘霸氣阿峰:市府應檢值
0000000001.png,oXuu5ddF1qU,1,5704,台鐵便當縮水?網友買排骨比官方圖片
0000000045.png,oXuu5ddF1qU,44,5727,「便當重量超過4759台鐘澄清份量不縮水
0000000071.png,oXuu5ddF1qU,70,5750,「便當重量超過4759台鐵澄清份量不縮小
0000000080.png,oXuu5ddF1qU,79,5773,"超商便當新招牌系列漲2塊錢,反映成本"
0000000006.png,Noi8cdF7Qtg,5,5796,周五起各地有雨中南部有局部大雨
0000000065.png,Noi8cdF7Qtg,64,5819,周起雨仍多下周二起雨減少
0000000077.png,Noi8cdF7Qtg,76,5842,周五起白天熱到稍早晚舒適
0000000095.png,Noi8cdF7Qtg,94,5865,周五起白天熱到稍熱早晚舒適
0000000120.png,Noi8cdF7Qtg,119,5888,周六起雨仍多下周二起雨減少
0000000137.png,Noi8cdF7Qtg,136,5911,周五起自天熱到稍早晚舒適
0000000154.png,Noi8cdF7Qtg,153,5934,周五起注意北中南部金馬易有关
0000000172.png,Noi8cdF7Qtg,171,5957,周国各地有雨中南部有局部大雨
0000000001.png,Z8oOc2tjnHE,1,5980,煮早餐引發火警母赤腳抱女急逃命
0000000021.png,Z8oOc2tjnHE,20,6003,煮早餐引發火警母赤腳抱女急逃命
0000000062.png,Z8oOc2tjnHE,61,6026,煮早餐引發火警母赤腳抱女急逃命
0000000001.png,efKnX7lUTk4,1,6049,進口車換碼整台賣!國產車拆解5折銷售
0000000031.png,efKnX7lUTk4,30,6072,新車零件有編碼集團鎖定車齡5-10年信
0000000084.png,efKnX7lUTk4,83,6095,新車零件有碼!集團鎖定車齡5-10年信
0000000001.png,oUH6dOK1f_4,1,6118,檢方以輕生不起訴死者子抗議求真相
0000000016.png,oUH6dOK1f_4,15,6141,檢方以輕生不起訴死者子抗議求真机
0000000070.png,oUH6dOK1f_4,69,6164,檢方以輕生不起訴死者子抗議求真相
0000000001.png,hk-QgaMnWaI,1,6187,“怎沒人看著爺爺家屬控長照中心卸責
0000000041.png,hk-QgaMnWaI,40,6210,爺爺手腳無力怎破窗家屬疑墜樓是意外
0000000068.png,hk-QgaMnWaI,67,6233,"爺爺手腳無力怎破窗,家屬疑墜樓是意"
0000000009.png,src6FLFbQH4,8,6256,同公司開2種發票鵬灣業者不影響領要
0000000017.png,src6FLFbQH4,16,6279,搞烏龍三獎以上列清單稽徵所已補鈣
0000000050.png,src6FLFbQH4,49,6302,搞烏龍獎以上列清單稽徵所已補
0000000072.png,src6FLFbQH4,71,6325,領獎要注意破損故發票視同廢紙無资
0000000001.png,XsX6Fm73toI,1,6348,50元發票中1萬卻領不到?消費者納民
0000000035.png,XsX6Fm73toI,34,6371,萬元飛了?難得中英竟稱”問題發票
0000000078.png,XsX6Fm73toI,77,6394,發票中1萬元領不到國稅局店家搞烏
0000000010.png,KchFp9Y1NVs,9,6417,不只性歸!遭控醫師涉欠薪曾任台大醫院
0000000033.png,KchFp9Y1NVs,32,6440,不只性歸!遭控醫師涉欠薪曾任台大醫院
0000000085.png,KchFp9Y1NVs,84,6463,簽不平等合約惹議」否認勞工局查證日
0000000005.png,4y5gKJb7EZ0,4,6486,郭董參選首份民調出小輸韓國瑜0.85
0000000032.png,4y5gKJb7EZ0,31,6509,郭董參選首份民調出爐小輸韓國瑜0.85
0000000055.png,4y5gKJb7EZ0,54,6532,郭vs蔡賴大幅領先柯P參戰支持度仍最高
0000000079.png,4y5gKJb7EZ0,78,6555,|經濟牌奏效郭台銘跳脫藍綠吸中間選目
0000000004.png,oAAVvF8Cpq8,3,6578,沒休息!韓國瑜回國直奔市府“零時差”上二
0000000030.png,oAAVvF8Cpq8,29,6601,沒休息韓國瑜回國直奔市府“零時差上二
0000000049.png,oAAVvF8Cpq8,48,6624,沒休息!韓國瑜回國直奔市府“零時差”
0000000062.png,oAAVvF8Cpq8,61,6647,即刻上工!韓挺高雄待辦公室猛批公文
0000000087.png,oAAVvF8Cpq8,86,6670,即刻上工!韓抵高雄待辦公室猛批公
0000000001.png,CjsNCrJyiq0,1,6693,面壁崩落煙塵飛揚震央銅門場面動
0000000045.png,CjsNCrJyiq0,44,6716,遊太魯閣遭落石擊中男子一度命危
0000000083.png,CjsNCrJyiq0,82,6739,龜山島落石揚塵宜蘭震感明顯儲沙塔但
0000000001.png,KhM5I8ZY3Kk,1,6762,"「快逃啊!辦公室,百貨狂晃民眾嚇到動不"
0000000038.png,KhM5I8ZY3Kk,37,6785,百貨爆水管燈具搖!櫃姊哭喊:我要撤村
0000000058.png,KhM5I8ZY3Kk,57,6808,站不穩!會議室男如喝醉高架路燈像鐘托
0000000100.png,KhM5I8ZY3Kk,99,6831,還在搖!家長拖孩衝出餐廳辦公室牆破汇
0000000126.png,KhM5I8ZY3Kk,125,6854,還在搖!家長拖孩衝出餐廳辦公室牆破
0000000141.png,KhM5I8ZY3Kk,140,6877,還在搖!家長拖孩衝出餐廳辦公室牆破
0000000001.png,vQ2rw7EQs3Q,1,6900,我的車勒?女友車不見男友求復合變則
0000000016.png,vQ2rw7EQs3Q,15,6923,我的車勒?女友軍不見男友求復合變則
0000000038.png,vQ2rw7EQs3Q,37,6946,我的車勒?女友不見男友求復合變里
0000000001.png,ZRibXGJ-voQ,1,6969,才爆共軍台數量吳釗燮又PO軍裝
0000000029.png,ZRibXGJ-voQ,28,6992,才爆共軍台數量吴剑變又PO軍裝
0000000065.png,ZRibXGJ-voQ,64,7015,才爆共軍脅台數量吳釗燮又PO軍裝照
0000000087.png,ZRibXGJ-voQ,86,7038,才爆料軍事機密吳釗燮推特又PO軍裝
0000000001.png,-KUtWDJ4GEk,1,7061,部車也重視警鍥而不捨破解體工
0000000015.png,-KUtWDJ4GEk,14,7084,偷一部車也重視警鍥而不捨破解體工
0000000027.png,-KUtWDJ4GEk,26,7107,偷一部車也重視警鍥而不捨破解體工
