0000000001.png,R7N8RZx1KMY,1,0,台商回流效益佳總統上修目標5000億
0000000013.png,R7N8RZx1KMY,12,23,目前已核准52家廠商累計投資2800億
0000000036.png,R7N8RZx1KMY,35,46,合商名揚國際燙金箔窗簾居世界前3名
0000000010.png,ynkZ1vKntU4,9,69,"走訪基層,郭台銘打地鋪夜宿農友家"
0000000041.png,ynkZ1vKntU4,40,92,主訪基層郭台銘打地鋪夜宿農友家
0000000052.png,ynkZ1vKntU4,51,115,"走訪基層,郭台銘打地鋪夜宿農友家"
0000000067.png,ynkZ1vKntU4,66,138,中小企業郭董基層拼農工商
0000000087.png,ynkZ1vKntU4,86,161,中小企業郭董走基層拼農工商
0000000001.png,5YOC10-pdOU,1,184,"【步系美食!肉餅,关进百貨邊走邊吃"
0000000019.png,5YOC10-pdOU,18,207,"步系美食肉餅,美逛百貨邊走邊吃"
0000000041.png,5YOC10-pdOU,40,230,"食街崛起手拿零食推快閃,分店搶市"
0000000011.png,zyrRtOoP6iY,10,253,總言承旭2年張照顧責不紅”被隱藏
0000000073.png,zyrRtOoP6iY,72,276,間重疊?分手張熙恩同年與林志玲出國
0000000098.png,zyrRtOoP6iY,97,299,承旭單親家庭生自認不夠勇敢去愛
0000000008.png,wi01Zha-uRs,7,322,問題19分鐘釀悲劇再爆5分園涉虐擬實
0000000049.png,wi01Zha-uRs,48,345,"保處查32家托嬰19間衛生,消防不合格"
0000000076.png,wi01Zha-uRs,75,368,"保處查32家托嬰19間衛生,消防不合格"
0000000013.png,a3xuZXQjZR0,12,391,5歲張孝全秘婚生子!長腿老婆曝光
0000000041.png,a3xuZXQjZR0,40,414,文服情場浪子!老婆曾被拍曬衣服遛狗
0000000059.png,a3xuZXQjZR0,58,437,"為丞琳潘慧如,徐懷鈺張孝全情史豐富"
0000000080.png,a3xuZXQjZR0,79,460,"易丞琳潘慧如,徐懷張孝全情史豐富"
0000000001.png,fBmo5Pz550A,1,483,車失控追撞肇逃車主怒報警揪駕駛
0000000043.png,fBmo5Pz550A,42,506,車失控追撞肇逃主怒報警揪駕駛
0000000082.png,fBmo5Pz550A,81,529,車門毀損估修費約2萬多找不到人踞
0000000001.png,YCsTCxuuUiw,1,552,販飛車拒捕警連開13槍逮1嫌2在逃
0000000048.png,YCsTCxuuUiw,47,575,販飛車拒捕警連開13槍逮1嫌2在
0000000066.png,YCsTCxuuUiw,65,598,版飛車拒捕警連開13槍逮1嫌2在逃
0000000001.png,YxqoVua8404,1,621,天雨路滑闖紅燈轎車撞翻巡邏車警輕傷
0000000046.png,YxqoVua8404,45,644,天雨路滑闖紅燈轎車撞翻巡邏車警輕傷
0000000065.png,YxqoVua8404,64,667,天雨路滑闖紅燈轎車撞翻巡邏車警輕傷
0000000001.png,RuYa5k66gVc,1,690,見餐具旁遺留手機!男買鍋貼順手牽羊
0000000037.png,RuYa5k66gVc,36,713,見餐具竞遺留手環男買鍋貼順手牽羊
0000000067.png,RuYa5k66gVc,66,736,子行竊監視器全都錄!業者報警貼告示
0000000001.png,VWEP2DrS9QI,1,759,外跟本尊合照!蜘蛛人”湯姆現身樂園
0000000019.png,VWEP2DrS9QI,18,782,克葛倫霍德國脫面罩湯姆露臉全場驚呼
0000000069.png,VWEP2DrS9QI,68,805,黑豹化身紐約警探追兇手封鎖曼哈頓
0000000094.png,VWEP2DrS9QI,93,828,藏版復仇片段?驚奇隊長開車載貓咪
0000000016.png,T9lO7C1eKnQ,15,851,海瑟薇詐騙徒聯手胖艾咪拐富豪
0000000037.png,T9lO7C1eKnQ,36,874,海瑟薇詐騙徒聯手胖艾咪拐富豪
0000000085.png,T9lO7C1eKnQ,84,897,場初見安海瑟薇胖艾咪:怎能如此迷人
0000000004.png,9L3Fi6-__r0,3,920,"卫戰母節!電商下殺百元服飾,包包5折"
0000000033.png,9L3Fi6-__r0,32,943,卫戰母節!電商下殺百元服飾包包5折
0000000052.png,9L3Fi6-__r0,51,966,一台滿額抽日本機票遊戲闖關抽電器
0000000001.png,5N0v7MUHRME,1,989,天給自經區說帖跳票?黃捷:6天給初稿
0000000049.png,5N0v7MUHRME,48,1012,天給自經區說帖跳票?韓國瑜:不要急
0000000007.png,dW6qKMA3QPM,6,1035,国中生電話向母傳情女學生感性哭了
0000000034.png,dW6qKMA3QPM,33,1058,國中生電話向母傳情女學生感性哭了
0000000080.png,dW6qKMA3QPM,79,1081,分色特效通訊軟體推出限定版新功能
0000000001.png,hJEY3lN8Z6c,1,1104,北市選舉無效訴訟宣判結果影響2020
0000000023.png,hJEY3lN8Z6c,22,1127,可若一審敗訴恐選總統突破藍綠重圍
0000000053.png,hJEY3lN8Z6c,52,1150,可若一審敗訴恐選總統突破藍綠重
0000000001.png,NRAPCuFHKrg,1,1173,7歲主嫌當強盜首領持刀脅迫暴力洗劫
0000000032.png,NRAPCuFHKrg,31,1196,我帶你去看車誕騙被害人上車持刀架聞
0000000051.png,NRAPCuFHKrg,50,1219,我帶你去看車誕騙被害人上車持刀架睛
0000000065.png,NRAPCuFHKrg,64,1242,或捐!押人南下沿路會車牌換躲避警追緝
0000000001.png,anq-JdW3K78,1,1265,了全上課新北設通學卷三時段全淨空
0000000039.png,anq-JdW3K78,38,1288,學者僅行人通行:預計4年完成224所
0000000062.png,anq-JdW3K78,61,1311,學巷行人通社預計4年完成224所
0000000001.png,XK8XwWPpvJc,1,1334,日本L牌車只賣8.5萬詐騙還被綁架搶劫
0000000063.png,XK8XwWPpvJc,62,1357,日本L牌車只賣8.5萬詐騙還被綁架搶劫
0000000001.png,-ngC50vgPG4,1,1380,友噴殺蔣萬安兒藍營狱:根本是假韓粉
0000000043.png,-ngC50vgPG4,42,1403,友嗆殺蔣萬安兒藍營批:根本是假韓粉
0000000077.png,-ngC50vgPG4,76,1426,書粉瞬間變韓黑?臉書威脅蔣萬安提告
0000000001.png,tBqXJclHOUs,1,1449,三大南市醫重複用醫材恐違法接罰10-50萬
0000000073.png,tBqXJclHOUs,72,1472,月”二手醫材衛福部解套提證明告知病患
0000000001.png,8YlLJbRSuUA,1,1495,复仇者效應延燒薩諾斯同款水果陸走紅
0000000024.png,8YlLJbRSuUA,23,1518,火参果淡而無味復仇者上映前乏人問津
0000000051.png,8YlLJbRSuUA,50,1541,"与投果農引進黃色火龍果,口感酸中帶甜"
0000000005.png,evPcEh7paAc,4,1564,等日打蔡總統:賴清德談解決核食問題
0000000021.png,evPcEh7paAc,20,1587,首清德好羨慕安倍增消費稅解決少子化
0000000037.png,evPcEh7paAc,36,1610,當總統解禁核食?賴清德:用國際標準
0000000064.png,evPcEh7paAc,63,1633,三不解決核食賴清德:台無法入CPTPP
0000000001.png,WmCkZxLOmEU,1,1656,二度就業應徵外務中年車手5天盜領150萬
0000000063.png,WmCkZxLOmEU,62,1679,大嫩易抓?詐騙車手轉向二度就業中年人
0000000001.png,jvESdL3n8L0,1,1702,李酒商捐60萬要求學校拍照進中華民國
0000000056.png,jvESdL3n8L0,55,1725,兩岸政治敏感惹爭議校方退回捐款
0000000062.png,Kjs-yS1_n9U,61,1748,"千億台幣,東海岸鐵路馬國一度宣布暫停"
0000000075.png,Kjs-yS1_n9U,74,1771,马尔籍留取道民的
0000000084.png,Kjs-yS1_n9U,83,1794,古無法回收成永久性負債馬國喊停
0000000092.png,Kjs-yS1_n9U,91,1817,路海岸鐵路計畫沿線產業人煙稀少
0000000107.png,Kjs-yS1_n9U,106,1840,各工程向中國借款中國企業興工無自主
0000000129.png,Kjs-yS1_n9U,128,1863,去償還巨額貨款將以“使用權”拱手相抵
0000000147.png,Kjs-yS1_n9U,146,1886,里蘭卡港口無法獲利讓渡中國99年經營
0000000163.png,Kjs-yS1_n9U,162,1909,勞陷阱帶路“國危機沿線多國處境一致
0000000178.png,Kjs-yS1_n9U,177,1932,吉「帶路工程涉千億台幣違約金需實交涉
0000000207.png,Kjs-yS1_n9U,206,1955,國爭回帶路”建設本國訂單提高到4成
0000000240.png,Kjs-yS1_n9U,239,1978,司跟進深水港中國出資達台幣2200億
0000000264.png,Kjs-yS1_n9U,263,2001,員價重緬甸砍經費剩1/5中資股退剩7成
0000000282.png,Kjs-yS1_n9U,281,2024,國反彈習近平公開放低姿態說“帶路”
0000000330.png,Kjs-yS1_n9U,329,2047,國“一帶一路10年1兆美金計畫持續修正
0000000006.png,VJ97HrrvNqk,5,2070,閃燈路口又出事計程車撞小貨車4人受傷
0000000018.png,VJ97HrrvNqk,17,2093,閃燈路口又出事計程車撞小貨車4人受傷
0000000033.png,VJ97HrrvNqk,32,2116,閃紅燈路口計程車沒先停衝撞貨車釀四傷
0000000048.png,VJ97HrrvNqk,47,2139,閃紅燈路口計程車沒先停衝撞貨車釀四傷
0000000003.png,AgmTFp2xsIw,2,2162,女淫性自由点
0000000001.png,HRvTRccZ4tU,1,2185,基隆離奇命案飛車撞人奪命4嫌棄車逃逸
0000000032.png,HRvTRccZ4tU,31,2208,男子疑遭蓄意衝撞一度卡車底送醫不治
0000000073.png,HRvTRccZ4tU,72,2231,疑債務+毒品交易價錢談不攏蓄意撞人釀死
0000000079.png,lTEsYjowVKw,78,2254,波酸一問三不知韓批:不要剪接扭曲
0000000051.png,uN2xjFXr0WY,50,2277,"「政府幫你賺一萬,遭批若虧損也要宣傳"
0000000085.png,uN2xjFXr0WY,84,2300,"「政府幫你賺一萬,這批若虧損也要宣傳"
0000000104.png,uN2xjFXr0WY,103,2323,勞工擔憂退休荷包低新下多提撥很難
0000000130.png,uN2xjFXr0WY,129,2346,勞工擔憂退休荷包低新下多提撥很難
0000000150.png,uN2xjFXr0WY,149,2369,金管會推自選平台但勞工未必能判斷
0000000187.png,uN2xjFXr0WY,186,2392,金管會推自選平台但勞工未必能判斷
0000000211.png,uN2xjFXr0WY,210,2415,投資有賺有賠政府民眾都應持平常心
0000000010.png,HFAAs6knX6Y,9,2438,高歌三曲陳水扁站肥皂箱”挑戰中監紅線
0000000028.png,HFAAs6knX6Y,27,2461,高歌三曲陳水扁站”肥皂箱”挑戰中監紅線
0000000046.png,HFAAs6knX6Y,45,2484,晶簽書場外抗議陳致中:韓應管好支持者
0000000073.png,HFAAs6knX6Y,72,2507,高歌三曲陳水扁站”肥皂箱挑戰中監紅線
0000000011.png,bWL50XAiaXw,10,2530,五中部以北雨漸停南部東台局部雨
0000000034.png,bWL50XAiaXw,33,2553,母親節晴朗暖熱東台及午後山區有雨
0000000042.png,bWL50XAiaXw,41,2576,司六日晴朗防曜午後山區活動防陣雨
0000000066.png,bWL50XAiaXw,65,2599,未來一周晴朗防曬體感溫高小心中暑
0000000077.png,bWL50XAiaXw,76,2622,五中部以北雨漸停南部東台局部雨
0000000088.png,bWL50XAiaXw,87,2645,鋒面逐漸離開山區附近雨勢仍較明顯
0000000102.png,bWL50XAiaXw,101,2668,五中部以北雨漸停南部東台局部雨
0000000115.png,bWL50XAiaXw,114,2691,鋒面逐漸離開山區附近雨勢仍較明顯
0000000128.png,bWL50XAiaXw,127,2714,早晚北台仍偏涼20-21度其他地區舒適
0000000146.png,bWL50XAiaXw,145,2737,白天高溫略升北東舒適中南部暖稍熱
0000000155.png,bWL50XAiaXw,154,2760,周六日晴朗防曬午後山區活動防陣雨
0000000173.png,bWL50XAiaXw,172,2783,未來一周晴朗防曬體感溫高小心中暑
0000000022.png,-HSMmTepKIM,21,2806,綠營議員集則退席獨留韓國瑜氣氛尷尬
0000000113.png,-HSMmTepKIM,112,2829,面對綠營議員砲韓國瑜採取以柔克剛
0000000152.png,-HSMmTepKIM,151,2852,韓國瑜對綠營喊話重申合作代替對抗
0000000004.png,gjYaXYc_V8E,3,2875,"限制使用農藥,除草劑打造友善茶園"
0000000026.png,gjYaXYc_V8E,25,2898,和茶農合作新創茶飲打造高品質台灣
0000000044.png,gjYaXYc_V8E,43,2921,和茶農合作茶品牌打造高品質台灣絮
0000000076.png,gjYaXYc_V8E,75,2944,和茶農合作新創茶飲打造高品質台灣
0000000091.png,gjYaXYc_V8E,90,2967,台灣茶精緻化質好價高產值1500億元
0000000134.png,gjYaXYc_V8E,133,2990,自經區議題郭董跟美簽FTA我最有辦法
0000000214.png,gjYaXYc_V8E,213,3013,自經區洗產地認賠上商餐?學者這麼說
0000000040.png,5z28KH1psqw,39,3036,"外食費漲,民眾每月出費用增加很有國"
0000000093.png,5z28KH1psqw,92,3059,業者考量租金等成本外食費易漲難跌
0000000134.png,5z28KH1psqw,133,3082,西式速食考量成本業者:不得已調漲
0000000191.png,5z28KH1psqw,190,3105,西式速食考量成本業者不得已調漲
0000000002.png,XK4r4if1GW0,1,3128,大跳廣場舞侯友宜陪媽媽們開心運動
0000000021.png,XK4r4if1GW0,20,3151,新北運動中心推優惠健康慶祝母親節
0000000053.png,XK4r4if1GW0,52,3174,新北運動中心推優惠健康慶祝母親節
0000000019.png,UdXNs9gMrN4,18,3197,"別讓日本以為排斥賴,謝長廷驚喜同框"
0000000043.png,UdXNs9gMrN4,42,3220,會日自民黨議員謝長廷現身助賴清德
0000000055.png,UdXNs9gMrN4,54,3243,賴桑加油”日本自民黨局長會賴清德
0000000010.png,ijVOJizcyKE,9,3266,"韓國瑜抗跌性強,藍委支持者黏著度高"
0000000075.png,ijVOJizcyKE,74,3289,外界放大檢視高雄回歸藍綠基本盤
0000000089.png,ijVOJizcyKE,88,3312,因此變成一個藍綠開始對立的一個狀觀
0000000107.png,ijVOJizcyKE,106,3335,"韓國瑜抗跌性強,藍委支持者黏著度員"
0000000150.png,ijVOJizcyKE,149,3358,親藍民調出爐韓國瑜全面領先蔡輯
0000000180.png,ijVOJizcyKE,179,3381,大選前哨戰激化藍綠壁壘分明
0000000211.png,ijVOJizcyKE,210,3404,回歸藍綠對決柯文哲成關鍵變數
0000000232.png,ijVOJizcyKE,231,3427,回歸藍綠對決柯文哲成關鍵變數
0000000010.png,-QRNdxPRca8,9,3450,"轉響?籲遠雄快都番柯文哲:不放水,不刁難"
0000000068.png,-QRNdxPRca8,67,3473,"梅雨季,颱風季接力安全維護工程施作中"
0000000100.png,-QRNdxPRca8,99,3496,柯文哲護樹宣言跳票路樹移植無人抗議」
0000000152.png,-QRNdxPRca8,151,3519,大巨蛋峰迴路轉王世堅批柯文哲虛耗4年
0000000195.png,-QRNdxPRca8,194,3542,政治干擾?停工年損失慘重廠商盼快復
0000000014.png,ERpQn_X2ROU,13,3565,三林化部国灰麻药是總人重德力习新车内2
0000000026.png,ERpQn_X2ROU,25,3588,三进宫水融雨水库药具換到新重金德力习新车内
0000000072.png,ERpQn_X2ROU,71,3611,留辑同行貼合金三营铝力呈红眼?
0000000088.png,ERpQn_X2ROU,87,3634,组辑同出国等合省三菱智力爭器红照!
0000000106.png,ERpQn_X2ROU,105,3657,三国辑同行此項目不會首套組力呈红呢?
0000000124.png,ERpQn_X2ROU,123,3680,固相同保貼酒的同歌命苗雷狂箱力导热了眼
0000000137.png,ERpQn_X2ROU,136,3703,电箱同品種、語會审雷帽之爭幾红呢
0000000180.png,ERpQn_X2ROU,179,3726,三册苗随静動員游說的王建民調中執會52)面最便間2
0000000191.png,ERpQn_X2ROU,190,3749,-好站随營太哥目前崎王博民調由教會52)面影师間)
0000000213.png,ERpQn_X2ROU,212,3772,"謝長廷說,自力更是選自而節效辑以此为"
0000000226.png,ERpQn_X2ROU,225,3795,三謝長廷固話:国立理是物理自而節效辑或
0000000254.png,ERpQn_X2ROU,253,3818,"三,就是活用品,是目分析理負面筋圆药辑以此为武"
0000000006.png,0s8a_nuOCoM,5,3841,郭董逛花市接地氣彎腰幫記者綁鞋帶
0000000022.png,0s8a_nuOCoM,21,3864,記者綁鞋帶郭台銘彎腰起跑衝刺!
0000000036.png,0s8a_nuOCoM,35,3887,心中想好副手人選了?郭台銘:還沒啦!
0000000054.png,0s8a_nuOCoM,53,3910,"國民黨副總統找誰當?學者:女性,中南部"
0000000095.png,0s8a_nuOCoM,94,3933,藍營副手找誰搭?學者:許淑華最適合
0000000125.png,0s8a_nuOCoM,124,3956,藍營副手找誰搭?學者:許淑華最適合
0000000198.png,0s8a_nuOCoM,197,3979,組金牌聯盟」監太陽們初選後就戰鬥位置
0000000238.png,0s8a_nuOCoM,237,4002,組金牌聯盟」藍太陽們初選後就戰鬥位置
0000000001.png,CDPke38Yz1I,1,4025,藍初選之爭有解了?全民調免領表登記
0000000018.png,CDPke38Yz1I,17,4048,“鸚鵡救火選到底吳張會“異”見多
0000000053.png,CDPke38Yz1I,52,4071,藍初選之爭解了?全民調免領表登記
0000000093.png,CDPke38Yz1I,92,4094,兩岸經濟攻防”最強者“出線需接招
0000000122.png,CDPke38Yz1I,121,4117,兩岸經濟攻防”最強者”出線需接招
0000000159.png,CDPke38Yz1I,158,4140,初選利弊難兼顧國內外皆有先例
0000000197.png,CDPke38Yz1I,196,4163,初選利弊難兼顧!國內外皆有先例
0000000222.png,CDPke38Yz1I,221,4186,太陽會就差吳郭!初選解套的下一劳
0000000001.png,6C-N9aOtnZU,1,4209,財產申報曝光!柯文哲拚連任舉債2000萬
0000000011.png,6C-N9aOtnZU,10,4232,「柯文哲存款2446萬拚選舉押房屋借2000萬
0000000025.png,6C-N9aOtnZU,24,4255,去年獲58萬663票佔領1741萬補助款
0000000041.png,6C-N9aOtnZU,40,4278,打補助款還負債笑要煩惱的是陳佩琪
0000000051.png,6C-N9aOtnZU,50,4301,柯文哲存款2446萬拚選舉押房產借2000萬
0000000062.png,6C-N9aOtnZU,61,4324,"顏寬恒身家曝坐擁65筆土地,債務7509"
0000000001.png,NRSOx0WBveo,1,4347,"点開發,閉聊掀波失言變黑的不只蔣萬安"
0000000013.png,NRSOx0WBveo,12,4370,"梁肅戎「敷衍敷衍,立委一失言成千古恨"
0000000038.png,NRSOx0WBveo,37,4393,王郁琦推服貿靠名嘴?12天後太陽花立院
0000000049.png,NRSOx0WBveo,48,4416,雷根書炸玩笑話惹毛俄小布希咬耳朵全都是
0000000001.png,7uHeIxrMDVc,1,4439,「蔣萬安失言非重點”羅韓參選之路現危機
0000000015.png,7uHeIxrMDVc,14,4462,"毁韓,抹黑連環爆羅韓若重傷危及藍2020"
0000000026.png,7uHeIxrMDVc,25,4485,誰釀韓國瑜困境?羅智強:真韓粉+假韓粉
0000000036.png,7uHeIxrMDVc,35,4508,動與不動都是動”羅智強籲韓講選或不選
0000000052.png,PMwmZxJGvBA,51,4531,攻擊韓國瑜砲火猛綠議員遭留言接小孩
0000000083.png,PMwmZxJGvBA,82,4554,質詢韓市長遭網友攻擊綠議員4人報案
0000000008.png,EtghPdtOwM0,7,4577,虐死女童想棄屍山區阿嬤4人判死刑
0000000032.png,EtghPdtOwM0,31,4600,稱女童卡到陰表姊竟想棄屍山區
0000000082.png,EtghPdtOwM0,81,4623,6人遭求無期徒刑小媽媽:男友人求打罪
0000000001.png,LxQ22sP8yv8,1,4646,會車意外九份轎車翻覆4日客輕微擦傷
0000000048.png,LxQ22sP8yv8,47,4669,會車意外九份轎車翻覆4日客輕微擦傷
0000000066.png,LxQ22sP8yv8,65,4692,會車意外九份轎車翻覆4日客輕微擦信
0000000001.png,8XPTXBgQLCU,1,4715,酸民轟偽造哈佛學国范瑋琪發文揭真相
0000000035.png,8XPTXBgQLCU,34,4738,請哈佛延伸學院休學范范從沒偽裝學歷
0000000063.png,8XPTXBgQLCU,62,4761,酸民書偽造哈佛學歷范瑋琪發文揭真相
0000000072.png,8XPTXBgQLCU,71,4784,哈佛延伸學院是什麼?留學顧問像學分班
0000000094.png,8XPTXBgQLCU,93,4807,哈佛延伸學院是什麼?留學顧問像學分班
0000000001.png,Kgef5ZQVXLA,1,4830,台薩復交?準總統重新檢視與陸關係
0000000022.png,Kgef5ZQVXLA,21,4853,"「陸薩建交不透明,準總統質疑涉政治獻金"
0000000040.png,Kgef5ZQVXLA,39,4876,"「陸薩建交不透明,準總統質疑涉政治獻金"
0000000076.png,Kgef5ZQVXLA,75,4899,美參議員助薩國準總統重申友台關係
0000000004.png,VZGgSyeBrVU,3,4922,兌現政見陳其邁人氣回溫成綠補選王牌
0000000028.png,VZGgSyeBrVU,27,4945,兌現政見陳其邁人氣回溫成綠補選王牌
0000000067.png,VZGgSyeBrVU,66,4968,「韓不瞭解橋頭科學園區”陳其邁:可惜了
0000000084.png,VZGgSyeBrVU,83,4991,韓選2020機率高市長空缺藍綠虎視眈眈
0000000096.png,VZGgSyeBrVU,95,5014,韓選2020機率高市長空缺藍綠虎視眈眈
0000000007.png,M3_h5dPl9oo,6,5037,不願同台?總統送橋頭大禮韓國瑜缺席
0000000033.png,M3_h5dPl9oo,32,5060,林濁水批陳菊成私人秘書總統失公允
0000000062.png,M3_h5dPl9oo,61,5083,林濁水批陳菊成私人秘書總統:失公允
0000000001.png,0lIMBK0iNio,1,5106,烤生蠔變蒸澎湖“限穿令”整頓燒烤店
0000000036.png,euY6qHtwinQ,35,5129,不只住市民!韓新任務一日系列智市政
0000000056.png,euY6qHtwinQ,55,5152,不只住市民韓新任務-日系列督市政
0000000085.png,euY6qHtwinQ,84,5175,不怕尷尬!韓國瑜找蔣萬安一起來一日鋪路
0000000101.png,euY6qHtwinQ,100,5198,不怕檔韓國花落萬安一起來一日鋪路
0000000005.png,jT-2FHx4XkM,4,5221,實測喬骨盆現縮4cm整骨師姿勢錯恐彈回
0000000015.png,jT-2FHx4XkM,14,5244,實測喬骨盆現縮4cm整骨師姿勢錯彈回
0000000046.png,jT-2FHx4XkM,45,5267,實測喬骨盆現縮4cm整骨師姿勢錯恐彈回
0000000060.png,jT-2FHx4XkM,59,5290,價差大!喬骨”效果不同治療師教走路縮臀
0000000090.png,jT-2FHx4XkM,89,5313,價差大喬骨效果不同治療師教“走路縮臂
0000000001.png,3ec5xVP216E,1,5336,首度掃街郭董蹲下幫攝影綁鞋帶引驚吗
0000000043.png,3ec5xVP216E,42,5359,母親節掃街選花市郭董霸氣:都給我來一
0000000072.png,3ec5xVP216E,71,5382,"母親節掃街選花市郭董霸氣,都給我來一打"
0000000004.png,oYemAPucyEg,3,5405,「15分鐘1千變1千5女控整脊預約後調價
0000000018.png,oYemAPucyEg,17,5428,|15分鐘1千變15女控整脊預約後調價
0000000047.png,oYemAPucyEg,46,5451,「15分鐘1千變15女控整脊預約後調價
0000000071.png,oYemAPucyEg,70,5474,整脊師駁漲價喬骨盆增變”套餐式服務
0000000001.png,uC21lYnuL-A,1,5497,「偷了現?男買賣場籍展示背心為裝让
0000000018.png,uC21lYnuL-A,17,5520,疑預謀犯案!鎖定模特克高單價男裝背心
0000000039.png,uC21lYnuL-A,38,5543,偷了現穿!男閱賣場稿展示背心“偽裝
0000000062.png,uC21lYnuL-A,61,5566,“空窗時段被盯上!賣場尚未營業慘遭報
0000000001.png,X5DUV-j-Un8,1,5589,"跑跑奴,市區,制影片。體不懂击的;"
0000000408.png,X5DUV-j-Un8,407,5612,"|鑑暨影火龍國地點包装同您"""
0000000431.png,X5DUV-j-Un8,430,5635,超继員質詢不等薛國裕講胜佳體甜度
0000000448.png,X5DUV-j-Un8,447,5658,茲總統國家隊繼續前言
0000000496.png,X5DUV-j-Un8,495,5681,"高雄兹,今年台商投资命達5倍"
0000000504.png,X5DUV-j-Un8,503,5704,临畫地選唱P細随甘漢才自言准市集
0000000527.png,X5DUV-j-Un8,526,5727,DoG與周區成了随甘薄胎畫書
0000000001.png,pTA2nbRVJNU,1,5750,恐怖貨單被撞翻30瓦斯桶四散還外海
0000000042.png,pTA2nbRVJNU,41,5773,疑闖燈釀禍瓦斯桶到處浪爆開噴發
0000000081.png,pTA2nbRVJNU,80,5796,險釀大爆濃濃瓦斯味嚇壞上班民
0000000001.png,d0oLFDWhlpk,1,5819,借貸利息認知異千追求遭拒男強擴女
0000000026.png,d0oLFDWhlpk,25,5842,兩人相識逾10年男跟蹤騷擾女心生認信
0000000047.png,d0oLFDWhlpk,46,5865,女離婚2年生活單純李男近來瘋狂追求
0000000080.png,d0oLFDWhlpk,79,5888,女離婚2年生活單純李男近來瘋狂追求
0000000016.png,E9d2oOFtTrU,15,5911,傳訊息求救毒犯持槍擄人女遭囚禁摩鐘
0000000045.png,E9d2oOFtTrU,44,5934,「他身上有信女傳訊息斗定位成功獲
0000000081.png,E9d2oOFtTrU,80,5957,從桃園開到南投!追求遭拒男強押女上国
0000000001.png,z2hxtBVUCVQ,1,5980,"直酷到471""}酷不好继后出图匯》"
0000000020.png,z2hxtBVUCVQ,19,6003,"区?重试盘动立时“上體不好"""
0000000048.png,z2hxtBVUCVQ,47,6026,"细巩固右春路」站轉城配侣趋势,"
0000000092.png,z2hxtBVUCVQ,91,6049,解體到目经富多帮我介石
0000000125.png,z2hxtBVUCVQ,124,6072,體重士團丝丝语題曲阳错》
0000000151.png,z2hxtBVUCVQ,150,6095,"后灯后里后挂直拉张和白佳,"
0000000203.png,z2hxtBVUCVQ,202,6118,|站首宝上黄错距唱晚畫)
0000000227.png,z2hxtBVUCVQ,226,6141,1句首日已灣佳里稽幽明禮具有戲但
0000000280.png,z2hxtBVUCVQ,279,6164,高雄與售Ann盾元2市应也遇了Ann倍了
0000000312.png,z2hxtBVUCVQ,311,6187,設計皆韵對花百出
0000000005.png,xrxpVQsr2uo,4,6210,九二共識不夠郭董一中各表的兩個中国
0000000049.png,xrxpVQsr2uo,48,6233,讚郭董兩個中國蘇揆:繼續講不要消国
0000000076.png,xrxpVQsr2uo,75,6256,兩個中國vs.線一中一台郭拋兩岸論
0000000001.png,eLz2jzzeRws,1,6279,「吹一聲行軍爆糾紛騎士慘遭毆
0000000044.png,eLz2jzzeRws,43,6302,"不滿被吹出口絕需當街揮拳,"
0000000066.png,eLz2jzzeRws,65,6325,不滿被吹出口飆罵當街揮拳
0000000085.png,eLz2jzzeRws,84,6348,熱心住戶錄影保證據喝令阻衝突
0000000008.png,P5ZIvX1mVCQ,7,6371,為韓量身打造初選免領表可代繳500萬
0000000032.png,P5ZIvX1mVCQ,31,6394,體做最強侯選人韓粉搶代繳500
0000000058.png,P5ZIvX1mVCQ,57,6417,洪韓做最強侯選人、韓粉搶代繳500自
0000000087.png,P5ZIvX1mVCQ,86,6440,代繳500萬由誰開戶?藍議員:有疑息
0000000107.png,P5ZIvX1mVCQ,106,6463,代繳500萬由誰開戶?藍議員:有疑慮
0000000001.png,GMDZH5IskuY,1,6486,震車拚改款馬力开萬元PK增自駕凍
0000000059.png,GMDZH5IskuY,58,6509,加質不加價!豪車續推改款拚曝光搶訂了
0000000002.png,Etsiev0NEws,1,6532,橋頭科學園區進度到哪?剛完成評信
0000000015.png,Etsiev0NEws,14,6555,南部科技走廊成形橋頭科學園區過評作
0000000026.png,Etsiev0NEws,25,6578,橋頭科學園區過頭關議員首重土地取得
0000000053.png,Etsiev0NEws,52,6601,"已廠商調查,道路規劃經發局否認狀況?"
0000000082.png,Etsiev0NEws,81,6624,科學園區變空城?陳其邁:路科已滿
0000000001.png,lpnC8H4D2pM,1,6647,哪控頂樓養狗經讓姜姓住戶反控遭霸道
0000000024.png,lpnC8H4D2pM,23,6670,鄰控頂樓養狗題與姜姓住戶反控遭霸
0000000001.png,65ivQIpYR00,1,6693,髮廊員工涉電用手狂甩”遭懲處停
0000000043.png,65ivQIpYR00,42,6716,當紙飛機晃員工優鶴飼主心疼喊太扣
0000000058.png,65ivQIpYR00,57,6739,當紙飛機异買工廈鶴飼主心疼喊太初
0000000072.png,65ivQIpYR00,71,6762,遭一星洗評動保處介入最高罰7萬5千万
0000000099.png,65ivQIpYR00,98,6785,遭三星洗部動保處介入最高罰7萬5千万
0000000001.png,k9ghNJ4bIN8,1,6808,被爆懷二胎?林心如:以後衣服選好一點
0000000035.png,k9ghNJ4bIN8,34,6831,"被爆懷二胎?林心如,以後衣服選好一點"
0000000063.png,k9ghNJ4bIN8,62,6854,小海豚愛唱反調林心如再添寶:看緣分
0000000082.png,k9ghNJ4bIN8,81,6877,小海豚愛唱反調林心如再添寶:看緣分
0000000001.png,x44X8Qw8ie0,1,6900,"「香香雞薯片,麻辣巧克力零食跨界小吃"
0000000028.png,x44X8Qw8ie0,27,6923,顛覆傳統味洋芋片加五香粉像吃鹹酥類
0000000047.png,x44X8Qw8ie0,46,6946,"「香香雞薯片,麻辣巧克力零食跨界小吃"
0000000074.png,x44X8Qw8ie0,73,6969,「香香雞薯片麻辣筑方零食跨界小吃
0000000001.png,jVzoLP_9AjI,1,6992,避7公分高跟鞋下種駕駛突駛離挥作
0000000020.png,jVzoLP_9AjI,19,7015,還有兩階高跟鞋還沒觸地公車駛離捧
0000000054.png,jVzoLP_9AjI,53,7038,瞪7公分高跟鞋下軍駕駛突駛離挥自
0000000074.png,jVzoLP_9AjI,73,7061,人未下公車就開男怒駕駛疏忽後門安
