0000000001.png,rDs6qcQffQs,1,0,媒測摺疊獲1天就两岸三
0000000023.png,rDs6qcQffQs,22,23,
0000000057.png,rDs6qcQffQs,56,46,媒測摺疊機侯就問探三星誤撕保護膜
0000000004.png,JwlJpnnNhcc,3,69,區管理室爆炸!瓦斯味濃保全燒成焦屍
0000000030.png,JwlJpnnNhcc,29,92,生職保全阻工人裝修一轉身就傳爆炸音
0000000048.png,JwlJpnnNhcc,47,115,職保全阳工人装修一轉身就傳爆炸聲
0000000081.png,JwlJpnnNhcc,80,138,判無生跡象”男任職10年3天前離開
0000000092.png,JwlJpnnNhcc,91,161,區管理室爆炸!瓦斯味濃保全燒成焦屍
0000000001.png,3mk4n2jO288,1,184,密反目藝人魚裸照外流辜莞允接管
0000000040.png,3mk4n2jO288,39,207,Sno否認偷拍遭打臉鮪魚心受傷是事實
0000000071.png,3mk4n2jO288,70,230,是受害莞允掉相機私密照網瘋傳
0000000082.png,3mk4n2jO288,81,253,3裸照流向鮪魚告妨害秘密傳雙方和解
0000000005.png,PkHwkvmXzYA,4,276,掏空上億美材副董葉美麗500萬交保
0000000038.png,PkHwkvmXzYA,37,299,調兵分六路搜帶回13人釐清掏空
0000000076.png,PkHwkvmXzYA,75,322,調兵分六路搜索帶回13人釐清掏空案
0000000001.png,Cw-h4VhmXME,1,345,二地公廟求明牌積範怒持鐵鎚打破神明頭
0000000014.png,Cw-h4VhmXME,13,368,龜重擊巴掌推倒誇張禎鄭男找神明出氣
0000000065.png,Cw-h4VhmXME,64,391,能找神明出氣!土地公頭破觀音菩薩斷
0000000077.png,Cw-h4VhmXME,76,414,中像接連遭破壞信装新監視器逮兇嫌
0000000001.png,-ivp0GX5vOY,1,437,税前3窮4絕?星飯店折扣”搶媽咪客
0000000046.png,-ivp0GX5vOY,45,460,税前34絕?五星飯店餐廳折扣搶媽咪容
0000000067.png,-ivp0GX5vOY,66,483,税前3窮4絕?五星飯店折扣”搶媽咪容
0000000086.png,-ivp0GX5vOY,85,506,月口袋空母親餐王朝國賓晶華殺折扣
0000000001.png,DP0g4rhsgow,1,529,捷運找槍手套招議員怒:公布身分
0000000057.png,DP0g4rhsgow,56,552,認事先套招交通局不認識賴同學
0000000065.png,DP0g4rhsgow,64,575,捷運找槍手套招議員怒:公布身分
0000000081.png,DP0g4rhsgow,80,598,認事先套招交通局不認識賴同學
0000000001.png,YV3pARlnxVs,1,621,居反目半夜瓷灌不明液體嚇壞人
0000000006.png,rPLOpNqb74k,5,644,又休息韓國瑜返高雄零時差上门
0000000030.png,rPLOpNqb74k,29,667,休息韓國瑜返高雄零時差”上工
0000000049.png,rPLOpNqb74k,48,690,又休息!韓搭高鐵回高雄直奔市府辦公
0000000062.png,rPLOpNqb74k,61,713,严8天市政進度算入府隨即開會辦公
0000000088.png,rPLOpNqb74k,87,736,消費8天市政進度算入府隨即開會辦公
0000000001.png,9DLxCKyAe8g,1,759,雙雙虐婴/2保母呼巴掌粗暴拖行幼童
0000000053.png,9DLxCKyAe8g,52,782,定信興開罰6~30萬終身禁當保母贈
0000000011.png,7lV_oNO_85k,10,805,郭董在找競選團隊阿土伯:願捐2千萬
0000000035.png,7lV_oNO_85k,34,828,子友任差遣宣明智郭比川普有錢不為私利
0000000076.png,7lV_oNO_85k,75,851,子友任差遣宣明智郭比川普有錢不為私利
0000000092.png,7lV_oNO_85k,91,874,子友任差遣宣明智郭川普有錢不為私利
0000000001.png,7tPPPwPxszY,1,897,貸款投資獲高報酬30名軍人遭詐上千萬
0000000016.png,7tPPPwPxszY,15,920,貸款投資獲高報酬30名軍人遭詐上千萬
0000000049.png,7tPPPwPxszY,48,943,巨人申請貸款免保證人遭詐騙集團鎖司
0000000077.png,7tPPPwPxszY,76,966,巨人申請貸款免保證人遭詐騙集團鎖定
0000000009.png,OYJmgv1Ei8s,8,989,要徵召菲韓不投韓粉送黨6萬連署書
0000000032.png,OYJmgv1Ei8s,31,1012,要徵召非算不投韓粉送黨6萬連署書
0000000071.png,OYJmgv1Ei8s,70,1035,重民調打到民進黨韓粉:尊重三日行情
0000000092.png,OYJmgv1Ei8s,91,1058,吉尴尬韓粉傻眼郭董參戰徵召韓生變
0000000011.png,DWSfVumE3_4,10,1081,当不及警制服換新美女警新衣亮相
0000000044.png,DWSfVumE3_4,43,1104,口袋多活動度提升功能強帥氣更俐落
0000000058.png,DWSfVumE3_4,57,1127,可認錯」警局海報宣傳自拍影片超吸睛
0000000008.png,zDfHvWcavdM,7,1150,台北沒水果賣靠創新柯P致疑暗酸韓國瑜
0000000028.png,zDfHvWcavdM,27,1173,台北沒水果賣創新柯P致疑暗酸韓
0000000048.png,zDfHvWcavdM,47,1196,考選布局?柯走訪雲高花東直搗藍營
0000000064.png,zDfHvWcavdM,63,1219,郭台銘中美關係好何家大業大易受
0000000080.png,zDfHvWcavdM,79,1242,可勤跑行程hold住人氣三角督局面仍明顯
0000000009.png,xK79nUe1C40,8,1265,"""outube訂閱破千!總統獲Google認證"
0000000032.png,xK79nUe1C40,31,1288,景初選隔空交火賴管再轟蔡咱約束網軍
0000000076.png,xK79nUe1C40,75,1311,冬賴互毒!網軍引戰火黨內盧愛分裂
0000000099.png,xK79nUe1C40,98,1334,冬賴互轟!網軍引戰火黨內盧髮分裂
0000000001.png,ZYPoe0skCNI,1,1357,女10萬奠儀改判無罪寬法官遭判10年
0000000041.png,ZYPoe0skCNI,40,1380,10萬奠儀改判無罪涉貪法官遭判10年
0000000001.png,a-BaNhVwITE,1,1403,專寫信給吳敦義要求徵召?韓:絕無此事
0000000035.png,a-BaNhVwITE,34,1426,藍營風向轉?馬連表態支持郭董參選
0000000071.png,a-BaNhVwITE,70,1449,"藍營風向轉?馬,連表態支持郭董參"
0000000001.png,zELcypF4b8M,1,1472,你幹嘛罵我女不滿便衣警攔查當街對糧
0000000001.png,PLaTTyHP3A0,1,1495,并排遭攔檢轎車道逃2度衝撞警車
0000000011.png,PLaTTyHP3A0,10,1518,三度衝撞警車拒檢轎車保險桿掉落
0000000037.png,PLaTTyHP3A0,36,1541,排遭攔檢轎車電述2度衝撞警車
0000000001.png,0s2zfOwV3T0,1,1564,憂影響逃生!女控頂樓違建套房拆了又葛
0000000022.png,0s2zfOwV3T0,21,1587,受影響逃生!女梦頂樓違建套房拆了又嘉
0000000063.png,0s2zfOwV3T0,62,1610,度檢舉違建拆除大隊將再度前往了解
0000000001.png,1RsLUMv1FRg,1,1633,郭董神明託夢王金平:媽祖要我們一起選
0000000021.png,1RsLUMv1FRg,20,1656,郭董神明託夢王金平:媽祖要我們一起選
0000000055.png,1RsLUMv1FRg,54,1679,郭董稱神明勸進朱:媽祖只會說多做好事
0000000075.png,1RsLUMv1FRg,74,1702,郭董參戰朱:別只看到新人忘了韓市長
0000000093.png,1RsLUMv1FRg,92,1725,郭董堅走初選恐分裂?朱:國民黨定團結
0000000006.png,WkyWwgdIZzo,5,1748,韋勒連夜北上會師唱夜襲穿韓裝接機
0000000018.png,WkyWwgdIZzo,17,1771,韋粉連夜北上會師唱夜襲穿韓裝接機
0000000031.png,WkyWwgdIZzo,30,1794,「韓不選韓粉將率百人赴中央黨部陳情
0000000062.png,WkyWwgdIZzo,61,1817,鎮守山海關行動劇韓家軍踢館王金平
0000000086.png,WkyWwgdIZzo,85,1840,「韓不選監委辦公室電話被打爆徵召韓
0000000001.png,I60TNTByyWw,1,1863,路透:蘋果CEO庫克致電郭台銘關切參選
0000000039.png,I60TNTByyWw,38,1886,馬祖託夢選總統!外媒報導郭董參選2020
0000000053.png,I60TNTByyWw,52,1909,馬祖託夢選總統!外媒報導郭董參選2020
0000000084.png,I60TNTByyWw,83,1932,宣布參選!BBC:郭董將成蔡英文強力對手
0000000003.png,ynIhtlzfUlA,2,1955,夫點洗衣服!淡水晨涼午暖明天雨又來
0000000060.png,ynIhtlzfUlA,59,1978,周四晴朗雲少暖熱山區及花東零星雨
0000000076.png,ynIhtlzfUlA,75,2001,四晴朗少暖熱山區及花東零星雨
0000000113.png,ynIhtlzfUlA,112,2024,司五暖濕午後陣雨周六鋒面近有大雨
0000000146.png,ynIhtlzfUlA,145,2047,司目一持續不穩定易有陣雨局部雷雨
0000000009.png,BGN0YZspldc,8,2070,主命力創作!楊世豪與大環共舞受矚目
0000000019.png,BGN0YZspldc,18,2093,楊世豪“大環表演”育學苦練五年!
0000000043.png,BGN0YZspldc,42,2116,或予”大環生命注入情感旋轉神乎其技
0000000067.png,BGN0YZspldc,66,2139,易世家大環表演官學苦練五到
0000000075.png,BGN0YZspldc,74,2162,主命力創作楊世豪與大環共舞受矚目
0000000163.png,BGN0YZspldc,162,2185,楊世豪大環表演育學苦練五!
0000000207.png,BGN0YZspldc,206,2208,或予大環生命注入情感旋轉神乎其技
0000000006.png,NRd2IAK1uAg,5,2231,老人活動據點各種課程帶動長輩身心
0000000078.png,NRd2IAK1uAg,77,2254,打破“生男較好觀念女兒照顧較具同理心
0000000104.png,NRd2IAK1uAg,103,2277,孝順等於投資?示範效果”被推翻
0000000146.png,NRd2IAK1uAg,145,2300,孝順等於投資示範效果”被推翻
0000000178.png,NRd2IAK1uAg,177,2323,最常和父母互動單身女兒排名第一
0000000202.png,NRd2IAK1uAg,201,2346,最常和父母互動單身女兒排名第一
0000000226.png,NRd2IAK1uAg,225,2369,最常和父母互動單身女兒排名第一
0000000019.png,CUhweYgTNbs,18,2392,用路人隱夏北市磁磚掉落年通報800件
0000000049.png,CUhweYgTNbs,48,2415,10年建物修外牆北市每棟補助四園
0000000113.png,CUhweYgTNbs,112,2438,修繕責任歸屬建管處所有權人或管委會
0000000140.png,CUhweYgTNbs,139,2461,重鋪牆面花費驚人市府補助九牛一毛
0000000180.png,CUhweYgTNbs,179,2484,強化牆面施工品質專家延長保固期
0000000214.png,CUhweYgTNbs,213,2507,強化牆面施工品質專家延長保固期
0000000001.png,UgN4wRlaWcc,1,2530,北市議會挺韓連著郭董參選地地震瘋彈
0000000016.png,UgN4wRlaWcc,15,2553,韓國瑜訪美招商成果豐選總統未鬆口
0000000080.png,UgN4wRlaWcc,79,2576,韓國瑜看郭參選天塌下來兩個人頂
0000000093.png,UgN4wRlaWcc,92,2599,韓國瑜看郭參選“天塌下來兩個人頂
0000000175.png,UgN4wRlaWcc,174,2622,譚國瑜怎徵召?郭董參戰擾亂藍營布局
0000000004.png,8FFP3oAmCe8,3,2645,2020藍綠人選未明朗柯P觀火輕鬆又自在
0000000021.png,8FFP3oAmCe8,20,2668,2020藍綠入選未明朗柯P觀火輕鬆又自在
0000000063.png,8FFP3oAmCe8,62,2691,藍綠政治人物憂心兩黨拖拉有利於柯
0000000077.png,8FFP3oAmCe8,76,2714,柯P走出台北出訪邊境微博圈粉通通來
0000000108.png,8FFP3oAmCe8,107,2737,柯P走出台北出訪遶境微博圈粉通通來
0000000136.png,8FFP3oAmCe8,135,2760,參不參選傳柯P幕僚精算出5%勝選關鍵
0000000182.png,8FFP3oAmCe8,181,2783,郭台銘若參選學者認為對柯P衝擊不大
0000000208.png,8FFP3oAmCe8,207,2806,郭台銘若參選學認為對柯P衝擊不大
0000000016.png,XP2UbeF5GC8,15,2829,宣布角逐總統大郭董問媽祖關公
0000000051.png,XP2UbeF5GC8,50,2852,宣布角逐總統大位?郭董”問媽祖關公
0000000077.png,XP2UbeF5GC8,76,2875,拜完媽祖拜關公郭台銘選前請示神明
0000000085.png,XP2UbeF5GC8,84,2898,賜我決心讓我能夠有機會站出來
0000000094.png,XP2UbeF5GC8,93,2921,"頒發「榮譽狀,郭台銘享藍黨員權利義務"
0000000166.png,XP2UbeF5GC8,165,2944,初選選到底不徵召郭台銘PK藍營太陽但
0000000186.png,XP2UbeF5GC8,185,2967,我願意參加初選我不願意接受賞
0000000199.png,XP2UbeF5GC8,198,2990,如果選上那我代表國民黨
0000000222.png,XP2UbeF5GC8,221,3013,并經濟比韓國瑜強兩岸論述考驗郭台銘
0000000001.png,IeMNZ7yb1bM,1,3036,拒繳酒駕罰金法務部大執法查封房產
0000000011.png,IeMNZ7yb1bM,10,3059,積欠9萬酒駕罰錢法務部出招查封房屋
0000000057.png,IeMNZ7yb1bM,56,3082,全台最大的酒駕次遭罰90萬家遭查封
0000000001.png,P4VOjjsxy2c,1,3105,台灣首富若成郭總統”85億美元身家得信託
0000000037.png,P4VOjjsxy2c,36,3128,郭董若當選有意造訪美陸得先獲對方同意
0000000001.png,FH05E90iT9E,1,3151,熟齡肌春季保養花草成份溫和滋養
0000000022.png,FH05E90iT9E,21,3174,熟齡肌春季保養障成份溫和滋養
0000000059.png,FH05E90iT9E,58,3197,日本通信品牌漢方基底阿護熟齡肌
0000000001.png,J0x35lIZ2oI,1,3220,請同修看郭台铭就会出鋁產總纯力量捕海内外
0000000012.png,J0x35lIZ2oI,11,3243,韓國俗望看台的就会出競選總维力畫材海内外
0000000042.png,J0x35lIZ2oI,41,3266,-韓國粉丝看会出站產统固力臺搞海内外
0000000068.png,J0x35lIZ2oI,67,3289,-韓國论望看郭台铭会出題選總統威力雲海内外
0000000001.png,FmXV11WeUiI,1,3312,角逐2020初選「郭董概念股集體走強
0000000010.png,FmXV11WeUiI,9,3335,郭董媽祖要我出來!鴻海股價飆13個月新高
0000000031.png,FmXV11WeUiI,30,3358,郭董宣布選工業富聯漲停富智康股價急浪
0000000046.png,FmXV11WeUiI,45,3381,鴻海後續安排郭董暗示效法台塑共治模式
0000000001.png,zI5wZdAqsS4,1,3404,馬英九”樂觀其成”關鍵促郭台銘選總統
0000000035.png,zI5wZdAqsS4,34,3427,年初確定馬無意選1月開粉絲團動作頻
0000000052.png,zI5wZdAqsS4,51,3450,2017年黨主席選舉郝龍斌吳敦義聲拱郭
0000000001.png,w0D7FPN7vbU,1,3473,「不排除罷工”長榮空服員勞資3度協商破局
0000000028.png,w0D7FPN7vbU,27,3496,「不排除罷工”長榮空服員勞資3度協商破局
0000000049.png,w0D7FPN7vbU,48,3519,周五前進行罷工投票!長榮:盼進一步協商
0000000087.png,w0D7FPN7vbU,86,3542,周五前進行罷工投票!長榮:盼進一步協商
0000000001.png,l5Ii56tPbjg,1,3565,"郭董篤信媽祖砸千萬迎來台,新廠擺一尊"
0000000016.png,l5Ii56tPbjg,15,3588,郭董2017年曾赴湄洲包船迎兩尊媽祖來台
0000000037.png,l5Ii56tPbjg,36,3611,不只拜媽祖也篤信關公2013年赴山西接加
0000000001.png,psiM6ytD6Rc,1,3634,費玉清告別舞台人生美聲成絕響
0000000012.png,psiM6ytD6Rc,11,3657,小哥告別演唱1月台北加開兩場
0000000006.png,utBK-xMnU-g,5,3680,三郭台铭前言AININ運總护照英計畫主?
0000000061.png,utBK-xMnU-g,60,3703,"三却留着面前。这个国首成,只郭台铭出生關鍵)"
0000000082.png,utBK-xMnU-g,81,3726,"-却远赴淮、三克力约到百元,但到台铁出生關鍵?"
0000000115.png,utBK-xMnU-g,114,3749,":到台管瘤,非而是多了換著也能出國?"
0000000022.png,AUZ9nDTK468,21,3772,三部台致出作经不接受當日參加国民當初選投靈精通》
0000000001.png,G6rwH8neQKk,1,3795,三郎台的音弦直宣城宣布莲许之前要先問动力
0000000037.png,G6rwH8neQKk,36,3818,-歌台:趙芬兰主要出委曲事2020按我其誰》
0000000005.png,JeZHWdgO9i0,4,3841,黃心穎發文致歉馬國明力挺很擔心
0000000037.png,JeZHWdgO9i0,36,3864,遭姊妹背叛鄭秀文G有些事情想清楚
0000000054.png,JeZHWdgO9i0,53,3887,拒與人見面傳鄭秀文搬離淺水灣愛第
0000000082.png,JeZHWdgO9i0,81,3910,情牽28年數度方合許志安得獎淚謝鄭秀文
0000000012.png,IBTQERw99yc,11,3933,逼韓表態!郭想做台灣川普”動機不單純
0000000039.png,IBTQERw99yc,38,3956,郭台銘參選中常委黨現在有兩張A王牌
0000000085.png,IBTQERw99yc,84,3979,老鼠偷拖鞋準韓國瑜:果然是大老虎
0000000028.png,-c_Kbn0BevA,27,4002,母院大火過後屋頂燒光十字架屹立
0000000047.png,-c_Kbn0BevA,46,4025,克宏誓言五年內重建籲各界支援
0000000070.png,-c_Kbn0BevA,69,4048,欲2024巴黎奧運前重建專家:需10-15年
0000000084.png,-c_Kbn0BevA,83,4071,教聖母院內藝術品合力搬往市政廳
0000000099.png,-c_Kbn0BevA,98,4094,"瑰窗,管風琴倖存銅公雞奇助式尋推"
0000000113.png,-c_Kbn0BevA,112,4117,鍵23分鐘!警報器響未發現起火點」
0000000130.png,-c_Kbn0BevA,129,4140,造屋頂“森林”導致火勢一發不可收拾
0000000153.png,-c_Kbn0BevA,152,4163,黎消防員棄空中灌水保全主體結構」
0000000184.png,-c_Kbn0BevA,183,4186,史木造建築自古火災屢見不鮮
0000000205.png,-c_Kbn0BevA,204,4209,京都金閣寺奈良東大寺都曾遇火劫]
0000000232.png,-c_Kbn0BevA,231,4232,"路城消防訓練但城門窄,消防車進不去"
0000000256.png,-c_Kbn0BevA,255,4255,"守閣旁装“放水砲""24小時防災監控"
0000000273.png,-c_Kbn0BevA,272,4278,守閣旁裝“放水砲“24小時防災監控
0000000290.png,-c_Kbn0BevA,289,4301,建巴黎聖母院!NT$350億捐款湧入
0000000039.png,GuhCzEeY5rk,38,4324,019年首季陸GDP增6.4%優於市場預期
0000000062.png,GuhCzEeY5rk,61,4347,國01經濟成長率66.4%與上一季持平
0000000078.png,GuhCzEeY5rk,77,4370,隨轉差風險仍在官方下修GDP最低6%
0000000105.png,GuhCzEeY5rk,104,4393,"市場信心提振金融活躍,民間投資擴大"
0000000142.png,GuhCzEeY5rk,141,4416,京中央推减税降费政策促景氣回升
0000000163.png,GuhCzEeY5rk,162,4439,市回溫新屋房價年漲1成23個月新高
0000000184.png,GuhCzEeY5rk,183,4462,3月房價65個成市喊漲上海深圳微跌
0000000222.png,GuhCzEeY5rk,221,4485,"港千萬富翁,僅11%有興趣在陸置產"
0000000266.png,GuhCzEeY5rk,265,4508,港逾51萬人封“千萬富豪”人數攀新高
0000000286.png,GuhCzEeY5rk,285,4531,股年初以來爬升恒指徘徊3萬點關口
0000000009.png,bhwyvSTbUF8,8,4554,睽違7年前冰館老圖重返永康戰場
0000000034.png,bhwyvSTbUF8,33,4577,睽違7年!前冰館艺圖重返永康戰場
0000000064.png,bhwyvSTbUF8,63,4600,永康冰店戰七彩獨角獸冰PK果汁雪花冰
0000000082.png,bhwyvSTbUF8,81,4623,新舊品牌齊聚永康商圈冰店林立闢戰場
0000000001.png,SIMMD01cGhw,1,4646,楠梓百慕達彎路害摔?警車速太快釀禍
0000000018.png,SIMMD01cGhw,17,4669,楠梓百慕達路警車速太快釀禍
0000000037.png,SIMMD01cGhw,36,4692,楠梓百慕達路警車速太快釀禍
0000000067.png,SIMMD01cGhw,66,4715,豐路又超速!楠梓百慕達年事故31起
0000000008.png,D3QldE3ENfs,7,4738,大陸瘋傳與惡結局電視台提告護版權
0000000020.png,D3QldE3ENfs,19,4761,"結局怎外流?電視台清查製播,海外送窗"
0000000062.png,D3QldE3ENfs,61,4784,"結局怎外流?電視台清查製播,海外送審"
0000000001.png,ZeMAmz2iCHk,1,4807,减證?苗栗國道槍擊作案車輛嘉義落海
0000000043.png,ZeMAmz2iCHk,42,4830,滅證?苗栗國道槍擊作案車輛嘉義落海
0000000051.png,ZeMAmz2iCHk,50,4853,自稱房仲業無結怨開老車遭擊中8槍
0000000075.png,ZeMAmz2iCHk,74,4876,自稱房仲業無結怨開老車遭擊中8槍
0000000014.png,rjbXcGxzRmY,13,4899,東石漁港2轎車落海疑涉苗栗槍擊案
0000000032.png,rjbXcGxzRmY,31,4922,車駛進東石漁港疑推車落海滅龍
0000000051.png,rjbXcGxzRmY,50,4945,落海軍藏槍彈及西瓜刀疑涉槍擊案
0000000087.png,rjbXcGxzRmY,86,4968,落海藏槍彈及西瓜刀疑涉槍擊案
0000000007.png,O3537x6Fe3M,6,4991,鎮守山海關行動劇韓家軍踢館王金平
0000000032.png,O3537x6Fe3M,31,5014,韓不選?郭台銘參加初選韓粉焦慮:麥來亂
0000000057.png,O3537x6Fe3M,56,5037,非韓不選委辦公室電話被打爆徵召韓
0000000071.png,O3537x6Fe3M,70,5060,非韓不選輯粉明军百人赴中央黨部陳情
0000000001.png,CqRLw2L7Tas,1,5083,郭董角逐2020綠營經濟外交牌恐失监
0000000037.png,CqRLw2L7Tas,36,5106,郭董參戰錄管更曼?綠委:統獨路線不同
0000000072.png,CqRLw2L7Tas,71,5129,郭董參戰綠營更夏?綠委:統獨路線不同
0000000088.png,CqRLw2L7Tas,87,5152,先打空戰黃重諺臉書笑看郭媽祖勸進說
0000000007.png,zkOa3maSsFQ,6,5175,馬笑而不答!郭董願出線傳因馬英九不選
0000000021.png,zkOa3maSsFQ,20,5198,馬笑而不答!郭董願出線傳因馬英九不選
0000000034.png,zkOa3maSsFQ,33,5221,好友力挺!宣明智:一年前就勸郭董選總統
0000000052.png,zkOa3maSsFQ,51,5244,「企業界當鴻海後援會佩服郭角逐總統
0000000088.png,zkOa3maSsFQ,87,5267,企業界當鴻海後援會佩服郭角逐總好
0000000001.png,PQpFKM4_Yx0,1,5290,找鳴人欠租落跑房東開門見垃圾山
0000000022.png,PQpFKM4_Yx0,21,5313,惡房客積欠租金垃圾堆滿屋人消失
0000000036.png,PQpFKM4_Yx0,35,5336,馬客積欠租金垃圾堆滿屋人消失
0000000011.png,7cKUhnlJu_8,10,5359,悔不當初被揭偷吃港姐許志安IG發黑
0000000030.png,7cKUhnlJu_8,29,5382,悔不當初被揭偷吃港姐許志安IG發黑
0000000063.png,7cKUhnlJu_8,62,5405,「桃色花邊不斷!黃心穎被瘋傳屢勾人夫
0000000001.png,QIrzCsnS4IE,1,5428,如何自保?私人停車場遭撞駕駛:警不介入
0000000030.png,QIrzCsnS4IE,29,5451,非道路車禍!車主竟證自保“保險公司處理
0000000048.png,QIrzCsnS4IE,47,5474,"非道路車禍!車主竟自保,保險公司處理"
0000000066.png,QIrzCsnS4IE,65,5497,「私人領域車輛遭撞!車主求償走”民事調解
0000000001.png,Csf6PQGsJcI,1,5520,假歇業躲查緝毒犯藏密室警逮10人
0000000034.png,Csf6PQGsJcI,33,5543,假歇業業者私接水電被疑供毒品場地
0000000054.png,Csf6PQGsJcI,53,5566,罰不怕旅館勒令停業接水電遭強拆
0000000083.png,Csf6PQGsJcI,82,5589,罰不怕旅館勒令停業接水電遭強拆
0000000018.png,nmMuHfGYP-8,17,5612,|150萬港幣揭偷運將曝光許志安曖昧情
0000000040.png,nmMuHfGYP-8,39,5635,|150萬港幣揭偷腥運將曝光許志安曖昧情
0000000073.png,nmMuHfGYP-8,72,5658,載到明星港運將賣行車紀錄器恐侵隱私
0000000093.png,nmMuHfGYP-8,92,5681,"践行車紀錄器自保,未經同意曝光恐觸法"
0000000008.png,EFFzfxTzico,7,5704,客少賺1倍!師大名店阿諾可麗餅縮還省和
0000000031.png,EFFzfxTzico,30,5727,應客少賺1倍!師大名店阿諾可麗餅縮攤省
0000000047.png,EFFzfxTzico,46,5750,攤商改租小店多型態賣/店家盼師大再起來
0000000076.png,EFFzfxTzico,75,5773,攤商改租小店多型態店家盼師大再起來
0000000024.png,DJ1wG97f23c,23,5796,正式宣告郭台銘領黨證角逐2020初選
0000000039.png,DJ1wG97f23c,38,5819,展現忠黨精神郭台銘鞠躬朗讀孫文遺囑
0000000058.png,DJ1wG97f23c,57,5842,展現忠黨精神郭台銘鞠躬朗讀孫文遺
0000000077.png,DJ1wG97f23c,76,5865,資洛解套!郭台銘領黨證認證50年黨員
0000000094.png,DJ1wG97f23c,93,5888,資洛解郭台銘領黨證認證50年黨員
0000000012.png,10oRGO3CjtY,11,5911,遭怨無處放行李!機捷直達車拆椅增空間
0000000028.png,10oRGO3CjtY,27,5934,遭怨無處放行李後捷直達車拆椅”增空目
0000000064.png,10oRGO3CjtY,63,5957,"行李箱滑動,座位數民眾正反看法不一"
0000000001.png,k5hL8npnucQ,1,5980,X光機驗不仿冒品闖關檢警難追看
0000000016.png,k5hL8npnucQ,15,6003,進口貨物年破百萬件海關查驗率百分百
0000000035.png,k5hL8npnucQ,34,6026,與陸快遞合作台報關行圖利造假申報單
0000000047.png,k5hL8npnucQ,46,6049,與陸快遞合作台報關行圖利造假申報身
0000000076.png,k5hL8npnucQ,75,6072,X光機驗不仿冒品闖關檢警難追看
0000000018.png,cTFMTdwGVxc,17,6095,誰在搞鬼人頭戶報關詐騙包裹合法入台
0000000060.png,cTFMTdwGVxc,59,6118,包裹誰的?報關行集運網聯手鑽漏評
0000000092.png,cTFMTdwGVxc,91,6141,保證通關時騙包裹大肆抵台非法橫行
0000000001.png,oDWSAhEC0Gg,1,6164,疑遭欺負!送公托中心9月大男嬰滿身傷
0000000024.png,oDWSAhEC0Gg,23,6187,頭險肚全身傷!家長質疑公托中心搶玩具
0000000056.png,oDWSAhEC0Gg,55,6210,幼兒玩鬧男嬰被5分鐘師目睹竟未阻工
0000000077.png,oDWSAhEC0Gg,76,6233,正值口慾期:女嬰傷男嬰社會局咬人非霸
0000000001.png,n2SPIQ-5HAo,1,6256,沒試水溫保母開水沖3個月大男嬰二度燙佳
0000000033.png,n2SPIQ-5HAo,32,6279,沒試水溫保母開水沖3個月大男嬰二度還
0000000059.png,n2SPIQ-5HAo,58,6302,"沒試水溫,保母開水沖3個月大男嬰二度還"
0000000082.png,n2SPIQ-5HAo,81,6325,嬰兒皮膚稚嫩50度C冲11秒恐二度還
0000000110.png,n2SPIQ-5HAo,109,6348,嬰兒皮膚稚嫩50度C冲11秒恐二度燙傷
0000000005.png,POhKz0vk1i8,4,6371,小三黃心穎發文致歉傳鄭秀文心痛搬離愛
0000000015.png,POhKz0vk1i8,14,6394,"安心偷食黃心穎致歉:對不起家人,男医"
0000000029.png,POhKz0vk1i8,28,6417,遭姊妹背叛鄭秀文有些事情想清楚
0000000039.png,POhKz0vk1i8,38,6440,拒與人見面傳鄭秀文搬離淺水灣愛算
0000000074.png,POhKz0vk1i8,73,6463,情牽28年數度分合許志安得獎謝鄭秀】
0000000091.png,POhKz0vk1i8,90,6486,情牽28年數度合許志安傳多次劈貼
0000000006.png,WCJVufVpXNA,5,6509,周四白天稍熱山區及花東零星雨
0000000035.png,WCJVufVpXNA,34,6532,周四天悄山區及花東零星雨
0000000060.png,WCJVufVpXNA,59,6555,周四注意防曬西台金馬易有霧
0000000077.png,WCJVufVpXNA,76,6578,周五八音也易下雨注意局部大雨
0000000089.png,WCJVufVpXNA,88,6601,周四白天稍熱山區及花東零星雨
0000000105.png,WCJVufVpXNA,104,6624,周五起合地自天熱早晚舒適
0000000114.png,WCJVufVpXNA,113,6647,周四注意防曬西台金馬易有霧
0000000123.png,WCJVufVpXNA,122,6670,周五六音也易下雨注意局部大雨
0000000152.png,WCJVufVpXNA,151,6693,周五起各地自天早晚舒適
0000000001.png,wj1U9hM-NFU,1,6716,澎群辦桌绿博推低碳飲食結合道地食
0000000011.png,wj1U9hM-NFU,10,6739,澎湃辦桌绿博推低碳飲食結合道地食材
0000000048.png,wj1U9hM-NFU,47,6762,在地料理主廚展等宣導落實環保節育
0000000001.png,LNjbGrE98OY,1,6785,“又是你男控1天內遭檢舉達人舉發2.
0000000033.png,LNjbGrE98OY,32,6808,反蒐證男臉書怒公布檢舉達人車輛影
0000000001.png,1jLEJ2oHDTc,1,6831,台灣金主出資籌組跨國詐騙集團
0000000049.png,1jLEJ2oHDTc,48,6854,境外機房阻斷追查警跨國合作揪出幕
0000000005.png,2bKrZMzdSaM,4,6877,郭表態參選總統議會挺韓連署生
0000000057.png,2bKrZMzdSaM,56,6900,郭表態參選總統北市議會挺韓連署生
0000000081.png,2bKrZMzdSaM,80,6923,姬韓流?挺台国?藍營尷尬陷兩重
0000000132.png,m2z4s0ZbM-U,131,6946,「沒想到拖出大老虎”韓自嘲:我參選會變驚悚片
0000000002.png,uoYhhctcRTA,1,6969,跨雙黃線對撞軍頭撞凹引擎蓋折
0000000039.png,uoYhhctcRTA,38,6992,逆向800ml量軍主精神不濟“釀
0000000077.png,uoYhhctcRTA,76,7015,逆向800ml肇事車主精神不濟釀看
0000000002.png,qLw6EcLZFH8,1,7038,鄭秀文臉書封面全黑好友擔心憂鬱症發们
0000000022.png,qLw6EcLZFH8,21,7061,"早知出軌?1G端倪,有些事情要想清楚"
0000000054.png,qLw6EcLZFH8,53,7084,鄭秀文新片老公不忠合許志安出動
0000000080.png,qLw6EcLZFH8,79,7107,相識28年數度胎唯獨你不可取替超題
