0000000001.png,D7TWio3Ras4,1,0,三陽光刺眼失控軍卡撞路邊停車無人傷
0000000039.png,D7TWio3Ras4,38,23,陽光刺眼失控重卡撞路邊停車無人傷
0000000016.png,yJtWXUWpAOo,15,46,支質詢南部大機場韓反問議員滿意嗎
0000000049.png,yJtWXUWpAOo,48,69,皮質詢南部大機場韓反問議員滿意嗎
0000000110.png,yJtWXUWpAOo,109,92,奥統大選每日一問韓國瑜基於使命感
0000000014.png,DNGTpUrPzlk,13,115,西酒吧屋頂坍塌2死83傷多人仍受困
0000000051.png,DNGTpUrPzlk,50,138,西酒吧屋頂坍塌2死3傷多人仍受困
0000000001.png,O9jcp7iMNO4,1,161,丁阿利易主1.9億轉手?業者還有主導權
0000000029.png,O9jcp7iMNO4,28,184,奧丁團客減少海鮮餐廳將以散客為主
0000000056.png,O9jcp7iMNO4,55,207,命為蚊子館?立榮發公告5/28不飛屏東
0000000019.png,cI8yLVW-nBc,18,230,遠航稱有合理補償“旅行社:未收到方察
0000000039.png,cI8yLVW-nBc,38,253,受損逾千萬!眼港返台機票1張1萬+食宿
0000000072.png,cI8yLVW-nBc,71,276,損逾千港返台機票1張1萬+食宿
0000000010.png,XtCqnDcNy4M,9,299,"貿易戰延燒演藝圈?曾美劇遭陸撤檔,延後"
0000000028.png,XtCqnDcNy4M,27,322,專爸爸因涉及美文化撤檔?片方尚未證實
0000000049.png,XtCqnDcNy4M,48,345,"貿易戰延燒演藝圈?美劇遭陸撤檔,延後"
0000000063.png,XtCqnDcNy4M,62,368,"3天放播抗美電影,央視:用藝術呼應時事"
0000000079.png,XtCqnDcNy4M,78,391,13天改播抗美電影央視:用藝術呼應時事
0000000091.png,XtCqnDcNy4M,90,414,專爸爸因涉及美文化撤檔?片方尚未證了
0000000001.png,TiugEsLvtwk,1,437,8歲母離異同居2人育子女常起糾紛
0000000022.png,TiugEsLvtwk,21,460,母返家帶2朋友前夫怒不顧小孩釀悲劇
0000000045.png,TiugEsLvtwk,44,483,賣網拍父打零工離婚扶養權喬不擔
0000000069.png,TiugEsLvtwk,68,506,斗賣網拍父打零工離婚扶養權喬不攏
0000000001.png,tVR4L2Xof88,1,529,哥吉拉2洛杉磯首映章子怡性感亮相
0000000018.png,tVR4L2Xof88,17,552,哥吉拉藍領節走紅毯渡邊謙擺俏皮POSH
0000000047.png,tVR4L2Xof88,46,575,7隻巨獸集結章子怡绿幕前靠想像演戲
0000000082.png,tVR4L2Xof88,81,598,7隻巨獸集結章子怡绿幕前靠想像演戲
0000000011.png,A0xeciDFF0Y,10,621,長柏芝承受攻擊硬咽談過往從沒後悔
0000000034.png,A0xeciDFF0Y,33,644,不雅照風波?張柏芝硬咽:傷害到極點
0000000066.png,A0xeciDFF0Y,65,667,長柏芝三胎生父成謎談過往從沒後悔
0000000085.png,A0xeciDFF0Y,84,690,曹向華強封殺張柏芝負責任往前看
0000000102.png,A0xeciDFF0Y,101,713,長柏芝承受攻擊硬咽談過往“從沒後悔
0000000010.png,7AWMItS7fuY,9,736,方雨!奈米噴霧防微波咖啡渣除濕
0000000053.png,7AWMItS7fuY,52,759,不想濕答答網平台防水小物銷量增6成
0000000068.png,7AWMItS7fuY,67,782,"方雨!奈米噴霧防濕,微波咖啡渣除濕"
0000000014.png,nhYYuIHUvBw,13,805,捍衛3票房冠軍努李維自爆暗戀珊卓
0000000049.png,nhYYuIHUvBw,48,828,"合拍捍衛戰警互有好感,害羞錯失良緣"
0000000074.png,nhYYuIHUvBw,73,851,"合拍“捍衛戰警,互有好感,害羞錯失良緣"
0000000017.png,QlDtqiAdO-Q,16,874,丁驗政府施政缺失國民黨聲勢卻下滑
0000000042.png,QlDtqiAdO-Q,41,897,2020元面减初選紛擾選民對藍失
0000000064.png,QlDtqiAdO-Q,63,920,2020元面減初選紛擾選民對藍失
0000000094.png,QlDtqiAdO-Q,93,943,2020贏面減!初選紛擾選民對藍失
0000000108.png,QlDtqiAdO-Q,107,966,韋流退燒?韓國民調降郭台銘
0000000001.png,RuJlBKsmVg8,1,989,季軍機民宅旁墜毀巨大火球濃煙沖天
0000000022.png,RuJlBKsmVg8,21,1012,老直升機墜毀農場目擊者空中就
0000000053.png,RuJlBKsmVg8,52,1035,直升機墜毀農場目擊者空中就解體了
0000000088.png,RuJlBKsmVg8,87,1058,巷直升機墜毀農場目擊者空中就解體了
0000000001.png,pQK3J8cIU-8,1,1081,芳和我付的!不願分手為挽回大鬧女友家
0000000031.png,pQK3J8cIU-8,30,1104,交往1個月開翻男不想分手當街遭壓制
0000000050.png,pQK3J8cIU-8,49,1127,交往1個月鬧翻男不想分手當街遭壓制
0000000073.png,pQK3J8cIU-8,72,1150,交往1個月鬧翻男不想分手當街遭壓制
0000000014.png,nHk9mgtNCXY,13,1173,奧地利通俄門副總理下台國會提前大道
0000000030.png,nHk9mgtNCXY,29,1196,奧地利通俄門副總理下台國會提前大選
0000000058.png,nHk9mgtNCXY,57,1219,聯合政府瓦解總統最快9月初重選國會
0000000090.png,nHk9mgtNCXY,89,1242,史特拉赫喊冤被只是喝醉酒亂講話
0000000004.png,_fzmv1dmYVU,3,1265,死黨成奪命槍手曾PO文虛偽朋友難防
0000000037.png,_fzmv1dmYVU,36,1288,死黨成奪命槍手曾PO文虛偽朋友難防
0000000068.png,_fzmv1dmYVU,67,1311,死黨成奪命槍手會PO文“虛偽朋友難防
0000000001.png,DiFYTOqCzTY,1,1334,鋒面通過台南樹倒瀑布再現訓練中心泡水
0000000020.png,DiFYTOqCzTY,19,1357,"司學好忙撈水,枯木划船訓練中心泡水"
0000000036.png,DiFYTOqCzTY,35,1380,壯觀台第1高爆發龍瀑布雨後氣勢磅礴
0000000052.png,DiFYTOqCzTY,51,1403,台南公園榕樹倒塌2學生打籃球被砸傷
0000000069.png,DiFYTOqCzTY,68,1426,台中市區道路小積水軍經過水花噴展
0000000001.png,s-vPgKeXGZo,1,1449,玩水遇山洪無人機投送物資熬過一夜
0000000041.png,s-vPgKeXGZo,40,1472,鋒面報到中部以北南部山區豪大雨
0000000085.png,s-vPgKeXGZo,84,1495,等3天霧散」能見度計金門機場疏運
0000000001.png,wILkYiNZnGM,1,1518,幼兒園女童背部遭師毆打瘀青傷痕累累
0000000031.png,wILkYiNZnGM,30,1541,幼兒園女童背部遭師毆打瘀青傷痕累累
0000000050.png,wILkYiNZnGM,49,1564,家長怒PO該師常童幼園主管鞠躬道歉
0000000086.png,wILkYiNZnGM,85,1587,力兒園女童背部遭師毆打瘀青傷痕累累
0000000007.png,IAV_5_VFEz8,6,1610,沒交集!蔡賴叫庫民調卓榮泰參戰喊5月
0000000027.png,IAV_5_VFEz8,26,1633,"協調破局?卓榮泰,5月底民調版本進软會"
0000000042.png,IAV_5_VFEz8,41,1656,"沒交集,蔡賴叫陣民調卓榮泰參戰喊5月底"
0000000082.png,IAV_5_VFEz8,81,1679,沒交集!蔡賴叫陣民調卓榮泰參戰喊5月
0000000007.png,yQ3OOvxrUSo,6,1702,"就職3年記者會,總統執政者須忍受孤獨"
0000000040.png,yQ3OOvxrUSo,39,1725,"第4年是收穫開始,總統提台灣10關鍵字"
0000000070.png,yQ3OOvxrUSo,69,1748,就職3年記者會總統執政者須忍受孤獨
0000000090.png,yQ3OOvxrUSo,89,1771,被指挑對總統是保衛台
0000000001.png,ovSM4LrUng4,1,1794,電線短路釀禍暗夜火警延燒2層樓
0000000025.png,ovSM4LrUng4,24,1817,電線短路釀禍暗夜火警延燒2層樓無人傷
0000000053.png,ovSM4LrUng4,52,1840,電線短路釀禍暗夜火警延燒2層樓無人傷
0000000078.png,ovSM4LrUng4,77,1863,電線短路釀禍暗夜火警延燒2層樓無人傷
0000000004.png,CqrleEtmswI,3,1886,九零後儲蓄兩樣情月光族VS兼差3份存錢
0000000033.png,CqrleEtmswI,32,1909,九零後儲蓄兩樣情!月光族vs.差3份存錢
0000000059.png,CqrleEtmswI,58,1932,58%年輕人拿不出10萬投資自己取代儲警
0000000083.png,CqrleEtmswI,82,1955,58%年輕人拿不出10萬!投資自己取代儲蓄
0000000001.png,fLkrGX4WF2c,1,1978,開關燈起衝突男拿掃把柄打斷婦手骨
0000000048.png,fLkrGX4WF2c,47,2001,開關燈起衝突擊掃把柄打斷婦手骨
0000000081.png,fLkrGX4WF2c,80,2024,開關燈起衝型男拿掃把柄打斷婦手骨
0000000031.png,5ifulDvNl04,30,2047,導滯留旅客半夜轉機!飛航時間倍增
0000000067.png,5ifulDvNl04,66,2070,衝擊擴大!遠航再取消日韓陸總計8航線
0000000117.png,5ifulDvNl04,116,2093,衝擊擴大!遠航再取消自韓陸”總計8航
0000000001.png,fhC1Uohg_70,1,2116,疑電線走火羅東診所2樓火警延燒到3樓
0000000031.png,fhC1Uohg_70,30,2139,疑電線走火!羅東診所2樓火警延燒到3樓
0000000067.png,fhC1Uohg_70,66,2162,疑電線走火羅東診所2樓火警延燒到3樓
0000000001.png,FJlgLBkxCV8,1,2185,別買貴了!同款貼圖不同價官網省10元
0000000037.png,FJlgLBkxCV8,36,2208,別買貴了!同款貼圖不同價官網省10元
0000000009.png,P26Gyl3ndOU,8,2231,聞香下馬vs.銘踏上場郭台銘簽字雙關語
0000000033.png,P26Gyl3ndOU,32,2254,聞香下馬vs.踏上場郭台銘簽字雙關語
0000000077.png,P26Gyl3ndOU,76,2277,講台語接地氣!郭台銘與雲林鄉親搏感情
0000000004.png,KA5_4JHyPKU,3,2300,第三波梅雨鋒接近中!估9-10點雨勢
0000000029.png,KA5_4JHyPKU,28,2323,"防豪雨襲!“中小尺度系統,如水炸彈量"
0000000056.png,KA5_4JHyPKU,55,2346,移動性鋒面:雨勢北→南全台防雨
0000000079.png,KA5_4JHyPKU,78,2369,周一鋒面通過各地有雨局部大或豪雨
0000000088.png,KA5_4JHyPKU,87,2392,鋒面附近強對流發展注意短時強降雨
0000000105.png,KA5_4JHyPKU,104,2415,注意西半部及東北部易有大雨或豪雨
0000000130.png,KA5_4JHyPKU,129,2438,鋒面雷雨區內注意瞬間大雨雷擊強
0000000146.png,KA5_4JHyPKU,145,2461,連日大雨影響山區應慎防坍方及落石
0000000163.png,KA5_4JHyPKU,162,2484,搭機注意鋒前金門馬祖有局部霧低雲
0000000172.png,KA5_4JHyPKU,171,2507,周二雨趨緩中南部山區仍有較大雨勢
0000000013.png,1-pOL50kx_o,12,2530,吳宗憲演唱會“山寨”韓國瑜大玩政治梗
0000000034.png,1-pOL50kx_o,33,2553,韓現身演唱會吳宗憲大唱紅豆夜襲mix版
0000000065.png,1-pOL50kx_o,64,2576,為韓準備超大麥克風與吳合唱經典名曲
0000000088.png,1-pOL50kx_o,87,2599,"沒特別邀上台韓,吳台下握手互動熱絡"
0000000016.png,9QKhKGucq6M,15,2622,“不要用光照我”騎士遭警挥粉碎性骨折
0000000049.png,9QKhKGucq6M,48,2645,“沒駕照就過肩摔”?家屬控警執法過當
0000000076.png,9QKhKGucq6M,75,2668,嫌毆警遭壓制警駁過當:依法執行公務
0000000029.png,hv5EWxk3dUg,28,2691,打造友善河濱環境新月橋水岸電梯啟用
0000000054.png,hv5EWxk3dUg,53,2714,打造友善河濱環境新月橋水岸電梯
0000000003.png,JkTn3Zma1yU,2,2737,韓流退燒?親綠民調顯示韓郭支持度
0000000022.png,JkTn3Zma1yU,21,2760,韓流退燒?親綠民調顯示韓郭支持度拉近
0000000052.png,JkTn3Zma1yU,51,2783,韓流退燒?親綠民調顯示韓郭支持度拉近
0000000072.png,JkTn3Zma1yU,71,2806,韓流冷卻至親綠民調出戰蔡賴位居下風
0000000010.png,8KYuhudK9mo,9,2829,柯有倫中Legacy開唱小場地更貼近歌迷
0000000021.png,8KYuhudK9mo,20,2852,大咖歌手要用中小型場地近距離接觸粉絲
0000000053.png,8KYuhudK9mo,52,2875,中小型場地人數少場租低歌手免打票房壓力
0000000087.png,8KYuhudK9mo,86,2898,中小型場地人數少場租低歌手免打票房壓力
0000000001.png,kKh4GXLNgMc,1,2921,瓦斯槍射破兩車窗富家男辯臨時起意
0000000010.png,kKh4GXLNgMc,9,2944,受害兩車僅距50米槍影像曝光遭逮
0000000042.png,kKh4GXLNgMc,41,2967,受害兩車僅距50米槍手影像曝光遭逮
0000000062.png,kKh4GXLNgMc,61,2990,看見車子就開信涉案富家男住家遭逮
0000000012.png,yHevnz4hXhs,11,3013,被稱最佳副手政挺誰:不要害我
0000000038.png,yHevnz4hXhs,37,3036,張視察市場吃吃院研油條韓讀他了不起
0000000062.png,yHevnz4hXhs,61,3059,郭張配或韓張配?張善政道問題陷害我
0000000099.png,yHevnz4hXhs,98,3082,被稱最佳副手張善政挺誰:不要害我
0000000001.png,UEjJcfPJo7c,1,3105,韓說哈你決定!網友搞笑製發大財產生器
0000000059.png,UEjJcfPJo7c,58,3128,金句被網友KUSO韓戲而不誰可以接受
0000000095.png,UEjJcfPJo7c,94,3151,金句被網友KUSO韓戲而不誰可以接受
0000000009.png,MDawWQmz8is,8,3174,“高雄造船要發了!總統拚兌現國艦國造
0000000028.png,MDawWQmz8is,27,3197,"總統炫政績,今年是投資大爆發的年代"
0000000057.png,MDawWQmz8is,56,3220,蔡總統就職滿6年慶祝行情滿意度上升
0000000001.png,Sjhpv4o_h_g,1,3243,陸聯結車貨物超高「頭過身沒過撞垮天橋
0000000037.png,Sjhpv4o_h_g,36,3266,轎車行經险遭慶駛急踩油門躲過一劫
0000000055.png,Sjhpv4o_h_g,54,3289,騎車行經险遭壓駕駛急踩油門躲過一劫
0000000012.png,RbuvRR1JQc8,11,3312,遠航董座出國!總經理致神隱現身沒道歉
0000000048.png,RbuvRR1JQc8,47,3335,擺爛?遠航取消航線簽轉代藝全靠旅行社
0000000068.png,RbuvRR1JQc8,67,3358,人工協助簽轉key票旅行業損失估上億元
0000000092.png,RbuvRR1JQc8,91,3381,擺爛?遠航取消航線簽轉代墊全靠旅行社
0000000111.png,RbuvRR1JQc8,110,3404,遠航董座出國」總經理發神隱現身沒道歉
0000000001.png,YLPJKAJbSvc,1,3427,這種第一名太糟死亡車禍三個月63件
0000000026.png,YLPJKAJbSvc,25,3450,這種第一名太糟晚亡車禍三個月63件
0000000061.png,YLPJKAJbSvc,60,3473,"違規轉彎,超速闖紅燈大執法2日6千件"
0000000095.png,YLPJKAJbSvc,94,3496,"違規轉彎,超速闖紅燈大執法2日6千件"
0000000009.png,38Uk-h4NXMQ,8,3519,訪高雄遭總統酸要專心市政柯:我很用心
0000000028.png,38Uk-h4NXMQ,27,3542,訪高雄遭總統酸要專心市政柯:我很用心
0000000040.png,38Uk-h4NXMQ,39,3565,人在高雄再誇北市議會柯:我有說錯嗎
0000000065.png,38Uk-h4NXMQ,64,3588,柯赴校園演講傳遭關切校方澄清沒壓力
0000000087.png,38Uk-h4NXMQ,86,3611,柯赴校園演講傳遭關切校方澄清沒壓力
0000000003.png,qhNIOSW1dlY,2,3634,Forever21撤出大陸門市紛清倉甩貨
0000000016.png,qhNIOSW1dlY,15,3657,Forever21撤出大陸門市清倉甩貨
0000000028.png,qhNIOSW1dlY,27,3680,Forever21收據陸網友稱CP值低不意外
0000000044.png,qhNIOSW1dlY,43,3703,網紅帶動平價服飾銷量衝擊快時尚行業
0000000062.png,qhNIOSW1dlY,61,3726,網紅帶動平價服飾銷量衝擊快時尚行業
0000000004.png,McJAn-3jKNk,3,3749,“全面攻佔三部曲傑瑞德陷圈套殺總統
0000000027.png,McJAn-3jKNk,26,3772,傑瑞德·摩根三度合作續集格局大添看頭
0000000069.png,McJAn-3jKNk,68,3795,特訓5個月免替身基努李維”捍衛埋伏筆
0000000004.png,0Q9nsfyaqTU,3,3818,800多旅客仍滯留旅行社虧損恐千萬
0000000015.png,0Q9nsfyaqTU,14,3841,500多旅客仍滯留旅行社虧損恐千萬
0000000055.png,0Q9nsfyaqTU,54,3864,事發3天!遠航首出面業者會補償費用
0000000071.png,0Q9nsfyaqTU,70,3887,遠航取消日新鴻福島旅行社恐虧千萬
0000000001.png,CmdAUBGCKa4,1,3910,玩遊戲器材用的雙貓遊客嚇得尖叫連連
0000000057.png,CmdAUBGCKa4,56,3933,退票包600元图問金遊客難接受決提告
0000000095.png,CmdAUBGCKa4,94,3956,"退票,包600元慰問金遊客難接受決提告"
0000000016.png,Qvszj7qa-jY,15,3979,剩一半撐場中商圈精品巷接連5家指
0000000043.png,Qvszj7qa-jY,42,4002,"相半年仍空,精品消費移轉百貨,飯店內"
0000000068.png,Qvszj7qa-jY,67,4025,精品街邊店接連退場outlet崛起拓展版區
0000000005.png,S3UEEessPfM,4,4048,拿別針刺女童15下幼兒園教師下跪道歉
0000000023.png,S3UEEessPfM,22,4071,拿別針刺女童15下幼兒園教師下跪道
0000000039.png,S3UEEessPfM,38,4094,【痛痛”5歲女童遭幼師拿別針刺手15
0000000064.png,S3UEEessPfM,63,4117,家長臉書控虐童圓方要求刪文家長怒告
0000000090.png,S3UEEessPfM,89,4140,涉虐童教師已遭開除警依傷害罪偵辦
0000000001.png,TD1bAGQpwvc,1,4163,跑單踢鐵板!屢吃霸王餐店員追700米逮人
0000000020.png,TD1bAGQpwvc,19,4186,酒足飯飽就落跑店長高一呼追700米抓
0000000043.png,TD1bAGQpwvc,42,4209,至少三次屢吃霸王餐遭鎖定店家不織方
0000000077.png,TD1bAGQpwvc,76,4232,跑單踢鐵板!厦吃霸王餐店員追700米遠》
0000000001.png,D6oAv6kL40Q,1,4255,空瓶買汽油未登記2男為虛擬寶物報復
0000000042.png,D6oAv6kL40Q,41,4278,人工加油可詢問自助加油區恐成痛
0000000070.png,D6oAv6kL40Q,69,4301,"買油要登記非硬性規定多為""口頭詢問"
0000000001.png,QW8FmWNFjrY,1,4324,疑討債不成兩嫌自製汽油彈深夜險燒屋
0000000027.png,QW8FmWNFjrY,26,4347,"只為兩萬元,賺不到錢深夜丟汽油彈"
0000000052.png,QW8FmWNFjrY,51,4370,逃跑兩天落網遭警逮2嫌觸公共危險
0000000001.png,x1ub7JzR6VI,1,4393,邀友續攤竟遭國小腿縫6針屋主告傷害
0000000019.png,x1ub7JzR6VI,18,4416,眼遭毆纯傷視力受損女友勸架也遭區
0000000042.png,x1ub7JzR6VI,41,4439,“喝多了3嫌到案供稱酒醉惹禍疑欲減开
0000000088.png,x1ub7JzR6VI,87,4462,邀友續攤竟遭國小腿縫6針屋主告傷害
0000000001.png,a6gWRPHjCqs,1,4485,"郭董回嗆蔡總統,把往生者當競選議題"
0000000021.png,a6gWRPHjCqs,20,4508,蔡英文怒批郭工廠這麼多年輕人想不開
0000000033.png,a6gWRPHjCqs,32,4531,郭董回嗆蔡總統把往生者當競選議題
0000000076.png,a6gWRPHjCqs,75,4554,"郭董回咱蔡總統,把往生者當競選議題"
0000000015.png,QQqCO7HBUbM,14,4577,張善政祝心想事成韓國瑜:yes|do
0000000005.png,cXByr158wYc,4,4600,期滿前兩天突延長境管馬根本是羞辱
0000000044.png,cXByr158wYc,43,4623,延長境管限制馬吳聯手轟蔡因人設事
0000000082.png,cXByr158wYc,81,4646,突延長境管期限海峽論壇吳習會恐泡湯
0000000001.png,DdP3ADfmevs,1,4669,史男遭槍殺生前畫面曝光!1車3人進茶會
0000000038.png,DdP3ADfmevs,37,4692,兇嫌故佈疑陣?連燒兩輛租車繞路逃逸
0000000061.png,DdP3ADfmevs,60,4715,"兇嫌,死者同為詐欺集團嫌犯!一番各判6年"
0000000101.png,DdP3ADfmevs,100,4738,史男詐欺一審判6年上訴未入監反遭槍擊
0000000023.png,kQ7hml4TYEA,22,4761,「總統民調幸運星?蘇揆調整過去沒做好的
0000000058.png,kQ7hml4TYEA,57,4784,賴清德急了?反悔協商共識批黨詐財
0000000084.png,kQ7hml4TYEA,83,4807,賴清德急了?反悔協商共識批黨詐財
0000000001.png,Prz9aP36cUo,1,4830,88秒快閃2槍手埋伏行党公然掃射26
0000000047.png,Prz9aP36cUo,46,4853,驚悚沙鹿茶館掃射兩槍手持槍畫面曝
0000000088.png,Prz9aP36cUo,87,4876,38秒快閃!2管理行党公然掃射26行
0000000113.png,Prz9aP36cUo,112,4899,驚悚!沙鹿茶館掃射兩槍手持槍畫面曝光
0000000017.png,MIf8baHfJ7U,16,4922,霧鎖金門近兩千旅客滞留鼓課我要回家
0000000039.png,MIf8baHfJ7U,38,4945,霧鎖金門!近兩千旅客滞留鼓課”我要回家
0000000056.png,MIf8baHfJ7U,55,4968,縣府介入處理不排除加派軍機跟軍艦疏這
0000000001.png,Yj57k-L6YII,1,4991,洗個人物品涉偷竊淺水灣公廁洗滌惹議
0000000033.png,Yj57k-L6YII,32,5014,|公厕私人管理水電自付業者:有管理
0000000069.png,Yj57k-L6YII,68,5037,清洗装置得投幣10元咖啡廳消費可冲
0000000010.png,Tui7_Ryd1F4,9,5060,址!”4米長綠地道染人PO網民怨丢所
0000000042.png,Tui7_Ryd1F4,41,5083,址:4米長綠地遭梁朝人PO網民怨丢
0000000076.png,Tui7_Ryd1F4,75,5106,省工時漆染步道綠草水利局裁罰承包商
0000000001.png,Ua8RkgMJfew,1,5129,剪鎖頭敲玻璃偷娃娃機業者損失破10萬
0000000015.png,Ua8RkgMJfew,14,5152,剪鎮頭敲玻璃娃娃機業者損失破10萬
0000000028.png,Ua8RkgMJfew,27,5175,剪鎮頭敲玻璃娃娃機業者損失破10萬
0000000048.png,Ua8RkgMJfew,47,5198,「業者一次被偷3萬1個半月仍未抓到嫌刀
0000000074.png,Ua8RkgMJfew,73,5221,業者一次被偷3萬1個半月仍未抓到嫌犯
0000000001.png,x_DV_rEGKOY,1,5244,"綠趁限公投法運行了,現提案恐打回原开"
0000000027.png,x_DV_rEGKOY,26,5267,昔為核廢反目朱立倫黃士修今齊轟執政
0000000063.png,x_DV_rEGKOY,62,5290,綠委版公投限八月投資抵比政院版恶這
0000000004.png,KN0huKP5geM,3,5313,書法豆皮下肚穿古裝吃火鍋搭懷舊裝演
0000000027.png,KN0huKP5geM,26,5336,鍋底降價!二代火鍋店拼裝潢高CP值吸号
0000000045.png,KN0huKP5geM,44,5359,"鍋底降價!二代火鍋店裝潢,高CP值吸官"
0000000078.png,KN0huKP5geM,77,5382,9種湯頭2百有規連鎖火鍋副牌拚翻
0000000002.png,ITyR-8J-Isk,1,5405,東方神起舞蹈老師來台學生搶報名受高
0000000044.png,ITyR-8J-Isk,43,5428,鮮師來台傳授練習生制度台生搶報名體
0000000086.png,ITyR-8J-Isk,85,5451,韓國舞蹈視眼神細節要求嚴格反覆
0000000001.png,zrk5UXG-6aw,1,5474,浪漫情歌吸觀眾選票荷蘭歌手歌唱尊元
0000000015.png,zrk5UXG-6aw,14,5497,浪漫情歌吸觀眾選票荷蘭歌手歌唱尊元
0000000037.png,zrk5UXG-6aw,36,5520,歐洲歌唱大賽決賽26國歌手華麗署元
0000000001.png,-6JnGdvx-d4,1,5543,華府龍舟賽登場王建民現身參加廣三
0000000035.png,-6JnGdvx-d4,34,5566,連續18年舉辦龍舟賽拓展文化外
0000000003.png,vHPezz6vtws,2,5589,買一送一建商辦抽獎頭獎是500萬房屋
0000000018.png,vHPezz6vtws,17,5612,買一送一建商辦抽獎頭獎是500萬房屋
0000000040.png,vHPezz6vtws,39,5635,買一送一(建商辦抽獎頭獎是500萬房屋
0000000065.png,vHPezz6vtws,64,5658,"買一送一,建商辦抽獎頭獎是500萬房屋"
0000000001.png,8afbCTdG6yY,1,5681,故意拒絕酒測男子遭扣軍竟還控警不
0000000001.png,2e8YTpHQxR0,1,5704,遊覽車開在瀑布上?南投大雨驚險瞬盾
0000000036.png,2e8YTpHQxR0,35,5727,大雨侵蝕200年大樹電桿倒麼八民
0000000001.png,j5OLwk_HjTw,1,5750,拆投幣孔偷自助洗衣機警弃150米遠目
0000000029.png,j5OLwk_HjTw,28,5773,飛奔躲警喘吁吁威海洛因罪加一等
0000000041.png,j5OLwk_HjTw,40,5796,院檢都通緝」偷挖硬幣業者另提告毀損
0000000069.png,j5OLwk_HjTw,68,5819,院檢都通緝偷挖硬幣業者另提告毀損
0000000007.png,ji8fWIMBvBw,6,5842,柯瑞36分格林大三元勇士110399逆轉聽片
0000000023.png,ji8fWIMBvBw,22,5865,拓荒者上半場全長一度拉開18分三
0000000037.png,ji8fWIMBvBw,36,5888,勇士主帥出招變陣下半場比賽風雲變色
0000000056.png,ji8fWIMBvBw,55,5911,拓荒者禁區失守勇士猛烈攻勢一舉反
0000000069.png,ji8fWIMBvBw,68,5934,柯瑞36分格林大三元勇士11099逆轉用
0000000007.png,NvmSGcTroSw,6,5957,"台人有期待暗示選?柯撒選舉,談該準"
0000000041.png,NvmSGcTroSw,40,5980,柯訪高雄2020起手式吸日媒到場採訪
0000000070.png,NvmSGcTroSw,69,6003,初訪高雄2020起手式?吸日媒到場採訪
0000000090.png,NvmSGcTroSw,89,6026,搭捷運趕場柯博愛座沒分色猶豫怕坐
0000000002.png,itaet8y4cXI,1,6049,驚悚沙鹿茶館掃射兩槍手持槍畫面曝光
0000000057.png,itaet8y4cXI,56,6072,沙鹿茶館掃射兩嫌掃射殺人狂奔接應
0000000090.png,itaet8y4cXI,89,6095,沙鹿茶館掃射兩嫌掃射殺人狂奔接應目
0000000066.png,CsL-plg1Fv4,65,6118,荒謬大師無厘頭高喊沈韓配笑翻全
0000000001.png,lF5yVRt-33E,1,6141,擊破器加手套竊賊偷娃娃機20秒快目
0000000035.png,lF5yVRt-33E,34,6164,擊破器加手套箱偷娃娃機20秒快同
0000000071.png,lF5yVRt-33E,70,6187,機台主集資買2萬又組巡邏隊抓周
0000000001.png,Xg9KiopKSbM,1,6210,喜願行4款產品標示不實檢偵辦許
0000000031.png,Xg9KiopKSbM,30,6233,涉改標延後有效期用過期原料釀黑豆
0000000011.png,788ZMZNQcxo,10,6256,出現交叉!韓民調下滑6%柯支持率32
0000000076.png,788ZMZNQcxo,75,6279,藍營質詢韓都說Yesido柯我不會
0000000100.png,788ZMZNQcxo,99,6302,完工無期監管酸柯乾脆去大巨蛋就
0000000001.png,5G6uo3-8J18,1,6325,前立委蓋違建免拆?建築師:已購地補程
0000000038.png,5G6uo3-8J18,37,6348,前立委蓋違建免拆?建築師:已購地補程
0000000069.png,5G6uo3-8J18,68,6371,前立委蓋違建免拆?建築師已購地補程
