0000000032.png,39zTvw9Hgik,31,7107,星許自昌講到靠左理由善终目缝插针握作善号
0000000001.png,VvoARFIfawc,1,7130,基隆放流6萬尾魚苗淨灘清出2噸垃
0000000040.png,VvoARFIfawc,39,7153,基隆嶼放流3萬尾音淨灘清出2噸垃
0000000001.png,-5PgmAzf2ls,1,7176,感受客家文化!2017巧聖仙師文化祭開跑
0000000018.png,-5PgmAzf2ls,17,7199,感受客家文化2017巧聖仙師文化祭開跑
0000000029.png,-5PgmAzf2ls,28,7222,感受客家文化2017巧聖仙師文化祭開跑
0000000001.png,YXz72ooUKYU,1,7245,過去5年碰4回勇士再勝火箭挺進西完
0000000011.png,YXz72ooUKYU,10,7268,上半場得分掛蛋柯瑞下半場爆氣拿33分
0000000035.png,YXz72ooUKYU,34,7291,上半場得分掛蛋柯瑞下半場爆氣拿33分
0000000054.png,YXz72ooUKYU,53,7314,"「火箭雙槍”哈波,保羅合拿62分無助赢"
0000000009.png,TyS0IaPMFqI,8,7337,嘻哈新人高爾宣冒出頭擠下林宥嘉尊元
0000000036.png,TyS0IaPMFqI,35,7360,高爾宣出道半年!演唱會門票秒殺點閱百青
0000000059.png,TyS0IaPMFqI,58,7383,貴人相助高領讀取發謝和弦親帶跑校国
0000000080.png,TyS0IaPMFqI,79,7406,貴人相助高司董啟發謝和弦親帶跑校国
0000000094.png,TyS0IaPMFqI,93,7429,高爾宣出道半年演唱會門票秒殺點閱百言
0000000016.png,SPN6Wg4-mr8,15,7452,日財務副大臣當導遊帶賴清德選橫濱
0000000043.png,SPN6Wg4-mr8,42,7475,"亡者已矣來者可追,賴盼多溝通核自"
0000000072.png,SPN6Wg4-mr8,71,7498,賴清德訪日低調變風光謝長廷二度同台
0000000009.png,cHcgkWq3KJI,8,7521,恐怖情人前科多!遭指吸毒向七旬母討每
0000000036.png,cHcgkWq3KJI,35,7544,「不要打女生國中生見義勇為反遭砍
0000000050.png,cHcgkWq3KJI,49,7567,少年阻衝突遭砍!分局長慰問提醒:先報
0000000084.png,cHcgkWq3KJI,83,7590,憂遭報復!兩性專家報警提告是必要的
0000000008.png,lklKvBQl2CU,7,7613,潘高空彈跳一吐怨氣隔空邀綠營議員同
0000000025.png,lklKvBQl2CU,24,7636,王浩宇高雄開襪子店潘佔好處又批韓方
0000000050.png,lklKvBQl2CU,49,7659,潘喧用除臭襪除嘴冥王浩宇:局長先試音
0000000090.png,lklKvBQl2CU,89,7682,潘喧用除臭襪除嘴冥王浩宇:局長先試
0000000005.png,8wHxv39z3iY,4,7705,"应低售價,新設計PP材質耐刮,國應解算"
0000000016.png,8wHxv39z3iY,15,7728,"拉低售價,新識PP材質耐刮,感應解"
0000000039.png,8wHxv39z3iY,38,7751,降價土補助搶市Gogoro光陽中華3萬
0000000069.png,8wHxv39z3iY,68,7774,本土品牌策降價取勝陸電動機車龍頭攻;
0000000089.png,8wHxv39z3iY,88,7797,本土品牌策降價取勝陸電動機車龍頭攻;
0000000001.png,BZAJoyR9moM,1,7820,沒喝他端的湯逆子痛殴85歲父”助骨斷2相
0000000029.png,BZAJoyR9moM,28,7843,沒喝他端的湯逆子痛殴85歲父肋骨斷2
0000000048.png,BZAJoyR9moM,47,7866,染毒瘾父母沒給錢男持水果刀刺燒房
0000000086.png,BZAJoyR9moM,85,7889,染毒瘾父母沒給錢男持水果刀刺燒房
0000000001.png,8gbcobnK0Jc,1,7912,"南進審計新村,柯文哲拿冰淇淋拍網紅巴"
0000000034.png,8gbcobnK0Jc,33,7935,"柯文哲假日南下中彰演講,參訪全都只"
0000000059.png,8gbcobnK0Jc,58,7958,"柯文哲假日南下中影演講,參訪全都与"
0000000009.png,xKdqIwgPBsE,8,7981,母親節限定送電視十食波PK快閃299方案
0000000070.png,xKdqIwgPBsE,69,8004,電信再掀低價戰吃到飽月租下殺2字頭
0000000014.png,EjfEEA9KrdM,13,8027,"染色難分!店家添色素無果粒,化工味重"
0000000047.png,EjfEEA9KrdM,46,8050,"染色難分!店家添色素無果粒,化工味重"
0000000001.png,btiiAAAGEQA,1,8073,請注意這支門號受害餐飲店籲別收單
0000000037.png,btiiAAAGEQA,36,8096,吃喝送到卻遭拒門號苦主嘆可能被
0000000056.png,btiiAAAGEQA,55,8119,電改來電顯示?請店家給證據來報到
0000000008.png,G6O_w_g5K4w,7,8142,租金貴2.4年11家業者遷離美食華爾佳
0000000030.png,G6O_w_g5K4w,29,8165,老店搬離月租120萬閒置兩年租不出三
0000000048.png,G6O_w_g5K4w,47,8188,藝人餐廳搬家租金翻倍火鍋店僅租4個
0000000077.png,G6O_w_g5K4w,76,8211,租金貴?4年11家業者遷離美食華爾佳
0000000108.png,G6O_w_g5K4w,107,8234,"租金漲人事成本,外送宅經濟餐廳難經"
0000000001.png,EMGKliIC5X8,1,8257,“買到假貨男不滿怒老闆搶手錶道;
0000000021.png,EMGKliIC5X8,20,8280,買到假貨男不滿怒骑老闆搶手錶遭;
0000000039.png,EMGKliIC5X8,38,8303,「買到假貨”男不滿嘴老闆搶手錶遭
0000000053.png,EMGKliIC5X8,52,8326,"「氣炸,渐場買戒指檢驗驚覺假貨暴。"
0000000002.png,LXAHNSfv4CU,1,8349,出地下道橫越慢車道切西瓜”撞傷騎
0000000039.png,LXAHNSfv4CU,38,8372,出地下道橫越慢車道切西瓜”撞傷騎
0000000056.png,LXAHNSfv4CU,55,8395,右轉請走慢車道車禍頻傳連2告示提醒
0000000008.png,nACbLI0Mmpg,7,8418,前後任市長都是自經區綠質疑韓抄襲
0000000030.png,nACbLI0Mmpg,29,8441,陳菊多次提自經區高雄條件最適合
0000000040.png,nACbLI0Mmpg,39,8464,韓提”醫療觀光”翁宋開放陸人士工作
0000000090.png,nACbLI0Mmpg,89,8487,前後任市長都提自經區綠質疑韓抄襲
0000000018.png,nuNJ8EbMGAE,17,8510,自有設備又故障微風南山半年內3度跳
0000000052.png,nuNJ8EbMGAE,51,8533,停電時間最長一次顧客摸黑逛街逾1小
0000000073.png,nuNJ8EbMGAE,72,8556,停電時間最長一次顧客摸黑逛街逾1小
0000000001.png,VhM4_Zvrhfg,1,8579,自經區說帖抄襲陳菊?韓國瑜:不可信
0000000044.png,VhM4_Zvrhfg,43,8602,要讓我出模韓國瑜馆先查”說帖”定
0000000015.png,F5S6ztYsqdA,14,8625,"「跟我回家攻拒絕遭打傷控男恐嚇殺,"
0000000044.png,F5S6ztYsqdA,43,8648,「跟我回家攻拒絕遭打傷控男恐嚇殺。
0000000077.png,F5S6ztYsqdA,76,8671,落網並稱金錢糾紛女控說謊聲請家暴
0000000001.png,D-MlCYn0k5Q,1,8694,驚!轎車疑國紅燈連撞2車駕駛險噴
0000000027.png,D-MlCYn0k5Q,26,8717,驚轎車疑闖紅燈連撞2車駕駛險噴元
0000000047.png,D-MlCYn0k5Q,46,8740,接撞駕駛卡車內警破壞車體急救
0000000078.png,D-MlCYn0k5Q,77,8763,驚!轎車疑闖紅燈連撞2車駕駛險噴
0000000014.png,9ZDkwbD0ZJ0,13,8786,下次叫市長陳其邁:是叫韓市長來回
0000000036.png,9ZDkwbD0ZJ0,35,8809,頻回高雄趴走陳其邁常常回家很正
0000000101.png,9ZDkwbD0ZJ0,100,8832,陳其邁談產業園區建議韓國瑜多走多
0000000009.png,-HnPTr3i8_g,8,8855,自經區為大陸開放?馬英九轟綠沒常
0000000056.png,-HnPTr3i8_g,55,8878,糾正郭一中各表?馬朱:一中是中華民
0000000090.png,-HnPTr3i8_g,89,8901,科正郭一中各表?馬朱一中是中華民
0000000010.png,9luvcCUNLXA,9,8924,疑遭打水貨疫苗港體檢中心遭陸客插
0000000030.png,9luvcCUNLXA,29,8947,陸客討說法港體檢中心只退款不說來
0000000066.png,9luvcCUNLXA,65,8970,陸客頻上門質問診所人員暴走開嘴對
0000000078.png,9luvcCUNLXA,77,8993,陸客頻上門質問診所人員暴走開嗆對
0000000007.png,UMKSchWCIGY,6,9016,陳妍希穿旗袍開唱重現鄧麗君溫柔氣
0000000021.png,UMKSchWCIGY,20,9039,還原70年代場景陸資劇打造繁體字道
0000000049.png,UMKSchWCIGY,48,9062,何潤東飾陳妍希男友虛擬角色感情
0000000065.png,UMKSchWCIGY,64,9085,穿古裝要刀劍馮小剛監製何潤東新
0000000086.png,UMKSchWCIGY,85,9108,穿古裝要刀劍馮小剛監製何潤東新
0000000001.png,cqxp1GxaQdY,1,9131,駁”網紅總統蔡英文我工作是當總
0000000054.png,cqxp1GxaQdY,53,9154,「槍青年族群總統任內兩度破框改
0000000085.png,cqxp1GxaQdY,84,9177,板中男裙日惹議總統挺黨國元老也
0000000111.png,cqxp1GxaQdY,110,9200,堅持改革引批評總統好處要待往後
0000000006.png,DOaJR2R1-_k,5,9223,普欽打冰球顯身手!個人得8分賽後跌大
0000000016.png,DOaJR2R1-_k,15,9246,最強總統展雄風!普欽打冰球不輸職業好
0000000041.png,DOaJR2R1-_k,40,9269,個人連進8球普欽擔任中鋒成最強射
0000000075.png,DOaJR2R1-_k,74,9292,個人連進8球曾擔任中鋒成最強射
0000000085.png,DOaJR2R1-_k,84,9315,普欽打冰球顯身手!個人得8分賽後跌大
0000000008.png,hvDtqPRy93Q,7,9338,"火災戲沒在仰,築夢童星吸睛激似楊"
0000000023.png,hvDtqPRy93Q,22,9361,火災戲沒在怕築夢童星吸睛激似楊
0000000036.png,hvDtqPRy93Q,35,9384,御用女主角童星黃楊鈿甜4歲學舞展氣
0000000049.png,hvDtqPRy93Q,48,9407,外貌演技不輸大人!小半月劉楚恬萌
0000000069.png,hvDtqPRy93Q,68,9430,母音擁700萬粉絲!裴佳欣絕美大眼圈
0000000082.png,hvDtqPRy93Q,81,9453,母音擁700萬粉絲!裴佳欣絕美大眼圈
0000000001.png,S_0Aaqf8oMA,1,9476,假的!網頁延著養聚落吳神父出面備
0000000024.png,S_0Aaqf8oMA,23,9499,假的!網頁羅蓋養聚落吳神父出面備
0000000044.png,S_0Aaqf8oMA,43,9522,冒用吳神父名網頁賣拖鞋混淆消費
0000000087.png,S_0Aaqf8oMA,86,9545,別上當!屢遭詐騙集團鎖定吳神父急澄
0000000009.png,63BSPloeoSk,8,9568,東區大樓掉傳不修住戶控管委會延至
0000000029.png,63BSPloeoSk,28,9591,東區大樓掉磚不停住戶控管委會延f
0000000064.png,63BSPloeoSk,63,9614,維修估280萬管委會須尊重區大會決。
0000000097.png,63BSPloeoSk,96,9637,"延宕已久影響通行建管處,依法可罰6"
0000000009.png,fD8gmfcUyTE,8,9660,不再回去當董事長郭董宣示選總統決
0000000030.png,fD8gmfcUyTE,29,9683,學韓國瑜醫療觀光?郭推醫療自貿
0000000057.png,fD8gmfcUyTE,56,9706,較勁韓國瑜?郭是好兄弟別見縫插
0000000069.png,fD8gmfcUyTE,68,9729,"雅醫療自貿區,夜宿民間郭台銘較勁草"
0000000093.png,fD8gmfcUyTE,92,9752,"难醫療自貿區,夜宿民間郭台銘較章"
0000000002.png,U-mNO1ScFMo,1,9775,松高炒股案朱國榮1億保金早準備
0000000014.png,U-mNO1ScFMo,13,9798,朱國榮女密友曝形奈兒包1500萬交
0000000026.png,U-mNO1ScFMo,25,9821,涉結合6組人炒作股價朱國榮否
0000000059.png,U-mNO1ScFMo,58,9844,朱國榮疑曾是大圈仔來台投資身家百
0000000094.png,U-mNO1ScFMo,93,9867,又涉炒股案朱國榮1億交保女密友1500
0000000001.png,iheDDj5nbX8,1,9890,停車場科技車牌辨識賊直接把車開
0000000034.png,iheDDj5nbX8,33,9913,停車場科技車牌辨識賊直接把車開
0000000073.png,iheDDj5nbX8,72,9936,不用代幣票卡車牌辨識進出“偷兒也方
0000000001.png,Z02sDEkCWkQ,1,9959,香港出現首宗非洲猪瘟銷毀6千隻活
0000000040.png,Z02sDEkCWkQ,39,9982,香港出現首宗非洲猪瘟銷毀6千隻活
0000000084.png,Z02sDEkCWkQ,83,10005,香港出現首宗非洲猪瘟銷毀6千隻活
0000000001.png,ep2gNUpzVKA,1,10028,三局下紅機啟動攻勢長短打連轟攻下四
0000000044.png,ep2gNUpzVKA,43,10051,Moreland貢獻四分打點砲轟水手豪不留
0000000079.png,ep2gNUpzVKA,78,10074,水手四任投手壓不住紅襪五月10戰8
0000000001.png,XoOVh4JFQ2Y,1,10097,龍山國中挖校地整理路樹驚見陳年骨
0000000001.png,65JBYIqNYGA,1,10120,继昌很音7層的生對奴静电影上放进
0000000011.png,65JBYIqNYGA,10,10143,相譜醋醋醋能铝制改翻熱?
0000000092.png,65JBYIqNYGA,91,10166,终端昌鬼故音階的生當奴藉由截影片的进
0000000108.png,65JBYIqNYGA,107,10189,現譜醋醋醋能络執政耐熱
0000000134.png,65JBYIqNYGA,133,10212,龍市長議命站地問雷拉曾一
