0000000001.png,ElTTLu_7q4A,1,6992,外傘頂洲員工旅遊驚呼:怎麼那麼多垃圾
0000000024.png,ElTTLu_7q4A,23,7015,外傘頂洲員工旅遊驚呼:怎麼那麼多垃圾
0000000045.png,ElTTLu_7q4A,44,7038,外傘頂洲員工旅遊驚呼:怎麼那麼多垃圾
0000000081.png,ElTTLu_7q4A,80,7061,外傘頂洲員工旅遊驚呼:怎麼那麼多垃圾
0000000001.png,E2RW2466VAM,1,7084,線將沒收初選?卓榮泰追劇本不好啦
0000000013.png,E2RW2466VAM,12,7107,黨沒收初選「挺連任?總統:惡意的謠言
0000000027.png,E2RW2466VAM,26,7130,綠將沒收初選?卓榮泰:這劇本不好吃
0000000060.png,E2RW2466VAM,59,7153,綠重啟總統協調傳27日前蔡賴二次會
0000000084.png,E2RW2466VAM,83,7176,綠重啟總統協調傳27日前蔡賴二次會
0000000051.png,wWOgU1SDD44,50,7199,韓聲明牽動藍營士氣柯文哲:應要沉住氣
0000000092.png,wWOgU1SDD44,91,7222,白話解讀韓國瑜聲明:初就是要去選總統
0000000001.png,Hot7mhklBow,1,7245,租一樓店面不含騎樓門面接擋房客怒
0000000036.png,Hot7mhklBow,35,7268,房客控騎樓停車遭包膜房東:請勿停”
0000000057.png,Hot7mhklBow,56,7291,騎樓分租攤販惹爭議房東對方僅租店面
0000000095.png,Hot7mhklBow,94,7314,騎樓出租做生意觸法房仲合約恐無效
0000000004.png,aSbz5uP4U30,3,7337,玉女掌門人周慧敏仙氣宣布8月攻蛋
0000000019.png,aSbz5uP4U30,18,7360,周慧敏勤健身練體力跳舞成最愛橋段
0000000066.png,aSbz5uP4U30,65,7383,51歲周慧敏進攻小巨蛋老公倪震不看好
0000000092.png,aSbz5uP4U30,91,7406,玉女掌門人周慧敏仙氣宣布8月攻蛋
0000000007.png,YYkeYWOzwGE,6,7429,燒肉比拼!韓醃製肉塊PK日“軟嫩肉片
0000000032.png,YYkeYWOzwGE,31,7452,燒肉比拚!韓醃製肉塊PK日”軟嫩肉片
0000000052.png,YYkeYWOzwGE,51,7475,燒肉比拚!韓醃製肉塊PK日軟嫩肉片
0000000064.png,YYkeYWOzwGE,63,7498,比吃法!日推肉片沾醬料韓銅盤肉包生菜
0000000094.png,YYkeYWOzwGE,93,7521,比吃法日推肉片沾醬料韓銅盤肉包生菜
0000000005.png,ps5XqZ4TvzY,4,7544,周四天溫高防曬晚北台有雨
0000000018.png,ps5XqZ4TvzY,17,7567,周五一溫降自天舒適早晚稍涼
0000000034.png,ps5XqZ4TvzY,33,7590,周四宣天溫高防曬晚北台有雨
0000000072.png,ps5XqZ4TvzY,71,7613,周五六溫降自天舒適早晚稍涼
0000000088.png,ps5XqZ4TvzY,87,7636,同四合三溫高防曬晚北台有雨
0000000114.png,ps5XqZ4TvzY,113,7659,周五一溫降自天舒適早晚稍涼
0000000133.png,ps5XqZ4TvzY,132,7682,周五六天地有雨局部大雨。
0000000157.png,ps5XqZ4TvzY,156,7705,周回溫升白天熱易有午後陣雨
0000000176.png,ps5XqZ4TvzY,175,7728,周回溫产自天恩易有午後陣雨
0000000001.png,aj9m0iCi00o,1,7751,展期172天台中花博閉幕吸引逾700萬人
0000000037.png,aj9m0iCi00o,36,7774,"展期12天,台中花博閉幕吸引逾700萬人"
0000000001.png,CfzzbxQ5ZLg,1,7797,"男失業欠債跳橋尋短員警,民眾即刻救援"
0000000053.png,CfzzbxQ5ZLg,52,7820,"男失業欠債跳橋尋短員警,民眾即刻救援"
0000000001.png,srLDY0xIrYE,1,7843,"被邊緣?黨狂替韓參選解套朱,王馆中央"
0000000015.png,srLDY0xIrYE,14,7866,"被邊緣B黨狂替韓參選解套朱,王喻中央"
0000000024.png,srLDY0xIrYE,23,7889,為韓量身打造初選辦法?王噲因人設事
0000000047.png,srLDY0xIrYE,46,7912,"被邊緣黨狂替韓參選解套朱,王煊中央"
0000000076.png,srLDY0xIrYE,75,7935,"被邊緣化黨狂替韓參選解套朱,王喻中央"
0000000001.png,g3-AsS2KfWs,1,7958,林子偉擔任先發二壘手防守表現穩健
0000000034.png,g3-AsS2KfWs,33,7981,本季首支長打林子偉開啟紅襪攻勢
0000000044.png,g3-AsS2KfWs,43,8004,林子偉飛身接球先一步觸殺盜壘者
0000000063.png,g3-AsS2KfWs,62,8027,林子偉攻守好表現無奈紅襪不敵老虎
0000000001.png,oLvZl3pJz2E,1,8050,郭台銘參選總統業界支持拚經濟一定
0000000023.png,oLvZl3pJz2E,22,8073,挺商人從政王文渊:台現在拚經濟最重要
0000000032.png,oLvZl3pJz2E,31,8096,讀郭董林伯豐:企業家效率積極度一定高
0000000041.png,oLvZl3pJz2E,40,8119,郭台銘參選總統業界支持拚經濟一定贏
0000000057.png,oLvZl3pJz2E,56,8142,經濟穩定國發會:台商回流投資破1200億
0000000001.png,kkjSKRmptRY,1,8165,納郭台銘韓國瑜藍朝協調式初選”解套
0000000024.png,kkjSKRmptRY,23,8188,納郭台銘韓國瑜藍朝“協調式初選解套
0000000039.png,kkjSKRmptRY,38,8211,藍營若採協調式初選有形式為初選之名
0000000052.png,kkjSKRmptRY,51,8234,韓拒現行初選專家民粹政治的慣用伎俩
0000000063.png,kkjSKRmptRY,62,8257,納郭台銘韓國瑜藍朝協調式初選解套
0000000072.png,kkjSKRmptRY,71,8280,韓拒現行初選專家:民粹政治的慣用伎倆
0000000001.png,Kllou-ukq1o,1,8303,"心結難解!韓吐怨吳駁開槍,密室協商"
0000000033.png,Kllou-ukq1o,32,8326,攤牌聲明後下一步揭韓國瑜四條總統路
0000000041.png,Kllou-ukq1o,40,8349,"權貴密室協商意指?親韓人士,吳馬拱郭"
0000000056.png,Kllou-ukq1o,55,8372,吳韓無互信成2020絆腳石柯沉不住氣
0000000068.png,Kllou-ukq1o,67,8395,參加初選?現行“七三制競爭贏者勝出
0000000094.png,Kllou-ukq1o,93,8418,捨棄初選?黨中央協調勸退民調落後者
0000000102.png,Kllou-ukq1o,101,8441,「攤牌聲明後下一步揭韓國瑜四條總統路
0000000013.png,-XyY436qlsY,12,8464,郭台銘參選未知會韓潘恆旭:不講義氣
0000000070.png,-XyY436qlsY,69,8487,郭台銘參選未知會韓潘恆旭:不講義氣
0000000001.png,ZY6f_f_rtZw,1,8510,台鐵新系統買異級票多搭一段反而便宜
0000000015.png,ZY6f_f_rtZw,14,8533,第四代票務系統上線民眾多稱讚:很方便
0000000032.png,ZY6f_f_rtZw,31,8556,能自動分段媒合民眾買到票的機率增加
0000000045.png,ZY6f_f_rtZw,44,8579,台鐵新系統買異級票多搭一段反而便宜:
0000000005.png,eR9xfH4uh3U,4,8602,“不會因入獄放棄佔中三子被判16個月
0000000042.png,eR9xfH4uh3U,41,8625,"香港佔中案今判刑抗議,支持團體到場"
0000000064.png,eR9xfH4uh3U,63,8648,“不會因入獄放棄佔中三子被判16個月
0000000087.png,eR9xfH4uh3U,86,8671,香港佔中案今判刑發起人被判16個月
0000000001.png,NvRbx2y1jyw,1,8694,民宿熱水器裝室內15陸客一氧化碳中毒
0000000035.png,NvRbx2y1jyw,34,8717,民宿熱水器裝室內15陸客一氧化碳中毒
0000000062.png,NvRbx2y1jyw,61,8740,違法攬客民宿沒登記稽查人員開罰10萬
0000000017.png,qkWVkaYml4A,16,8763,世界賽首在台爐石4天戰舞台LED吸睛
0000000060.png,qkWVkaYml4A,59,8786,獎盼留台!16強好手雲集冠軍約770萬獎金
0000000089.png,qkWVkaYml4A,88,8809,獎盼留!16強好手雲集冠軍約770萬獎金
0000000001.png,C4l-AN9RuCw,1,8832,被爆毀前男友車寫不雅乳李珍妮駁無此事
0000000023.png,C4l-AN9RuCw,22,8855,被爆毀前男友車寫不雅!李珍妮駁無此事
0000000038.png,C4l-AN9RuCw,37,8878,衣架大王陳友亮擬髮新歡李疑怒毀車
0000000063.png,C4l-AN9RuCw,62,8901,衣架大王陳友亮擬娶新歡!李疑怒毀車
0000000013.png,An1AvV6U8-U,12,8924,林宥嘉走遠蟬聯冠軍郁可唯MV點閱200萬
0000000036.png,An1AvV6U8-U,35,8947,林宥嘉走彈聯冠軍郁可唯MV點閱200萬
0000000063.png,An1AvV6U8-U,62,8970,與惡歌曲林宥嘉郁可唯為戲量身打造
0000000079.png,An1AvV6U8-U,78,8993,"「與悲歌曲林宥嘉,郁可唯為戲量身打造"
0000000092.png,An1AvV6U8-U,91,9016,“與惡”登日媒讚華劇良心豆瓣IMDB高分
