0000000001.png,qn7xOCte_lc,1,0,滿宋楚瑜喊一國兩制?黃珊珊辭黨贈
0000000013.png,qn7xOCte_lc,12,23,"雲題誤導,李鴻鈞宋主席沒說一國"
0000000055.png,qn7xOCte_lc,54,46,標題誤導!李鸿钧宋主席沒說一國兩制
0000000006.png,1S0CcAyG_w8,5,69,帶作業遭連續狠蹈男童母控補習班體罰
0000000024.png,1S0CcAyG_w8,23,92,"帶作業遭連續張開,靈母控補習班體"
0000000058.png,1S0CcAyG_w8,57,115,帶作業遭連續張開男童母控補習班體罰
0000000001.png,RHQ_3zmk314,1,138,峇里島騎水上摩托車女被載到孤島猥亵
0000000026.png,RHQ_3zmk314,25,161,峇里島騎水上摩托車女被載到孤島携葛
0000000001.png,11pW9qux2Iw,1,184,妻命案子等鹰電話返家驚見陳屍屋內
0000000029.png,11pW9qux2Iw,28,207,倒臥室妻死队房脖子疑有勒痕初判他殺
0000000057.png,11pW9qux2Iw,56,230,"鎖未破壞,夫妻證件全遺失恐熟人下手"
0000000032.png,VkCwjrVp9C0,31,253,一加歌友會被騙匯買點支付消費攤免錢
0000000049.png,VkCwjrVp9C0,48,276,生痛消費中市接獲12起疑似投資Q點詐騙
0000000092.png,VkCwjrVp9C0,91,299,吾痛消費中市接獲1起疑似投資Q點評
0000000003.png,MzXmlAn6fCQ,2,322,境隨俗參拜宮廟豐握護身符過香烟
0000000050.png,MzXmlAn6fCQ,49,345,日合拍片赴官取景妻夫木聰讀華麗
0000000081.png,MzXmlAn6fCQ,80,368,和新時代來臨張震東道主請妻夫木聰吃飯
0000000015.png,8hXeH6FDDjA,14,391,身分曝光逃逸移工遇警盤查拔腿狂奔
0000000043.png,8hXeH6FDDjA,42,414,檢變追逐戰兩逃逸移工見警拔腿狂奔
0000000078.png,8hXeH6FDDjA,77,437,可移工簽證皆逾期解送移民署遣返
0000000001.png,FmUjB2MYD-A,1,460,品加工廠偷排無所遁形里民蒐證狱
0000000029.png,FmUjB2MYD-A,28,483,爐噴油嘴故障食品加工廠排黑煙罰10萬
0000000052.png,FmUjB2MYD-A,51,506,民當環保小監兵錄影蒐證抓偷排工廠
0000000079.png,FmUjB2MYD-A,78,529,年1至4月中前207件開罰金額2517萬
0000000008.png,EC1QwpVfpow,7,552,要征服宇宙?柯文哲笑:他是看哪本漫畫
0000000025.png,EC1QwpVfpow,24,575,“四不一被動網KUSO就是想”被徵召
0000000084.png,EC1QwpVfpow,83,598,聲明線酸想黃袍加身藍護航”是民意
0000000010.png,xgTlbuipcIM,9,621,千人!環保局工會近百人抗議籲柯P捕入
0000000026.png,xgTlbuipcIM,25,644,千人!環保局工會近百人抗議籲柯P補人
0000000082.png,xgTlbuipcIM,81,667,缺人加護工會衛福部抗議提3大訴求
0000000001.png,ctKbpnbOUjM,1,690,二泉仁遭爆另結新歡棄麻衣想3度結婚
0000000021.png,ctKbpnbOUjM,20,713,出小三為韓國空姐逼婚王泉仁談不攏
0000000064.png,ctKbpnbOUjM,63,736,不甩老公王泉仁情欲麻衣有子萬事足
0000000010.png,WDjeFUIoCeI,9,759,青攤摸胸接告光學總經理遭判刑4個月
0000000027.png,WDjeFUIoCeI,26,782,攤摸胸接告光學總經理遭判刑4個月
0000000042.png,WDjeFUIoCeI,41,805,沒有到案否認性騷法官斥毫無反省
0000000072.png,WDjeFUIoCeI,71,828,酒續擴KTV總經理伺機摸診所職員胸
0000000007.png,Pz2g0a-uh9c,6,851,loutlet比台便宜”蔡阿嘎:衣單價<100元
0000000027.png,Pz2g0a-uh9c,26,874,Joutlet比台便宜”蔡阿嘎衣單價<100元
0000000066.png,Pz2g0a-uh9c,65,897,是眾批台outlet難買專櫃定價比日貴1成
0000000094.png,Pz2g0a-uh9c,93,920,三班台outlet難買專櫃定價比日貴1成
0000000001.png,E78_JAC3AvA,1,943,号版奈奈?投資講師王派宏疑捲20億失聯
0000000027.png,E78_JAC3AvA,26,966,吹黃金磨粉轉賣印度年報酬率20%86%
0000000074.png,E78_JAC3AvA,73,989,二千人捧錢投資本金未拿回找鹰王派宏
0000000001.png,LkGDsF3fNwM,1,1012,死人轎車佔用地院停車場還貼女鬼頭
0000000019.png,lbBBcXQsF8k,18,1035,二旬夫婦遭勒頸亡疑親戚談判糾紛惹殺機
0000000044.png,lbBBcXQsF8k,43,1058,下毒手扶妻遭勒頸亡疑伊拉克女婿犯案逃逸
0000000001.png,bTbhBPLnPJk,1,1081,同課寫暢銷書王派宏旗下會員曾逾3萬
0000000043.png,bTbhBPLnPJk,42,1104,老師失聯3天會員:只是出國散心速回
0000000071.png,bTbhBPLnPJk,70,1127,"老師失聯3天顧盼,只是出國散心速回"
0000000001.png,XOMtE485Nmw,1,1150,三義慕台達電員工分紅年薪上看28個月
0000000001.png,jWaLDw6Foh4,1,1173,案重審?瑞士催辦洗錢帳戶密西法部
0000000083.png,jWaLDw6Foh4,82,1196,告士來函問扁案進度陳致中:打臉特偵組
0000000001.png,uQ5hM8ezv8E,1,1219,日輪椅特教生竟稱重聚建中生玩笑惹議
0000000019.png,uQ5hM8ezv8E,18,1242,日輪椅特教生竟稱重聚建中生玩笑惹議
0000000050.png,uQ5hM8ezv8E,49,1265,日輪椅特教生竟稱車影建中生玩笑惹議
0000000008.png,1fIDl4Atc48,7,1288,劇阿斯達下月播宋仲基脱衣解放秀胸
0000000026.png,1fIDl4Atc48,25,1311,全智媛宋仲基太陽的後裔二度合作
0000000047.png,1fIDl4Atc48,46,1334,智媛宋仲基飾演德人因種族威脅被迫分開
0000000076.png,1fIDl4Atc48,75,1357,"智媛波浪長髮曝光張東健,宋仲基身机"
0000000014.png,8Xvz_k1ypS8,13,1380,國瑜微表國民黨7月初推總統候選人
0000000040.png,8Xvz_k1ypS8,39,1403,「國瑜微表態」國民黨7月初推總統候選人
0000000074.png,8Xvz_k1ypS8,73,1426,掌國瑜微表態」國民黨7月初推總統候選人
0000000003.png,IpuadoCCFFo,2,1449,三服違規充電被抓包!虎航調查將懲處
0000000019.png,IpuadoCCFFo,18,1472,三服違規充電被抓虎航調查將懲處
0000000040.png,IpuadoCCFFo,39,1495,李託運得隨國籍航空另定充電規則
0000000001.png,0RFtARxNFms,1,1518,"豪雨慘淹水馬路成滑水道,黃泥水流量"
0000000030.png,0RFtARxNFms,29,1541,晨雨大淹小腿居民参算當鏟子教家具
0000000066.png,0RFtARxNFms,65,1564,"豪雨慘淹水馬路成滑水道,黃泥水流量"
0000000075.png,0RFtARxNFms,74,1587,機排水管漏水2航廈出境大廳溼答答
0000000011.png,YZ1IydMAEKQ,10,1610,下雨天視線差黑衣路人穿越馬路被撞彈飛
0000000043.png,YZ1IydMAEKQ,42,1633,重將視線完全沒看到路人被撞全身傷
0000000001.png,tqYvhltFVAY,1,1656,郭台銘將赴美協商鴻海威州投資案
0000000037.png,tqYvhltFVAY,36,1679,郭台銘訪美是否和川普會面受矚目
0000000047.png,tqYvhltFVAY,46,1702,萬海威州投資案恐跳票?州長重啟協商中
0000000078.png,tqYvhltFVAY,77,1725,||普威州造勢活動未提鴻海恐是警訊
0000000001.png,EPMylo-Jego,1,1748,新日皇德仁即位日本街頭掛出祝賀布條
0000000043.png,EPMylo-Jego,42,1771,各大報頭版頭條報導德仁即位日皇
0000000073.png,EPMylo-Jego,72,1794,惠仁今天即位開啟日本令和新時代
0000000001.png,wKJ5B8-iysA,1,1817,三腳防滑!家長控親子餐廳要童穿襪玩害摔
0000000022.png,wKJ5B8-iysA,21,1840,三腳防滑!家長控親子餐廳要童穿機玩害
0000000058.png,wKJ5B8-iysA,57,1863,"也较多,穿後不防滑地材商要看材質,粗粒"
0000000077.png,wKJ5B8-iysA,76,1886,"也较多,穿後不防滑地材商要看材質,粗粒"
0000000001.png,HGwyEQsIlbA,1,1909,單車男閃臨停車擦撞後車遭公車撞死
0000000046.png,HGwyEQsIlbA,45,1932,單車男閃臨停車擦撞後車遭公車撞死
0000000059.png,HGwyEQsIlbA,58,1955,死亡哈男騎單車擦撞偏向遭公車撞
0000000005.png,4ANqBvYdQK8,4,1978,雨雨來了!台中彰化現正暴雨外出注意
0000000078.png,4ANqBvYdQK8,77,2001,三鋒面過各地雨注意雷擊瞬間大雨
0000000104.png,4ANqBvYdQK8,103,2024,全面帶上對流發展強注意短時強降雨
0000000137.png,4ANqBvYdQK8,136,2047,顯降北市降幅達1度北台早晚偏涼
0000000165.png,4ANqBvYdQK8,164,2070,周四鋒面南移仍不穩各地雨局部大雨
0000000178.png,4ANqBvYdQK8,177,2093,五六東台局部雨西部午後局部雷雨
0000000191.png,4ANqBvYdQK8,190,2116,目另波鋒面接近下周一起雨再增多
0000000001.png,fgu1yTOD55o,1,2139,新北輔具特約三合一計畫提升服務品質
0000000028.png,fgu1yTOD55o,27,2162,新北輔具特約三合一計畫提升服務品質
0000000052.png,fgu1yTOD55o,51,2185,575家特約廠商代勞簡化民眾申請流程
0000000001.png,bqmP6SbiHuU,1,2208,章國瑜尊重就吴還增設要有非我不可氣憤
0000000024.png,bqmP6SbiHuU,23,2231,本土社團齊聚通過總統初選排除成見支援
0000000087.png,bqmP6SbiHuU,86,2254,章國瑜尊重說吳酸要有非我不可氣憤
0000000001.png,NZU-R18Eu0k,1,2277,非周年慶台鐵新APP難分退票塘爆櫃台
0000000040.png,NZU-R18Eu0k,39,2300,售票員怨得教育民眾新系統台鐵逐步改善
0000000067.png,NZU-R18Eu0k,66,2323,售票員怨得教育民眾新系統台鐵逐步改善
0000000028.png,nWNUDWwcXl8,27,2346,"章,郭,朱首交鋒各談政見像選前辯論會"
0000000074.png,nWNUDWwcXl8,73,2369,同框為經濟把脈藍營天王上台先互
0000000118.png,nWNUDWwcXl8,117,2392,2020國民黨初選怎解?韓國瑜靜觀其變
0000000006.png,ApEIZwLEZr4,5,2415,「請回份按实的淫营主管的安排宣布施耐象逢》
0000000021.png,ApEIZwLEZr4,20,2438,「續回合就參加同程管护理管舞的見證给水2不爽
0000000001.png,QUMqPYA3GDs,1,2461,章聲明預留伏筆被動參選?藍綠各解讀
0000000034.png,QUMqPYA3GDs,33,2484,北韓換湯不換藥吳子嘉:他要黃袍加身
0000000063.png,QUMqPYA3GDs,62,2507,新聲明」抵韓派振奮王世堅批精髓消
0000000084.png,QUMqPYA3GDs,83,2530,新聲明!挺韓派振奮王世堅批精髓消失
0000000105.png,QUMqPYA3GDs,104,2553,點聲明留伏筆律師親算是不主動外遇
0000000001.png,ubBPfCsqG1M,1,2576,名人賣水餃第二名顏清標只輸白冰冰
0000000050.png,ubBPfCsqG1M,49,2599,名人賣水餃第二名顏清標只輸白冰冰
0000000005.png,GpjIExz_p8Q,4,2622,一般玻璃0.3公分不抗震一受力就破碎
0000000013.png,GpjIExz_p8Q,12,2645,"皮璃窗怎麼抗震?專家:材質,厚度是關鍵"
0000000036.png,GpjIExz_p8Q,35,2668,"皮璃窗怎麼抗震?專家材質,厚度是關鍵"
0000000083.png,GpjIExz_p8Q,82,2691,綠能耐震玻璃不只會發電還能防爆裂
0000000105.png,GpjIExz_p8Q,104,2714,"皮璃窗怎麼抗震?專家:材質,厚度是關鍵"
0000000129.png,GpjIExz_p8Q,128,2737,cow-E玻璃隔熱防噪搭配制震壁更耐
0000000165.png,GpjIExz_p8Q,164,2760,Low-E玻璃隔熱防噪搭配制震壁更耐震
0000000201.png,GpjIExz_p8Q,200,2783,制震壁阻尼器防震建築物安全係數高
0000000001.png,uBNrOYY5U5k,1,2806,50年以上屋齡危老建物屋主盼重建
0000000013.png,uBNrOYY5U5k,12,2829,50年以上屋齡危老建物屋主盼重建
0000000071.png,uBNrOYY5U5k,70,2852,北市30年建物占86%726件可申請重建
0000000101.png,uBNrOYY5U5k,100,2875,大規模地震易章長週期速度脈衝
0000000139.png,uBNrOYY5U5k,138,2898,全台重建計畫進行中6縣市進度
0000000156.png,uBNrOYY5U5k,155,2921,全台重建計畫進行中6縣市進度G
0000000215.png,uBNrOYY5U5k,214,2944,公眾使用建築物用途係數須更高
0000000235.png,uBNrOYY5U5k,234,2967,公眾使用建築物用途係數須更高
0000000065.png,0-tdB75RTVg,64,2990,從適肉飯到四千萬吳韓關係微妙
0000000146.png,0-tdB75RTVg,145,3013,吳韓會解僵局?初選技術問題是關鍵
0000000192.png,0-tdB75RTVg,191,3036,吳韓會解僵局?初選技術問題是關鍵
0000000001.png,HxTJdsfh7iE,1,3059,掌握行政資源跑全台蔡英文初選人氣升
0000000026.png,HxTJdsfh7iE,25,3082,保障現任是不智之舉警界連署挺賴清德
0000000061.png,HxTJdsfh7iE,60,3105,延後初選基層焦慮演現綠委:快定調
0000000092.png,HxTJdsfh7iE,91,3128,竟鬼藏細節民調執行方法影響初選結果
0000000156.png,HxTJdsfh7iE,155,3151,賴清德初選走佛系打法蔡拉近部分民調
0000000014.png,ndcPxq0Tbxs,13,3174,吴韓會黨中央登場接韓人士籲韓選總統
0000000025.png,ndcPxq0Tbxs,24,3197,吳韓會登場!「麻煩製造者」抵黨中央
0000000048.png,ndcPxq0Tbxs,47,3220,。吳韓會登場!「麻煩製造者」抵黨中央
0000000219.png,ndcPxq0Tbxs,218,3243,國民黨不內鬥齊喊團結
0000000261.png,ndcPxq0Tbxs,260,3266,"「會-論壇,國民黨不內鬥齊喊團結"
0000000310.png,ndcPxq0Tbxs,309,3289,"「一會論壇,國民黨不內鬥齊喊團結"
0000000001.png,ADuhUcTR7as,1,3312,又是酒駕釀禍從後方高速衝撞停等紅燈轎車
0000000020.png,ADuhUcTR7as,19,3335,停等紅燈被酒駕車輛追撞噴到30公尺外
0000000041.png,ADuhUcTR7as,40,3358,酒後開車高速衝撞前方轎車害人害己
0000000068.png,ADuhUcTR7as,67,3381,從後撞擊停等紅軍辅酒測值0.93毫克
0000000001.png,Q55Hq_xt554,1,3404,日天皇交棒”平成”落幕歷史一刻全記錄
0000000028.png,Q55Hq_xt554,27,3427,三神器象徵奉還皇位”明仁天皇重任
0000000086.png,Q55Hq_xt554,85,3450,明仁化身護花使者扶著美智子下台階
0000000102.png,Q55Hq_xt554,101,3473,"爱民親民,開放明仁開創日皇新典範"
0000000118.png,Q55Hq_xt554,117,3496,雅子”被止步”登基禮紐時:有損國際形象
0000000144.png,Q55Hq_xt554,143,3519,日天皇交棒”平成落幕歷史一刻全記錄
0000000001.png,vh31ZERySw4,1,3542,德仁伉儷揮手致意TVBS第一時間直擊
0000000018.png,vh31ZERySw4,17,3565,確保儀式安全無虞日本陸空防衛嚴密
0000000027.png,vh31ZERySw4,26,3588,TVBS全天候觀察日皇退位實時報導
0000000069.png,vh31ZERySw4,68,3611,日皇退位大典相隔20年再度舉行
0000000124.png,vh31ZERySw4,123,3634,五月一日德仁繼位日本迎來“令和時代
0000000001.png,xMIxj8B8KIk,1,3657,一路端!車後照鏡遭毁警逮挪威籍男模
0000000031.png,xMIxj8B8KIk,30,3680,一路開車後照鏡遭毁警逮挪威籍男模
0000000051.png,xMIxj8B8KIk,50,3703,喝到斷片通告男模喝茫沿路亂端2
0000000001.png,l4KZZ1DdZPQ,1,3726,5/27-5-31綠初選民調英粉要求手機民調
0000000020.png,l4KZZ1DdZPQ,19,3749,綠總統初選日程5/1日中常會討論拍板
0000000028.png,l4KZZ1DdZPQ,27,3772,初選政見發表5/24-5/26間舉辦1至2场
0000000037.png,l4KZZ1DdZPQ,36,3795,民進黨總統初選中執會估6/5公告提名
0000000047.png,l4KZZ1DdZPQ,46,3818,5/27-5-31綠初選民調英粉要求手機民調
0000000056.png,l4KZZ1DdZPQ,55,3841,採對比式民調英系立委:反應真實民意
0000000001.png,_pdnTn6uTtw,1,3864,吳韓會30分黨務人士:確認韓被動意願
0000000011.png,_pdnTn6uTtw,10,3887,吳韓會四共識”感謝吳敦義普提名參選
0000000024.png,_pdnTn6uTtw,23,3910,肩負市民期待不參加初選”韓尊重黨安排
0000000033.png,_pdnTn6uTtw,32,3933,肩負高雄市民期待”韓國瑜無法參加初通
0000000018.png,N-dErKDpGsw,17,3956,藍太陽首聚!馬邀郭算朱對談聚焦經濟
0000000040.png,N-dErKDpGsw,39,3979,藍太陽首聚!馬邀郭韓朱對談聚焦經濟
0000000098.png,N-dErKDpGsw,97,4002,提名须因人設事王金平證實周四吳王會
0000000008.png,i7sGNg07W84,7,4025,表面上吳韓兩位相敬如賓
0000000024.png,i7sGNg07W84,23,4048,而且韓國瑜表面上談笑風生
0000000065.png,i7sGNg07W84,64,4071,所以事實上今天可能不是結束
0000000001.png,CAHlFP5V7_Y,1,4094,馬英九經濟圓桌論壇郭韓朱同框受目
0000000016.png,CAHlFP5V7_Y,15,4117,馬英九辦圓桌論壇韓同台郭朱談經濟
0000000037.png,CAHlFP5V7_Y,36,4140,政治需替經濟服務郭需要千千萬萬個輯
0000000047.png,CAHlFP5V7_Y,46,4163,不能單看科技經濟”朱要拚全民經濟
0000000055.png,CAHlFP5V7_Y,54,4186,金字塔該倒過來“韓官員不該高高在上
0000000001.png,qv77kb0ro3s,1,4209,選前批吳選後酸馬韓國瑜抛愛與包容
0000000015.png,qv77kb0ro3s,14,4232,韓流成雙面刃外界放大鏡般檢視言行
0000000026.png,qv77kb0ro3s,25,4255,選前批吳選後酸馬韓國瑜拋愛與包容
0000000036.png,qv77kb0ro3s,35,4278,親痛仇快?對外包容韓對自己人苛刻
0000000053.png,qv77kb0ro3s,52,4301,暗酸韓?柯:募款太多蟑螂老鼠也很多
0000000063.png,qv77kb0ro3s,62,4324,募款說暗諷韓?柯笑:他用的不只那些
0000000031.png,9r7rIcFVkq8,30,4347,"請回的高雄人的信,注初產物新英莲心甘情願"
0000000040.png,9r7rIcFVkq8,39,4370,-韓國给后自高雄人的洛法初莲抽動长连心甘情劇
0000000071.png,9r7rIcFVkq8,70,4393,該回炉后自言在人期待無法運動条理清圖2
0000000086.png,9r7rIcFVkq8,85,4416,甜回的目自言性人即告無法初莲被新來避自信爾
0000000094.png,9r7rIcFVkq8,93,4439,請回的自高雄人期待無法初莲湖新參選而出情願
0000000042.png,hcFCN_A60vw,41,4462,鼓团份無法參加初選酋雷當的宝现言布施財染選)
0000000005.png,tlk6e-kUdrk,4,4485,體同份額招到近9成声並打動民加的體店狂潮2
0000000044.png,tlk6e-kUdrk,43,4508,韓國给小額近四成事強打新年前价钱法狂潮司
0000000055.png,tlk6e-kUdrk,54,4531,三趙國小冠指成南亞郎打新民心转活江湖?
0000000072.png,tlk6e-kUdrk,71,4554,-水层搭档会出恐書庫始得住吗?
0000000117.png,tlk6e-kUdrk,116,4577,-待到复议。上一個路口發10章太
0000000095.png,1msGRkAwbUA,94,4600,別平成Sony新機械智慧錶挖掘競爭新動能
0000000109.png,1msGRkAwbUA,108,4623,速實現創新Sony智慧錶體現未來競爭
0000000134.png,1msGRkAwbUA,133,4646,ony智慧錶一公釐關鍵零件來自京瓷
0000000145.png,1msGRkAwbUA,144,4669,ony智慧錶一公釐關鍵零件來自京瓷
0000000160.png,1msGRkAwbUA,159,4692,業結合日本新一代商品發展新趨勢
0000000189.png,1msGRkAwbUA,188,4715,新家電掀平成旋風烤土司神器靠口碑熱銷
0000000210.png,1msGRkAwbUA,209,4738,銷50萬台蒸氣烤土司機平成難忘商品
0000000234.png,1msGRkAwbUA,233,4761,創企業年營收NT.28億目標提高海外銷售
0000000260.png,1msGRkAwbUA,259,4784,本薄型電視困境全球市佔4成掉剩1成
0000000280.png,1msGRkAwbUA,279,4807,海收購日本夏普平成家電萎縮一記驚嘆號!
0000000292.png,1msGRkAwbUA,291,4830,韓夾殺平成年代日本家電生死關頭
0000000311.png,1msGRkAwbUA,310,4853,普董事會平成年危機糾結接受鴻海收購
0000000339.png,1msGRkAwbUA,338,4876,棄平成年閉門造車日本產業迎向新時代
0000000022.png,QvzCfDuZj80,21,4899,真沒心結?吳見韓國瑜立刻喊“兄弟”
0000000046.png,QvzCfDuZj80,45,4922,韓”男人抱抱很怪笑喊韓:你是小男人
0000000066.png,QvzCfDuZj80,65,4945,韓”男人抱抱很怪笑喊韓:你是小男人
0000000001.png,R5byQxTqHT0,1,4968,超跑車商兼賽車手涉暴力討債不服反告
0000000035.png,R5byQxTqHT0,34,4991,超跑車商兼賽車手涉暴力討債他不服反告
0000000086.png,R5byQxTqHT0,85,5014,駁斥暴力討債超跑車商反控:原告誣告
0000000001.png,YOV0MQOasOg,1,5037,人?要找車位沒人理惱羞據員工出氣
0000000024.png,YOV0MQOasOg,23,5060,人吻”?要找車位沒人理惱羞據員工出氣。
0000000034.png,YOV0MQOasOg,33,5083,「當我隱形人不回老闆弟訊息惨遭打傷
0000000058.png,YOV0MQOasOg,57,5106,沒回訊息遭扣薪記警告雇主恐違勞基法
0000000091.png,YOV0MQOasOg,90,5129,人咧?要找車位沒人理惱羞據員工出氣
0000000005.png,-9Jq9WdDxPM,4,5152,田馥甄正式辦了華研!簽約何樂宣佈5專2巡
0000000021.png,-9Jq9WdDxPM,20,5175,田馥甄正式辦了華研簽約何樂宣佈5萬2
0000000043.png,-9Jq9WdDxPM,42,5198,"SHE18週年合體?田馥甄不說死,充滿展望"
0000000062.png,-9Jq9WdDxPM,61,5221,「離島遭下架?田馥甄本是平台獨家版權
0000000097.png,-9Jq9WdDxPM,96,5244,「離島遭下架?田馥甄本是平台獨家版權
0000000036.png,9Xp7CJgNhDU,35,5267,巴格達迪現!對蒙面聖戰士發號施令
0000000068.png,9Xp7CJgNhDU,67,5290,"3分鐘影片AK-47步槍,全身軍服顯強勢"
0000000077.png,9Xp7CJgNhDU,76,5313,彈客背心同時入鏡暗喻鼓動追隨起義
0000000111.png,9Xp7CJgNhDU,110,5336,里蘭卡恐攻案巴格達迪:為弟兄復仇
0000000123.png,9Xp7CJgNhDU,122,5359,"「畫面說話!遞報告,發命令秀領袖風範"
0000000150.png,9Xp7CJgNhDU,149,5382,球2014起通緝IS首腦開7億NT懸賞金
0000000163.png,9Xp7CJgNhDU,162,5405,免多窟IS首領巴格達迪總能全身而退
0000000172.png,9Xp7CJgNhDU,171,5428,于殊儀器屏蔽現身前小鎮手機訊號遭阻
0000000196.png,9Xp7CJgNhDU,195,5451,格達迪搖電子通訊美軍情報單位苦追
0000000211.png,9Xp7CJgNhDU,210,5474,透美國!加州退伍軍人策恐攻:效忠IS
0000000225.png,9Xp7CJgNhDU,224,5497,31安排網路線民交付假炸彈順利逮人
0000000253.png,9Xp7CJgNhDU,252,5520,過七萬名聖戰士遺孀孤兒敘利亞監禁
0000000263.png,9Xp7CJgNhDU,262,5543,漏不知何去從收容營惡劣環境算童命
0000000293.png,9Xp7CJgNhDU,292,5566,轉型組虛擬哈里發”恐更加難以預測
0000000304.png,9Xp7CJgNhDU,303,5589,效蓋達組織網路散播深化信念影響大
0000000327.png,9Xp7CJgNhDU,326,5612,度現身稱末日審判”IS首腦:展開復仇
0000000013.png,n5CiaQVvvrA,12,5635,傳郭董將交棒!徐旭東:他犧牲自己出來
0000000042.png,n5CiaQVvvrA,41,5658,傳郭董將交棒!徐旭東:他犧牲自己出來
0000000073.png,n5CiaQVvvrA,72,5681,商人總統?郭董角逐大位鄭崇華:有利有弊
0000000088.png,n5CiaQVvvrA,87,5704,商人總統?郭董角逐大位鄭崇華:有利有弊
0000000005.png,QyL5Jxs7yrc,4,5727,試管雙胞胎早產仍保1嬰機率萬分之一
0000000022.png,QyL5Jxs7yrc,21,5750,試管雙胞胎早產仍保嬰機率萬分之一
0000000054.png,QyL5Jxs7yrc,53,5773,幸運懷異卵雙胞胎暗帶塞回母體救1命
0000000079.png,QyL5Jxs7yrc,78,5796,幸運懷異卵雙胞胎臂帶塞回母體救命
0000000001.png,79zcB6Um5h4,1,5819,"點燃市場戰火!跑車品牌增代理,改款上陣"
0000000034.png,79zcB6Um5h4,33,5842,"點燃市場戰火!跑車品牌增代理,改款上陣"
0000000053.png,79zcB6Um5h4,52,5865,德日商互別苗頭經典改款pk全手工打造
0000000008.png,53k3q1eUiz0,7,5888,有人拿刀棍可幫員工指控老闆弟動手
0000000044.png,53k3q1eUiz0,43,5911,有人拿刀棍則指控老闆弟動手
0000000057.png,53k3q1eUiz0,56,5934,訊息已讀不回車行拉下鐵門員工接接
0000000070.png,53k3q1eUiz0,69,5957,訊息已讀不回車行拉下鐵門員工接接
0000000088.png,53k3q1eUiz0,87,5980,車行變是非地胸口挫傷員工請辭提告
0000000069.png,wAl5lVCcKVo,68,6003,韓郭朱難得同框客談政見像選前辯論會
0000000109.png,wAl5lVCcKVo,108,6026,體部朱難得同框各說政見像選前辯論會
0000000079.png,ZFfhT6ftoDw,78,6049,北下午四點天皇退位三百人觀禮
0000000094.png,ZFfhT6ftoDw,93,6072,年平成重擔一肩扛明仁天皇已卸下
0000000105.png,ZFfhT6ftoDw,104,6095,令惡題為惡皇的眼窝
0000000113.png,ZFfhT6ftoDw,112,6118,對我成為象徵的回园
0000000124.png,ZFfhT6ftoDw,123,6141,仁最後講話1分半鐘滿感謝祝福令和年
0000000133.png,ZFfhT6ftoDw,132,6164,後談話經內閣會議通過隻字未提繼承
0000000161.png,ZFfhT6ftoDw,160,6187,2分鐘退位禮象徵平成圓滿句點
0000000184.png,ZFfhT6ftoDw,183,6210,「殷迴廊先現身拜禮言:御告文歷時1小時
0000000241.png,ZFfhT6ftoDw,240,6233,京鐵塔大神宮發參拜證明最後紀念照
0000000254.png,ZFfhT6ftoDw,253,6256,成最後一天御朱印”大阪住吉大社人滿
0000000269.png,ZFfhT6ftoDw,268,6279,地搭橋平成到令和過橋跨入新時代
0000000295.png,ZFfhT6ftoDw,294,6302,種紀念平成迎接令和全日本不一而足
0000000314.png,ZFfhT6ftoDw,313,6325,"價31萬珠寶搭“平成31年""優惠價賣出"
0000000324.png,ZFfhT6ftoDw,323,6348,壽司吞燒肉分居平成最後晚餐-二選項
0000000355.png,ZFfhT6ftoDw,354,6371,有天皇駕崩哀傷更添期待新年號盼望
0000000367.png,ZFfhT6ftoDw,366,6394,仁退位成上皇德仁繼位成第126位天皇
0000000001.png,0Z3FrYN1AHU,1,6417,都韓國歐巴哈設賭博網洗錢金流達6價
0000000049.png,0Z3FrYN1AHU,48,6440,來台租”睛博機房6千韓會員跨國簽朋
0000000080.png,0Z3FrYN1AHU,79,6463,無司法互助台賭博罪易輕判逃韓國追究
0000000001.png,zZlvVUaHFfw,1,6486,警追查可疑男專挑學生隨機攔人要錢
0000000018.png,zZlvVUaHFfw,17,6509,屏東男子稱急用隨機將學生攔下借鲜
0000000038.png,zZlvVUaHFfw,37,6532,營追查可疑男專挑學生隨機攔入要转
0000000068.png,zZlvVUaHFfw,67,6555,男子形跡詭異家長PO文提醒注意
0000000084.png,zZlvVUaHFfw,83,6578,屏東男子稱急用隨機將學生攔下
0000000110.png,zZlvVUaHFfw,109,6601,男子形跡詭異家長PO文提醒注意安全
0000000016.png,8Mmj8ArLzmA,15,6624,吳韓會後聲明四不一被動”韓表參選意原
0000000062.png,8Mmj8ArLzmA,61,6647,吳韓會後聲明四不一被動”韓表參選意原
0000000011.png,HyM55lYk314,10,6670,恐怖面具嚇童師判免罰家長憂無法管
0000000030.png,HyM55lYk314,29,6693,「恐怖面具晰童師判免罰家長憂無法管
0000000087.png,HyM55lYk314,86,6716,面具嚇童無法可管會局不排除再上司
0000000001.png,amdkK2kHmk4,1,6739,"產婦胎盤滯留未發現,院方反控瞞病情"
0000000024.png,amdkK2kHmk4,23,6762,產婦胎盤滯留未發現
0000000048.png,amdkK2kHmk4,47,6785,產婦控胎盤滯留未發現院方
0000000067.png,amdkK2kHmk4,66,6808,"產婦胎盤滯留未發現,院方反控歸病"
0000000089.png,amdkK2kHmk4,88,6831,"產婦胎盤滯留未發現,院方反控瞞病情"
0000000001.png,tRpbIAqbmR0,1,6854,"光腳防滑,家長控親子餐廳要童穿機玩害"
0000000041.png,tRpbIAqbmR0,40,6877,"地较多穿機不防滑,地材商要看材質相若"
0000000061.png,tRpbIAqbmR0,60,6900,"地较多,穿襪不防滑,地材商要看材質,相"
0000000094.png,tRpbIAqbmR0,93,6923,"地较多,穿襪不防滑地材商要看材質,粗料"
0000000001.png,ktDsyg2oiS4,1,6946,“幫我擋一下!肇事駕駛跑了叫乘客頂看
0000000027.png,ktDsyg2oiS4,26,6969,"“我還""肇事駕駛跑了叫乘客頂看"
0000000051.png,ktDsyg2oiS4,50,6992,無照偷騎車遭撞!16歲少年騎士拒警介》
0000000071.png,ktDsyg2oiS4,70,7015,車禍和解不限當事人警人溜不算肇
0000000001.png,bMfKMmdrvQ0,1,7038,女友不肯見面!男持榔頭砸南山通訊區
