0000000003.png,dgogr9O0lUE,2,7080,家長控師霸凌學生辱罵教唆端人卻沒事!?
0000000051.png,dgogr9O0lUE,50,7104,"有人先幫我踢他好嗎?”老師竟教唆學生器人,"
0000000086.png,dgogr9O0lUE,85,7128,家長指控學校開三次協調會只承諾派人觀課
0000000127.png,dgogr9O0lUE,126,7152,防堵老師霸凌人本基金會:羞辱學生要納入解聘
0000000004.png,9fW28ORZ0Sg,3,7176,伯享生技將過期奶精分裝後賣到市面
0000000047.png,9fW28ORZ0Sg,46,7200,太黑心過期近1年奶精被分裝流入市面
0000000085.png,9fW28ORZ0Sg,84,7224,過期奶精電改效期1萬6千餘公斤流入市面
0000000101.png,9fW28ORZ0Sg,100,7248,伯享生技宣改過期奶精效期31品項下架回收
0000000117.png,9fW28ORZ0Sg,116,7272,伯享生技育改過期奶精效期31品項下架回收
0000000129.png,9fW28ORZ0Sg,128,7296,伯享改過期奶精效期1萬6千公斤製成商品
0000000029.png,hEKYM-ziiKg,28,7320,客家桐花季開幕蔡總統獻花獻果
0000000044.png,hEKYM-ziiKg,43,7344,「拉近民眾距離蔡總統流利客語問候
0000000062.png,hEKYM-ziiKg,61,7368,桐花季演大批人潮日本觀光客也來朝聖
0000000104.png,hEKYM-ziiKg,103,7392,2019桐花季開幕謝天敬地祭祀邀請入客庄
0000000003.png,y8O8I8LDF0I,2,7416,樹林焚化廠工安意外員工捲入引風機慘死
0000000036.png,y8O8I8LDF0I,35,7440,樹林焚化廠工安意外員工捲入引風機慘死
0000000060.png,y8O8I8LDF0I,59,7464,焚化廠年度維修釀工安員工捲入引風機慘死
0000000098.png,y8O8I8LDF0I,97,7488,疑外包廠員工誤觸啟動鍵詳細原因待調查
0000000002.png,tQtIflt4UFU,1,7512,明明斷電了!工人被捲入焚化廠引風機慘死
0000000027.png,tQtIflt4UFU,26,7536,焚化廠引風機歲修工人遭捲入引風機慘死
0000000044.png,tQtIflt4UFU,43,7560,明明斷電了!為何引風機突然啟動?
0000000087.png,tQtIflt4UFU,86,7584,引風機作用將焚燒廢氣集中吸到煙离再排除
0000000123.png,tQtIflt4UFU,122,7608,維修經驗20年57歲焚化廠外包廠商不幸慘死
0000000039.png,hodTLVZILt0,38,7632,黃昆輝基金會民調74%認國安比新聞自由重要
0000000003.png,dtqeDpy7_9k,2,7656,韓國瑜會僑胞插曲多韓放鸽子國旗遮皇帝像
0000000030.png,dtqeDpy7_9k,29,7680,國瑜要來了!僑胞”國瑜有責手板拱他選總統
0000000040.png,dtqeDpy7_9k,39,7704,趕快起來!牆上康熙畫像怕引聯想僑胞忙遮
0000000079.png,dtqeDpy7_9k,78,7728,我的國瑜呢?僑胞等應郎韓國瑜趕飛機放鸽子
0000000146.png,dtqeDpy7_9k,145,7752,訂會僑胞韓國瑜趕飛機放鴿子韓粉超失望
0000000040.png,kVboeJRWEtI,39,7776,收錢不出貨!“被害者聯盟押主嫌回家反遭噸
0000000051.png,kVboeJRWEtI,50,7800,沒悔意也不願還錢被害者氣炸與主嫌扭打
0000000071.png,kVboeJRWEtI,70,7824,兒子長期詐騙無辜民眾母親讓警察把你抓走
0000000116.png,kVboeJRWEtI,115,7848,收錢不出貨!”被害者聯盟”押主嫌回家反遭噸
0000000079.png,GTv6Dh-9Jxo,78,7872,綠營議員反嗆抵制親中促統遊行突喊卡
0000000108.png,GTv6Dh-9Jxo,107,7896,促統遊行喊卡月底竟還有武統宣講團來台
0000000035.png,XFUCRWUBr6o,34,7920,找林嘉誠寫國政白皮書柯:本來就需要智庫
0000000125.png,XFUCRWUBr6o,124,7944,不認選總統柯:把國政改市政就好
0000000042.png,cTV5mV2gh7w,41,7968,"昔十大傑出經理人久葉總座葉永和落網,"
0000000081.png,cTV5mV2gh7w,80,7992,遭控吸金上億捲款潛逃葉永和遭通緝逃亡14年
0000000098.png,cTV5mV2gh7w,97,8016,葉永和逃14年隱姓埋名躲宮廟任心靈老師
0000000124.png,cTV5mV2gh7w,123,8040,遭控吸金上億躲14年藏身宮廟久葉總座終落網
0000000030.png,ME4anz_je7s,29,8064,焚化廠引風機歲修工人遭捲入引風機慘死
0000000048.png,ME4anz_je7s,47,8088,「明明斷電了!為何引風機突然啟動?
0000000094.png,ME4anz_je7s,93,8112,引風機作用將焚燒廢氣集中吸到煙肉再排除
0000000130.png,ME4anz_je7s,129,8136,維修經驗20年57歲焚化廠外包廠商不幸慘死
0000000069.png,8HpuRnyJMrk,68,8160,「鹿草探芒果趣!防落果砸傷用路人
0000000100.png,8HpuRnyJMrk,99,8184,|芒果開放免費摘做芒果青也美味
0000000118.png,8HpuRnyJMrk,117,8208,路上芒果別亂採貪小便宜以竊盜送辦
0000000055.png,aSE9IDLYxAA,54,8232,"洗腦式報導韓國瑜新聞校園餐廳柜看韓粉,"
0000000036.png,ONqQLE9cYYw,35,8256,延選後賴清德首公開現身民眾高喊賴總統
0000000050.png,ONqQLE9cYYw,49,8280,堅定決心選到底!賴清德重申不會火車對撞
0000000084.png,ONqQLE9cYYw,83,8304,"曾說不戰2020卻又登記?賴清德:不是事實,"
0000000142.png,ONqQLE9cYYw,141,8328,"賴簽書拚人氣,蔡接見喊護主權蔡賴延長賽再過招"
0000000003.png,YpUpYOB35wQ,2,8352,老師辱罵學生教唆端人家長控學校沒作為
0000000055.png,YpUpYOB35wQ,54,8376,有人先幫我跟他好嗎?”老師竟教唆學生器人
0000000090.png,YpUpYOB35wQ,89,8400,家長指控學校開三次協調會只承諾派人觀課
0000000131.png,YpUpYOB35wQ,130,8424,防堵老師霸凌!人本基金會羞辱學生要納入解聘
0000000003.png,cq4s3s3m8Sg,2,8448,台灣錢補中國公司虧損”華映隱匿違法
0000000026.png,cq4s3s3m8Sg,25,8472,承諾補貼中國華映卻隱匿華映將移送檢調
0000000060.png,cq4s3s3m8Sg,59,8496,台灣錢補中國公司虧損”華映這證交法
0000000091.png,cq4s3s3m8Sg,90,8520,華映違反證交法可處3-10年刑罰1千萬至2億
