0000000025.png,JDyoR2T7Qcs,24,0,看了讓人生氣!高職男當街爆打小學妹
0000000047.png,JDyoR2T7Qcs,46,24,路人看不慣上前制止女竟頻道歉替男說情
0000000063.png,JDyoR2T7Qcs,62,48,路人離開又開打連續掌规左右呼巴掌
0000000093.png,JDyoR2T7Qcs,92,72,學生情侣校外吵架動粗校方:依校規懲處
0000000114.png,JDyoR2T7Qcs,113,96,網友群起圍剿肉搜當事人深夜PO文道歉
0000000004.png,h9ExnfbG-pM,3,120,電商攜手外匯車商網購大砍價還能無卡分期
0000000021.png,h9ExnfbG-pM,20,144,網路電商攜手外匯車商供外匯車賞車服務
0000000071.png,h9ExnfbG-pM,70,168,電商平台訂購超便宜還能使用無卡分期
0000000030.png,ONcxQAf4-KY,29,192,東吳宿舍用水墨書危機”學生近半月陸續上吐下瀉
0000000085.png,ONcxQAf4-KY,84,216,水塔牆壁有裂縫外部麟水與紅線蟲滲入污染水源
0000000111.png,ONcxQAf4-KY,110,240,東吳向台北大學租合樂宿舍舊式水泥水塔遭污染
0000000023.png,-n4EGzAP4QA,22,264,宜蘭普門冠名“馬偕醫院接告偽造文書商標法
0000000065.png,-n4EGzAP4QA,64,288,普門醫院擅自冠名沒授權台灣百合正義會提告
0000000095.png,-n4EGzAP4QA,94,312,"普門醫院擅用商標接告馬偕醫院不回應,"
0000000030.png,dpdvYFXUwag,29,336,鼓勵都更房屋稅優惠從2年拉長為12年
0000000058.png,dpdvYFXUwag,57,360,鼓勵都更房屋稅優惠從2年拉長為12年
0000000090.png,dpdvYFXUwag,89,384,協議合建也納入土增稅減免優惠減免40%
0000000035.png,1VV8JCrU28o,34,408,台大首度聯合分發不見三冠王、五冠王
0000000070.png,1VV8JCrU28o,69,432,不讓考生同時正取多系備取數減438人
0000000112.png,1VV8JCrU28o,111,456,不再現大批缺額!協調口試時段解決衝堂問題
0000000044.png,niznfQGTMA4,43,480,選前重啟海選制度柯文哲宣布廣徵市府幕僚
0000000081.png,niznfQGTMA4,80,504,"發言人月薪5K,附加條件一大堆柯坦言算低薪"
0000000124.png,niznfQGTMA4,123,528,"熱或海選制度人卻難久留僅剩勞動局長留任,"
0000000153.png,niznfQGTMA4,152,552,大動作換血幕僚是為2020佈局打造品牌?
0000000032.png,lfo3Vwo4dJY,31,576,師大商圈申請BOT旅館部分居民反彈
0000000068.png,lfo3Vwo4dJY,67,600,反對居民主張鄰路不到12米不得設旅館
0000000085.png,lfo3Vwo4dJY,84,624,"台大規劃提供特定對象居住贊成住戶可活絡商圈,"
0000000133.png,lfo3Vwo4dJY,132,648,"師大商圈轉型後店家出走間置地蓋旅館再引反彈,"
0000000029.png,5Wjk38Sr0so,28,672,看了讓人生氣!高職男當街爆打小學妹
0000000046.png,5Wjk38Sr0so,45,696,路人看不慣上前制止女竟頻道歉替男說情
0000000067.png,5Wjk38Sr0so,66,720,路人離開又開打連續掌规左右呼巴掌
0000000076.png,5Wjk38Sr0so,75,744,男怒罵動手甩耳光網友氣到拳頭硬了
0000000097.png,5Wjk38Sr0so,96,768,學生情侣校外吵架動粗校方:依校規懲處
0000000118.png,5Wjk38Sr0so,117,792,網友群起圍剿肉搜當事人深夜PO文道歉
0000000045.png,BIzHJuYydz0,44,816,男子落海失去意識海巡人員英勇救援
0000000057.png,BIzHJuYydz0,56,840,落海男子被救起沒呼吸海巡人員CPR成功救命
0000000077.png,BIzHJuYydz0,76,864,落海男子被救起沒呼吸海巡人員CPR成功救命
0000000029.png,ZU8V8B_ofzI,28,888,無預警停電蛋糕融化半年內受害兩次
0000000055.png,ZU8V8B_ofzI,54,912,蛋糕離開冷藏櫃半小時會融化1小時就變質
0000000072.png,ZU8V8B_ofzI,71,936,7個蛋糕融化損失近6千元台電賠償能打折嗎
0000000120.png,ZU8V8B_ofzI,119,960,二度無預警停電母親節檔期又受害
0000000034.png,CaS1G9bXUBA,33,984,天雨路滑砂石車失控撞電桿冒火花釀停電
0000000073.png,CaS1G9bXUBA,72,1008,"砂石車右轉彎不慎撞單車老翁險捲車輪下,"
0000000105.png,CaS1G9bXUBA,104,1032,"砂石車右轉彎不慎撞單車老翁險捲車輪下,"
0000000025.png,GxfJafHzAEo,24,1056,民黨初選時程運未定賴爆登記前曾被問蔡賴配
0000000048.png,GxfJafHzAEo,47,1080,當面調說什麼?賴爆:總統贏變2.0我意新氣象
0000000116.png,GxfJafHzAEo,115,1104,重話不會犯蘇貞昌的毛病”賴隔天致電蘇貞昌
0000000028.png,h6hQCFmO3uE,27,1128,帶職參選?韓國瑜:假設性問題無法回答
0000000061.png,h6hQCFmO3uE,60,1152,程建隱婉拒土開總座韓國瑜:這事到此為止
0000000093.png,h6hQCFmO3uE,92,1176,|網友喻對韓冰不利韓國瑜不捨心疼
0000000124.png,h6hQCFmO3uE,123,1200,將帶職參選2020?韓國瑜:一切尊重黨內決定
0000000034.png,i0QnJ2h6oJ8,33,1224,初選禁假消息攻擊綠委提案納選罷法
0000000052.png,i0QnJ2h6oJ8,51,1248,對手祭假訊息攻擊無法提告意圖使人不當選
0000000072.png,i0QnJ2h6oJ8,71,1272,“假新聞攻擊力強綠委提案納選罷法
0000000094.png,i0QnJ2h6oJ8,93,1296,初選禁假消息攻擊綠委提案納選罷法
0000000019.png,x-3O5mIVcvo,18,1320,高速自撞修車廠旁騎樓柱清晨巨響嚇壞住戶
0000000033.png,x-3O5mIVcvo,32,1344,高速撞騎樓柱車頭凹陷成V字駕駛送醫不治
0000000062.png,x-3O5mIVcvo,61,1368,天雨路滑?高速自撞騎樓柱駕駛當場死亡
0000000019.png,DTfUFkLqdTE,18,1392,螺絲起子撬開兌幣機!戰火火速搜刮零錢箱
0000000057.png,DTfUFkLqdTE,56,1416,娃娃機店生意興隆?客人上門宵小也來了
0000000077.png,DTfUFkLqdTE,76,1440,缺錢竟動歪腦筋!兌幣機直接當提款機
0000000004.png,NpB3JMwiaO0,3,1464,入圍72屆坎城影展桂綸鎂有望爭影后
0000000041.png,NpB3JMwiaO0,40,1488,首次自編自演吳可熙新片入圍競賽單元
0000000086.png,NpB3JMwiaO0,85,1512,受MeToo啟發挑戰驚悚片趙德胤首度入圍
0000000097.png,NpB3JMwiaO0,96,1536,"台灣4支VR遠征坎城黃心健林強入圍XR單元,"
0000000110.png,NpB3JMwiaO0,109,1560,探VR技術黃心健呈現台灣老公寓王船元素
0000000004.png,6mAfcbmA-Bk,3,1584,3D列印運用建築世界首座“印製橋”在荷蘭
0000000004.png,nxHcDrFc1w8,3,1608,10年來最大隻!台東抓到280公斤曼波魚
0000000019.png,nxHcDrFc1w8,18,1632,台東抓到巨無霸曼波魚280公斤10年來最大隻
0000000057.png,nxHcDrFc1w8,56,1656,5月曼波魚洄游季280公斤曼波魚賣價逾3萬
0000000075.png,nxHcDrFc1w8,74,1680,曼波魚皮魚肉內臟都可食魚腸又被稱龍腸
0000000104.png,nxHcDrFc1w8,103,1704,10年來最大抓到280公斤曼波魚漁民發小財
0000000003.png,oQMiM_ZgjNU,2,1728,一人分飾買家賣家男子臉書Line詐騙虛擬幣
0000000048.png,oQMiM_ZgjNU,47,1752,利用假帳號買空賣空騙徒大做無本生意行騙
0000000004.png,dMxs0pIEvYc,3,1776,小內閣人事輕軌二階遲未定案議員批韓無心市政
0000000030.png,dMxs0pIEvYc,29,1800,高二階遲遲未定案議員批韓國瑜無心市政
0000000058.png,dMxs0pIEvYc,57,1824,輕軌二階說不清韓國瑜議會親上火線
0000000079.png,dMxs0pIEvYc,78,1848,把高雄當跳板?黃光芹批韓”炸蛙市長
0000000004.png,Jho88k2hoRc,3,1872,寧夏夜市“吸金”有一手不敗關鍵大揭密
0000000025.png,Jho88k2hoRc,24,1896,經典美食大集合寧夏夜市人氣強強滾
0000000047.png,Jho88k2hoRc,46,1920,銅板堆疊龐大商機寧夏夜市”不敗有原因
0000000082.png,Jho88k2hoRc,81,1944,營業許可證無法轉讓攤商合作搶百萬商機
0000000116.png,Jho88k2hoRc,115,1968,年造訪人次破百萬寧夏夜市人潮不減
0000000003.png,u0fsPgOV6L0,2,1992,崗山之眼打卡後墜橋19歲男送醫不治
0000000024.png,u0fsPgOV6L0,23,2016,19歲男“爬出”崗山之眼墜樓高廊道要命
0000000048.png,u0fsPgOV6L0,47,2040,騎車又轉小黃入園區爬過圍離從8樓高墜落
0000000082.png,u0fsPgOV6L0,81,2064,臉書打卡”故事結束了”前一天預告結束生命?
0000000098.png,u0fsPgOV6L0,97,2088,"警方曾介入,求助生命線近期屢屢想不開"
0000000003.png,fzeZ9vwMKf4,2,2112,台東知名景點禁菸遊客脫序裝傻行徑誇張
0000000028.png,fzeZ9vwMKf4,27,2136,台東知名景點禁菸衛生局稽查取締竟遭噶
0000000042.png,fzeZ9vwMKf4,41,2160,中國遊客違規抽菸被稽查取締還裝傻!
0000000073.png,fzeZ9vwMKf4,72,2184,水往上流風景區禁菸標語許多遊客視而不見
0000000003.png,bKqLAV8BnZk,2,2208,不養大閘蟹改養小龍蝦苗栗業者靠經驗養殖
0000000032.png,bKqLAV8BnZk,31,2232,近年興起小龍蝦商機一斤約350-400元
0000000050.png,bKqLAV8BnZk,49,2256,養殖池設置加溫棒存活率仍不到兩成
0000000091.png,bKqLAV8BnZk,90,2280,澳洲小龍蝦兇悍網子圍住隔開避免“大吃小”
0000000115.png,bKqLAV8BnZk,114,2304,繁殖技術尚未成熟養殖業者尋求產學合作
0000000004.png,gxW5iduhL5w,3,2328,索羅門總理專訪表示考慮棄台投中與我斷交
0000000045.png,gxW5iduhL5w,44,2352,(必須考量利益”索羅門總理考慮棄台投中
0000000089.png,gxW5iduhL5w,88,2376,1983年索羅門與台灣建交蘇嘉瓦瑞多次來台
0000000133.png,gxW5iduhL5w,132,2400,台索交流密切外交部表示關係穩健成長
0000000003.png,teYbofqDCUg,2,2424,花蓮警連2天破非法槍枝破獲地下槍廠
0000000051.png,teYbofqDCUg,50,2448,查獲槍枝改槍工』警埋伏跟監破地下兵工廠
0000000093.png,teYbofqDCUg,92,2472,原住民持槍未登記警搜索民宅查獲2改造手槍
0000000121.png,teYbofqDCUg,120,2496,嫌犯具原住民身分槍枝未登記仍觸法移送
0000000001.png,CMPmIXIizp8,1,2520,毒犯拒檢飛車撞電桿落網狂吞安毒警幫催吐
0000000034.png,CMPmIXIizp8,33,2544,毒犯遇攔檢開車加速逃員警緊追在後
0000000047.png,CMPmIXIizp8,46,2568,自撞電線桿落網毒犯竟吞整包安非他命
0000000058.png,CMPmIXIizp8,57,2592,“你不要命啦!”員警忙用哈姆立克法救人
0000000069.png,CMPmIXIizp8,68,2616,“你不要命啦!”員警忙用哈姆立克法救人
0000000090.png,CMPmIXIizp8,89,2640,不要命毒犯“吞毒滅證”員警忙催吐救人
0000000004.png,8OC-oD4qaUY,3,2664,下班報名駕訓班交通部長林佳龍沒有機車駕照。
0000000029.png,8OC-oD4qaUY,28,2688,下班後學騎機車!林佳龍全副武裝駕訓班報到
0000000069.png,8OC-oD4qaUY,68,2712,只騎過小綿羊”林佳龍練考駕照敗給「直線7秒
0000000108.png,8OC-oD4qaUY,107,2736,林佳龍放閃:第一個乘客一定是前女友。我太太
0000000119.png,8OC-oD4qaUY,118,2760,機車駕訓班補助千元林佳龍以身作則考覺照
0000000006.png,dxmmzyCH9NA,5,2784,新北首座特色遊戲場啟用幼兒園納入蝴蝶特色
0000000028.png,dxmmzyCH9NA,27,2808,幼兒園特色遊戲場啟用侯友宜與小朋友同樂
0000000038.png,dxmmzyCH9NA,37,2832,小朋友化小老師教市長遊樂器材玩法
0000000056.png,dxmmzyCH9NA,55,2856,幼兒園特色遊戲場啟用侯友宜:打造寓教於樂環境
0000000080.png,dxmmzyCH9NA,79,2880,"蝴蝶造型溜滑梯由幼兒園師生共同設計,"
0000000003.png,OQ0vcKZLjnA,2,2904,載特教生放學自撞山壁司機昏迷7人輕傷送醫
0000000019.png,OQ0vcKZLjnA,18,2928,碰!天雨路滑自撞山壁小巴士180度旋轉
0000000036.png,OQ0vcKZLjnA,35,2952,"小巴士自撞山壁油箱破裂,保險桿撞凹"
0000000067.png,OQ0vcKZLjnA,66,2976,戴特教生放學自撞山壁司機昏迷7人輕傷送醫
0000000102.png,OQ0vcKZLjnA,101,3000,載特教生放學自撞山壁白色小巴險翻覆山下
0000000005.png,pOOZKvvwY8c,4,3024,網路騙虛擬幣53人國小畢業嫌詐450萬
0000000024.png,pOOZKvvwY8c,23,3048,一人分飾買家賣家男子臉書Line詐騙虛擬幣
0000000043.png,pOOZKvvwY8c,42,3072,利用假帳號買空賣空騙徒大做無本生意行騙
0000000005.png,S0zVeS2Q5-I,4,3096,憑一股傻勁邱萬興相機記錄台灣民主進程
0000000035.png,S0zVeS2Q5-I,34,3120,珍貴史料精華集結成書出自邱萬興之手
0000000071.png,S0zVeS2Q5-I,70,3144,總止檢調先到場!萬興任多家黨外雜誌美編
0000000117.png,S0zVeS2Q5-I,116,3168,前人打拼化成影像史料”邱萬興堅特紀錄抗爭
0000000002.png,cM6_7GEUIvo,1,3192,母親節禮物首選“喝的“保健品方便受青睐
0000000014.png,cM6_7GEUIvo,13,3216,銀髮族重保養關節喝的保健品更有利吸收
0000000010.png,2dhCR11Gl74,9,3240,"世界展望會,咖啡品牌合作偏鄉籌募助學金"
0000000004.png,nPMMymCqLeU,3,3264,"製麵員工跳進冰箱嬉鬧戲稱""好吃的秘訣"
0000000029.png,nPMMymCqLeU,28,3288,知名烏龍麵店員工嬉鬧玩開關冰箱遊戲
0000000049.png,nPMMymCqLeU,48,3312,製麵員工跳進冰箱嬉鬧戲稱好吃的秘訣
0000000076.png,nPMMymCqLeU,75,3336,不顧衛生跳進冰箱玩PO網總公司懲處2員工
0000000099.png,nPMMymCqLeU,98,3360,烏龍麵店員工玩過頭衛生局上門清查開單
0000000003.png,vt9ZMHqyM7k,2,3384,花蓮警連2天破非法槍枝破獲地下槍廠
0000000019.png,vt9ZMHqyM7k,18,3408,修車廠暗藏兵工廠破獲改造手槍土造獵槍
0000000042.png,vt9ZMHqyM7k,41,3432,查獲槍枝改槍工具警埋伏跟監破地下兵工廠
0000000084.png,vt9ZMHqyM7k,83,3456,原住民持槍未登記警搜索民宅查獲2改造手槍
0000000113.png,vt9ZMHqyM7k,112,3480,嫌犯具原住民身分槍枝未登記仍觸法移送
0000000003.png,hKTZkO344fk,2,3504,毒犯拒檢飛車撞電桿落網狂吞安毒警幫催吐
0000000029.png,hKTZkO344fk,28,3528,書犯遇攔檢開車加速逃員警緊追在後
0000000043.png,hKTZkO344fk,42,3552,自撞電線桿落網書犯竟吞整包安非他命
0000000054.png,hKTZkO344fk,53,3576,“你不要命啦員警忙用哈姆立克法救人
0000000085.png,hKTZkO344fk,84,3600,不要命毒犯“吞毒滅證”員警忙催吐救人
0000000050.png,UwF9ZRwWOUE,49,3624,高捷二階遲遲未定案議員批韓國瑜無心市政
0000000079.png,UwF9ZRwWOUE,78,3648,輕軌二階說不清韓國瑜議會親上火線
0000000099.png,UwF9ZRwWOUE,98,3672,把高雄當跳板?黃光芹批韓”蚱蜢市長
0000000143.png,UwF9ZRwWOUE,142,3696,大選市政魚與熊掌韓國瑜挨轟無心市政
0000000027.png,kLTDdRlYHaw,26,3720,"大病初癒!孫翠鳳重返舞台依舊威風凛凛,"
0000000053.png,kLTDdRlYHaw,52,3744,孫翠鳳坦承排練仍病爛爛目前體力恢復良好
0000000077.png,kLTDdRlYHaw,76,3768,孫翠鳳和女兒陳昭賢新作擔尚雙男主角互尬演技
0000000031.png,gckHnnjlZdQ,30,3792,除濕機節能補助申請天未亮民眾搶排領號
0000000078.png,gckHnnjlZdQ,77,3816,限定除濕機節能補助申請第二天補助額度已滿
0000000101.png,gckHnnjlZdQ,100,3840,買冷氣冰箱補助最高3千“眉角多申請補助不易
0000000133.png,gckHnnjlZdQ,132,3864,冷氣冰箱換汰舊換新需求大除濕機之亂惹議
0000000018.png,vArVfe5Y1X0,17,3888,砂鍋鋪上滿滿豬背油大火爆香醃漬兩天
0000000034.png,vArVfe5Y1X0,33,3912,"花雕酒老抽,蜂蜜醬汁下鍋光聞就醉了!"
0000000058.png,vArVfe5Y1X0,57,3936,"煲仔飯粒粒分明吸飽臘腸,肝腸油脂"
0000000066.png,vArVfe5Y1X0,65,3960,泰香米飯混和燒臘香調整火候烤出酥香鍋巴
0000000145.png,I6XLNAT-ytM,144,3984,拿”他們與養的距離給吳看王外界聲音最公平
0000000202.png,I6XLNAT-ytM,201,4008,七三制?全民調?王金平非常願意參加辯論
0000000220.png,I6XLNAT-ytM,219,4032,卡韓?朱王下戰帖辯論待5/15中常會通過
0000000005.png,WAJjTeekWmw,4,4056,"製麵員工跳進冰箱嬉鬧戲稱""好吃的秘訣"
0000000035.png,WAJjTeekWmw,34,4080,知名烏龍麵店員工嬉鬧玩開關冰箱遊戲
0000000057.png,WAJjTeekWmw,56,4104,銅板堆疊龐大商機寧夏夜市”不敗”有原因
0000000093.png,WAJjTeekWmw,92,4128,營業許可證無法轉讓攤商合作搶百萬商機
0000000125.png,WAJjTeekWmw,124,4152,年造訪人次破百萬寧夏夜市人氣始終不減
0000000040.png,-9a4qhEm544,39,4176,16300一把抓雨衣盗亮刀洗劫加油站
0000000071.png,-9a4qhEm544,70,4200,缺錢買毒持刀行搶員工勇猛追匪攔車
0000000098.png,-9a4qhEm544,97,4224,僅2名女員工值班1人攔車1人報警合作無間
0000000112.png,-9a4qhEm544,111,4248,變裝寬逃仍遭逮警察察眼尖攔車壓制逮人
0000000140.png,-9a4qhEm544,139,4272,被風吹走?劫走騙款6300只剩2600元
0000000059.png,I5QPiPHMP8U,58,4296,中常會火爆植羅文嘉鄭文燦詭異笑我忘記了
0000000100.png,I5QPiPHMP8U,99,4320,羅文嘉披露初選時程陳明文書:黨中央是秘書長制?
0000000135.png,I5QPiPHMP8U,134,4344,綠營中常會討論總統初選吵翻卓榮泰道歉滅火
0000000044.png,RsgdRDgeU_w,43,4368,拼初選賴清德訪大稻埕遭反南鐵東移人士喧聲
0000000060.png,RsgdRDgeU_w,59,4392,朱立倫代班主持廣播臉書邀賴清德當來賓:
0000000079.png,RsgdRDgeU_w,78,4416,總統初選時程5/22再確認賴清德:堅持選到底
0000000150.png,RsgdRDgeU_w,149,4440,尋連任之路遇窘境蔡總統積極展現執政能力
0000000063.png,PTdjApTJGsY,62,4464,疑犯案後畫面曝光男一手抱兒拉行李箱直奔機場
0000000096.png,PTdjApTJGsY,95,4488,雙親疑遭夫殺害子又被帶走死者女兒深受打擊
0000000123.png,PTdjApTJGsY,122,4512,伊拉克婿坦承殺岳父母日本視訊謊稱在巴格達
0000000166.png,PTdjApTJGsY,165,4536,拥帶走一歲兒爭執伊拉克婿涉殺岳父母逃出境
0000000004.png,45KfLBfdhGk,3,4560,營救輕生醉漢消防員誤踩採光罩摔落3米高
0000000033.png,45KfLBfdhGk,32,4584,"醉漢揚言輕生消防員搶救時踩破採光罩摔落3米,"
0000000099.png,45KfLBfdhGk,98,4608,醉漢鬧輕生消防員搶救跌落3公尺下水泥地上
0000000027.png,1dHUQ1O0VhQ,26,4632,19歲男”爬出”崗山之眼墜樓高廊道要命
0000000052.png,1dHUQ1O0VhQ,51,4656,"「騎車又轉小黃入園區,爬過圍籬從8樓高墜落"
0000000086.png,1dHUQ1O0VhQ,85,4680,臉書打卡”故事結束了”前一天預告結束生命?
0000000100.png,1dHUQ1O0VhQ,99,4704,警方曾介入求助生命線近期屢屢想不開
0000000003.png,MpXKt4Uj0yU,2,4728,經濟不好該怪誰?扁:馬英九最應負全責!
0000000038.png,MpXKt4Uj0yU,37,4752,馬英九主張“反中拖垮經濟”扁不要靠中國
0000000109.png,MpXKt4Uj0yU,108,4776,馬執政8年經濟成長2.8%扁執政平均達6%
0000000020.png,PTvldj4wdiw,19,4800,台東抓到巨無霸曼波魚260公斤10年來最大隻
0000000057.png,PTvldj4wdiw,56,4824,5月曼波魚洄游季280公斤曼波魚賣價逾3萬
0000000076.png,PTvldj4wdiw,75,4848,曼波魚皮魚肉、內臟都可食魚腸又被稱龍陽”
0000000105.png,PTvldj4wdiw,104,4872,|10年來最大抓到280公斤曼波魚漁民發小时
0000000004.png,N8ZPtGz3n9A,3,4896,"郭台銘唱低薪未解決許銘春:3年已終結22k,"
0000000019.png,N8ZPtGz3n9A,18,4920,"郭台銘低薪問題未解決許銘春早已終結22K,"
0000000049.png,N8ZPtGz3n9A,48,4944,勞團訴求訂定「長照假”許:6月找勞資雙方開會
0000000080.png,N8ZPtGz3n9A,79,4968,就業保險盈餘支付長照假?許銘春制度不符合
0000000119.png,N8ZPtGz3n9A,118,4992,"盈餘不足,人力調派問題勞動部推長照假壓力大"
0000000003.png,PrYVro2R5tA,2,5016,母親節送禮首選美容保健品需求增溫
0000000014.png,PrYVro2R5tA,13,5040,母親節送禮首選美容保健品需求增溫
0000000003.png,bwGghnOALlg,2,5064,下班報名駕訓班交通部長林佳龍沒有機車駕照
0000000030.png,bwGghnOALlg,29,5088,下班後學騎機車!林佳龍全副武裝駕訓班報到
0000000071.png,bwGghnOALlg,70,5112,只騎過小綿羊”林佳龍練考駕照敗”直線7秒”
0000000117.png,bwGghnOALlg,116,5136,機車駕訓班補助千元林佳龍以身作則考駕照
0000000003.png,YQyn7R4KU5E,2,5160,「南鐵地下化市區拆除明將強制執行
0000000040.png,YQyn7R4KU5E,39,5184,"南鐵地下化市區拆除明將強制執行,"
0000000063.png,YQyn7R4KU5E,62,5208,徐世榮臉書向蔡總統求救批大埔強拆再現
0000000107.png,YQyn7R4KU5E,106,5232,黃偉哲:南鐵地下化延宕12年5/3起依法強拆
0000000003.png,rPHUwOKmGIU,2,5256,胡志強入大陸小組惹議柯P:難道要找沒關係的人?
0000000043.png,rPHUwOKmGIU,42,5280,副市長蔡炳坤引薦胡志強入北市府大陸小組
0000000066.png,rPHUwOKmGIU,65,5304,找胡志強惹議柯P:難道要找跟中國沒關係的人?
0000000087.png,rPHUwOKmGIU,86,5328,"新大陸小組名單多台商會長議員以經促統陷阱,"
0000000134.png,rPHUwOKmGIU,133,5352,柯文哲6月赴上海雙城論壇大陸小組大洗牌
0000000004.png,aeR5z8LPsZY,3,5376,水煮沸竟變黃自來水公司檢測澄清沒問題
0000000046.png,aeR5z8LPsZY,45,5400,自來水煮沸竟變黃民眾投訴喝了全身發癢
0000000064.png,aeR5z8LPsZY,63,5424,"水公司檢測沒問題""疑鍋具,水塔因素造成"
0000000080.png,aeR5z8LPsZY,79,5448,實際煮沸測試自來水質透明無問題
0000000119.png,aeR5z8LPsZY,118,5472,自來水公司到府檢測確認水質安全無虞
0000000082.png,n6YcmjuE5A4,81,5496,"恐嚇案件連三起韓國瑜議會報告隨扈緊繃,"
0000000093.png,n6YcmjuE5A4,92,5520,恐嚇韓國瑜連三起鳳山分局長親坐鎮
0000000121.png,n6YcmjuE5A4,120,5544,恐陆毅韓國瑜P來自境外恐嚇信來自中部
0000000189.png,n6YcmjuE5A4,188,5568,曾遭韓粉恐嚇圍剿黃光芹:我的兒子就是草
0000000004.png,hAaCZa2QD3U,3,5592,破獲毒咖啡包工廠赫見客運富少涉案
0000000035.png,hAaCZa2QD3U,34,5616,民宅兼做製毒工廠警破門逮嫌客運少東涉案
0000000052.png,hAaCZa2QD3U,51,5640,"毒品工廠藏身民宅客運少東稱被德意加入,"
0000000077.png,hAaCZa2QD3U,76,5664,客運少東稱被德息才加入製毒販毒終遭警逮
0000000098.png,hAaCZa2QD3U,97,5688,客運少東涉毒遭逮自毁前程險連累家族公司
0000000035.png,JhK3Ira4zvg,34,5712,台東知名景點禁菸衛生局稽查取締竟遭嗆
0000000053.png,JhK3Ira4zvg,52,5736,中國遊客違規抽菸被稽查取締還裝傻!
0000000072.png,JhK3Ira4zvg,71,5760,5/1起全面禁菸違規將開罰2千~1萬元
0000000082.png,JhK3Ira4zvg,81,5784,水往上流風景區禁菸標語許多遊客視而不見
0000000036.png,1meoAwS1yaw,35,5808,誤闖民宅血統珍貴名鸽發抖縮牆角
0000000055.png,1meoAwS1yaw,54,5832,腳環確認身分誤闖民宅名鴿身價20萬起跳
0000000084.png,1meoAwS1yaw,83,5856,速度穩血統優良名鴿用於配種培育賽鴿
0000000101.png,1meoAwS1yaw,100,5880,警方發布消息尋飼主認領電話一天十幾通
0000000004.png,f9G9EfXmzwM,3,5904,"「人肉佔車位不成離譜男副車門洩恨,"
0000000048.png,f9G9EfXmzwM,47,5928,"「人肉佔車位不成離譜男到車門洩恨,"
0000000079.png,f9G9EfXmzwM,78,5952,停不到車位心生不滿?佔位男刮車門洩恨
0000000117.png,f9G9EfXmzwM,116,5976,停不到車位心生不滿?佔位男到車門洩恨
0000000004.png,LoyZoLMM694,3,6000,不養大閘蟹改養小龍蝦苗栗業者靠經驗養殖
0000000040.png,LoyZoLMM694,39,6024,"近年興起小龍蝦商機一斤約350-400塊,"
0000000064.png,LoyZoLMM694,63,6048,養殖池設置加溫棒存活率仍不到兩成
0000000098.png,LoyZoLMM694,97,6072,澳洲小龍蝦兇悍網子圍住隔開避免“大吃小”
0000000122.png,LoyZoLMM694,121,6096,繁殖技術尚未成熟養殖業者尋求產學合作
0000000003.png,sp8znM252GA,2,6120,"索羅門總理專訪表示,考慮棄台投中與我斷交"
0000000040.png,sp8znM252GA,39,6144,“必須考量利益”索羅門總理考慮棄台投中
0000000084.png,sp8znM252GA,83,6168,1983年索羅門與台灣建交蘇嘉瓦瑞多次來台
0000000128.png,sp8znM252GA,127,6192,"台索交流密切,外交部表示關係穩健成長"
0000000003.png,2NwME46XkdA,2,6216,炸雞配珍奶”旋風吹回台首家店坐落台北東區
0000000025.png,2NwME46XkdA,24,6240,國外超夯手搖飲登台搭配本土炸雞開賣
0000000073.png,2NwME46XkdA,72,6264,本土炸雞業攜手超夯手搖飲開設首家複合式餐飲
0000000110.png,2NwME46XkdA,109,6288,外國最愛爆珠款手搖飲引進台順勢翻轉東區
0000000004.png,s4jinlywipw,3,6312,嚴執法警分局長榮陞民眾放鞭炮狂賀離職
0000000023.png,s4jinlywipw,22,6336,嚴執法警分局長榮陞民眾放鞭炮狂賀離職
0000000083.png,s4jinlywipw,82,6360,交通整頓惹怨分局長榮陞民眾放炮狂賀”
0000000038.png,61fXyyhkbME,37,6384,副市長蔡炳坤引薦胡志強入北市府大陸小組
0000000062.png,61fXyyhkbME,61,6408,找胡志強惹議柯P難道要找跟中國沒關係的人?
0000000082.png,61fXyyhkbME,81,6432,新大陸小組名單多台商會長議員以經促統陷阱
0000000129.png,61fXyyhkbME,128,6456,柯文哲6月赴上海雙城論壇大陸小組大洗牌
0000000026.png,bqBoWvlg0z0,25,6480,氣流影響空中盤旋成群黑腹燕鷗如龍捲風
0000000058.png,bqBoWvlg0z0,57,6504,奇觀成千上萬隻黑腹燕鷗順氣流旋轉俯衝
0000000071.png,bqBoWvlg0z0,70,6528,黑腹燕鷗成群出現為降低被獵殺機率?
0000000039.png,3W6aIxO0PZ4,38,6552,恐嚇案件連三起韓國瑜議會報告隨扈緊綱
0000000050.png,3W6aIxO0PZ4,49,6576,热陆韓國瑜連三起鳳山分局長親坐鎮
0000000078.png,3W6aIxO0PZ4,77,6600,热陆毅韓國瑜兩肥來自境外恐嚇信來自中部
0000000098.png,3W6aIxO0PZ4,97,6624,恐嚇案連三起韓國瑜隨扈四人變六人
0000000040.png,kvBDHv3PAP0,39,6648,陳吉仲日前掛保證芭樂價格回升藍委批跳票
0000000074.png,kvBDHv3PAP0,73,6672,近3月芭樂價較去年同期利/3?農糧署反駁澄清
0000000111.png,kvBDHv3PAP0,110,6696,芭樂與鳳梨賣出價高於成本農委會力推外銷
0000000021.png,u6tm7lFChOo,20,6720,節能補助申請天未亮民眾搶排領號
0000000042.png,u6tm7lFChOo,41,6744,申請人數爆量基隆市府窗口動線亂
0000000070.png,u6tm7lFChOo,69,6768,220萬補助金將用完市府緊急宣布暫停受理
0000000102.png,u6tm7lFChOo,101,6792,基隆限定補助急喊卡市府計畫完善再開放
0000000027.png,c5cpJJc0Bh8,26,6816,Kolas表態反對中樞祭祀鄭成功鄭氏宗親不滿
0000000095.png,c5cpJJc0Bh8,94,6840,Kolas反對中樞祭祀鄭成功鄭氏宗親要求下台
0000000031.png,GG5GCS7noQE,30,6864,無視禁入告示進花田金針花慘被踩踏
0000000055.png,GG5GCS7noQE,54,6888,花田當自家!只為拍照踐踏採花亂象多
