0000000001.png,EwYe03gy36E,1,0,章的谷千人演講彩李佳芳上台掀高潮
0000000027.png,EwYe03gy36E,26,24,重返政壇是意外!李佳芬要韓別有“非分之想
0000000102.png,EwYe03gy36E,101,48,相信韓國瑜”李佳芳笑喊好像在拉票
0000000019.png,mm0JMy5B-OI,18,72,公司相識許志安鄭秀文相差5歲陷熱戀
0000000046.png,mm0JMy5B-OI,45,96,于志安鄭秀文齊拿獎2002年廚房宣言“放閃
0000000072.png,mm0JMy5B-OI,71,120,志安鄭秀文分手近10年港媒女方曾罹憂鬱症
0000000105.png,mm0JMy5B-OI,104,144,2016年許志安生日派對求婚鄭秀文:我願意
0000000118.png,mm0JMy5B-OI,117,168,等動分合终結婚好友讀香港最後一個童話
0000000131.png,mm0JMy5B-OI,130,192,"目詩詩安情產近30年年鄭秀文認了許太,"
0000000001.png,bDA3u7dazTQ,1,216,"三親班暴打國男童臉滿是血痕,"
0000000039.png,bDA3u7dazTQ,38,240,兒子扔我手機!班主任蔡呼巴掌童險滲血
0000000098.png,bDA3u7dazTQ,97,264,歲童遭班主任甩巴掌教育局確認違法就罰
0000000002.png,Y6_J_2mymPk,1,288,三20多次!許志安外遇認錯哭好慘
0000000042.png,Y6_J_2mymPk,41,312,許志安認外遇痛哭“覺得自己好噁心
0000000076.png,Y6_J_2mymPk,75,336,于志安認偷吃”暫停工作”鄭秀文痛心臉書反黑
0000000001.png,TuqHIRqvxrM,1,360,李佳芬安養院致詞金句連發晦翻銀髮族
0000000017.png,TuqHIRqvxrM,16,384,国内外僑胞祝福李佳芳高雄怎能不發大財
0000000032.png,TuqHIRqvxrM,31,408,高雄發大財紅包搶翻李佳芬以為沒人要
0000000054.png,TuqHIRqvxrM,53,432,音被運將認出李佳芬連老公都分不出
0000000068.png,TuqHIRqvxrM,67,456,爱男長!韓國瑜頻問市府團隊“快不快樂
0000000083.png,TuqHIRqvxrM,82,480,李佳芬致詞放閃讀韓開朗沒戒心沒防心
0000000001.png,HX6y932dm3Y,1,504,兵不死只是會累鐵人行程韓國瑜累壞
0000000025.png,HX6y932dm3Y,24,528,斗技與學術之旅好累!韓國瑜座談竟遲到
0000000057.png,HX6y932dm3Y,56,552,水土不服韓國瑜硬撑被完全程
0000000001.png,kC3WiodiYQI,1,576,男嬰公托中心遭霸凌?社會局若疏失將處分
0000000081.png,kC3WiodiYQI,80,600,未積極制正與溝通社會局若疏失將處分
0000000001.png,ZoO33EX8O1U,1,624,3千胞挺韓選统111返台住宿好
0000000039.png,ZoO33EX8O1U,38,648,"香胞韓選總統,111台住宿己好"
0000000063.png,ZoO33EX8O1U,62,672,"部台銘選202071僑胞,相當詭異,搶風頭"
0000000099.png,ZoO33EX8O1U,98,696,"郭台銘選20202僑胞相當詭異,搶風頭"
0000000003.png,dZ61DOwfG2E,2,720,選對總統救台灣戰2020韓國瑜露心聲?
0000000035.png,dZ61DOwfG2E,34,744,異總統心聲?!韓國瑜幾流人民出幾流國家
0000000088.png,dZ61DOwfG2E,87,768,選對總統救台灣藍解讀韓國瑜參選學
0000000006.png,9qc16eVQBs8,5,792,草國瑜總統級大進場3千名粉絲加油聲不斷
0000000020.png,9qc16eVQBs8,19,816,近距離見韓國瑜一面3千僑胞high到坐不住
0000000038.png,9qc16eVQBs8,37,840,譚國瑜總統級“大進場場面震撼如三山造勢
0000000063.png,9qc16eVQBs8,62,864,14名“赤子護衛隊護駕韓國瑜感動拍頭
0000000004.png,QuW-CrLJF_I,3,888,國道行進連續遭槍擊駕駛臨停路肩驚魂未定
0000000026.png,QuW-CrLJF_I,25,912,頭部家雙斷住勢頭定手别程線路明毒火迎大甲媽回鑾!返北遭突擊彈匣射光才罷手
0000000052.png,QuW-CrLJF_I,51,936,大甲媽回齡駕駛上國道遭開槍車身布8彈
0000000004.png,RXwTDCNTTfo,3,960,重訪三高科技巨擘韓”拚經濟”鐵人行程
0000000053.png,RXwTDCNTTfo,52,984,一定要開放!韓招商簽千萬美金投資備忘錄
0000000091.png,RXwTDCNTTfo,90,1008,頭腦不能要!韓國瑜高雄開放是唯一活路
0000000002.png,Ct2Ff3Iko8w,1,1032,等行淪毒窟!?雙北9據點賣吸一條龍”
0000000024.png,Ct2Ff3Iko8w,23,1056,這遊貨去別家”毒窟連鎖如超商?
0000000069.png,Ct2Ff3Iko8w,68,1080,官階可减刑“藥頭利誘身障人士販毒
0000000001.png,wBMweFfkmrg,1,1104,三不理遷怒別人教友丟汽油彈縱火
0000000020.png,wBMweFfkmrg,19,1128,事記息狂嗆聲!你家會火燒“被害人心生恐
0000000065.png,wBMweFfkmrg,64,1152,小三不理遷怒別人教友丟汽油彈縱火
0000000001.png,zVEuY7Rt4Rk,1,1176,聖母院內部救火曝光火焰吞噬建築殘骸堆地
0000000028.png,zVEuY7Rt4Rk,27,1200,塞纳河畔遊船目睹惡火燒哥德式尖塔
0000000052.png,zVEuY7Rt4Rk,51,1224,火再天都要救!神父董火海救出耶稣荊棘冠冕
0000000069.png,zVEuY7Rt4Rk,68,1248,"報器2度響消防員23分鐘後才發現火點,"
0000000080.png,zVEuY7Rt4Rk,79,1272,聖母院内部救火曝光專家恐花數10年重建
0000000031.png,PAT9Glz5NG4,30,1296,打麻將喻美中日台前美駐阿富汗大使约韓繼續聊
0000000066.png,PAT9Glz5NG4,65,1320,打麻將喻美中国台前美駐阿富汗大使約韓繼續聊
0000000096.png,PAT9Glz5NG4,95,1344,可是台灣女婿曾任美陸軍中將駐阿天使
0000000002.png,QdQHKP2PLxM,1,1368,9天8夜遙境!大甲媽回鄉安座信徒穿雨衣相
0000000040.png,QdQHKP2PLxM,39,1392,馬英九主持安座大典感動致詞“台灣真有人情味”
0000000078.png,QdQHKP2PLxM,77,1416,大甲媽9天8夜读境回鑾上萬信眾恭迎媽祖安座
0000000001.png,ahDrRPKpaq4,1,1440,公托爆疏失?”9月天男嬰被孩童咬又踩
0000000026.png,ahDrRPKpaq4,25,1464,部還不會站會搶玩具?師看嬰被咬視若無睹
0000000052.png,4DhdhYbBImA,51,1488,不滿NCC重罰僑胞天喊中天加油
0000000078.png,4DhdhYbBImA,77,1512,僑胞怒挺捍衛中天喻NCC應該廢掉
0000000001.png,ZqfS0iDR5Qk,1,1536,美最大場300人演講6500包子相挺
0000000018.png,ZqfS0iDR5Qk,17,1560,備製做大費周章6500個包子力被韓
0000000043.png,ZqfS0iDR5Qk,42,1584,建議最大場600人演講6500包子相挺|
0000000001.png,ox0-SoCjw-s,1,1608,韓國瑜壓軸演講粉絲提早3小時進場
0000000017.png,ox0-SoCjw-s,16,1632,韓國瑜訪美壓軸演講3千粉絲擠滿會場
0000000060.png,ox0-SoCjw-s,59,1656,韓國瑜壓軸演講安檢現場大排長龍
0000000110.png,ox0-SoCjw-s,109,1680,黃國訪美國軸演講6千粉絲擠滿會場
0000000133.png,ox0-SoCjw-s,132,1704,韓國瑜壓軸演講粉絲提早6時進場
0000000146.png,ox0-SoCjw-s,145,1728,對國瑜訪美國軸演講6千粉絲擠滿會場
0000000154.png,ox0-SoCjw-s,153,1752,韓國瑜壓軸演講安檢現場大排長龍
0000000002.png,zlAbj9r95TI,1,1776,男童話得安親班竟因誤會遭班主任賞巴掌
0000000001.png,KbZNRAR7wSU,1,1800,千人擠爆會場!韓國瑜談“城市活力區域經濟
0000000054.png,KbZNRAR7wSU,53,1824,讀國瑜韓流讓很多沒話講的老夫老妻有話題了
0000000143.png,KbZNRAR7wSU,142,1848,寶僑胞!韓國瑜身在異國打拼心在台灣
0000000216.png,KbZNRAR7wSU,215,1872,"請國瑜:台灣民主在搞什麼?百萬大陸台商抬不起頭,"
0000000249.png,KbZNRAR7wSU,248,1896,讓人民過好日子莫里台湾民主政治還值得做?
0000000396.png,KbZNRAR7wSU,395,1920,韓不要問政府為你做什麼要問你投票給誰
0000000415.png,KbZNRAR7wSU,414,1944,讓我曾是最年輕立委久之就迷失忘了選民的託付
0000000489.png,KbZNRAR7wSU,488,1968,韓找不到人生方向退出政治17年看清自己
0000000514.png,KbZNRAR7wSU,513,1992,譚國政治人物承諾人民就要一心一意為人民做事
0000000546.png,KbZNRAR7wSU,545,2016,讀國瑜:高雄土地下挖3公尺都是綠的只有我一個藍的
0000000599.png,KbZNRAR7wSU,598,2040,讀國瑜:我空降高雄人路都不熟但民進黨又做了什麼?
0000000678.png,KbZNRAR7wSU,677,2064,"韓國瑜:政治人物3選擇英雄,崑雄,狗熊"
0000000001.png,Rj9myQ4jiMY,1,2088,"韓國瑜:政治人物選擇英雄,臭雄狗熊"
0000000039.png,Rj9myQ4jiMY,38,2112,韓國瑜有機會為高雄服務不選座位選做牛做馬
0000000086.png,Rj9myQ4jiMY,85,2136,韓國瑜誰最優秀誰領導中華民國2020是生死保衛戰
0000000135.png,Rj9myQ4jiMY,134,2160,曹國瑜:2020太重要!請各位僑胞明年1月11日回合
0000000224.png,Rj9myQ4jiMY,223,2184,韓國瑜:海外華僑做後盾全力支持台灣
0000000310.png,Rj9myQ4jiMY,309,2208,韓國瑜:華僑的熱情無與倫比令人感動
0000000341.png,Rj9myQ4jiMY,340,2232,韓國瑜與僑胞相約明年1/11台灣見
0000000003.png,AqjF3jBQ2CU,2,2256,控師腳踩學童湯匙!家長怒:有衛生疑慮
0000000014.png,AqjF3jBQ2CU,13,2280,幼教師全程盤腿踩湯匙的不是“她”
0000000035.png,AqjF3jBQ2CU,34,2304,播佛曲?鼓棒TF家長臉書控師脫序
0000000048.png,AqjF3jBQ2CU,47,2328,播佛曲?鼓棒K?家長臉書控師脫序
0000000067.png,AqjF3jBQ2CU,66,2352,幼教師涉管教不當教育局擬輔導改善
0000000006.png,W9UHpLQ3IuM,5,2376,訪美家鄉味韓節合理餐店吃“燒餅油條
0000000029.png,W9UHpLQ3IuM,28,2400,韓訪台式早餐店圖貼心準備”家鄉味”
0000000064.png,W9UHpLQ3IuM,63,2424,終於嚐到家鄉味韓讀不絕回直呼“不輸合湾
0000000032.png,kC0o-rfTfR8,31,2448,科技重鎮取經韓國瑜參訪美國特斯拉
0000000046.png,kC0o-rfTfR8,45,2472,赴特斯拉頻果台達電算高科技公司
0000000070.png,kC0o-rfTfR8,69,2496,罕見開放參韓國瑜加場進蘋果公司
0000000099.png,kC0o-rfTfR8,98,2520,特斯拉蘋果合達電韓國瑜訪科技公司
0000000017.png,7VUDnZGYGgI,16,2544,人都站不穩!車翻覆漏油地滑籍重大
0000000033.png,7VUDnZGYGgI,32,2568,質疑漏油清潔沒做好駕駛要求賠償修車費
0000000049.png,7VUDnZGYGgI,48,2592,灌2次石灰吸油警車安全清潔隊才撤離
0000000080.png,7VUDnZGYGgI,79,2616,更引車警道翻覆漏油害地滑轎車失控撞護欄
0000000002.png,_iF2zRud214,1,2640,本週唯一好笑氣降雨減少氣溫回升
0000000030.png,_iF2zRud214,29,2664,把握好天氣陽光露臉週四再濕到下週
0000000048.png,_iF2zRud214,47,2688,"西半部多雲到晴東半部局部短暫雨,"
0000000061.png,_iF2zRud214,60,2712,週五至週末鋒面十華南水氣各地天氣不穩
0000000076.png,_iF2zRud214,75,2736,明下半天水氣逐漸增加晚間轉短暫雨
0000000084.png,_iF2zRud214,83,2760,把握好天氣!陽光露臉週四再濕到下週
0000000098.png,_iF2zRud214,97,2784,校概群雕昕蠟繩艦群體相機聯姻本週唯一好天氣降雨減少氣溫回升
0000000109.png,_iF2zRud214,108,2808,把握好天氣!陽光露臉週四再濕到下週
0000000117.png,_iF2zRud214,116,2832,西半部多雲到晴部局部短暫雨
0000000125.png,_iF2zRud214,124,2856,把握好天氣!陽光露臉週四再濕到下週
0000000135.png,_iF2zRud214,134,2880,本週唯一好天氣降雨減少氣溫回升
0000000149.png,_iF2zRud214,148,2904,把握好天氣!陽光露臉週四再濕到下週
0000000169.png,_iF2zRud214,168,2928,西半部多雲到晴東半部局部短暫雨
0000000181.png,_iF2zRud214,180,2952,本週唯一好天氣降雨減少氣溫回升
0000000014.png,0Eh5mz4VW1E,13,2976,僑胞瘋問韓選總統李芬險招架不住
0000000037.png,0Eh5mz4VW1E,36,3000,洗衣服我們來僑胞要李佳芬挺韓選總統
0000000059.png,0Eh5mz4VW1E,58,3024,被僑胞讚“第一夫人風範李佳为我種田長大
0000000085.png,0Eh5mz4VW1E,84,3048,就是要韓總統僑胞瘋問李佳芬“韓選不選
0000000005.png,W0LhtkyfkRA,4,3072,艾江山臨時造訪與韓級包廂早餐會
0000000028.png,W0LhtkyfkRA,27,3096,懷念台灣早餐味韓市長停留吃燒餅喝豆漿
0000000055.png,W0LhtkyfkRA,54,3120,華僑貼心安排請韓農吃冷灣味早餐
0000000082.png,W0LhtkyfkRA,81,3144,懷念台灣早餐味韓網停留吃燒餅喝豆漿
0000000001.png,CFpwKYhQyS0,1,3168,自打臉?讓媒體“假新聞“蘇29小時後致歉
0000000021.png,CFpwKYhQyS0,20,3192,假新聞大逆轉!蘇韻致歉:公文語意未盡清楚
0000000060.png,CFpwKYhQyS0,59,3216,蘇毒媒體開錯砲名嘴畫錄才假新聞製造機
0000000090.png,CFpwKYhQyS0,89,3240,蘇銷書媒體“假新聞一藍營酸(NCC罰不罰?
0000000007.png,nslvh420GHo,6,3264,人氣不輸韓國瑜李笑到安養中心發紅包
0000000018.png,nslvh420GHo,17,3288,李佳芬分享韓冰櫃置趣事逗樂銀髮族僑胞
0000000066.png,nslvh420GHo,65,3312,就愛李佳物洗腎12年韓粉奶奶堅持到場
0000000095.png,nslvh420GHo,94,3336,北加州安養院發饱僑胞零佳芬:好感動
0000000001.png,HO84TqdhMDQ,1,3360,老字號中連貨運算去裁買
0000000017.png,HO84TqdhMDQ,16,3384,1例1休新環保冷“增加成本上櫃公司傳裁員
0000000027.png,HO84TqdhMDQ,26,3408,"""1例1休新環保法令增加成本上櫃公司傳裁員"
0000000038.png,HO84TqdhMDQ,37,3432,1例1休新環保法令增加成本上櫃公司傳裁員
0000000058.png,HO84TqdhMDQ,57,3456,老字號中連貨運撑下载買上千人
0000000001.png,WOBAut-SQJM,1,3480,郭台銘參戰?韓國瑜:2020從文藝片變武俠片
0000000078.png,WOBAut-SQJM,77,3504,尊重郭晉銘參選意願韓國瑜法的一顆震撼彈
0000000004.png,mGNPjtss4l8,3,3528,遇粉絲特地照韓國瑜親民作風受歡迎
0000000017.png,mGNPjtss4l8,16,3552,連訪三高科學韓國瑜拼經濟鐵人行程
0000000049.png,mGNPjtss4l8,48,3576,蘋果罕見開放參訪美科技業重視韓流
0000000079.png,mGNPjtss4l8,78,3600,連訪三高科技巨擘韓國瑜拼經濟鐵人行程
0000000016.png,HwLIxKifN58,15,3624,韓國瑜參訪特斯拉會面佛利蒙首位華人女市長
0000000057.png,HwLIxKifN58,56,3648,巧遇熱情華僑韓國瑜親下車拍照
0000000067.png,HwLIxKifN58,66,3672,科技重鎮取經韓國瑜參訪美國特斯拉
0000000004.png,m_6-2XvsMZs,3,3696,聲寶跨足熟食法卻延遲給業者貨款
0000000043.png,m_6-2XvsMZs,42,3720,外送員也爆薪水拿不到”勸業者取消接單
0000000083.png,m_6-2XvsMZs,82,3744,法年底出現欠款情形誠實蜜蜂盡快結清
0000000006.png,kEXgAarlz-Q,5,3768,保外就學頭紅線陳水扁遭質颖“裝病
0000000038.png,kEXgAarlz-Q,37,3792,保外就壘頭紅線陳水扁遭質载“装病
0000000055.png,kEXgAarlz-Q,54,3816,保外就醫頻踩紅線陳水扁遭質疑裝病
0000000086.png,kEXgAarlz-Q,85,3840,“阿局關回去民眾聚集台中監前抗議
0000000001.png,wT3e01EzeEY,1,3864,恐怖!電線落地噴火維修人員陷火海
0000000039.png,wT3e01EzeEY,38,3888,驚恐扯下電線引火海工人秒逃死劫
0000000052.png,wT3e01EzeEY,51,3912,驚!巨大吊臂突倒塌險砸下方施工人員
0000000018.png,5QWhp4Bd6Mk,17,3936,"體國瑜訪美隱軸演講!5千韓粉提早卡位,"
0000000040.png,5QWhp4Bd6Mk,39,3960,要給韓國瑜驚喜!志工拿守秩序排提醒韓粉
0000000048.png,5QWhp4Bd6Mk,47,3984,"工匠在我們的公龍粉守秩序給韓市長驚喜,"
0000000065.png,5QWhp4Bd6Mk,64,4008,體粉興奮入場過完安檢門連手機手錶都該
0000000098.png,5QWhp4Bd6Mk,97,4032,"蘭区動場千人演講「韓粉提早卡位秩序排隊,"
0000000001.png,vglwoGryl2M,1,4056,"體讓區軸演說提“選總統,為人民”參選有譜?"
0000000046.png,vglwoGryl2M,45,4080,分享韓流“心路歷程韓國瑜:人民有新的期待
0000000098.png,vglwoGryl2M,97,4104,"體感動演說提選總統,為人民”參選有譜?"
0000000135.png,vglwoGryl2M,134,4128,韓國瑜籲1/11回台投票僑胞高喊「選總統”
0000000001.png,cAHGSHNGUGk,1,4152,2020選總統?!企業界掀反對郭台銘聲浪
0000000030.png,cAHGSHNGUGk,29,4176,不看好郭台銘參選頓正錯政治讓韓國瑜來
0000000054.png,cAHGSHNGUGk,53,4200,"「治理企業與國家不一樣林伯豐肯定韓政治理念,"
0000000081.png,cAHGSHNGUGk,80,4224,"2020選總統?!企業界掀反對郭台銘聲浪,"
0000000001.png,M7S4QkQtZ1M,1,4248,一路逆向駕駛精神不濟撞上對向來車
0000000015.png,M7S4QkQtZ1M,14,4272,一路逆向駕駛精神不濟撞上對向來車
0000000032.png,M7S4QkQtZ1M,31,4296,一路逆向駕駛精神不濟撞上對向來車
0000000059.png,M7S4QkQtZ1M,58,4320,互不相讓?兩車互撞轎車90度側翻
0000000099.png,M7S4QkQtZ1M,98,4344,"互不相讓?兩車互撞轎車90度側翻,"
0000000001.png,wGHDy7J38N0,1,4368,不滿被按喇叭急通車又持球棒砸車窗
0000000026.png,wGHDy7J38N0,25,4392,惡煞談開門接人駕駛心生恐懼報警
0000000084.png,wGHDy7J38N0,83,4416,不滿被按喇叭急剂這車又持球棒砸車窗
0000000029.png,Vi168KUVU3c,28,4440,現金只要付300刷卡收2千停車2天變冤大頭!
0000000047.png,Vi168KUVU3c,46,4464,停車場24小時計費!路邊車格夜間才免收費
0000000064.png,Vi168KUVU3c,63,4488,"隐曾回最高“吸客!停車場現金刷卡不同價,"
0000000088.png,Vi168KUVU3c,87,4512,現金只要300刷卡收2000停車2天變冤大頭!
0000000002.png,obtm2hvT9Oc,1,4536,"卡位韓國瑜演講千僑胞也聲援中天,"
0000000058.png,obtm2hvT9Oc,57,4560,NCC才該被罰僑胞淪為民進黨打手
0000000114.png,obtm2hvT9Oc,113,4584,韓國瑜訪美壓軸演講3千僑胞卡位也挺中天
0000000004.png,ziiENtOkV40,3,4608,離譜!投資人控:公司吸金16億還在運作
0000000023.png,ziiENtOkV40,22,4632,女性重病還貸款2000萬投資人聲淚俱下:
0000000101.png,ziiENtOkV40,100,4656,置開庭!100多名受害者現身舒公道
0000000025.png,vRB6M5VTRXU,24,4680,高羅素梅西喻陳其他不務正業變NCC主委
0000000054.png,vRB6M5VTRXU,53,4704,防委掏空農民存款、未遂犯12陳吉仲反批:假新聞!
0000000078.png,vRB6M5VTRXU,77,4728,立委掏空農民存款未遂犯!陳吉仲反批:假新聞!
0000000002.png,se_TQR9YuCg,1,4752,"東石漁港2車落海軍上無人驚見槍枝防彈衣,"
0000000024.png,se_TQR9YuCg,23,4776,東石漁港2車落海軍上無人驚見槍枝防彈衣
0000000040.png,se_TQR9YuCg,39,4800,"躲追緝掩埋跡證?2車遭刻意推入海,"
0000000074.png,se_TQR9YuCg,73,4824,降現國道槍擊涉案車嫌犯疑曾現蹤東石漁港
0000000004.png,nOWN0DlqhRY,3,4848,露營最強韓粉開炮!王世堅轟郭台銘財神榜正神
0000000036.png,nOWN0DlqhRY,35,4872,露營最強韓粉開炮!王世堅毒郭台銘財神情正神
0000000010.png,vUGizsCxTSA,9,4896,"請封麥演唱安搶孝親票送媽媽,"
0000000028.png,vUGizsCxTSA,27,4920,費玉清封麥演唱子女搶孝親票送媽媽
0000000046.png,vUGizsCxTSA,45,4944,"費玉清封麥演唱子女搶孝親票送媽媽,"
0000000004.png,lOP7bSYNmGQ,3,4968,高雄移居津貼申請首目勞工局辦人龍
0000000019.png,lOP7bSYNmGQ,18,4992,4小時名額少一半!對比去年半年才額滿”差很大
0000000037.png,lOP7bSYNmGQ,36,5016,韓國瑜拚經濟有成效!“移居津貼“申請暴增
0000000071.png,lOP7bSYNmGQ,70,5040,高难移居建貼申請首回勞工局排人龍
0000000029.png,GFL2PaX8GVg,28,5064,"「媽祖灣叫我選?!”郭台銘打神明牌參選遭狂酸,"
0000000060.png,GFL2PaX8GVg,59,5088,"郎都稱“依媽祖指示網酸誰能求證媽祖巡離,"
0000000108.png,GFL2PaX8GVg,107,5112,即着就參選“滿口神佛“名嘴酸:2020選誰法力強?
0000000011.png,CR7ojz3nGMQ,10,5136,配合宣布參加初選王鴻薇轟黨中央量身打造“條款
0000000050.png,CR7ojz3nGMQ,49,5160,羅友志:失聯黨員24小時復活一天內變榮譽黨員
0000000063.png,CR7ojz3nGMQ,62,5184,生這時候你在哪?王丰郭台銘割稻仔尾
0000000095.png,CR7ojz3nGMQ,94,5208,"配合宣布參加初選王鴻薇轟黨中央量身打造條款,"
0000000002.png,ykZVXTj3AMY,1,5232,台遊車龍粉凌晨路北上從韓國瑜選總統!」
0000000023.png,ykZVXTj3AMY,22,5256,全國農會理事長也挺韓!將到桃園接機
0000000040.png,ykZVXTj3AMY,39,5280,杏仁哥”就是挺韓連署書兩週近5萬份
0000000052.png,ykZVXTj3AMY,51,5304,杏仁哥”就是挺韓”連署書兩週近5萬份
0000000065.png,ykZVXTj3AMY,64,5328,「韓粉印製貼紙NCC變麟CC將北上挺中天
0000000099.png,ykZVXTj3AMY,98,5352,"台遊覽車體粉凌晨将比上超韓國瑜選總統,"
0000000001.png,yhNHp4elS08,1,5376,韓國瑜結束訪美行韓粉依依不捨送機
0000000022.png,yhNHp4elS08,21,5400,種趕飛機韓國瑜差點丟包李佳芳
0000000037.png,yhNHp4elS08,36,5424,體式幽默:“感情不好股票套牢多看韓流
0000000055.png,yhNHp4elS08,54,5448,"體粉抓準最後機會合照簽名送禮物,"
0000000088.png,yhNHp4elS08,87,5472,"體國瑜結束訪美行韓粉依依不捨送機,"
0000000002.png,LuJ6n_-fzjw,1,5496,"誰選總統都不重要“韓國瑜現在睡覺最重要,"
0000000014.png,LuJ6n_-fzjw,13,5520,美國行太緊湊!李佳芬真的去掉半條命
0000000031.png,LuJ6n_-fzjw,30,5544,霞市長回合立馬去上班!李佳芳也太不人道
0000000063.png,LuJ6n_-fzjw,62,5568,"丽入初選?!韓國瑜:我加入變驚悚片,"
0000000076.png,LuJ6n_-fzjw,75,5592,"回高雄第一件事?韓國瑜等不及要上班,"
0000000002.png,Aslf-leorDU,1,5616,賣場偷衣批防盗扣“穿上身變裝開溜
0000000023.png,Aslf-leorDU,22,5640,售不及先穿了?混搭太顯眼員工眼尖抓包
0000000047.png,Aslf-leorDU,46,5664,不及先穿了?混搭太顯眼員工眼尖抓包
0000000002.png,RL1ZVzwpuKs,1,5688,三歲男童疑迷路員警挨家挨戶找回家路
0000000036.png,RL1ZVzwpuKs,35,5712,"男童哭喊话我要找爸媽暖心警親接回家,"
0000000065.png,RL1ZVzwpuKs,64,5736,"三歲男童疑迷路員警挨家挨戶團找回家路,"
0000000050.png,roGSDGC2qU0,49,5760,"許志安部外遇痛哭“覺得自己好噁心,"
0000000061.png,roGSDGC2qU0,60,5784,星暗通款曲!港媒傳許志安與小三交往2年
0000000095.png,roGSDGC2qU0,94,5808,"安仔出軌,鄭秀文心痛!不吃不喝火速搬離愛巢"
0000000114.png,roGSDGC2qU0,113,5832,"安仔出軌,鄭秀文心痛!不吃不喝火速搬離愛巢"
0000000002.png,cL6XCtnJ2YM,1,5856,許志安外遇童話破滅鄭秀文#拐杖粉絲心疼
0000000030.png,cL6XCtnJ2YM,29,5880,同公司相識許志安鄭秀文相差5歲陷熱
0000000039.png,cL6XCtnJ2YM,38,5904,許志安鄭秀文齊拿獎2002年廚房宣言放閃
0000000076.png,cL6XCtnJ2YM,75,5928,分手10年大復合修成正果被封香港最後一個童話”
0000000090.png,cL6XCtnJ2YM,89,5952,「許鄭“分合終结婚好友讀香港最後一個童話
0000000112.png,cL6XCtnJ2YM,111,5976,"情牽近30年安仔出動,香港最後一個童話破滅"
0000000001.png,wqmc-kTvxpA,1,6000,與鄭秀文情同姊妹假面港姐介入許志安婚姻
0000000039.png,wqmc-kTvxpA,38,6024,與鄭秀文情同姊妹假面港姐介入許志安婚姻
0000000065.png,wqmc-kTvxpA,64,6048,2012獲選港姐亞軍黃心穎外型亮麗身材姣好
0000000078.png,wqmc-kTvxpA,77,6072,「港藝圈發電機黃心穎情史豐富對象皆有婦之夫
0000000097.png,wqmc-kTvxpA,96,6096,心寒!介入安仔婚姻黃心穎道歉文末提鄭秀文
0000000007.png,7vuKzpVHl7M,6,6120,「獨立機關淪陷藍毒蘇回歸戒嚴伸手NCC
0000000036.png,7vuKzpVHl7M,35,6144,委副手掌權盛世獨立機關流蘇貞昌慰?」
0000000075.png,7vuKzpVHl7M,74,6168,NCC開罰中天藍委轟民進黨開民主倒車
0000000094.png,7vuKzpVHl7M,93,6192,甚至於他們甚至於應該要給申訴機會
0000000104.png,7vuKzpVHl7M,103,6216,直指NCC聽命於上面。盛批針對性處理
0000000033.png,SaR8GY-N_5Y,32,6240,陳明通:一國兩制消滅中華民國將予管制
0000000104.png,SaR8GY-N_5Y,103,6264,"質疑蔡回到戒嚴時代藍委不管台獨兩套標準,"
0000000002.png,jqZWDQZG0HI,1,6288,"能娃機大盜頭戴貌似人臉面具犯案,"
0000000035.png,jqZWDQZG0HI,34,6312,娃機大盜頭戴貌似柯P人臉面具犯案
0000000048.png,jqZWDQZG0HI,47,6336,強力磁鐵犯案!人臉面具怪客磁吸“娃機
0000000081.png,jqZWDQZG0HI,80,6360,「吸星大法!人臉面具怪客”吸“光娃機商品。
0000000001.png,cSyt8vSBVxI,1,6384,鳳梨銷星國!”6個月訂單超過去年全台總和
0000000043.png,cSyt8vSBVxI,42,6408,"梨銷星國!3個月訂單超過去年全台總和,"
0000000081.png,cSyt8vSBVxI,80,6432,同桌外銷星國25噸大勝去年全台總和16噸
0000000010.png,DyGLLyWJhCY,9,6456,酒駕此類害死人“被害者家屬痛徹心扉
0000000023.png,DyGLLyWJhCY,22,6480,年87人因酒駕亡!市府下猛藥赴殯儀館講習
0000000036.png,DyGLLyWJhCY,35,6504,靈堂掛白布!酒駕累犯面對87位往生亡靈
0000000074.png,DyGLLyWJhCY,73,6528,"震撼教育!中市43名酒駕累犯赴殯儀館上課,"
0000000001.png,qTzgnlfKgUA,1,6552,白瑟睛舒適明晚起鋒面近轉雷雨
0000000018.png,qTzgnlfKgUA,17,6576,铁氣悶熱外活動多補充水分
0000000045.png,qTzgnlfKgUA,44,6600,"週五起華南雲帶東移,局部雷雨明顯"
0000000072.png,qTzgnlfKgUA,71,6624,
0000000082.png,qTzgnlfKgUA,81,6648,
0000000092.png,qTzgnlfKgUA,91,6672,天晴舒適一明晚起鋒面轉雷雨
0000000118.png,qTzgnlfKgUA,117,6696,週外出備雨具山區濃霧
0000000001.png,zYx6TbYIMDA,1,6720,天氣轉熱说高敏燈換季保養有秘武
0000000031.png,zYx6TbYIMDA,30,6744,隐季天打折保養品成分要慎選
0000000069.png,zYx6TbYIMDA,68,6768,保養品母親節買氣旺禮盒包裝搶市
