0000000001.png,SzFFN_aw8fI,1,0,司公不滿廟公遭控擇2警兒助陣毆人
0000000019.png,SzFFN_aw8fI,18,24,当警察沒在怕?2警身分敏感勸架惹爭議
0000000036.png,SzFFN_aw8fI,35,48,不爽主委幫瓷出氣?2勢兒勸架變打架?
0000000067.png,SzFFN_aw8fI,66,72,最理國務爆不滿!主委嘴角遭歐滲血
0000000075.png,SzFFN_aw8fI,74,96,公不清廟公遭控擇2警弟助陣歐人
0000000002.png,zLokE5ddLFA,1,120,卡騙車手遭逮趁隙報信我被警察抓了
0000000034.png,zLokE5ddLFA,33,144,手遭逮通風報信阳警追查幕後集團
0000000052.png,zLokE5ddLFA,51,168,高獲利喊頭徵人車手遭逮風險最高
0000000081.png,zLokE5ddLFA,80,192,車手遭逮通風報信勢將擴大追查偵辦
0000000002.png,mVTMcONr5TA,1,216,未接怒轟恐怖份子李毅自爆2年前曾訪綠營黨部
0000000034.png,mVTMcONr5TA,33,240,未接怒轟恐怖份子”李毅自爆2年前曾訪線營黨部
0000000062.png,mVTMcONr5TA,61,264,矛盾?師大教授范世平痛罵武統卻與李毅會面
0000000088.png,mVTMcONr5TA,87,288,"三毅曾訪民進黨部丁允恭;僅交流,無關工作,"
0000000001.png,4oOMz1zrNkY,1,312,書店翻版!好吃但播中天“蒸飯店遭網友負評
0000000047.png,4oOMz1zrNkY,46,336,天的活着中天遭負評艺間戲稱客來吃電視
0000000068.png,4oOMz1zrNkY,67,360,"卡鎖頻,摇控器可隨意轉顧客卻故意下負評"
0000000090.png,4oOMz1zrNkY,89,384,書店翻版!好吃但播中天”蒸飯店遭網友負評
0000000023.png,0k-YNLWWGGo,22,408,中天新聞抱不平!僑胞真理永遠戰勝
0000000001.png,KZW7ipZtGpE,1,432,寺要張雨生天海”韓時此款像回到蓬勃年代
0000000031.png,KZW7ipZtGpE,30,456,不只月亮代表我的心!韓年筹追女也唱我一見你就笑
0000000057.png,KZW7ipZtGpE,56,480,讓前任DJ韓爆年轻追女友情歌我一見你就笑
0000000087.png,KZW7ipZtGpE,86,504,大學超愛這首歌!韓點播ThePowerOfLove
0000000002.png,gRor3eGmIyA,1,528,水節被圍攻!侯友宜開水槍反擊
0000000053.png,gRor3eGmIyA,52,552,水則發!新北市潑水節熱鬧登場
0000000016.png,K62tJW9WBjA,15,576,大膽預言!王世堅韓國瑜返台將宣布參選2020
0000000053.png,K62tJW9WBjA,52,600,只差一步王世堅韓國瑜在等太陽繳械交心
0000000092.png,K62tJW9WBjA,91,624,“初學家王世堅斷定2020三腳督一藍一綠一陣
0000000007.png,CFt2MTevPf0,6,648,"參加科技論壇身體微恙韓不停咳嗽,并探」眼,"
0000000024.png,CFt2MTevPf0,23,672,重時忍不住要水喝韓國瑜出席論壇顯疲態
0000000056.png,CFt2MTevPf0,55,696,給我幾分鐘喘口氣“韓國瑜抓空檔時間離場休息
0000000070.png,CFt2MTevPf0,69,720,身體微恙!韓國瑜出席波士頓晚宴不斷揉眼鼻
0000000086.png,CFt2MTevPf0,85,744,王咳自嘲“小李飛刀主角韓:身體差卻武功強
0000000030.png,oBq-B_zdFkU,29,768,訂召韓選總統!國民黨議會周三提案
0000000066.png,oBq-B_zdFkU,65,792,是要韓國瑜!韓粉號召4/18機場接機|
0000000104.png,oBq-B_zdFkU,103,816,"設要韓國瑜藍基層連署徵召韓戰2020,"
0000000002.png,HjjZ1V_rifs,1,840,現車買菸腳麻撞超商平車店內
0000000015.png,HjjZ1V_rifs,14,864,為了買菸賠很天駕駛腳麻誤踩油門|
0000000047.png,HjjZ1V_rifs,46,888,遭猛撞翻車駕駛輕傷車窗院
0000000065.png,HjjZ1V_rifs,64,912,驚險瞬間高速直行撞餐車休旅車頭全毀
0000000008.png,gupEGrFLHxw,7,936,"不讓僑胞失望!韓國瑜當人形立牌跟粉絲合照,"
0000000043.png,gupEGrFLHxw,42,960,"肉偿不適韓國瑜頻深鼻子眼睛,笑容僵硬」"
0000000055.png,gupEGrFLHxw,54,984,黑兩度大口嘆氣韓行程滿檔體力透支
0000000073.png,gupEGrFLHxw,72,1008,晨5點忙到晚上10點韓國瑜訪美成爆肝行程
0000000007.png,DyymQR_I-gE,6,1032,"香胞搶排隊合照韓國瑜,李佳芬成人型立牌,"
0000000068.png,DyymQR_I-gE,67,1056,"國造訪洛杉磯美華裔眾議員送榮譽狀,"
0000000086.png,DyymQR_I-gE,85,1080,"韓國瑜選總統,晚宴僑胞狂喊長達1分鐘"
0000000002.png,Pxwc-M9BRz4,1,1104,2000强不强?韓國美国行三度明年1月見
0000000035.png,Pxwc-M9BRz4,34,1128,"號」衛中華民國學國父為例韓演說拉高層級,"
0000000063.png,Pxwc-M9BRz4,62,1152,流起現象韓國衛民心思變的象徵
0000000104.png,Pxwc-M9BRz4,103,1176,韓國瑜訪美談話寒冰只差沒說我要選”
0000000005.png,vjdROhxVxbA,4,1200,曾國瑜僑宴離場壯觀僑胞站椅搶拍好不指
0000000019.png,vjdROhxVxbA,18,1224,曾國瑜離場壯觀僑胞站椅搶拍好不捨
0000000043.png,vjdROhxVxbA,42,1248,國瑜進場奮激動後排僑胞椅德看
0000000087.png,vjdROhxVxbA,86,1272,喬胞晚宴不吃飯拿桌次牌排隊合照韓國瑜
0000000097.png,vjdROhxVxbA,96,1296,大螢幕秀“安静”維持秩序韓粉展現團隊精神
0000000001.png,8QF3YjMOfIw,1,1320,再好吃都不值“烤鴨店遭霸凌民眾前來聲援
0000000012.png,8QF3YjMOfIw,11,1344,再好吃都不值“烤鴨店遭霸凌民眾前來聲援
0000000082.png,8QF3YjMOfIw,81,1368,南好吃都不值“烤鴨店遭霸凌民眾前來獨
0000000084.png,5qI1g33GXi4,83,1392,"王丹熊奶奶熊海靈乖孫,台灣不歡迎你"
0000000007.png,8ukmPe6-gmY,6,1416,美國滑板讓現身台北驚險公設溜滑板
0000000030.png,8ukmPe6-gmY,29,1440,頭遊樂園?U型地下道頂溜滑板
0000000057.png,8ukmPe6-gmY,56,1464,滑板溜屋頂修摔路邊民眾:太危險
0000000071.png,8ukmPe6-gmY,70,1488,美國滑板冠軍現身台北驚險公設溜滑板
0000000086.png,8ukmPe6-gmY,85,1512,一頭遊樂園?U型地下道屋頂溜滑板
0000000004.png,zf1qqw5L82I,3,1536,請書10口齊桓韓國瑜混血孫先超吸睛
0000000018.png,zf1qqw5L82I,17,1560,深谈五官高挑良材“歸亞蕾混血孫女明星味十足”
0000000060.png,zf1qqw5L82I,59,1584,“經費選總統”歸亞蕾一家10口全出動
0000000001.png,a3wY4vAL01A,1,1608,總統級天進場重現近千韓粉喊:選總統救台灣
0000000026.png,a3wY4vAL01A,25,1632,三造勢重現!韓國瑜出席僑宴韓粉瘋狂
0000000035.png,a3wY4vAL01A,34,1656,于詹胞熱情包圍韓國瑜親民握手致意
0000000050.png,a3wY4vAL01A,49,1680,僑胞熱情搶握韓國瑜韓粉熱情喊:總統加油”
0000000069.png,a3wY4vAL01A,68,1704,統級大進場藍粉盡情包圍20公尺走5分鐘
0000000087.png,a3wY4vAL01A,86,1728,"記者游指润鞋韓國瑜暖心等鞋穿好再繼續走,"
0000000129.png,a3wY4vAL01A,128,1752,韓流襲洛城!史上最盛大信宴韓粉搶看韓國瑜
0000000001.png,Nr69Ssr57eE,1,1776,"一打方向燈直接轉後方騎士閃避不及,"
0000000002.png,ts74l4tFLkw,1,1800,"共體選總統僑胞晚宴響起,台灣有你真好"
0000000019.png,ts74l4tFLkw,18,1824,台灣有你真好”僑胞晚宴歌曲共韓選總統
0000000083.png,ts74l4tFLkw,82,1848,晚宴起“台灣有你真好”防韓大選
0000000001.png,ngrygy82-o4,1,1872,卡哇伊!稻田長出“企鵝家族”成最夯打卡點
0000000048.png,ngrygy82-o4,47,1896,程回路正夯!熊大兔兔也在稻田裡
0000000078.png,ngrygy82-o4,77,1920,卡哇伊!稻田長出企鵝家族”成最夯打卡點
0000000001.png,ZuySUw1Uv14,1,1944,回来干節連三週水花狂歡舞不停
0000000026.png,ZuySUw1Uv14,25,1968,回来干節連三週水花狂歡舞不停
0000000050.png,ZuySUw1Uv14,49,1992,回来干節連三週水花狂歡舞不停
0000000003.png,ZsS22mzRN14,2,2016,弦外之音?韓與僑胞晚宴唱國歌引述國父精神
0000000038.png,ZsS22mzRN14,37,2040,弦外之音?韓與僑胞晚宴唱國歌引述國父精神
0000000063.png,ZsS22mzRN14,62,2064,僑胞拱韓國瑜選總統晚宴現自製韓總統紀念酒
0000000084.png,ZsS22mzRN14,83,2088,僑胞簇擁淹沒市長韓國瑜站上椅子揮手|
0000000103.png,ZsS22mzRN14,102,2112,參與晚宴僑胞熱情難再續明年1月返台投票
0000000001.png,soSR8bx2n7I,1,2136,最奇缘杯直立桌裙連續10天未掉落
0000000025.png,soSR8bx2n7I,24,2160,最奇缘杯直立桌裙連續10天未掉落
0000000048.png,soSR8bx2n7I,47,2184,廟方請示土地公婆杯直立懸空等待有緣人
0000000077.png,soSR8bx2n7I,76,2208,"关机直立刻桌裙顯神蹟?民俗專家:魔鬼蛋原理,"
0000000006.png,z__p8KMrodw,5,2232,達文西手術爆疑A錢健保署查金額高達3.55億
0000000047.png,z__p8KMrodw,46,2256,最大弊端達文西手術疑A健保3.55億北醫居冠
0000000089.png,z__p8KMrodw,88,2280,達文西手術爆疑A錢健保署查金額高達6.55億
0000000001.png,_-p-uTBz3dk,1,2304,說還要拱韓選2020.基層藍營內香理署
0000000012.png,_-p-uTBz3dk,11,2328,“選總統救台灣“韓粉热韓國瑜參戰2020
0000000022.png,_-p-uTBz3dk,21,2352,"杏昌發起連署逾4萬份将上接機,"
0000000060.png,_-p-uTBz3dk,59,2376,要抵韓選2020.基層藍營內齊連署
0000000086.png,_-p-uTBz3dk,85,2400,"地體連署書已4萬多份目標韓返台資10萬份,"
0000000001.png,ykiXVK944l4,1,2424,"宮門前抬棺抗議撒冥纸!不滿遭詐賭6百萬,"
0000000035.png,ykiXVK944l4,34,2448,"屋主疑詐賭3百萬豪宅前遭抬棺,撒冥紙抗議"
0000000070.png,ykiXVK944l4,69,2472,豪宅門前抬棺抗議撒冥紙不滿遭詐賭3百萬
0000000002.png,sH1gBgcvgkA,1,2496,"借1萬元拿不回反被砍男手掌大腿刀傷送醫,"
0000000024.png,sH1gBgcvgkA,23,2520,借1萬元拿不回反被砍男手掌大腿刀傷送醫
0000000033.png,sH1gBgcvgkA,32,2544,欠酒錢託友談判一言不合持刀械當街砍人
0000000014.png,aCDzsUTVTVM,13,2568,出席洛杉磯僑宴龍疲憊忍不住大嘆一口氣
0000000031.png,aCDzsUTVTVM,30,2592,"咳嗽换眼又操韓美鐵人行程累出病來,"
0000000046.png,aCDzsUTVTVM,45,2616,連咳忍不住要水喝韓出席論壇顯疲態
0000000080.png,aCDzsUTVTVM,79,2640,“給我幾分鐘喘口氣“韓抓準空檔時間離場休息
0000000088.png,aCDzsUTVTVM,87,2664,身體微恙!韓出席波士頓晚宴不斷揉眼鼻”
0000000101.png,aCDzsUTVTVM,100,2688,"自嘲“李飛刀主角韓國瑜身體差卻成功高強,"
0000000012.png,vNuD3vRRnW4,11,2712,"酒駕騎士醉撞捲車底熱心民眾抬車救人,"
0000000024.png,vNuD3vRRnW4,23,2736,酒後騎車!天雨擦撞轎車騎士捲車底
0000000056.png,vNuD3vRRnW4,55,2760,酒駕撞捲車底熱心民眾抬車救人
0000000001.png,QkkGaJpKtiU,1,2784,"路回頭禍償撞電桿孕婦斷牙,"
0000000033.png,QkkGaJpKtiU,32,2808,"母子過馬路被捲車底路人44秒抬車救人,"
0000000062.png,QkkGaJpKtiU,61,2832,母子過馬路被捲車底路人44秒抬車救人
0000000003.png,Js-TMGcJRFs,2,2856,"暗喻選2020?僑胞喊選總統韓明年1月11見,"
0000000065.png,Js-TMGcJRFs,64,2880,粉絲製影片热韓參選2020你是我的陽光
0000000085.png,Js-TMGcJRFs,84,2904,粉絲製影片热韓參選2020你是我的陽光
0000000002.png,EtKUb97TE00,1,2928,自小客撞機車衝進水溝翻覆駕駛稱拖鞋卡住
0000000032.png,EtKUb97TE00,31,2952,拖鞋卡踏板無法重自小客撞機車衝進水溝翻
0000000056.png,EtKUb97TE00,55,2976,"自撞機車衝進水溝翻覆駕駛稱拖鞋卡住,"
0000000001.png,lxWbCIhrBr0,1,3000,監理所刷卡繳罰單逾4千萬手續費恐全民買單
0000000028.png,lxWbCIhrBr0,27,3024,罰錢手續費全民幫繳?地方政府民眾反彈
0000000074.png,lxWbCIhrBr0,73,3048,處理罰緩手續費惹議交通部國發會討論中
0000000003.png,3wWgeCdcgYM,2,3072,獨家曝光!韓粉超用心做Q版韓國瑜紅包
0000000024.png,3wWgeCdcgYM,23,3096,獨家迎韓馬不停蹄限量美元韓國瑜紅包|
0000000070.png,3wWgeCdcgYM,69,3120,獨家「韓國瑜創造韓流學者譽他是政治新星
0000000107.png,3wWgeCdcgYM,106,3144,韓非典政治人物學者用大眾語言意地方選舉
0000000141.png,3wWgeCdcgYM,140,3168,獨家韓國創造韓流學者響他是政治新星
0000000010.png,JSXtxEclkh0,9,3192,招商座談開嗓!重要阮背一通會員讀:給高分!
0000000045.png,JSXtxEclkh0,44,3216,最強記憶力!韓唱“山”重要山脈背一遍
0000000085.png,JSXtxEclkh0,84,3240,英文台語都能唱!韓國瑜好歌喉訪美再開嗓
0000000005.png,VNIBxIu9NBc,4,3264,"韓國瑜晚宴餐敘僑胞熱情高聲大喊選總統,"
0000000019.png,VNIBxIu9NBc,18,3288,"僑胞呼“立刻徵召“韓國瑜民調勝朱,王"
0000000078.png,VNIBxIu9NBc,77,3312,"順應拱韓民意王金平鲜腳石轉身,墊腳石?"
0000000008.png,MmIh85iZlMI,7,3336,英德內戰開打賴請蔡要求網軍停止對我攻擊
0000000039.png,MmIh85iZlMI,38,3360,察幕僚重炮批賴”把誠信檢視當成網軍攻擊
0000000003.png,lHYuxB3Vy2w,2,3384,價差十倍轎車違規左轉撞休旅車賠償“吃力了
0000000029.png,lHYuxB3Vy2w,28,3408,安全第遭爆開零件噴飛兩車皆車頭全毀
0000000047.png,lHYuxB3Vy2w,46,3432,價差十倍護車違規左轉撞休旅車賠償吃力了
0000000066.png,lHYuxB3Vy2w,65,3456,價差十倍護車違規左轉撞休旅車賠償吃力了
0000000003.png,E3wpLRcxjIM,2,3480,當童!?塘見2歲童哭泣落單竟
0000000036.png,E3wpLRcxjIM,35,3504,隔壞了女童跟嬤購物被陌生婦抱回賣場
0000000083.png,E3wpLRcxjIM,82,3528,警方介入調查釐清是否真有“擄童事件
0000000015.png,Md9CQBOhK7c,14,3552,"逆子持水果刀刺母母背上插刀送醫不治,"
0000000047.png,Md9CQBOhK7c,46,3576,台中太平逆倫慘案男子酒後持水果刀刺母亡
0000000005.png,-jUnTYMkP1w,4,3600,參加科技座談會招商女創業家喊韓國瑜“英雄”
0000000016.png,-jUnTYMkP1w,15,3624,韓國瑜用心招商洛杉磯創業家記憶深刻
0000000046.png,-jUnTYMkP1w,45,3648,韓國瑜用心招商洛杉磯創業家記憶深刻
0000000003.png,Tg10UH2C_yE,2,3672,"設要韓國瑜」藍營基層連署徵召出戰2020,"
0000000074.png,Tg10UH2C_yE,73,3696,徵召韓選總統?國民黨議會週三提案
0000000097.png,Tg10UH2C_yE,96,3720,還要韓國瑜藍營基層連署信昌出戰2020
0000000001.png,vxPousoT2L0,1,3744,“總統參選人“等級!韓訪美維安高規格
0000000045.png,vxPousoT2L0,44,3768,高度重視!洛城市政廳假日為韓國瑜而開」
0000000074.png,vxPousoT2L0,73,3792,理假期!洛城副市長高規格接待韓
0000000127.png,vxPousoT2L0,126,3816,超越市長規格!韓訪美重申“總統級願望
0000000003.png,naXxn0pkRsM,2,3840,2020選不選?!韓國瑜摸心目前不在範疇」
0000000036.png,naXxn0pkRsM,35,3864,2020選不選?!韓國瑜又摸心避回答
0000000046.png,naXxn0pkRsM,45,3888,歐韓流風起韓國瑜:民心思變的象徵
0000000070.png,naXxn0pkRsM,69,3912,重話批“台灣鬼混20年經濟競爭力已殘廢
0000000005.png,kY7k6BG2qac,4,3936,體與僑胞晚宴唱國歌學孫中山精神弦外之音?
0000000064.png,kY7k6BG2qac,63,3960,參與晚宣僑胞熱情難再箭明年1月返台投票
0000000078.png,kY7k6BG2qac,77,3984,陪韓國瑜參加僑胞晚宴李佳芬細心幫調領帶
0000000098.png,kY7k6BG2qac,97,4008,"「僑胞韓國瑜選總統晚宴現自製韓總統紀念酒”,"
0000000001.png,FjUnZ1hG2Gk,1,4032,統級天進場藍粉狂喊「選總統救合
0000000042.png,FjUnZ1hG2Gk,41,4056,"體展親民,對眼握手”貼心等記者穿鞋"
0000000089.png,FjUnZ1hG2Gk,88,4080,總統級“韓流襲「韓粉青韓國瑜新聞才睡
0000000005.png,Dje2sKZrbAg,4,4104,"洛杉磯僑宴星光熠熠藝人張俐敏,歸亞蕾到場,"
0000000028.png,Dje2sKZrbAg,27,4128,張敏親送雞湯盼韓走更長遠的路
0000000044.png,Dje2sKZrbAg,43,4152,"顏國晚宴擠爆張琍敏,應辦在體育館"
0000000071.png,Dje2sKZrbAg,70,4176,陷杉磯僑宴擠爆韓國瑜明星臉成焦點
0000000001.png,SxYJhJYiNBw,1,4200,韓冰雜誌美照再曝光透視裙大秀美腿
0000000055.png,SxYJhJYiNBw,54,4224,"氣眼神,POSE專業韓冰自曝不爱拍照"
0000000086.png,SxYJhJYiNBw,85,4248,"韓粉存起來百變韓冰雜誌美照曝光,"
0000000002.png,3jLrKhGBFu8,1,4272,隨貨車油箱起火重機騎士摔車被燒成焦屍
0000000041.png,3jLrKhGBFu8,40,4296,"重機騎士魂斷蘇花""感謝老婆”成最後PO文"
0000000068.png,3jLrKhGBFu8,67,4320,重機騎士魂斷蘇花”感謝老婆”成最後PO文
0000000003.png,v_FjbX6oZ20,2,4344,食快釀禍償違規左轉彎撞直行車
0000000036.png,v_FjbX6oZ20,35,4368,腿跨“五線左轉償違規釀禍四輪朝天
0000000065.png,v_FjbX6oZ20,64,4392,會供過償違規左轉彎撞直行車
0000000002.png,nhu2Ejlo0O8,1,4416,重機環島魂斷花蓮除書最後留言詞謝老婆
0000000025.png,nhu2Ejlo0O8,24,4440,"隱撞車起火重機騎士飛進軍斗燒死,"
0000000048.png,nhu2Ejlo0O8,47,4464,"重機環島魂斷花蓮臉書最後留言詞謝老婆,"
0000000057.png,nhu2Ejlo0O8,56,4488,險撞貨車起火重機騎士飛進車斗遭燒死
0000000001.png,de4yTnlMlBU,1,4512,"拖鞋卡住油門踏板“撞飛騎士駕駛翻車摔溝,"
0000000018.png,UAVRhfgIRQA,17,4536,沒意見想怎樣我都隨便
0000000039.png,UAVRhfgIRQA,38,4560,"感翻唱演員”薛之謙攻蛋首場邀Hebe合唱,"
0000000090.png,UAVRhfgIRQA,89,4584,陸首歌手攻蛋薛之謙開唱邀Hebe合唱演員”
0000000001.png,i13-Y7gaPW0,1,4608,崩潰手滑LINE傳錯好多巴蘭收回也晚了
0000000025.png,i13-Y7gaPW0,24,4632,收回來不及!手滑LINE傳錯人快換桌布救你
0000000041.png,i13-Y7gaPW0,40,4656,LINE收回“更有用網熱推“防錯頻桌布”
0000000062.png,i13-Y7gaPW0,61,4680,"雷鹏UINE改設定防錯按Alt+Enter才能傳訊,"
0000000076.png,i13-Y7gaPW0,75,4704,随私人內容傳到工作群組?快换防錯頭桌布
0000000001.png,46o1hsvIENw,1,4728,萌犬隨你挑!美警搭韓流賣公仔做公益
0000000018.png,46o1hsvIENw,17,4752,"體到人潮就到美警“嗅出商機賣犬公仔,"
0000000042.png,46o1hsvIENw,41,4776,曾園背心超精警犬玩偶義賣盼韓粉買單
0000000062.png,46o1hsvIENw,61,4800,“人進來貨出去美警也懂僑宴會場義賣玩偶
0000000012.png,rPT8RgnG6OQ,11,4824,體國洛杉磯僑宴美國警方高規格維安
0000000043.png,rPT8RgnG6OQ,42,4848,韓流襲LA!美高規格維安媲美總統參選人
0000000001.png,2Vmrd0x34nY,1,4872,騎車違規左轉擦撞600萬休旅挨撞成廢鐵
0000000040.png,2Vmrd0x34nY,39,4896,隨車左轉聲連撞2機車釀6傷
0000000069.png,2Vmrd0x34nY,68,4920,「重約左轉連撞2機車讓心傷
0000000001.png,MM_5_QnqeE4,1,4944,韓國瑜洛城首站參訪高科技廣告公司
0000000067.png,MM_5_QnqeE4,66,4968,年產值百萬美金超狂效率震撼韓國瑜
0000000015.png,dXrgau142lE,14,4992,「真人版“獅空“預告曝1994年場景神還原
0000000028.png,dXrgau142lE,27,5016,真人版“預告曝彭彭丁滿現身
0000000064.png,dXrgau142lE,63,5040,真人版“阿拉宁“保留歌舞場面十經典神曲
0000000090.png,dXrgau142lE,89,5064,迪士尼2009真人電影三部曲搬家率先上映
0000000001.png,7qIVyzxzN4o,1,5088,南天宮關帝爺遶境風雨無阻布施白米
0000000022.png,7qIVyzxzN4o,21,5112,南天宮關帝爺遶境国雨無阻布施百米
0000000046.png,7qIVyzxzN4o,45,5136,南天宮關帝爺遶境国雨無阳布施自来
0000000032.png,OkzCHjVa09k,31,5160,毛頭加油!旅美著村好友讀韓有正義感
0000000066.png,OkzCHjVa09k,65,5184,壽德之光!鄰居談韓國瑜小名“大毛頭
0000000022.png,2wJqGnG5Mh4,21,5208,700人晚宴座無虛席韓粉大廳守韓國瑜
0000000064.png,2wJqGnG5Mh4,63,5232,大批僑胞影大廳僑宴飯店大廳擠爆
0000000095.png,2wJqGnG5Mh4,94,5256,洛杉磯僑胞晚宴將登場飯店熱鬧滾滾
0000000108.png,2wJqGnG5Mh4,107,5280,只為巧遇韓緩韓粉聚飯店大廳守候
0000000008.png,_eHGHWNMiCU,7,5304,「訪美鐵人人行程!韓國瑜李佳芬身體不適
0000000024.png,_eHGHWNMiCU,23,5328,"逾6小時航程:李佳芬椅壞90度坚挺重機,"
0000000046.png,_eHGHWNMiCU,45,5352,趕緊補眠佳芬姐過敏量機韓長好擔心
0000000068.png,_eHGHWNMiCU,67,5376,韓國瑜、李势氣色漸變續辩超人行程
0000000012.png,aaXg9poR09g,11,5400,他說美國必須改變目前的立場
0000000022.png,aaXg9poR09g,21,5424,"金正恩列川金三會條件韓人也吃驚,"
0000000035.png,aaXg9poR09g,34,5448,美要朝全面棄核北韓只願逐步削減軍備
0000000065.png,aaXg9poR09g,64,5472,金正恩川金會等美國改變立場
0000000077.png,aaXg9poR09g,76,5496,美朝“廢核“立場不同川金三會卡關
0000000001.png,MQyT3PpjEOc,1,5520,今東北季風增全台有雨週二再迎強鋒面
0000000025.png,MQyT3PpjEOc,24,5544,東部中南部短暫雨出門記得帶雨具
0000000048.png,MQyT3PpjEOc,47,5568,中南部局部陣雨暖濕天氣高溫達31度
0000000069.png,MQyT3PpjEOc,68,5592,水氣增!台中以北短暫雨中南部山區局部雨
0000000079.png,MQyT3PpjEOc,78,5616,下風處擴散條件差嘉南高屏空品橘色提醒
0000000096.png,MQyT3PpjEOc,95,5640,週二到三強鋒面通過全台劇烈天氣有雷雨
0000000125.png,MQyT3PpjEOc,124,5664,週四週五水氣北移未來一週天氣均不穩定
0000000002.png,CQLUKdDZUFQ,1,5688,北京國際電影節開幕女鬥艷走紅毯
0000000057.png,CQLUKdDZUFQ,56,5712,北京電影節”天壇獎”十大最佳20日出爐
0000000068.png,CQLUKdDZUFQ,67,5736,科技與藝術結合VR電影蓄勢待發
0000000087.png,CQLUKdDZUFQ,86,5760,2018中國票房1678億讓寶影票房
0000000004.png,TT2Ut8TdHxE,3,5784,"霉味撲鼻叭鎖店免費白飯蹤發貨隔夜飯,"
0000000038.png,TT2Ut8TdHxE,37,5808,宏聞起來好像有一點發霉味
0000000050.png,TT2Ut8TdHxE,49,5832,"吃到發黃隔夜飯店家致歉,服務生首日上班"
0000000073.png,TT2Ut8TdHxE,72,5856,店家坦承疏失員工訓練不足毀店響
0000000018.png,ocUQpVy9yeI,17,5880,遭批偷襲賴清德視、批評言論為網軍攻擊
0000000062.png,ocUQpVy9yeI,61,5904,談黨內初選蔡英文:同舟共濟“才有護力量
0000000083.png,ocUQpVy9yeI,82,5928,蔡英文坦承擔心初選分裂盡力維持黨內團結
0000000002.png,4sSdRjuD1F4,1,5952,睡不到6小時!韓市長早餐炒蛋狄腿”果腹
0000000031.png,4sSdRjuD1F4,30,5976,怎不見韓式養身操?市長改在房間做操
0000000054.png,4sSdRjuD1F4,53,6000,與老友見面心情好!韓長餐會憶童年趣事
0000000001.png,oJugoxmOTNQ,1,6024,美術班聯招吵雜高架橋下成辈休息區
0000000018.png,oJugoxmOTNQ,17,6048,室内座不足!外縣市生04:00是考剩戶外休息座
0000000029.png,oJugoxmOTNQ,28,6072,室內座不足!外縣市生04200經考剩戶外休息座
0000000047.png,oJugoxmOTNQ,46,6096,台北學生占滿休息座位?家長批外縣市遭歧視
0000000086.png,oJugoxmOTNQ,85,6120,家長怒教室被拉布條皆位校方:空間開放可共享
0000000004.png,H3JAuF4JYaA,3,6144,徵召韓選總統?國民黨北市議會週三提案
0000000039.png,H3JAuF4JYaA,38,6168,"徵召韓選總統,國民黨議會週三”提案"
0000000081.png,H3JAuF4JYaA,80,6192,徵召韓國瑜選2020藍肺議會開第一槍
0000000016.png,AlZFPrG2vIs,15,6216,"犧牲假日,洛杉磯副市長高規格接待"
0000000043.png,AlZFPrG2vIs,42,6240,韓國瑜受高度重視副市長假日接見
0000000062.png,AlZFPrG2vIs,61,6264,市政廳特例假開放只為接待韓國瑜
0000000083.png,AlZFPrG2vIs,82,6288,韓國瑜受重視的職副緩假冒接見
0000000001.png,mhQbDWW99UQ,1,6312,韓國瑜赴CA市政府會見第一副緩何契珍
0000000029.png,mhQbDWW99UQ,28,6336,假日會見小時!LA副高規接待韓國瑜
0000000053.png,mhQbDWW99UQ,52,6360,同為港都城中韓交流空污交通等議題
0000000082.png,mhQbDWW99UQ,81,6384,和鄭文燦互別苗頭韓關鍵之旅會LA副市長
0000000001.png,2EGXD4s5-ns,1,6408,台中太平驚爆逆倫慘案兒持刀刺死母親
0000000027.png,2EGXD4s5-ns,26,6432,嫌飲酒失控持刀刺每段人勸架也遭刺傷
0000000063.png,2EGXD4s5-ns,62,6456,嫌飲酒失控持刀刺每段人勸架也遭刺傷
0000000001.png,Jj64DCft1UM,1,6480,獨家專訪李佳芬談韓家選後生活改變
0000000087.png,Jj64DCft1UM,86,6504,與韓國瑜有摩擦李佳芬喝咖啡退一步就好
0000000059.png,ern-1YBHEmM,58,6528,"超越市長規格算訪美重申“總統級""願望"
0000000093.png,ern-1YBHEmM,92,6552,"韓拜會洛杉磯副市長,超越城市交流總統級問題"
