0000000005.png,sx3H7-k1guU,4,0,國瑜隔空傳情要親自致電祝母親節快樂
0000000044.png,sx3H7-k1guU,43,24,吉網友隔空傳情!韓國瑜12晚間直播CALLIN
0000000079.png,sx3H7-k1guU,78,48,"用友思念天上父親,韓國瑜直播哽咽"
0000000007.png,C-VEUIi42jQ,6,72,廷韓更上一層樓!瓊瑤:他是我最崇拜的人
0000000022.png,C-VEUIi42jQ,21,96,据臉書公開書大讀韓秃子月亮天地無雙
0000000049.png,C-VEUIi42jQ,48,120,之念不动價强结束高雄行返台北單點滴
0000000063.png,C-VEUIi42jQ,62,144,"文章結尾我怎能離開你,表達對高雄愛"
0000000023.png,TA41dqvU9nU,22,168,火毀天倫兒院險見罹難親大腿軟
0000000039.png,TA41dqvU9nU,38,192,文具店富燒2小時民眾罵翻對面消防隊竟沒雲梯車
0000000089.png,TA41dqvU9nU,88,216,支援雲梯車擺著好看火燒20時民罵翻
0000000026.png,o6j568-eyJI,25,240,中國製造洗產地?!遭打臉要洗現在就能洗
0000000060.png,o6j568-eyJI,59,264,"自經區遭中國製造產地""算重點還管理問題"
0000000071.png,o6j568-eyJI,70,288,媽曾挺自經區蒙卻批讓中國製造洗產地
0000000088.png,o6j568-eyJI,87,312,套標準?貴花媽賴清德挺自經區現自打臉?
0000000114.png,o6j568-eyJI,113,336,套標準?背花媽賴清德挺自經區現自打臉?
0000000037.png,CD9sKcwHwd4,36,360,"背後中槍變開槍,黨內暗箭韓國瑜後腿"
0000000012.png,7eDjPSLn5-Q,11,384,5/5就要看五月天家家加碼演唱知足”
0000000029.png,7eDjPSLn5-Q,28,408,馬莎破廣東話教學方頭“上海灘開金嗓
0000000062.png,7eDjPSLn5-Q,61,432,5/5就要看家家加碼演唱知足
0000000095.png,7eDjPSLn5-Q,94,456,五月天香港開唱合體家家陶唱“上海灘
0000000035.png,Opl0q2xy7fE,34,480,"打韓國民黨孫大千韓國瑜出力助KMT,"
0000000068.png,Opl0q2xy7fE,67,504,改意卡韓要韓國瑜被動初選還得繳500萬?
0000000099.png,Opl0q2xy7fE,98,528,吳敦義三招半韓保高層權疗張友驊非常不智
0000000008.png,-HHrkSiitGU,7,552,流行音樂全金榜最受歡迎男歌手王力宏捧三獎
0000000028.png,-HHrkSiitGU,27,576,王力宏合巨蛋演場會6月8-9日登場
0000000048.png,-HHrkSiitGU,47,600,王力宏合小巨蛋演場會6月8-9日登場
0000000064.png,-HHrkSiitGU,63,624,"王力宏加盟”中國好聲音,自信帶冠軍團"
0000000089.png,-HHrkSiitGU,88,648,全金榜十年實疗歌手領軍華語樂壇新人輩出
0000000001.png,Fc8Aa40P4Dk,1,672,童死高三生肇逃嫌藏匿于小時投案法院裁押
0000000015.png,Fc8Aa40P4Dk,14,696,西駕撞死少年落跑父署人地檢署绪嫌
0000000052.png,Fc8Aa40P4Dk,51,720,爱音樂課業優秀少年剛考上大學竟遇死劫
0000000079.png,Fc8Aa40P4Dk,78,744,西駕撞死少年落跑父親友地檢署署人
0000000004.png,A2PvH17x5gM,3,768,南方雲系及東北季風影響天氣依舊不穩
0000000025.png,A2PvH17x5gM,24,792,今北台偏凉高溫2度中南26度25度
0000000037.png,A2PvH17x5gM,36,816,比東有雨中南雨後整天偏涼
0000000061.png,A2PvH17x5gM,60,840,大雨特報高屏臺東南投嘉義臺南山區
0000000082.png,A2PvH17x5gM,81,864,午後水氣逐漸離開中南部可望轉多雲
0000000099.png,A2PvH17x5gM,98,888,周三至週五水氣減少午後降雨機率高
0000000116.png,A2PvH17x5gM,115,912,周末母親節天氣較穩各地多雲到晴
0000000125.png,A2PvH17x5gM,124,936,周三起東北季風減弱各地氣溫回升
0000000136.png,A2PvH17x5gM,135,960,周末母親節天氣較穩各地多雲到晴
0000000145.png,A2PvH17x5gM,144,984,東北季風晨低溫18至21度
0000000154.png,A2PvH17x5gM,153,1008,今北台偏涼高溫北22度中南26度東25度
0000000168.png,A2PvH17x5gM,167,1032,午後水氣逐漸離開中南部可望轉多雲
0000000187.png,A2PvH17x5gM,186,1056,東有雨中南雨後多雲壹整天偏涼
0000000208.png,A2PvH17x5gM,207,1080,南方雲系及東北季風影響天氣依舊不穩
0000000006.png,svpAe9NJfCA,5,1104,海根生了小王!新手爸哈利笑開懷
0000000037.png,svpAe9NJfCA,36,1128,不給梅根性小王子全程保有隱私
0000000050.png,svpAe9NJfCA,49,1152,凱特生產全球連線生完時就現身
0000000063.png,svpAe9NJfCA,62,1176,想看皇室寶寶熱情市民只能遙望古堡
0000000082.png,svpAe9NJfCA,81,1200,皇室寶寶第三順位皇室重任較少
0000000019.png,H4AfVZiOHpw,18,1224,外阴“全聯先生邱彥翔戲劇辩轉型
0000000050.png,H4AfVZiOHpw,49,1248,「黑湖會“畢業後淡出勇免戲劇回歸螢光幕|
0000000097.png,H4AfVZiOHpw,96,1272,當戲劇咖”全聯先生勇兔轉型丁噹想演戲
0000000002.png,tUDndOd4WSg,1,1296,左轉憑空”殺出雙載機車?騎士撞噴飛
0000000036.png,tUDndOd4WSg,35,1320,"舊車疑違規左轉機車女乘客雙腿骨折,"
0000000002.png,gtMDK-pA6Qk,1,1344,"購票網站導講多幾乎每天就有一件,"
0000000040.png,gtMDK-pA6Qk,39,1368,票價差超多!網站票價比官方高近4倍”
0000000087.png,gtMDK-pA6Qk,86,1392,超多購票秀”票快賣完讀秒倒數催買票
0000000002.png,YXPOjx7IOGs,1,1416,新車速過快!兩騎士路口相撞害兩傷
0000000035.png,YXPOjx7IOGs,34,1440,產業道路機車相撞騎士彈飛竟無礙
0000000002.png,GJmOFELm1ag,1,1464,鐵皮拔8電桿“地主不用通知竹市府已拆
0000000021.png,GJmOFELm1ag,20,1488,強逼買地不成就圍路惡劣行徑店家無奈
0000000044.png,GJmOFELm1ag,43,1512,強買強賣惡行一坪110萬飛了竹市府拆鐵皮拔8電料
0000000002.png,XERapobpScE,1,1536,求复合不成男子拿安全帽猛K前女友
0000000064.png,KvdoQmh6YUk,63,1560,天龍國鹽酥雞嚇到蔡阿嘎3樣竟要190元
0000000002.png,Q8OBa1NmSMo,1,1584,骑士撞轎車卡車底亡熱心民眾幫救援
0000000030.png,Q8OBa1NmSMo,29,1608,騎士慘死輪下肇事女駕駛崩潰痛哭
0000000001.png,eRnp-okY5Kk,1,1632,打破傳統教育創客季活動開跑
0000000022.png,eRnp-okY5Kk,21,1656,從生活玩科技!創客離華激發學生潛能
0000000048.png,eRnp-okY5Kk,47,1680,從生活玩科技!創嘉年華激發學生。
0000000002.png,hXNLp6RU8d8,1,1704,長出奇招反質詢民進黨團總召
0000000030.png,hXNLp6RU8d8,29,1728,反質詢總總習!高雄市議員齊噴笑
0000000057.png,hXNLp6RU8d8,56,1752,给韓市長團隊打幾分?绿總召變得友善積極
0000000097.png,hXNLp6RU8d8,96,1776,超越派蒂韓市府後總召局處長積值友善
0000000006.png,L6IzRERj6Rc,5,1800,帶學生進議會拍摄惹議!苗栗2縣議員場外怒槓
0000000021.png,L6IzRERj6Rc,20,1824,學生進議會拍攝採訪縣議員:經議長同意
0000000035.png,L6IzRERj6Rc,34,1848,生進議會拍攝遭趕秘書長非開會時間可以
0000000063.png,L6IzRERj6Rc,62,1872,帶學生進議會拍攝惹議!苗栗2縣議員場外怒槓
0000000002.png,hG4QHKKoEyA,1,1896,雷載客量米其林美食端上台鐵觀光列車
0000000018.png,hG4QHKKoEyA,17,1920,列車無法使用明火米其林美食僅供麵包糕點
0000000056.png,hG4QHKKoEyA,55,1944,觀光列車遭批俗氣台鐵成立美學小組改善
0000000086.png,hG4QHKKoEyA,85,1968,衝載客量米其林美食端上台鐵觀光列車
0000000002.png,DgOh8xGLC4o,1,1992,到玉荷包產量剩2成每公斤恐额1200元
0000000019.png,DgOh8xGLC4o,18,2016,雕下手玉荷包價恐狂翻1顆相當40元
0000000036.png,DgOh8xGLC4o,35,2040,受暖冬影響玉荷包價恐狂親1顆40元
0000000063.png,DgOh8xGLC4o,62,2064,冬產量銳減8成玉荷包每公斤恐上看1200元
0000000009.png,z2YeY4ub4Gw,8,2088,失火文具店當地經營60餘載居民感嘆
0000000040.png,z2YeY4ub4Gw,39,2112,失火文具店當地經營60餘載居民感嘆
0000000070.png,z2YeY4ub4Gw,69,2136,文具行火警1死3傷死者一家人幾乎全是義消
0000000003.png,npumtTRQT-I,2,2160,带美國隊長”上廣播賴喊不會經倒蔡
0000000098.png,npumtTRQT-I,97,2184,"3理由反對手懼民調賴清德沒母群體易作假,"
0000000006.png,LMAu8wUeKDI,5,2208,王者漫慶祝母親節員飛吻一個
0000000027.png,LMAu8wUeKDI,26,2232,去年父親節也辦過韓國瑜直播感動哽咽
0000000070.png,LMAu8wUeKDI,69,2256,"友隔空傳情!韓國12日晚間直播CALLIN,"
0000000005.png,T5Bxxt0cjRQ,4,2280,比達平均一天1人受傷多為“電扶梯”推擠導致
0000000027.png,T5Bxxt0cjRQ,26,2304,北捷4年受傷理賠2826萬元乘客動線可改善
0000000068.png,T5Bxxt0cjRQ,67,2328,北捷四天旅客易受傷車站北車128件居冠
0000000093.png,T5Bxxt0cjRQ,92,2352,捷運安全遭質疑種旅客受傷率持續下降
0000000001.png,-zo--0y7NfQ,1,2376,新型?6女控假貨真車貸背債換中古車
0000000038.png,-zo--0y7NfQ,37,2400,未清償又來!投訴人不會開車卻背40萬車貨
0000000092.png,-zo--0y7NfQ,91,2424,強調非詐騙!業者澄清符合法律程序
0000000001.png,7ra6UXxP86s,1,2448,顏清晨海清月酒菜色曝光黑萌魚干海帶超有氣
0000000031.png,7ra6UXxP86s,30,2472,冷盤不夠看!顏寬恒麻油雞油飯才是精華!
0000000047.png,7ra6UXxP86s,46,2496,顏董喜獲12金孫笑開懷席開10桌只宴親友
0000000068.png,7ra6UXxP86s,67,2520,顏清標练满月酒菜色曝光“黑鮪魚+海膽超霸氣
0000000009.png,Z1Sq39NJCzY,8,2544,批全中運對空氣致詞韓國打臉:8千位觀眾
0000000031.png,Z1Sq39NJCzY,30,2568,批全中運對空氣致詞韓國瑜打臉:8千位觀眾
0000000051.png,Z1Sq39NJCzY,50,2592,市議員逼簽青創MOO韓國瑜:5月成立籌備處
0000000080.png,Z1Sq39NJCzY,79,2616,韓國瑜五月夜宿地點”天社對空污出重拳
0000000108.png,Z1Sq39NJCzY,107,2640,市議員輪番開槍韓國瑜備詢見招拆招
0000000002.png,KCun6wwQ5Ww,1,2664,鄰居為停車反“亂移機車“感有着
0000000031.png,KCun6wwQ5Ww,30,2688,機車移至直線外險開單住戶蒐證怒提告
0000000065.png,KCun6wwQ5Ww,64,2712,騎士遭移車怒告強制罪“律師未有判例
0000000096.png,KCun6wwQ5Ww,95,2736,鄰居為侵重反目“亂移機車“恐有罪
0000000001.png,gYmcwCz6cu0,1,2760,1000元獎金沒了!PO中獎發票炫耀竟遭人冒領
0000000029.png,gYmcwCz6cu0,28,2784,全台首例冒領獎金!APP兌獎認OR-CODE不認人
0000000055.png,gYmcwCz6cu0,54,2808,離譜首例!FB暱中獎發票竟被兌獎APP盜領千元
0000000002.png,advzCsvpI4g,1,2832,知名網紅自由下藥性侵“借女友車到處劈腿
0000000048.png,advzCsvpI4g,47,2856,國知識型網紅曾做“八大“批軟飯男
0000000072.png,advzCsvpI4g,71,2880,下藥性侵不止一起受害女性漸浮面
0000000084.png,advzCsvpI4g,83,2904,"YouTube10萬訂閱知名網自由下藥性侵關版,"
0000000002.png,sw6iPC1sw_Q,1,2928,援引陳菊賴清德說法韓國瑜:陳賴也支持自經區
0000000065.png,sw6iPC1sw_Q,64,2952,朱世英故意混淆藍委批蔡總統裝睡叫不醒
0000000002.png,dqgAGYOePwM,1,2976,"體飽受抹黑之苦藍議員揭密黑韓網軍分兩種,"
0000000030.png,dqgAGYOePwM,29,3000,系統性發文攻擊韓羅智強喻“天野狼軍團
0000000054.png,dqgAGYOePwM,53,3024,"【體路四處威脅抹黑?羅智強三假韓粉,"
0000000093.png,dqgAGYOePwM,92,3048,"假體頻散布威脅論韓國瑜怒,應立刻報"
0000000005.png,THmHyG1kAbc,4,3072,抓到了!黑韓網軍遭質疑就是民進黨議員
0000000015.png,THmHyG1kAbc,14,3096,好眼熟!黑韓專頁影背景竟是議員辦公室
0000000095.png,THmHyG1kAbc,94,3120,抓到了?!黑龍细軍遭質疑就是民進黨議員
0000000003.png,L0bUuY0309o,2,3144,公車司機不滿遭擋道拔刀出鞘要砍人
0000000018.png,L0bUuY0309o,17,3168,公車直刀?!司機撞50公分西瓜口味婦人
0000000031.png,L0bUuY0309o,30,3192,公車司機揮刀實錄車上母女嚇到發抖
0000000051.png,L0bUuY0309o,50,3216,目擊司機亮刀公車上母女發抖瑟縮
0000000079.png,L0bUuY0309o,78,3240,家需要不到道歉客運公司開除司機急切割
0000000114.png,L0bUuY0309o,113,3264,公車司機不滿遭滑道拔刀出鞘要砍人
0000000001.png,off6VXHz8FI,1,3288,"回想酒駕醉撞死路人肇事男竟找頂罪,"
0000000026.png,off6VXHz8FI,25,3312,回酒駕撞死路人肇事男竟找頂罪
0000000044.png,off6VXHz8FI,43,3336,"回想酒駕醉撞死路人肇事男竟找妻頁罪,"
0000000066.png,off6VXHz8FI,65,3360,障撞兩路人釀一死肇事男竟想找太太頂罪”
0000000002.png,uGyOEjXA3iY,1,3384,暗夜惡火一家四口一二命危一傷
0000000026.png,uGyOEjXA3iY,25,3408,惡火阻逃四口受困屋主兒跳隔壁頂樓脫險
0000000049.png,uGyOEjXA3iY,48,3432,野天倫!主脫險見罹難親人腿軟
0000000069.png,uGyOEjXA3iY,68,3456,"陆惡火燒民當朝對面消防隊竟沒雲梯車,"
0000000099.png,uGyOEjXA3iY,98,3480,支援雲梯車擺著好看?!民眾質疑延誤救援
0000000001.png,e94LLI45M9E,1,3504,路口憑空衝出機車?女騎上高速撞上轎車
0000000015.png,e94LLI45M9E,14,3528,哪來的機車?違規左轉突接撞轎車駕駛陆營
0000000045.png,e94LLI45M9E,44,3552,「跟著“左轉?轎車群業體違規騎士撞噴飛
0000000078.png,e94LLI45M9E,77,3576,未注意路況出“撞”況雙載女乘客雙腿骨折
0000000002.png,kGO_iF9HqDo,1,3600,只開英語字墓”韓次分享學英文撇步
0000000031.png,kGO_iF9HqDo,30,3624,教學弟妹看影集學英文韓冰玩笑別我麟話多的
0000000050.png,kGO_iF9HqDo,49,3648,高中時期演出舞台劇韓冰秀流利英文
0000000079.png,kGO_iF9HqDo,78,3672,成交英文小老師!韓冰常幫聽演講練習
0000000002.png,DVt9kAstJ8Q,1,3696,求鳴人!LadyGaga時尚奧斯卡連4變
0000000033.png,DVt9kAstJ8Q,32,3720,"脱脱!百變朱浮誇,復古全到位"
0000000054.png,DVt9kAstJ8Q,53,3744,搞怪卡卡脫到剩內衣網驚:無人能超越”;
0000000072.png,DVt9kAstJ8Q,71,3768,"金卡戴珊深V裙凱蒂佩芮變身獨燈,"
0000000002.png,5QzVg1zD4r4,1,3792,吃不消高麗菜一顆逾175元同名便當錢
0000000015.png,5QzVg1zD4r4,14,3816,高麗菜好貴一顆逾175元等同6便當錢
0000000038.png,5QzVg1zD4r4,37,3840,高麗菜量少價持續翻漲菜販恐再持續2周
0000000059.png,5QzVg1zD4r4,58,3864,"高麗菜量少價持續翻漲菜販,恐再持續2周"
0000000071.png,5QzVg1zD4r4,70,3888,"連續鋒面襲地瓜葉價格漲至一斤65元,"
0000000007.png,Gorp3X3Ks4o,6,3912,VIANLABEAUTE熱彎成功挑戰金氏紀錄
0000000032.png,Gorp3X3Ks4o,31,3936,VIANLABEAUTE熱蠟除毛搶攻熱商機
0000000056.png,Gorp3X3Ks4o,55,3960,VIANLABEAUTE熱蠟除毛搶攻熱商機。
0000000001.png,1bi-Mqr4VPY,1,3984,體方破販毒集團意外查違建毒窟遭翻印
0000000049.png,1bi-Mqr4VPY,48,4008,些方破販毒集團意外查違建毒窟遭劑
0000000001.png,PlOSLENFeo0,1,4032,租透天厝集中管理“低調機房仍遭攻破
0000000044.png,PlOSLENFeo0,43,4056,警破代號淘寶許團假公安詳對岸6千萬
0000000079.png,PlOSLENFeo0,78,4080,台灣許刑“比較低?警破透天厝機房全收押
0000000032.png,UPbaxJZaJ3k,31,4104,費玉苦別演唱會本週末高雄巨蛋開唱
0000000051.png,UPbaxJZaJ3k,50,4128,"吳宗憲月高雄演唱會盼與韓國瑜同框,"
0000000001.png,oafaWvLNpgc,1,4152,"黑湾海海富天際!后里輪胎工廠陷火海,"
0000000012.png,oafaWvLNpgc,11,4176,"碰!現場爆炸聲頻傳廢棄輪胎倉庫火勢猛烈,"
0000000042.png,oafaWvLNpgc,41,4200,"重輪胎倉庫叉燒,鄰居無奈第6次了,"
0000000075.png,oafaWvLNpgc,74,4224,黑核園天際!后里輪胎工廠陷火海
0000000022.png,Brq8m_0eXIQ,21,4248,梅雨不停南投賞崩塌民眾驚:像921)
0000000049.png,Brq8m_0eXIQ,48,4272,"前兩人!“大雨沖刷地形起伏”成山前主因,"
0000000066.png,Brq8m_0eXIQ,65,4296,梅雨不南投債崩塌民眾驚:像921:
0000000001.png,KzG3sfjFYso,1,4320,簡約自百“下藥性侵模交往後繼續劈腿
0000000041.png,KzG3sfjFYso,40,4344,遭下藥性侵才交往小模批住我房開我車
0000000088.png,KzG3sfjFYso,87,4368,|Soutube10萬訂閱知名網紅自首下藥性侵關版
0000000004.png,r8_WLBT0C5Q,3,4392,危險宣明潭向旅客中心購管溜滑梯
0000000022.png,r8_WLBT0C5Q,21,4416,"危險童爬明潭向山旅客中心牆當溜滑梯,"
0000000048.png,r8_WLBT0C5Q,47,4440,警告標示視而不見!風管處會加強勸導
0000000005.png,9-v3SaqDMMU,4,4464,"媽媽身體不適孝順請假陪母目睹昏迷過程,"
0000000016.png,9-v3SaqDMMU,15,4488,緊急!媽媽突倒地救護員聲控CPR教學
0000000035.png,9-v3SaqDMMU,34,4512,"緊急!媽媽突倒地救護員聲控""CPR教學"
0000000053.png,9-v3SaqDMMU,52,4536,母胸照迷15歲兒神救援機對CPR救母
0000000002.png,9KtIcnhbQls,1,4560,姚元浩赴大陸比賽撞車自曝內臟都被震到”
0000000002.png,tE9CsjSfhZw,1,4584,"5月夜宿大社工業區韓傾聽農民,感受空污"
0000000023.png,tE9CsjSfhZw,22,4608,照夜宿社!韓傾聽農民及關懷單親
0000000038.png,tE9CsjSfhZw,37,4632,"“要親自去買一間“韓國瑜5月將夜宿大社,"
0000000064.png,tE9CsjSfhZw,63,4656,"5日夜宿大社工業區韓傾聽農民,感受空游"
0000000075.png,tE9CsjSfhZw,74,4680,將夜宿大社!韓傾聽農民及關懷單親」
0000000086.png,tE9CsjSfhZw,85,4704,好久不見前世情人“韓冰悄返加拿大暑修
0000000001.png,2rjpuCoZcvs,1,4728,"「醒水遭恐後無再露面。韓國瑜證實她回加拿大了,"
0000000032.png,2rjpuCoZcvs,31,4752,"鹽開纷纷擾擾,韓冰回加拿大5/6日開學,"
0000000065.png,2rjpuCoZcvs,64,4776,私下透露不會再出席活動韓冰早打算回加拿大?
0000000093.png,2rjpuCoZcvs,92,4800,"建議韓冰回加拿大?韓國瑜她自己計畫的,"
0000000001.png,Ihy7jlsLh1s,1,4824,到了?!黑龍细軍藍疑就是民進黨議員。
0000000015.png,Ihy7jlsLh1s,14,4848,眼熟黑韓專頁背景是議員辦公室。
0000000086.png,Ihy7jlsLh1s,85,4872,"「不為民進黨工作?!“黑韓網站被抓包和綠議員吃好料,"
0000000113.png,Ihy7jlsLh1s,112,4896,到了?!“黑韓網軍“藍疑就是民進黨議員。
0000000008.png,Y1wL5Rnz3Lo,7,4920,國手機民調!總總統初選改機制?蔡賴戏狗中
0000000033.png,Y1wL5Rnz3Lo,32,4944,「順宿與時俱進“暗諷賴跟不上時代?
0000000058.png,Y1wL5Rnz3Lo,57,4968,「顧種手機民調易作假“蔡回別因噎廢食
0000000102.png,Y1wL5Rnz3Lo,101,4992,盛擁當國資源副寒冰賴最後白努力定律
0000000001.png,ir9X9jEyXCU,1,5016,"重變拆車百萬名車主哀號“千瘡百孔”,"
0000000031.png,ir9X9jEyXCU,30,5040,丽裝環景成拆車?百萬名車被“鎖錯洞”?
0000000055.png,ir9X9jEyXCU,54,5064,「阿瑟”還是“成拆車!?百萬名車被鎖錯洞”?
0000000102.png,ir9X9jEyXCU,101,5088,"改裝爆爭議!店家強調已賠償,"
0000000002.png,sVOGDhEe9tQ,1,5112,體國瑜貼近基層撥款成立珍珠媽媽
0000000033.png,sVOGDhEe9tQ,32,5136,"月夜宿大社區重點農民,空污單親媽媽,"
0000000065.png,sVOGDhEe9tQ,64,5160,空污響農民收成韓國瑜將突襲夜宿
0000000097.png,sVOGDhEe9tQ,96,5184,"5月夜宿大社區重點農民,空污單親媽媽"
0000000001.png,vTYh8LXxGKA,1,5208,"東北風增強,氣溫下降-騎車要保暖"
0000000021.png,vTYh8LXxGKA,20,5232,望晚天氣較早出晚歸書保暖
0000000040.png,vTYh8LXxGKA,39,5256,"東北風增強氣溫下降,騎重要保暖"
0000000078.png,vTYh8LXxGKA,77,5280,明天東北風減弱白天温升北部個面
0000000105.png,vTYh8LXxGKA,104,5304,週四鋒面接近部陣雨濃霧
0000000119.png,vTYh8LXxGKA,118,5328,早晚天氣較涼早出晚歸導著保暖
0000000001.png,8xbS6F3oRs0,1,5352,你我看到的不一樣!這雙鞋到底什麼顏色?
0000000041.png,8xbS6F3oRs0,40,5376,群色照片2年前流傳洁巨基5月PO文再引熱議
0000000062.png,8xbS6F3oRs0,61,5400,聯色無開左右腦誰強!醫師是色彩恆常性
0000000081.png,8xbS6F3oRs0,80,5424,瞬色無開左右腦誰強!醫師是色彩恆常性
0000000091.png,8xbS6F3oRs0,90,5448,光源周遭物相對色影響大腦判斷物體顏色
0000000044.png,86bLUPhkYuU,43,5472,公車藏50cm西瓜切業者每周僅檢查一次
0000000066.png,86bLUPhkYuU,65,5496,"堅持“带刀開車?業者前一目自扣,"
0000000088.png,86bLUPhkYuU,87,5520,"同帶錄取“走後門?竟連續2天带刀上車,"
0000000001.png,l2iP03WTpdY,1,5544,「夠了!韓國瑜強硬抗網路抹黑渡
0000000018.png,l2iP03WTpdY,17,5568,網路現黑藍圖象!韓國瑜呼籲修法
0000000068.png,l2iP03WTpdY,67,5592,層與包容有底線!韓籲修法制“網路霸凌”
0000000078.png,l2iP03WTpdY,77,5616,"底線不容侵踏!韓國瑜遭抹黑堅護家人,"
0000000001.png,aEvNIvImYjE,1,5640,躲稽查獲後陽台躲雜物倉庫孩在玩躲貓貓
0000000056.png,aEvNIvImYjE,55,5664,區興中心去年評鑑優等“竟藏小朋友躲稽查
0000000087.png,aEvNIvImYjE,86,5688,"壁普查獲後陽台,躲雜物倉庫孩在玩躲貓貓"
0000000004.png,XsZ9wYbdGOA,3,5712,随再有糾紛!店家菜單補標註“限加一次
0000000032.png,XsZ9wYbdGOA,31,5736,安學生加麵不成怒告店長檢方不起訴
0000000057.png,XsZ9wYbdGOA,56,5760,防消費爭議同商圈拉麵店會標清楚“加幾次
0000000082.png,XsZ9wYbdGOA,81,5784,"防消費爭議同商圈拉麵店會標清楚加幾次,"
0000000001.png,OgEw0hLDVuE,1,5808,合菜美食新風潮!飯店推失傳酒家菜搶市場
0000000036.png,OgEw0hLDVuE,35,5832,"合英料理獲兩岸美食獎飯店祭優惠推美味,"
0000000061.png,OgEw0hLDVuE,60,5856,米其林活絡台菜市場連鎖品牌也推平價手路菜
0000000099.png,OgEw0hLDVuE,98,5880,张其状活絡台菜市場連鎖品牌也推平價手路菜
0000000001.png,mo_DLCFAwzA,1,5904,躍前曾到新人證婚鞋簽名直呼心理壓力大
0000000029.png,mo_DLCFAwzA,28,5928,5/25河集婚禮韓證婚吸百對新人報名
0000000059.png,mo_DLCFAwzA,58,5952,“走鵲橋與韓市長合影集團結婚報名倍增
0000000073.png,mo_DLCFAwzA,72,5976,520登記結婚!民政局加碼送韓發財對杯
0000000098.png,mo_DLCFAwzA,97,6000,想國龍市長證婚”高市集團結婚報名倍增
0000000001.png,kBFh4WrzLjY,1,6024,度中三滯洪池公園兼顧防洪與休憩
0000000026.png,kBFh4WrzLjY,25,6048,脉回共28個滯洪池17座改造為公園
0000000053.png,kBFh4WrzLjY,52,6072,階池公園周還景觀規劃環境更美好
0000000004.png,ly56hLu_MDg,3,6096,"體國市府開會自己一對此議會經驗,"
0000000045.png,ly56hLu_MDg,44,6120,借育局長PASS?韓國瑜笑回後腦又沒長眼睛
0000000064.png,ly56hLu_MDg,63,6144,吳郭見不見?韓妙回吳郭魚、白帶魚都不知道
0000000001.png,WP7Z21zFyrE,1,6168,"賴批“把文化當國家認同“韓回擊,解釋太狭窄"
0000000020.png,WP7Z21zFyrE,19,6192,顯批韓把文化當國家認同“韓;解釋太狹窄
0000000039.png,WP7Z21zFyrE,38,6216,回朝“文化根斬斷”韓孩子將如無根浮萍
0000000088.png,WP7Z21zFyrE,87,6240,"回就朝清德蘭國別用政治萬花筒着文化,"
0000000001.png,r6-WAerCon8,1,6264,"臉好腫!陳菊曾稱自經區高雄轉型大好機會,"
0000000029.png,r6-WAerCon8,28,6288,"借独自經區“天好機會。陳菊今改口時空不同,"
0000000051.png,r6-WAerCon8,50,6312,陳菊逐自經區影片曝光政院發言人自打臉
0000000086.png,r6-WAerCon8,85,6336,斷章取義班藍草包?對此陳菊“空談高下立判
0000000113.png,r6-WAerCon8,112,6360,"英互打臉!自經區立場“挺反“精神錯,"
0000000012.png,nljxhytRPrM,11,6384,春吶助孩子重要?簡懷宗遭恐未立刻報案
0000000057.png,nljxhytRPrM,56,6408,咖波造恐時不先報警簡煥宗先到春晚直播
0000000083.png,nljxhytRPrM,82,6432,波波恐時不先報警簡懷宗先到春时直播:
0000000104.png,nljxhytRPrM,103,6456,"原清議會演很大?簡煥宗遭脅竟未通報数,"
0000000004.png,EBUjcuZ9W2c,3,6480,"國家機密保護法三讀馬吳境管恐再延三年,"
0000000015.png,EBUjcuZ9W2c,14,6504,馬沙天不敵綠營涉密人員境管延長至六年
0000000046.png,EBUjcuZ9W2c,45,6528,"傳吳敦義六月登陸境管若延長國共論壇恐三度落空,"
0000000093.png,EBUjcuZ9W2c,92,6552,國民黨痛批因人設事三點聲明批綠營修法選舉考量
