0000000006.png,yYUTJSSYYdQ,5,0,“小姊弟命案”父泰山搭小黃獨家畫面曝光!
0000000038.png,yYUTJSSYYdQ,37,27,吳男戴眼鏡穿白T黑短褲現身淺水灣路邊
0000000054.png,yYUTJSSYYdQ,53,54,委員襲著吳男神色不安頻頻東張西望
0000000066.png,yYUTJSSYYdQ,65,81,失聯父徘徊沙灘後離去警方海巡擴大搜尋
0000000082.png,yYUTJSSYYdQ,81,108,"失聯父泰山搭小黃!疑用藥下車一度嘔吐,"
0000000101.png,yYUTJSSYYdQ,100,135,"吳男戴眼鏡穿白T黑短褲現身淺水灣路邊,"
0000000006.png,9AV9Pz5BMSk,5,162,"手機民調“準確高”蔡韓對打支持度拉近,"
0000000029.png,9AV9Pz5BMSk,28,189,郭台銘國防策和平”總統反駁:和平靠國防
0000000006.png,yQLC43QP-jM,5,216,"吃火鍋”生蛋+醫曝險!腎臟病恐敗血,"
0000000006.png,uKrS44FL5-U,5,243,奧迪暗夜衝民宅撞10機車民眾:像雷聲
0000000024.png,uKrS44FL5-U,23,270,奧迪暗夜衝民宅撞10機車民眾:像雷聲
0000000042.png,uKrS44FL5-U,41,297,奥迪衝撞10多輛機車竟棄車逃逸
0000000064.png,uKrS44FL5-U,63,324,碎!奧迪衝撞10多輛機車竟「棄車逃逸
0000000010.png,bJ9b13eBKRk,9,351,小姊弟窒息死陳屍關父不見蹤影涉重嫌
0000000081.png,bJ9b13eBKRk,80,378,父關機不見蹤影響:涉重嫌呼籲盡快出面
0000000006.png,REnPXL9hTqw,5,405,準備逃亡?父奔超商領2萬隨即失聯
0000000029.png,REnPXL9hTqw,28,432,準備逃亡?案發當天父多次外出“領錢
0000000042.png,REnPXL9hTqw,41,459,準備逃亡?案發當天父多次外出領錢
0000000077.png,REnPXL9hTqw,76,486,“平時很疼小孩父關機失聯警追通紀錄
0000000006.png,uWa5nHcLDPs,5,513,離婚後父性格變恐成弒親凶嫌!同事驚
0000000024.png,uWa5nHcLDPs,23,540,離婚低潮毀升官路董事長非常意外
0000000060.png,uWa5nHcLDPs,59,567,臉書常曜姊弟照離婚後獨缺全家福
0000000095.png,uWa5nHcLDPs,94,594,離婚後父性格變恐成弒親凶嫌!同事驚
0000000006.png,CX8nAVYVVMA,5,621,等15年了!蘇接速拍板1377億環狀線
0000000032.png,CX8nAVYVVMA,31,648,等15年了!蘇揆速拍板1377億環狀線
0000000079.png,CX8nAVYVVMA,78,675,"等15年了!蘇揆速拍板""1377億環狀線"
0000000098.png,CX8nAVYVVMA,97,702,等15年了!蘇揆速拍板(1377億環狀線
0000000027.png,_Qs876vPHJc,26,729,苗縣負債634億年花418萬租『黃金操場
0000000068.png,_Qs876vPHJc,67,756,苗縣負債634億年花418萬租黃金操場
0000000006.png,rFsfz4Lvups,5,783,兩岸新模式?陳明通抛歐盟與中建交
0000000044.png,rFsfz4Lvups,43,810,試水溫被燙到?陳明通撇:不是政府政策
0000000080.png,rFsfz4Lvups,79,837,試水溫被燙到?陳明通概不是政府政策!
0000000006.png,VAhSvJvAWvM,5,864,清水地熱自備老鼠籠煮蛋網驚:滿滿的韻味
0000000037.png,VAhSvJvAWvM,36,891,"老鼠籠煮蛋觀感不佳管理員當下即制止,"
0000000007.png,oubYBSr7AGc,6,918,廈航招空服!年薪最高150萬會台語加分
0000000030.png,oubYBSr7AGc,29,945,基本門檻中英文流利日韓閩南語“加分”
0000000051.png,oubYBSr7AGc,50,972,廈航招空服!年薪最高150萬會台語加分:
0000000065.png,oubYBSr7AGc,64,999,航空搶人大戰!國泰再招120人起薪5.5萬
0000000077.png,oubYBSr7AGc,76,1026,新加坡航空月薪10萬起!4.5月面試開跑
0000000006.png,UHBndpJjY-A,5,1053,本來要培訓當謀長!男子老闆:上周出勤都正常
0000000016.png,UHBndpJjY-A,15,1080,領錢後返家下手?小姊弟疑遭父”悶死”
0000000039.png,UHBndpJjY-A,38,1107,小姊弟疑遭悶死窒息檢警報驗釐清死因。
0000000048.png,UHBndpJjY-A,47,1134,小姊弟陳屍上下鋪窒息亡切確死因仍待釐清。
0000000072.png,UHBndpJjY-A,71,1161,昨天下午有看到他”鄰居間小姊弟死訊驚訝!
0000000100.png,UHBndpJjY-A,99,1188,臉書曬父愛!女童老師還約定6月去校外教學
0000000114.png,UHBndpJjY-A,113,1215,領錢後返家下手?小姊弟疑遭父“死”
0000000127.png,UHBndpJjY-A,126,1242,小姊弟疑遭悶死窒息檢警報驗釐清死因
0000000153.png,UHBndpJjY-A,152,1269,臉書曬父愛!女童老師還約定6月去校外教學
0000000007.png,9v1zpN5h1hM,6,1296,泰山兩子命案陷膠著警急尋失蹤父親
0000000018.png,9v1zpN5h1hM,17,1323,"疑殺害子女後離家手機關機難追通聯紀錄,"
0000000036.png,9v1zpN5h1hM,35,1350,"兒女室息陳屍父家中警鎖定父親重嫌,"
0000000047.png,9v1zpN5h1hM,46,1377,"小姊弟遭父死?警無家暴前科關機失聯,"
0000000066.png,9v1zpN5h1hM,65,1404,泰山兩子命案陷膠著急尋失蹤父親。
0000000112.png,9JDQMAcJgTg,111,1431,要微信被拒2次已婚男竟揮拳暴打正妹
0000000007.png,AvVlhm3LtkI,6,1458,郭董選總統館長態度大轉無法投他一票
0000000008.png,ykBZqgX2pww,7,1485,復活節血案逾200斯里蘭卡教堂爆炸瞬間
0000000037.png,ykBZqgX2pww,36,1512,坐視恐攻發生?!復活節前10天已掌握情資
0000000047.png,ykBZqgX2pww,46,1539,"五彩煙霧空中轉圈媽祖遶境廟方嘆罕見,"
0000000088.png,ykBZqgX2pww,87,1566,五彩煙霧空中轉圈媽祖遶境廟方嘆罕見
0000000129.png,ykBZqgX2pww,128,1593,"五彩雲霧讓熱對流顯眼「旋轉效果民眾稱奇,"
0000000006.png,3x7E7_ixZpk,5,1620,今各地多雲到晴午後仍有短暫陣雨雷雨
0000000026.png,3x7E7_ixZpk,25,1647,"今下半天鋒面北抬降雨區域北移強度減弱,"
0000000035.png,3x7E7_ixZpk,34,1674,今各地多雲到晴午後仍有短暫陣雨雷雨
0000000052.png,3x7E7_ixZpk,51,1701,外島易有霧金門地區濃霧特報!能見度差
0000000067.png,3x7E7_ixZpk,66,1728,周二一四暖熱如夏全台高溫可達33-35度
0000000092.png,3x7E7_ixZpk,91,1755,"周五,六天氣不穩定各地有局部陣雨或雷雨"
0000000105.png,3x7E7_ixZpk,104,1782,"天氣偏暖今日南部23-33度東部22-30度,"
0000000114.png,3x7E7_ixZpk,113,1809,周四午後陣雨機率高周五鋒面到各地再轉雨」
0000000124.png,3x7E7_ixZpk,123,1836,"明水氣少天氣回穩西半部高溫上看31-3℃,"
0000000006.png,RhvcYoYUpF4,5,1863,姊弟疑遭下藥勒斃!警急追失聯生父
0000000019.png,RhvcYoYUpF4,18,1890,姊弟疑遭下藥勒斃!警急追失聯生父
0000000087.png,RhvcYoYUpF4,86,1917,心碎!家庭日悲劇媽開門驚見姊弟雙亡
0000000011.png,Fbu8Nj0Sncg,10,1944,"郭董批“160萬人吃不飽”陳吉仲:那是馬政府,"
0000000006.png,SWtnN5rCfRU,5,1971,"可惡想撞死人肇逃“北聯大哥”押小弟顶包,"
0000000034.png,SWtnN5rCfRU,33,1998,
0000000069.png,SWtnN5rCfRU,68,2025,去年7月曾掀二殯槍戰肇事男隸屬北聯幫
0000000081.png,SWtnN5rCfRU,80,2052,去年7月曾掀二殯槍戰肇事男隸屬北聯幫
0000000006.png,Wd0Sn1Dwcdk,5,2079,間直播批智稱帝”陸生離台倒數85天訴無奈
0000000026.png,Wd0Sn1Dwcdk,25,2106,間道恐嚇家人斷聯繫李家資帳號都被註銷
0000000059.png,Wd0Sn1Dwcdk,58,2133,間遭恐嚇家人斷聯繫李家資帳號都被註銷
0000000006.png,yqpQiN5ww58,5,2160,"台商回流再過5投資案計1370億元,"
0000000031.png,yqpQiN5ww58,30,2187,"隱形眼鏡廠回台!據14產線”增逾900職缺,"
0000000055.png,yqpQiN5ww58,54,2214,車燈銷80國!台廠回流投資40億擴產線
0000000083.png,yqpQiN5ww58,82,2241,"台商回流!再過5投資案累計1370億元,"
