0000000006.png,ALLVyxjeQg8,5,0,方仰寧甫接任大甲媽遶境暴打!4警1記者傷
0000000032.png,ALLVyxjeQg8,31,27,"邊境一級戰區民生地下道記者被往死裡打,"
0000000048.png,ALLVyxjeQg8,47,54,意境衝突一波波記者破頭警察掛彩
0000000061.png,ALLVyxjeQg8,60,81,"方應注语方案遠境一級戰區民生地下道記者被往死裡打,"
0000000094.png,ALLVyxjeQg8,93,108,方仰寧甫接任大甲媽遶境暴打4記者傷
0000000006.png,CH2bSHq6bF8,5,135,蔡賴昨會面柯建銘轉述沒談現任優先
0000000006.png,ZVME0MbKDgw,5,162,盡初選遲無解王重砲轟哭:想選就快表態
0000000044.png,ZVME0MbKDgw,43,189,不滿吳態度不明王:要選就不要跟我們談
0000000006.png,CJaLtt3z4yM,5,216,大甲媽遶境民眾擺攤“免費供茶水“副神蹟」
0000000033.png,CJaLtt3z4yM,32,243,"大甲媽遶境民眾擺攤“免費供茶水酬神蹟,"
0000000054.png,CJaLtt3z4yM,53,270,。她跟隨大甲媽遶境廿年謝神保佑很樓還願。
0000000062.png,CJaLtt3z4yM,61,297,有生殖与大甲雄合国25年謝神保悟境
0000000087.png,CJaLtt3z4yM,86,324,大甲媽遶境民眾穩捷、“免費供茶水神蹟
0000000006.png,Pi5YDVGkMsY,5,351,"新北議員遭埋伏棒歐,因手是建設公司總座"
0000000042.png,Pi5YDVGkMsY,41,378,開發案疑肇因惡煞持棒痛毆!議員骨裂住院。
0000000060.png,Pi5YDVGkMsY,59,405,"疑開發案成導火線建設公司總經理持棒追打,"
0000000080.png,Pi5YDVGkMsY,79,432,新北議員遭埋伏棒毆!凶手是建設公司總座
0000000001.png,V47lxEEuiCA,1,459,"暖熱如夏!西半部高溫飆至31-35度,"
0000000016.png,V47lxEEuiCA,15,486,北部高溫33度中部32度南部高溫飆35度
0000000024.png,V47lxEEuiCA,23,513,"西半部,金門馬祖!有低雲影響能見度"
0000000032.png,V47lxEEuiCA,31,540,"台灣海峽北部北部海面注意有局部霧,"
0000000043.png,V47lxEEuiCA,42,567,"擴散效果不佳!北部、南部空氣品質差,"
0000000056.png,V47lxEEuiCA,55,594,"周三晚上鋒面接近“北部東北部“轉涼,"
0000000068.png,V47lxEEuiCA,67,621,"周三晚“北部東北部降雨機率逐增加,"
0000000080.png,V47lxEEuiCA,79,648,周四華南雲雨區東移北部、東北部轉涼
0000000099.png,V47lxEEuiCA,98,675,北部高溫33度中部32度南部高溫飆35度
0000000006.png,F-974zf5TYU,5,702,姊妹市簽不簽?議員批市府2套說法
0000000021.png,F-974zf5TYU,20,729,姊妹市簽不簽?議員批市府2套說法
0000000035.png,F-974zf5TYU,34,756,簽姊妹市局處不同調議員批1市府2套說法
0000000059.png,F-974zf5TYU,58,783,美國行鋪路選總統?韓、簽姊妹市未定案
0000000085.png,F-974zf5TYU,84,810,「韓美國行沒簽姊妹市?議員批鋪路選總統
0000000011.png,er6NUyvpw_I,10,837,否認蔡賴會把現任優先”英放話適可而止
0000000088.png,er6NUyvpw_I,87,864,總統若換人選英:做關黨如何定義三年新
0000000022.png,9fz1TGXesd8,21,891,大甲媽遶境過一級戰區記者警被往死裡打
0000000040.png,9fz1TGXesd8,39,918,"大甲媽遶境過一級戰區記者被往死裡打,"
0000000053.png,9fz1TGXesd8,52,945,"宗教盛事變調記者拍攝遭圍毆機器砸爛,"
0000000087.png,9fz1TGXesd8,86,972,"大甲媽遠境過一級戰區記者警被往死裡打,"
0000000103.png,9fz1TGXesd8,102,999,宗教盛事變調!記者警遭毆釀5人傷
0000000011.png,Gy5rxqJs20U,10,1026,英賴見面談“現任優先?英親自駁斥
0000000035.png,Gy5rxqJs20U,34,1053,蔡賴首會一小時無交集賴堅持走完初選」
0000000043.png,Gy5rxqJs20U,42,1080,LINE2014縣市長連任優先”英駁討糖吃”
0000000063.png,Gy5rxqJs20U,62,1107,"親上火線駁斥現任優先,英籲尊重黨中央"
0000000076.png,Gy5rxqJs20U,75,1134,"協調期最後5天蔡賴會中執會摄延後初選,"
0000000086.png,Gy5rxqJs20U,85,1161,英賴見面談現任優先”?英親自駁斥
0000000095.png,Gy5rxqJs20U,94,1188,"蔡賴首會一小時無交集賴堅持走完初選,"
0000000111.png,Gy5rxqJs20U,110,1215,"親上火線駁斥現任優先”英籲尊重黨中央,"
0000000123.png,Gy5rxqJs20U,122,1242,尊重協調小組總統:保持額默沒法戰
0000000152.png,Gy5rxqJs20U,151,1269,蔡穎首會一小時無交集賴堅持走完初選」
0000000168.png,Gy5rxqJs20U,167,1296,LINE2014縣市長連任優先”英駁討糖吃
0000000176.png,Gy5rxqJs20U,175,1323,歷經多次大選蔡總統:怯戰不是我的風格
0000000210.png,Gy5rxqJs20U,209,1350,顯上次级联現任優先英籲尊重黨中英
0000000222.png,Gy5rxqJs20U,221,1377,為2020找出勝選方案總統願忍受外界攻擊
0000000240.png,Gy5rxqJs20U,239,1404,歷經多次大選蔡總統:法就不是我的風格
0000000249.png,Gy5rxqJs20U,248,1431,為2020找出勝選方案總統願忍受外界攻擊
0000000267.png,Gy5rxqJs20U,266,1458,尊重協調小組總統:保持默沒法戰
0000000285.png,Gy5rxqJs20U,284,1485,協調3目標總統團結勝選可能性降低學
0000000301.png,Gy5rxqJs20U,300,1512,尊重協調小組總統:保持默沒怯戰
0000000323.png,Gy5rxqJs20U,322,1539,駁現任優先說總統籲:不適當的放話適可而止
0000000337.png,Gy5rxqJs20U,336,1566,協調目標總統:團結勝選可能性降低衝擊
0000000354.png,Gy5rxqJs20U,353,1593,"誰贏初選不是重點總統贏了2020才是重點,"
0000000384.png,Gy5rxqJs20U,383,1620,"尊重協調小組總統:保持默沒怯戰,"
0000000402.png,Gy5rxqJs20U,401,1647,初選只是過程總統:2020勝選才是目標
0000000430.png,Gy5rxqJs20U,429,1674,"協調3目標總統:團結勝選可能性降低衝擊,"
0000000442.png,Gy5rxqJs20U,441,1701,"駁現任優先說總統籲不適當的放話適可而止,"
0000000450.png,Gy5rxqJs20U,449,1728,誰贏初選不是重點總統:贏了2020才是重點
0000000458.png,Gy5rxqJs20U,457,1755,"初選只是過程總統:2020勝選才是目標,"
0000000487.png,Gy5rxqJs20U,486,1782,"協調3目標總統:團結勝選可能性降低衝擊,"
0000000495.png,Gy5rxqJs20U,494,1809,"駁現任優先說總統篇:不適當的放話適可而止,"
0000000505.png,Gy5rxqJs20U,504,1836,"誰贏初選不是重點總統,了2020才是重點,"
0000000520.png,Gy5rxqJs20U,519,1863,初選只是過程總統:2020勝選才是目標
0000000558.png,Gy5rxqJs20U,557,1890,"可以跟任何人合作!總統:尋求勝選最大可能性,"
0000000578.png,Gy5rxqJs20U,577,1917,"協調3目標總統:團結勝選可能性降低衝擊,"
0000000601.png,Gy5rxqJs20U,600,1944,"駁現任優先說總統籲:不適當的放話適可而止,"
0000000609.png,Gy5rxqJs20U,608,1971,誰贏初選不是重點總統贏了2020才是重點
0000000617.png,Gy5rxqJs20U,616,1998,初選只是過程總統:2020勝選才是目標
0000000628.png,Gy5rxqJs20U,627,2025,可以跟任何人合作!總統尋求勝選最大可能性。
0000000652.png,Gy5rxqJs20U,651,2052,為2020我出勝選方案總統願忍受外界攻擊
0000000666.png,Gy5rxqJs20U,665,2079,駁現任優先說總統籲不適當的放話適可而止
0000000707.png,Gy5rxqJs20U,706,2106,"誰贏初選不是重點總統贏了2020才是重點,"
0000000006.png,E1pp3DkrMM0,5,2133,"撑不住了!20元蛋包飯下月底吹熄燈號,"
0000000031.png,E1pp3DkrMM0,30,2160,嘆“商圈型態轉變20元蛋包飯將熄燈
0000000073.png,E1pp3DkrMM0,72,2187,"撑不住了!20元蛋包飯5月底吹熄燈號,"
0000000011.png,jJydZ30LCAM,10,2214,柯文哲橫紋肌溶解症狀改騎單車衝新港
0000000029.png,jJydZ30LCAM,28,2241,柯文哲橫紋肌溶解症狀改騎單車衝新港
0000000050.png,jJydZ30LCAM,49,2268,大甲媽遠境柯P橫紋肌溶解朱立倫中暑
0000000072.png,jJydZ30LCAM,71,2295,跟大甲媽選境!朱立倫中暑刮痧後繼續拚
0000000009.png,bXVLYwzd7u0,8,2322,白沙屯媽神導航”直撞警所要升官了
0000000047.png,bXVLYwzd7u0,46,2349,自沙屯媽神導航”直衝響所要升官
0000000061.png,bXVLYwzd7u0,60,2376,"白沙屯媽,神導航”直撞警所要升官"
0000000106.png,bXVLYwzd7u0,105,2403,大甲媽瘋搶轎!彰民生地下道“攻防主戰場
0000000124.png,bXVLYwzd7u0,123,2430,白沙屯媽進香抵彰化途中天轉彎進小學
0000000149.png,bXVLYwzd7u0,148,2457,白沙屯媽屢傳神蹟虔誠信徒沿途參拜
0000000159.png,bXVLYwzd7u0,158,2484,白沙屯媽進香抵彰化途中大轉彎進小學
0000000186.png,bXVLYwzd7u0,185,2511,"白沙屯媽屢傳神蹟虔誠信徒沿途參拜,"
0000000206.png,bXVLYwzd7u0,205,2538,網路直播夏娃后每隻3200元被起訴
0000000226.png,bXVLYwzd7u0,225,2565,網路直播員播實蟻后每隻300經
0000000264.png,bXVLYwzd7u0,263,2592,"買賣螞蟻當寵物,遊走三不管台恐陷蟲蟲危機"
