0000000115.png,81uejNdHA_g,114,0,超狂便當要價5.5萬台幣超級海陸雙拼
0000000156.png,81uejNdHA_g,155,27,魚河豚高檔食材全包筷子還能灌金粉
0000000204.png,81uejNdHA_g,203,54,白金版小學生書包竟要價287萬台幣
0000000006.png,XdvqfZsVHRg,5,81,暴雨上午肆虐北台下午雨彈轟中南部
0000000029.png,XdvqfZsVHRg,28,108,一路往南移動速度快!所到之處淹成災
0000000046.png,XdvqfZsVHRg,45,135,先轟北部中午炸中部”目前雨灌雲嘉投
0000000058.png,XdvqfZsVHRg,57,162,高屏警戒!強降雨進這雨勢最猛落在傍晚
0000000068.png,XdvqfZsVHRg,67,189,"用倒的雨勢劇烈民眾,比颱風天還颱風天"
0000000077.png,XdvqfZsVHRg,76,216,再炸全台!鋒面登入南部中下周恐還有一波
0000000088.png,XdvqfZsVHRg,87,243,鋒面將在“入夜後出海仍整晚有雨漸趨緩
0000000101.png,XdvqfZsVHRg,100,270,雨過天晴明南部雨漸歇北部東部轉晴好天氣
0000000112.png,XdvqfZsVHRg,111,297,一路往南移動速度快!所到之處淹成災
0000000123.png,XdvqfZsVHRg,122,324,先轟北部中午炸中部“目前雨灌雲嘉投
0000000136.png,XdvqfZsVHRg,135,351,南高屏警戒!強降雨進這雨勢最猛落在傍晚
0000000150.png,XdvqfZsVHRg,149,378,「用倒的雨勢劇烈民眾:比颱風天還附属关。
0000000177.png,XdvqfZsVHRg,176,405,雨炸全台!鋒面登入南部中“下周恐還有一波
0000000200.png,XdvqfZsVHRg,199,432,鋒面將在入夜後出海仍整晚有雨漸趨緩
0000000215.png,XdvqfZsVHRg,214,459,雨過天晴明南部雨漸歇北部東部轉晴好天賞
0000000233.png,XdvqfZsVHRg,232,486,先疆北部中于中部“箭”一
0000000244.png,XdvqfZsVHRg,243,513,"雨炸全台!鋒面登入南部中“下周恐還有一波,"
0000000008.png,JBxqSnCgDCY,7,540,高市府爆貪瀆醜!高官收賄撤職判4年2月
0000000035.png,JBxqSnCgDCY,34,567,高市工務局高官養兒出國買車竟全由廠商買單
0000000049.png,JBxqSnCgDCY,48,594,忍受三年護駕!蔡唱衰台灣的人你們不會得逞
0000000111.png,JBxqSnCgDCY,110,621,忍受三年讓黑!蔡唱衰台灣的人你們不會得這
0000000210.png,JBxqSnCgDCY,209,648,反擊藍營唱衰英:馬曾交代年改不能等
0000000106.png,pkzxAd69-vw,105,675,忘憂森林水流馬路遊覽車如“開在瀑布
0000000164.png,pkzxAd69-vw,163,702,忘憂森林水流馬路遊覽車如開在瀑右
0000000006.png,TPivSbyMT88,5,729,鋒面上午報到全台雨:苗栗以北防豪雨
0000000018.png,TPivSbyMT88,17,756,上午鋒面到一路往南嚴防劇烈天氣發生
0000000029.png,TPivSbyMT88,28,783,鋒面通過!氣象局豪大雨特報範圍蓋全台
0000000038.png,TPivSbyMT88,37,810,"劇烈天氣!慎防“強降雨雷擊強陣風”,"
0000000047.png,TPivSbyMT88,46,837,鋒面上午報到全台前“雷業龙防蒙讀
0000000056.png,TPivSbyMT88,55,864,"上班留意!雙北大雷雨訊息”夾帶旺盛雷雨胞,"
0000000078.png,TPivSbyMT88,77,891,"鋒面上午報到全台雨:“苗栗以北防豪雨,"
0000000086.png,TPivSbyMT88,85,918,上班留意(雙北大雷雨訊息”夾帶旺盛雷雨胞」
0000000094.png,TPivSbyMT88,93,945,"上午鋒面到一路往南嚴防劇烈天氣發生,"
0000000121.png,TPivSbyMT88,120,972,劇烈天氣!慎防“强降雨雷擊強陣風”
0000000144.png,TPivSbyMT88,143,999,氣溫明顯下降!中部低溫22度南部23度
0000000055.png,-bMxd2aolEE,54,1026,國外這款“佛頭奶茶”泰國信徒超火的
0000000115.png,-bMxd2aolEE,114,1053,看了就跟國外YouTuber介紹台灣小吃8天點閱千萬
0000000178.png,-bMxd2aolEE,177,1080,「夜市店員待客外套穿法”台日習慣大不同
0000000202.png,-bMxd2aolEE,201,1107,"“夜市店員待客外套穿法台日習慣大不同,"
0000000241.png,-bMxd2aolEE,240,1134,"台灣騎摩托車外套反穿“日本人超驚訝,"
0000000294.png,-bMxd2aolEE,293,1161,神人阿嬤不用膠水!為愛孫手編「榕樹帽”
0000000401.png,-bMxd2aolEE,400,1188,神人阿嬤不用膠水!為愛孫手編榕樹帽”
0000000001.png,mVaUxfe5CHU,1,1215,台股逐筆交易將上路隨到隨機省時省成本
0000000034.png,mVaUxfe5CHU,33,1242,盤後體驗下單擬真平台有助適應逐筆交易
0000000006.png,zD2ivwJhpSg,5,1269,繞境陣頭爬欄杆圍幼園納涼吃喝留垃圾
0000000021.png,zD2ivwJhpSg,20,1296,陣頭圓幼兒園教室吃便當喝啤酒未清理
0000000046.png,zD2ivwJhpSg,45,1323,繞境陣頭洗門風道歉園方同意不追究
0000000071.png,zD2ivwJhpSg,70,1350,私聞幼園當自家!陣頭攀爬欄杆
0000000026.png,4dGVFd66c90,25,1377,竊賊偷檳榔攤衰遇跆拳道金牌國手遭逮
0000000073.png,4dGVFd66c90,72,1404,調偷檳榔攤衰遇跆拳道金牌國手遭逮
0000000006.png,tBOUtHGYpOk,5,1431,吃海螺染病陸女8小時器官衰竭亡
0000000030.png,tBOUtHGYpOk,29,1458,吃海螺染病陸女8小時器官衰竭亡
0000000053.png,tBOUtHGYpOk,52,1485,
0000000006.png,q37u6ibMpHU,5,1512,“爆胎前兆專家勸別開胎壓過高鼓包龜裂
0000000025.png,q37u6ibMpHU,24,1539,“爆胎前兆專家勸別開胎壓過高鼓包龜裂
0000000057.png,q37u6ibMpHU,56,1566,開車前“注意胎紋、胎壓”關鍵時刻能救命
0000000026.png,JsoxBUSnEAk,25,1593,黑王世堅垃圾拒道歉柯P:看到什麼說什麼
0000000078.png,JsoxBUSnEAk,77,1620,黑王世堅垃圾拒道歉柯P:看到什麼說什麼
0000000028.png,wAcOJn7tisE,27,1647,韓空軍「聲量降名嘴爆網路贊助商收手
0000000046.png,wAcOJn7tisE,45,1674,韓空軍“聲量降名嘴爆網路贊助商”收手
0000000082.png,wAcOJn7tisE,81,1701,韓空軍“聲量降名嘴爆網路贊助商“收手
0000000018.png,DNAzJMlgvjY,17,1728,中槍」館長嗆韓沒做好做滿”朱:我好尴尬
0000000035.png,DNAzJMlgvjY,34,1755,天懺悔換柱沒做好做滿朱:胜三名的
0000000052.png,DNAzJMlgvjY,51,1782,天懺悔換柱沒做好做滿朱:被罵應該的
0000000079.png,DNAzJMlgvjY,78,1809,中槍!館長嗆韓沒做好做滿”朱:我好尴尬
0000000006.png,toSEt2sHqC4,5,1836,致力維持兩岸穩定蔡:受國際間肯定EL--全国”二
0000000055.png,toSEt2sHqC4,54,1863,"郭董隔空狂嗆蔡回酸,他須多了解政策"
0000000093.png,toSEt2sHqC4,92,1890,賴喊乾淨贏願會面蔡:尊重中常會民主機制
0000000133.png,toSEt2sHqC4,132,1917,"郭董隔空狂嗆蔡回酸,他須多了解政策"
0000000028.png,O-1mmYszlwA,27,1944,天寮居民下跪陳情韓國瑜改走地下道迴避
0000000078.png,O-1mmYszlwA,77,1971,避下跪居民走地下道韓國瑜跳針怕遲到
0000000102.png,O-1mmYszlwA,101,1998,天寮居民下跪陳情韓拖延會面“我時間不夠
0000000014.png,GrHp-2C_J2o,13,2025,高雄桂圓庫廢墟變身陳菊邀小英散步
0000000029.png,GrHp-2C_J2o,28,2052,高雄接庫廢墟變身陳菊邀小英散步”
0000000054.png,GrHp-2C_J2o,53,2079,接圓庫廢墟變身陳菊10年活化成文青基地
0000000074.png,GrHp-2C_J2o,73,2106,接夏庫廢墟變身陳菊10年活化成文青基地
0000000006.png,miLnWl0gJ9g,5,2133,酒測值剛好0.25無罪?花東判決不同調
0000000089.png,miLnWl0gJ9g,88,2160,酒測值剛好0.25無罪?花東判決不同調
0000000006.png,M2SBGbBKlSI,5,2187,萬言政策濃縮十句關鍵英:三年努力成果
0000000070.png,M2SBGbBKlSI,69,2214,強硬反兩制六成支持英;元首沒有模糊間
0000000096.png,M2SBGbBKlSI,95,2241,反擊藍營唱衰英:馬曾交代年改不能等
0000000026.png,zhXHpEHK0A0,25,2268,韓國民調下滑議員:無心市政民眾失望
0000000090.png,zhXHpEHK0A0,89,2295,無心市政市民失望!韓國瑜支持度下滑5%
0000000006.png,9emNOrBUhpE,5,2322,天水沖進大學餐廳腳泡水學生淡定吃午餐
0000000057.png,9emNOrBUhpE,56,2349,苦中作樂!充氣墊搞自拍學生大玩飄飄河
0000000074.png,9emNOrBUhpE,73,2376,商品泡水壓縮機毀輔大店家損失慘
0000000006.png,htp7FCkyuk8,5,2403,高市府官員認收賄遭停止任用2年
0000000031.png,htp7FCkyuk8,30,2430,"高市官員收賄開名車,生小孩廠商買單"
0000000008.png,ygNL_yTOKak,7,2457,"弓箭步形容.longstay""郭式哲學庶民路線。"
0000000021.png,ygNL_yTOKak,20,2484,郭台銘下鄉接地氣聲量漲網粉絲破30萬
0000000054.png,ygNL_yTOKak,53,2511,弓箭步形容Longstay郭式哲學庶民路線
0000000072.png,ygNL_yTOKak,71,2538,下鄉採民意奏效國黨初選郭台銘聲勢上漲
0000000087.png,ygNL_yTOKak,86,2565,下鄉採民意奏效國黨初選郭台銘聲勢上漲
0000000006.png,FChW-OWmydc,5,2592,政院萌貓秀三週年政績網:可惡已按讚
0000000042.png,FChW-OWmydc,41,2619,「萌貓吸引民眾注意!蘇揆:有人看了30次
0000000085.png,FChW-OWmydc,84,2646,"郭董酸英“不懂經濟「蘇歡迎投資自己國家,:"
0000000028.png,N4A9_yfIBUE,27,2673,70年最快修复
0000000066.png,N4A9_yfIBUE,65,2700,"70年最修,鐘靈產量不到成幢評急停"
0000000006.png,fM2TWEBziw8,5,2727,進軍好市多!老字號蜂蜜管控“反恐等級
0000000048.png,fM2TWEBziw8,47,2754,進軍好市多!老字號蜂蜜管控“反恐等級
0000000056.png,fM2TWEBziw8,55,2781,老字號蜂蜜品牌美迪士尼全台唯一授權
0000000076.png,fM2TWEBziw8,75,2808,進軍好多老字號蜂蜜管控反恐等級
0000000006.png,n8zBBWcZMzQ,5,2835,韓流發威六合夜市有救?這取好不到3個月
0000000046.png,n8zBBWcZMzQ,45,2862,韓流發威六合夜市有救?攤販好不到3個月
0000000075.png,n8zBBWcZMzQ,74,2889,在地議員觀察!六合夜市人潮曇花一現
0000000007.png,kVBIVEKLZuo,6,2916,柯文哲毒王世堅“垃圾”頭號柯黑怒回擊
0000000037.png,kVBIVEKLZuo,36,2943,雙子星案!王黑厚顏無恥柯低聲喧垃圾”
0000000050.png,kVBIVEKLZuo,49,2970,柯文哲轟王世堅垃圾”頭號柯黑怒回擊
0000000060.png,kVBIVEKLZuo,59,2997,市長又失言了垃圾”二字惹議頭號柯黑變臉
0000000073.png,kVBIVEKLZuo,72,3024,柯文哲轟王世堅垃圾頭號柯黑怒回擊
0000000081.png,kVBIVEKLZuo,80,3051,雙子星案!王黑厚顏無恥低聲喧垃圾”
0000000006.png,1RihZj8fLcc,5,3078,烏日霧峰水淹及腰消防出動橡皮艇救援
0000000006.png,DAIWfG_hdeo,5,3105,"郭台銘批蔡英文用空洞數字遮掩失敗,"
0000000046.png,DAIWfG_hdeo,45,3132,砲轟蔡英文三年執政郭台銘:做衰台灣
0000000032.png,ZZ07mDwLuUw,31,3159,"與發大財的距離「韓,發財是向上提升力量"
0000000074.png,ZZ07mDwLuUw,73,3186,"與發大財的距離「韓,發財是向上提升力量"
0000000006.png,ZC8hLYe3sSQ,5,3213,中美湖再現!輔大生苦中作樂玩“泡湯”
0000000006.png,m7a6FrdQyBg,5,3240,"雨炸南投草屯水淹腳踝台中大排水浸路面,"
